0,1,2
books,"Yes, when I get big and have my own home, no plush chairs and lace curtains for me. And no rubber plants. I'll have a desk like this in my parlor and white walls and a clean green blotter every Saturday night and a row of shining yellow pencils always sharpened for writing and a golden-brown bowl with a flower or some leaves or berries always in it and books . . . books . . . books. . . .","['books', 'reading ']"
books,Books are to me as homemade tattoos are to an inmate. Can't get enough of them.,"['books', 'humor', 'love', 'tattoos ']"
books,"My life - my personality, my habits, even my speech - is a combination of the books I choose to read, the people I choose to listen to, and the thoughts I choose to tolerate in my mind",['books ']
books,"I wanted to crawl in between those black lines of print, the way you crawl through a fence, and go to sleep under that beautiful big green fig-tree.","['books', 'literature', 'reading', 'words ']"
"truth,books",It takes a certain ingenuous faith - but I have it - to believe that people who read and reflect more likely than not come to judge things with liberality and truth.,"['books', 'reflection', 'truth ']"
books,I can promise you books and conversation and all my heart.,['books ']
"life,humor,truth,wisdom,knowledge,books","Reading makes you ready for the world. A man who doesn’t read is a man who is easily deceived. You must find that man and make him sign a contract, and you must do it before Satan does. Trust me, the profits are HUGE!","['advantage', 'books', 'contract', 'deceit', 'deceived', 'devil', 'humor', 'knowledge', 'life', 'preparation', 'read', 'reading', 'satan', 'truth', 'wisdom', 'wise', 'word-junkies', 'world ']"
books,الأمر الوحيد الذي أندم عليه هو أنه لن يتسنى لي قراءة كل الكتب التي أود قرائتها.,"['books', 'regret ']"
books,"The book smelled dusty and old but also carried a sweet tang, a hint of something inviting. She opened to the first page and started to read, pronouncing the words in a reverent whisper.","['books', 'reading ']"
books,"People talk about books being an escape, but here on the tube, this one feels more like a lifeline...The motion of the train makes her head rattle, but her eyes lock on the words the way a figure skater might choose a focal point as she spins, and just like that, she's grounded again.","['books', 'reading', 'teen ']"
books,Books are the most tolerant of friends.,['books ']
books,"Sometimes I sensed that the books I read in rapid succession had set up some sort of murmur among themselves, transforming my head into an orchestra pit where different musical instruments sounded out, and I would realize that I could endure this life because of these musicales going on in my head.","['books', 'literature', 'reading', 'words ']"
books,"One glance at (a book) and you hear the voice of another person - perhaps someone dead for thousands of years. Across the millenia, the author is speaking, clearly and silently, inside your head, directly to you. Writing is perhaps the greatest of human inventions, binding together people, citizens of distant epochs, who never knew one another. Books break the shackles of time.",['books ']
books,I think a good book is a good book forever.I don't think they get less good because times change.,['books ']
books,And she never could remember; and ever since that day what Lucy means by a good story is a story which reminds her of the forgotten story in the Magician's Book.,"['books', 'magic ']"
books,I have never been able to resist a book about books.,"['book', 'books', 'reading ']"
books,"Books aren't written - they're rewritten. Including your own. It is one of the hardest things to accept, especially after the seventh rewrite hasn't quite done it.","['books', 'on-writing', 'rewritten', 'written ']"
books,"I should rather have you than a heap of gold, even if it were very comfortable to sleep on.",['books ']
books,The book thief has struck for the first time – the beginning of an illustrious career.,"['books', 'reading ']"
books,I plan to learn enough to read you like a book.,"['books', 'love ']"
"poetry,books","When you are old and grey and full of sleep  And nodding by the fire, take down this book,  And slowly read, and dream of the soft look Your eyes had once, and of their shadows deep","['books', 'old-age', 'poetry', 'reading ']"
books,"Every night, I have to read a book, so that my mind will stop thinking about things that I stress about.",['books ']
books,"Books fall open, you fall in","['books', 'inspirational', 'reading-books ']"
books,"And this our life, exempt from public haunt, finds tongues in trees, books in the running brooks, sermons in stones, and good in everything. I would not change it.",['books ']
books,I don't know where people got the idea that characters in books are supposed to be likable. Books are not in the business of creating merely likeable characters with whom you can have some simple identification with. Books are in the business of creating great stories that make you're brain go ahhbdgbdmerhbergurhbudgerbudbaaarr.,"['books', 'characters', 'humor ']"
books,"Just like heaven. Ever’body wants a little piece of lan’. I read plenty of books out here. Nobody never gets to heaven, and nobody gets no land. It’s just in their head. They’re all the time talkin’ about it, but it’s jus’ in their head.","['books', 'heaven', 'land ']"
books,"It was like walking into a treasure trove of books, hoarded by pirate librarians.","['books', 'librarian', 'pirate', 'secret', 'treasure ']"
"romance,quotes,books","She turned to look at him, and he was already looking at her. “I’m going to miss you when I wake up,” she whispered, because she realized that she must have fallen asleep under the sun. Arin was too real for her imagination. He was a dream.“Don’t wake up,” he said.","['arin', 'books', 'dreaming', 'fiction', 'kestrel', 'love', 'quotes', 'romance ']"
"humor,books","My bookcase is all yours.""I walked to the door. ""I've just decided that those are my favorite five words in the world.","['books', 'comics', 'humor ']"
books,"Get books, sit yourself down anywhere, and go to reading them yourself.","['books', 'reading ']"
books,I had found my religion: nothing seemed more important to me than a book. I saw the library as a temple.,"['books', 'library', 'literature', 'reading', 'words ']"
books,Life is too short to waste time on books that end badly,['books ']
books,"If anything attacked us, we could just panic at it until it went away.","['books', 'funny', 'ironic', 'rosemary-and-rue', 'seanan-mcguire ']"
books,"No book worth its salt is meant to put you to sleep, it's meant to make you jump out of your bed in your underwear and run and beat the author's brains out.","['authors', 'books', 'brains', 'sleep', 'underwear ']"
books,"His library was a fine dark place bricked with books, so anything could happen there and always did. All you had to do was pull a book from the shelf and open it and suddenly the darkness was not so dark anymore.","['books', 'library', 'words ']"
"writing,books","Writers are really people who write books not because they are poor, but because they are dissatisfied with the books which they could buy but do not like.","['books', 'writers', 'writing ']"
books,Books don't need batteries.,"['books', 'technology ']"
"hope,inspiration,romance,books",I could recognise his soul in mine as much as he could find me in his. Our sole existences seemed to have been for this very moment when nothing else mattered.,"['books', 'hope', 'inspirational-quotes', 'life', 'love', 'paranormal-romance', 'romance', 'soul-mate ']"
books,"But there is in everything a reasonable division of labour. I have written the book, and nothing on earth would induce me to read it.","['books', 'humor', 'literary-criticism ']"
books,"I think it is good that books still exist, but they do make me sleepy.",['books ']
books,"Reading is going toward something that is about to be, and no one yet knows what it will be.","['books', 'philosophy-of-life', 'reading ']"
books,"Real life is physical. Give me books instead. Give me the invisibility of the contents of books, the thoughts, the ideas, the images. Let me become part of a book. . . . an intertextual being: a book cyborg, or, considering that books aren't cybernetic, perhaps a bibliorg.","['books', 'cybernetics', 'ideas', 'images', 'thoughts ']"
books,"I love inscriptions on flyleaves and notes in margins, I like the comradely sense of turning pages someone else turned, and reading passages someone long gone has called my attention to.","['book-lover', 'books ']"
books,Only the nonreader fears books.,"['books', 'censorship', 'reading ']"
books,"Books and doors are the same thing. You open them, and you go through into another world.","['books', 'reading ']"
"wisdom,hope,faith,inspiration,quotes,success,books,positive",The world’s greatest achievers have been those who have always stayed focussed on their goals and have been consistent in their efforts.,"['attitude', 'authors', 'books', 'coaching', 'connect', 'counseling', 'courage', 'dare', 'daring', 'determination', 'dreams', 'faith', 'famous', 'goals', 'hope', 'idea', 'inspiration', 'inspire', 'judge', 'leadership', 'life', 'motivation', 'motivator', 'never-give-up', 'passion', 'positive-thinking', 'promo', 'publishing', 'quotes', 'self-confidence', 'self-esteem', 'success', 'successful', 'triumph', 'victory', 'willpower', 'wisdom', 'words', 'you-can-do-it ']"
"poetry,books","So here is my story, may it bringSome smiles and a tear or so,It happened once upon a time,Far away, and long ago,Outside the night wind keens and wails,Come listen to me, the Teller of Tales!","['books', 'poem', 'poetry ']"
books,"Books can ignite fires in your mind, because they carry ideas for kindling, and art for matches.","['art', 'books', 'ideas ']"
books,"Books are the most wonderful friends in the world. When you meet them and pick them up, they are always ready to give you a few ideas. When you put them down, they never get mad; when you take them up again, they seem to enrich you all the more.",['books ']
books,Bloodthirsty little beasts. Never trust a duck.,['books ']
"inspiration,books","Read. Read anything. Read the things they say are good for you, and the things they claim are junk. You'll find what you need to find. Just read.","['books', 'inspirational', 'reading ']"
"writing,books","If I told you that my global audience has shot up 100% in the last six months, what would you say? If you were to say, “So you went from one reader to two readers?” you’d be absolutely correct. And after I had congratulated you on your keen guess, I’d thank you for being 50% of my reading base.","['absurd', 'audience', 'author', 'books', 'congratulate', 'congratulations', 'content', 'content-marketing', 'correct', 'demographics', 'global', 'global-reach', 'growth', 'guess', 'humor', 'keen', 'lit-on-literature', 'marketing', 'reader', 'readers', 'reading', 'self-growth', 'word-junkies', 'write', 'writer', 'writing ']"
books,"In my fool hardy youth, when my friends were dreaming of heroic deeds in the realms of engineering and law, finance and national politics, I dreamt of becoming a librarian.","['books', 'librarian', 'libraries', 'library ']"
books,"We can imagine the books we'd like to read, even if they have not yet been written, and we can imagine libraries full of books we would like to possess, even if they are well beyond our reach, because we enjoy dreaming up a library that reflects every one of our interests and every one of our foibles--a library that, in its variety and complexity, fully reflects the reader we are.","['books', 'dreams', 'library', 'literature', 'reader', 'reading ']"
"poetry,books","To feel most beautifully alive means to be reading something beautiful, ready always to apprehend in the flow of language the sudden flash of poetry.","['books', 'language', 'literature', 'poetry', 'reading', 'words ']"
books,"All that mankind has done, thought, gained, or been; it is lying as in magic preservation in the pages of books.","['books', 'literacy', 'reading ']"
"humor,books","Professors of literature collect books the way a ship collects barnacles, without seeming effort.","['books', 'humor ']"
books,I still remember the day my father took me to the Cemetery of Forgotten Books for the first time.,['books ']
books,"It's too late to apologize for I have already forgiven you.""-FitzChivalry Farseer",['books ']
books,"Reading is my favourite occupation, when I have leisure for it and books to read.","['books', 'hobby', 'leisure', 'reading ']"
"inspiration,hope,books","Right now, we're living in an ugly chapter of our lives, but books always get better!","['books', 'fantasy', 'hope', 'inspirational', 'self-help ']"
books,"To live is to have worries and uncertainties. Keep them inside, and they will destroy you for certain--leaving behind a person so callused that emotion can find no root in his heart.",['books ']
books,"I've developed a great reputation for wisdom by ordering more books than I ever had time to read, and reading more books, by far, than I learned anything useful from, except, of course, that some very tedious gentlemen have written books.","['books', 'literature', 'reading', 'words ']"
books,Reading is reading - no matter what the material.,"['books', 'reading ']"
books,"Prometheus, thief of light, giver of light, bound by the gods, must have been a book.",['books ']
"inspiration,books","Books have a way of finding their way into our lives, usually, right when we need them the most.","['books', 'inspirational ']"
books,No one knows as well as I how much nonsense is printed in books.,"['books', 'reading ']"
books,Some like to believe it's the book that chooses the person.,"['book-lovers', 'books', 'choose', 'people ']"
books,Reading made Don Quixote a gentleman. Believing what he read made him mad.,['books ']
books,"There are books so alive that you're always afraid that while you weren't reading, the book has gone and changed, has shifted like a river; while you went on living, it went on living too, and like a river moved on and moved away. No one has stepped twice into the same river. But did anyone ever step twice into the same book?","['books', 'literature', 'reading', 'words ']"
books,I only want power so I can get books.,"['books', 'harry-potter', 'power ']"
"inspiration,books","Books didn’t make me wallow in darkness, darkness made me wallow in books.","['books', 'inspirational', 'reading', 'teens ']"
"knowledge,education,books","....a good book can teach you about the world and about yourself. You learn more than how to read better; you also learn more about life. You become wiser. Not just more knowledgeable - books that provide nothing but information can produce that result. But wiser, in the sense that you are more deeply aware of the great and enduring truths of human life.","['books', 'education', 'knowledge ']"
books,"Allowing yourself to stop reading a book - at page 25, 50, or even, less frequently, a few chapters from the end - is a rite of passage in a reader's life, the literary equivalent of a bar mitzvah or a communion, the moment at which you look at yourself and announce: Today I am an adult. I can make my own decisions.","['books', 'reading ']"
books,Lovers of print are simply confusing the plate for the food.,"['books', 'digital-age', 'ebooks', 'ereaders', 'fiction', 'kindle', 'kobo', 'nook', 'print', 'print-books ']"
books,Nothing was truly unbearable if you had something to read.,"['books', 'reading ']"
books,I hate to lend a book I love…it never seems quite the same when it comes back to me…,"['books', 'l-m-montgomery ']"
books,"Read not to contradict and confute, nor to believe and take for granted ...but to weigh and consider.","['books', 'reading ']"
"knowledge,books","The true birthplace is that wherein for the first time one looks intelligently upon oneself; my first homelands have been books, and to a lesser degree schools.","['books', 'knowledge', 'literature', 'reading', 'self', 'words ']"
books,Tis the good reader that makes the good book.,['books ']
books,There are essentially two things that will make you wise -- the books you read and the people you meet.,"['book-sellers', 'books ']"
books,"If books are not good company, where shall I find it?",['books ']
"poetry,books","He ate and drank the precious words,His spirit grew robust;He knew no more that he was poor,Nor that his frame was dust.He danced along the dingy days,And this bequest of wingsWas but a book. What libertyA loosened spirit brings!","['books', 'literature', 'poetry', 'words ']"
books,"...writers are a savage breed, Mr. Strike. If you want life-long friendship and selfless camaraderie, join the army and learn to kill. If you want a lifetime of temporary alliances with peers who will glory in your every failure, write novels.","['books', 'camaraderie', 'friendship', 'loyalty', 'writers', 'writers-life', 'writers-on-writing', 'writers-world ']"
books,"Because when I read, I don't really read; I pop a beautiful sentence into my mouth and suck it like a fruit drop, or I sip it like a liqueur until the thought dissolves in me like alcohol, infusing brain and heart and coursing on through the veins to the root of each blood vessel.","['books', 'literature', 'reading', 'words ']"
books,Good books are about everything.,"['books', 'everything', 'reading ']"
"writing,books","Have you thought of an ending?""""Yes, several, and all are dark and unpleasant.""""Oh, that won't do! Books ought to have good endings. How would this do: and they all settled down and lived together happily ever after?""""It will do well, if it ever came to that.""""Ah! And where will they live? That's what I often wonder.","['bilbo', 'books', 'endings', 'frodo', 'happy-endings', 'lotr', 'sam-gamgee', 'writing ']"
books,"The books we read should be chosen with great care, that they may be, as an Egyptian king wrote over his library,'The medicines of the soul.","['books', 'reading ']"
"arts,books","Literature is the art of discovering something extraordinary about ordinary people, and saying with ordinary words something extraordinary.","['books', 'literature', 'reading', 'words ']"
books,Censorship is the child of fear and the father of ignorance.,"['banned-books', 'banned-books-week', 'books', 'censorship', 'freedom-to-read', 'ideas', 'intellectual-freedom ']"
books,"Worst of all, the inner vault is guarded by a live dragon, attended by fifty naked women armed with poisoned spears, each of them sworn to die in Requin's service. All redheads.-You're just making that up, Jean.",['books ']
books,"Associate with noblest people you can find; read the best books; live with the mighty. But learn to be happy alone.  Rely upon your own energies, and so not wait for, or depend on other people.","['books', 'independence', 'self-reliance ']"
"life,relationship,poetry,romance,books","I find Bukowski to be so edgy, gritty, and daring that he oozes romance, and if couples read him in bed they would appreciate what they have.","['appreciation', 'author', 'authors', 'bed', 'books', 'bukowski', 'couple', 'couples', 'daring', 'edgy', 'gritty', 'life', 'lit-on-literature', 'poem', 'poet', 'poetry', 'read', 'reading', 'relationships', 'romance', 'romantic', 'word-junkies', 'writer', 'writers ']"
"knowledge,books",Beware you be not swallowed up in books! An ounce of love is worth a pound of knowledge.,"['books', 'knowledge', 'love', 'reading ']"
books,"What I saw next stopped me dead in my tracks. Books. Not just one or two dozen, but hundreds of them. In crates. In piles on the floor. In bookcases that stretched from floor to ceiling and lined the entire room. I turned around and around in a slow circle, feeling as if I'd just stumbled into Ali Baba's cave. I was breathless, close to tears, and positively dizzy with greed.","['books', 'library', 'readers ']"
books,"I had found a new friend. The surprising thing is where I’d found him – not up a tree or sulking in the shade, or splashing around in one of the hill streams, but in a book. No one had told us kids to look there for a friend. Or that you could slip inside the skin of another. Or travel to another place with marshes, and where, to our ears, the bad people spoke like pirates.",['books ']
books,All of us can think of a book... that we hope none of our children or any other children have taken off the shelf. But if I have the right to remove that book from the shelf - that work I abhor - then you also have exactly the same right and so does everyone else. And then we have no books left on the shelf for any of us.,"['books', 'censorship', 'reading ']"
books,"Booksellers are the most valuable destination for the lonely, given the numbers of books written because authors couldn't find anyone to talk to.","['books', 'booksellers', 'loneliness ']"
books,"Books are like truth serum-- if you don't read, you can't figure out what's real.","['books', 'reading ']"
books,"...Something we once loved, and love now, in the shape of a book. Maybe eBooks are going to take over, one day, but not until those whizzkids in Silicon Valley invent a way to bend the corners, fold the spine, yellow the pages, add a coffee ring or two and allow the plastic tablet to fall open at a favorite page.","['books', 'ebooks ']"
books,We become the books we read.,"['books', 'character-development', 'reading ']"
books,Apa gunanya banyak baca bukuKalau mulut kau bungkam melulu,"['books', 'reading ']"
books,To prohibit the reading of certain books is to declare the inhabitants to be either fools or slaves.,"['books', 'censorship', 'reading ']"
"inspiration,books","Reading is my passion and my escape since I was 5 years old. Overall, children don't realize the magic that can live inside their own heads. Better even then any movie.","['books', 'escape', 'inspirational', 'intellectual', 'love', 'passion', 'reading', 'spiritual ']"
"poetry,books","Dreams, books, are each a world; and books, we know,Are a substantial world, both pure and good:Round these, with tendrils strong as flesh and blood,Our pastime and our happiness will grow.","['books', 'poetry', 'reading', 'words ']"
"writing,books","What amazes me is that most days feel useless. I don't seem to accomplish anything-just a few pages, most of which don't seem very good. Yet, when I put all those wasted days together, I somehow end up with a book of which I'm very proud.","['books', 'writing ']"
books,"It looked like the sort of book described in library catalogues as 'slightly foxed', although it would be more honest to admit that it looked as though it had been badgered, wolved and possibly beared as well.","['books', 'humour ']"
books,What is wonderful about great literature is that it transforms the man who reads it towards the condition of the man who wrote.,"['books', 'literature', 'reading', 'words ']"
books,"I’d volunteer to go to prison, as long as there are books. Because with books I am free.","['books', 'indonesia ']"
books,Sometimes I think books are the only friends worth having.,"['books', 'cynicism', 'humor ']"
books,"I can think of few better ways to introduce a child to books than to let her stack them, upend them, rearrange them, and get her fingerprints all over them.","['books', 'child', 'children ']"
"writing,books","The good, the admirable reader identifies himself not with the boy or the girl in the book, but with the mind that conceived and composed that book.","['author', 'books', 'reader', 'reading', 'writing ']"
books,An hour spent reading is one stolen from paradise.,"['books', 'reading ']"
books,I care more about the people in books than the people I see every day.,"['books', 'characters ']"
books,"Censorship of anything, at any time, in any place, on whatever pretense, has always been and always will be the last resort of the boob and the bigot.","['books', 'censorship ']"
books,"I have gone to [this bookshop] for years, always finding the one book I wanted - and then three more I hadn’t known I wanted.","['books', 'books-reading', 'bookstore', 'bookstores', 'buying-books ']"
"happiness,books","When we are collecting books, we are collecting happiness.","['books', 'happiness ']"
books,"When I was a child, books were everything. And so there is in me, always, a nostalgic, yearning for the lost pleasure of books. It is not a yearning that one ever expects to be fulfilled.",['books ']
books,"I think that every reader on earth has a list of cherished books as unique as their fingerprints....I think that, as you age, you tend to gravitate towards the classics, but those aren't the books that give you the same sort of hope for the world that a cherished book does.","['books', 'reading ']"
books,"Standing there, staring at the long shelves crammed with books, I felt myself relax and was suddenly at peace.","['books', 'bookstore', 'library ']"
books,"We lusty bibliophiles know that reading, unlike just about anything else, is both good for you and loads of fun.","['bibliophile', 'bibliophiles', 'books', 'fun', 'reader', 'reading ']"
books,The books are to remind us what asses and fools we are.,"['books', 'books-reading ']"
books,"It has long been my belief that everyone's library contains an Odd Shelf. On this shelf rests a small, mysterious corpus of volumes whose subject matter is completely unrelated to the rest of the library, yet which, upon closer inspection, reveals a good deal about its owner.","['books', 'library', 'readers ']"
"soul,books","Books let us into their souls and lay open to us the secrets of our own.""[The Sick Chamber (The New Monthly Magazine , August 1830)]","['books', 'reading', 'secrets', 'soul ']"
books,"She did not care very much for other little girls, but if she had plenty of books she could console herself.","['books', 'princess', 'reading ']"
