0,1,2
books,When was the last time you read a book? The truth now. And picture books don't count-I mean something with print in it.,"['books', 'reading ']"
books,"Do you understand now why books are hated and feared? Because they reveal the pores on the face of life. The comfortable people want only the faces of the full moon, wax, faces without pores, hairless, expressionless.",['books ']
books,Who made you Queen of Literacy? Go sit in your car!,"['books', 'humor', 'literacy', 'reading ']"
books,"CUSTOMER: If I were to, say... meet the love of my life in this bookshop, what section do you think they would be standing in?","['books', 'bookshops', 'humor', 'love ']"
books,So many FREAKS and not enough CIRCUSES!,"['books', 'humor ']"
"life,books","That's what I do. Watch movies and read. Sometimes I even pretend to write, but I'm not fooling anyone. Oh, and I go to the mailbox.","['books', 'everyday-life', 'life', 'love', 'movies', 'reading', 'thinking', 'write ']"
"philosophy,books","Do you shovel to survive, or survive to shovel?","['books', 'life-and-death', 'philosophy ']"
"faith,success,books",ولو إستطعت أن أعود بعجلة الزمان إلى الوراء ،لما إخترتك لي عاشقاً !ولأبقيتك عابراً غريباً يزور مدائني دون أن يحدث بداخلي أي ضجيج !,"['books', 'faith', 'heart', 'love', 'reading', 'success', 'to-read', 'شعر', 'صام', 'قلب', 'كتاب ']"
books,Reading was not a fallback position for her but an ideal state of being.,"['books', 'reading ']"
books,"Nothing ever invented provides such sustenance, such infinite reward for time spent, as a good book.",['books ']
books,It seems to me that anyone whose library consists of a Kindle lying on a table is some sort of bloodless nerd.,"['books', 'ebooks', 'ereaders', 'kindle ']"
books,Hold a book in your hand and you're a pilgrim at the gates of a new city.,"['books', 'literature', 'reading', 'words ']"
books,"It is really hard to be lonely very long in a world of words. Even if you don't have friends somewhere, you still have language, and it will find you and wrap its little syllables around you and suddenly there will be a story to live in.","['books', 'literature', 'reading', 'words ']"
books,"All books are either dreams or swords,You can cut, or you can drug, with words.","['books', 'dreams ']"
books,great books are the ones we need,"['books', 'reading ']"
"faith,success,books",اعذرني !!لن ألوث طهري ونقائي لمجرد إرضائك ،ولن أدنس مبادئي لأكسب شرف قربك مني ..ولن أنزع رداء الطفولة من روحي من ذاتي من وجداني ..لأكون في نظرك أنثى كاملة النضوجهذه أنا إن أردتني بطهري بطفولتي بنقائي بوفائي بعطائي !!وإن لم ترغب بنجلائك كما هي ..إذهب إليهن وغادرنيفكثيرات ياسيدي من هن بحجم رغباتك !وقليلات / قليلات من هن بحجم نقائي !,"['books', 'faith', 'heart', 'love', 'reading', 'success', 'to-read', 'شعر', 'صام', 'قلب', 'كتاب ']"
"writing,books",This is no book. Whoever touches this touches a man.,"['books', 'reading', 'writing ']"
"writing,books","if a book isn't self-explanatory, then it isn't worth reading.","['books', 'reading', 'writing ']"
books,"Books--oh! no. I am sure we never read the same, or not with the samefeelings.""""I am sorry you think so; but if that be the case, there can at least beno want of subject. We may compare our different opinions.",['books ']
books,"One little Indian left all alone, he went out and hanged himself and then there were none.","['books', 'mystery', 'nursery-rhyme', 'rhyme', 'suicide ']"
"death,books","I like to imagine that, on the day after my last, my library and I will crumble together, so that even when I am no more I'll still be with my books.","['books', 'death', 'library ']"
"poetry,books","I see all of us reading ourselves away from ourselves,  straining in circles of light to find more light until the line of words becomes a trail of crumbs that we follow across a page of fresh snow","['books', 'literature', 'poetry', 'reading', 'words ']"
"knowledge,writing,books","I’m up for the Julius Caesar Author of the Year Award this year. I’m tremendously proud, considering Caesar is the guy who burned down the Library of Alexandria.","['annual', 'author-of-the-year', 'bogus', 'books', 'burn', 'burned', 'fantasy', 'fire', 'julius-caesar', 'knowledge', 'library', 'library-of-alexandria', 'literary-award', 'literary-awards', 'nominated', 'nomination', 'nonsense', 'prestige', 'prestigious', 'prestigious-award', 'pride', 'proud', 'writer', 'writing', 'writing-award', 'year ']"
books,"Our society accepts the book as a given, but the act of reading -- once considered useful and important, as well as potentially dangerous and subversive -- is now condescendingly accepted as a pastime, a slow pastime that lacks efficiency and does not contribute to the common good.","['book', 'books', 'reader', 'reading', 'society ']"
books,"Like flies in amber, like corpses frozen in ice, that which according to the laws of nature should pass away is, by the miracle of ink on paper, preserved. It is a kind of magic. As one tends the graves of the dead, so I tend the books. And every day I open a volume or two, read a few lines or pages, allow the voices of the forgotten dead to resonate inside my head.","['books', 'literature', 'reading', 'words ']"
books,"... just as food is necessary to the life of the body, so good reading is necessary to the life of the soul.",['books ']
books,You will find most books worth reading are worth reading twice.,"['books', 'reading ']"
books,"Printer's ink has been running a race against gunpowder these many, many years. Ink is handicapped, in a way, because you can blow up a man with gunpowder in half a second, while it may take twenty years to blow him up with a book. But the gunpowder destroys itself along with its victim, while a book can keep on exploding for centuries.",['books ']
books,"Reading is the royal road to intellectual eminence...Truly good books are more than mines to those who can understand them. They are the breathings of the great souls of past times. Genius is not embalmed in them, but lives in them perpetually.","['books', 'reading ']"
books,"When at last I came upon the right book, the feeling was violent: it blew open a hole in me that made life more dangerous because I couldn't control what came through it.","['books', 'literature', 'reading ']"
books,"Books were only one type of receptacle where we stored a lot of things we were afraid we might forget. There is nothing magical in them at all. The magic is only in what books say, how they stitched the patches of the Universe together into one garment for us.","['books', 'bradbury', 'fahrenheit-451', 'magic', 'ray-bradbury ']"
books,"I always thought it was Mo Be Dick. I know Mo, and he is a dick.","['books', 'humor', 'literature', 'mo', 'moby-dick ']"
books,"A book has but one voice, but it does not instruct everyone alike.",['books ']
"education,books","A capacity, and taste, for reading, gives access to whatever has already been discovered by others. It is the key, or one of the keys, to the already solved problems. And not only so. It gives a relish, and facility, for successfully pursuing the [yet] unsolved ones.","['books', 'discovery', 'education', 'reading ']"
books,"What I will be remembered for are the Foundation Trilogy and the Three Laws of Robotics. What I want to be remembered for is no one book, or no dozen books. Any single thing I have written can be paralleled or even surpassed by something someone else has done. However, my total corpus for quantity, quality and variety can be duplicated by no one else. That is what I want to be remembered for.",['books ']
books,"Only five books tonight, Mommy,""she says.No, Olivia, just one.""How about four?""Two.""Three.""Oh, all right, three. But that's it!","['bedtime', 'books', 'olivia', 'pig ']"
books,Anything can become a children's book if you give it to a child...Children are actually the best (and worst) audience for literature because they have no patience with pretence.,"['books', 'children', 'children-s-books ']"
books,"My books hold between their covers every story I've ever known and still remember, or have now forgotten, or may one day read; they fill the space around me with ancient and new voices.","['book', 'books', 'read', 'reading ']"
"inspiration,relationship,books",Everyone creates realities based on their own personal beliefs. These beliefs are so powerful that they can create [expansive or entrapping] realities over and over.~Kuan Yin,"['books', 'goddess', 'gratitude', 'inspirational', 'kuanyin', 'law-of-attraction', 'loa', 'love', 'manifestation', 'prosperity', 'quantum-reality', 'relationships', 'the-secret', 'wealth ']"
"romance,quotes,books","She’d felt it before, she felt it now: the pull to fall in with him, to fall into him, to lose her sense of self.","['books', 'fiction', 'kestrel', 'love', 'quotes', 'romance ']"
"quotes,books","An emotion clamped down on her heart. It squeezed her into a terrible silence. But he said nothing after that, only her name, as if her name were not a name but a question. Or perhaps that it wasn’t how he had said it, and she was wrong, and she’d heard a question simply because the sound of him speaking her name made her wish that she were his answer.","['books', 'kestrel', 'quotes', 'romance', 'the-winner-s-crime ']"
books,"The flesh is sad, alas, and I have read all the books.","['books', 'flesh', 'sensuality', 'wit ']"
books,"One of my heroes, G.K. Chesterton, said, ""The old fairy tales endure forever. The old fairy tale makes the hero a normal human boy; it is his adventures that are startling; they startle him because he is normal.""Discovering that the modern world can still contain the wonder and strangeness of a fairy tale is part of what my novels are about.","['books', 'fairy-tales ']"
books,"Tis the good reader that makes the good book; in every book he finds passages which seem confidences or asides hidden from all else and unmistakenly meant for his ear; the profit of books is according to the sensibility of the reader; the profoundest thought or passion sleeps as in a mine, until it is discovered by an equal mind and heart.","['books', 'literature', 'reading', 'words ']"
books,"To all my librarian friends, champions of books, true magicians in the House of Life. Without you, this writer would be lost in the Dust.","['books', 'dedications', 'librarians ']"
books,"In a few minutes I heard the books' voices: a low, steady, unsupressible hum. I'd heard it many times before. I've always had a finely tuned ear for a library's accumulations of echo and desire. Libraries are anything but hushed.","['books', 'library ']"
books,"There were two sets of double doors leading out of the antechamber, one marked STACKS and the other TOMES. Not knowing the difference between the two, I headed to the ones labeled STACKS. That was what I wanted. Stacks of books. Great heaps of books. Shelf after endless shelf of books.","['books', 'libraries', 'reading ']"
books,"My last refuge, my books: simple pleasures, like finding wild onions by the side of a road, or requited love.",['books ']
books,"A book is a wonderful present. Though it may grow worn, it will never grow old.","['books', 'cage', 'girl', 'historical-fiction', 'marjorie-bruce', 'old', 'present', 'robert-the-bruce', 'worn', 'young-adult-fiction ']"
"writing,books",A good book will pull you in from the beginning and take you on a journey you'll never forget.,"['books', 'reading', 'writing ']"
books,"I remember the hours I had spent in Father's library, drugging myself with books so I could forget my doom for an hour..","['books', 'reading ']"
books,Woe be to him that reads but one book.,"['books', 'reading ']"
books,"Now begin in the middle, and later learn the beginning; the end will take care of itself.","['books', 'life ']"
books,"Lolita is famous, not I. I am an obscure, doubly obscure, novelist with an unpronounceable name.","['books', 'fame', 'lolita', 'names', 'obscure', 'writers ']"
books,"Knowing I lov'd my books, he furnish'd me From mine own library with volumes that I prize above my dukedom.","['books', 'libraries', 'reading ']"
books,A book read by a thousand different people is a thousand different books.,"['books', 'people', 'reading ']"
"philosophy,wisdom,poetry,quotes,books",Even if you are alone you wage war with yourself.,"['alone', 'books', 'dejan-stojanovic', 'literature', 'literature-quotes', 'philosophy', 'poetry', 'poetry-quotes', 'poets', 'quotes', 'the-sun-watches-the-sun', 'war', 'wars', 'wisdom', 'yourself ']"
"poetry,books","It is time to float on the waters of the night. Time to wrap my arms around this book and press it to my chest, life preserver in a sea of unremarkable men and women, anonymous faces on the street, a hundred thousand unalphabetized things, a million forgotten hours.","['books', 'poetry ']"
books,"Tell me I didn't imagine it, Leo. Tell me that even though our bodies were in seperate states, our star selves shared an enchanted place. Tell me that right around noon today (eastern time) you had the strangest sensation: a tiny chill on your shoulder...a flutter in the heart...a shadow of strawberry-banana crossing your tongue...tell me you whispered my name.","['books', 'stargirl ']"
books,Books are the compasses and telescopes and sextants and charts which other men have prepared to help us navigate the dangerous seas of human life.,"['books', 'life ']"
books,"Did you ever hear anyone say, 'That work had better be banned because I might read it and it might be very damaging to me'?","['books', 'censorship', 'reading ']"
books,"Every face, every shop, bedroom window, public-house, and dark square is a picture feverishly turned--in search of what? It is the same with books. What do we seek through millions of pages?","['book', 'books', 'face', 'faces', 'pages', 'search', 'shop', 'shops', 'window', 'windows ']"
books,"This must be what an addict feels like, I think, trying to fight the pull of one last, quick read. My fingers itch toward the binding, and finally, with a sigh of regret, I just grab the book and open it, hungrily reading the story.","['addiction', 'books ']"
books,"The thing about Tolkien, about The Lord of the Rings, is that it's perfect. It's this whole world, this whole process of immersion, this journey. It's not, I'm pretty sure, actually true, but that makes it more amazing, that someone could make it all up. Reading it changes everything.","['books', 'lord-of-the-rings', 'middle-earth', 'reading', 'the-lord-of-the-rings', 'tolkien ']"
books,"And what would happen if we never read the classics? There comes a point in life, it seems to me, where you have to decide whether you're a Person of Letters or merely someone who loves books, and I'm beginning to see that the book lovers have more fun.","['books', 'reading ']"
books,"As a fan of Agatha Christie, I think a brilliant mystery novel would be trying to identify the meat contents in a McDonald’s hamburger.","['agatha-christie', 'book', 'books', 'fan', 'hamburger', 'humor', 'mcdonald-s', 'mcdonalds', 'mystery', 'mystery-meat', 'mystery-novel', 'novel ']"
books,"My fingers positively itched to drift at length along their spines, to arrive at one whose lure I could not pass, to pluck it down, to inch it open, then to close my eyes and inhale the soul-sparking scent of old and literate dust.",['books ']
books,"I truly believe that if you have more friends than books, you have too many friends. Or not enough books. Probably both.","['books', 'friendship', 'twitter-quotes ']"
books,The real purpose of books is to trap the mind into doing its own thinking.,['books ']
books,The dirtiest book of all is the expurgated book.,"['books', 'censorship ']"
books,"anyone who’s worth anything reads just what he likes, as the mood takes him, and with extravagant enthusiasm.","['books', 'libraries', 'virginia-woolf ']"
"writing,books",You can cover a great deal of country in books.,"['books', 'scottish', 'writing ']"
"mind,books",There's no better way to inform and expand you mind on a regular basis than to get into the habit of reading good literature.,"['books', 'mind', 'reading ']"
books,I have no feelings of guilt regarding the books I have not read and perhaps will never read; I know that my books have unlimited patience. They will wait for me till the end of my days.,"['books', 'reading', 'tsundoku ']"
books,I read in self-defense.,"['books', 'life', 'reading ']"
books,"When I want to read a novel, I write one.","['authors', 'books', 'novels', 'reading ']"
books,"A good book is the precious life-blood of a master-spirit, embalmed and treasured up on purpose to a life beyond life, and as such it must surely be a necessary commodity.","['books', 'necessities', 'purpose-of-life', 'reading', 'spiritual-life', 'treasures ']"
books,"Not that she objected to solitude. Quite the contrary. She had books, thank Heaven, quantities of books. All sorts of books.","['books', 'heaven', 'reading', 'solitude ']"
books,"When you read to a child, when you put a book in a child's hands, you are bringing that child news of the infinitely varied nature of life. You are an awakener.","['books', 'children', 'reading ']"
books,"Write it down, boy. If you come across a passage in your reading that you’d like to remember, write it down in your little book; then you can read it again, memorize it, and have it whenever you wish.","['books', 'reading ']"
books,"Books swept me away, this way and that, one after the other; I made endless vows according to their lights for I believed them.","['books', 'reading ']"
books,"A book is an arrangement of twenty-six phonetic symbols, ten numerals, and about eight punctuation marks, and people can cast their eyes over these and envision the eruption of Mount Vesuvius or the Battle of Waterloo.","['books', 'literature', 'reading', 'words ']"
"writing,books",All novels are sequels; influence is bliss.,"['books', 'cliche', 'novels', 'originality', 'writing ']"
books,"And what would they be scared of? There's nothing to fear in a perfect world, is there?","['books', 'dystopian', 'incarceron ']"
books,"The library was a little old shabby place. Francie thought it was beautiful. The feeling she had about it was as good as the feeling she had about church. She pushed open the door and went in. She liked the combined smell of worn leather bindings, library past and freshly inked stamping pads better than she liked the smell of burning incense at high mass.","['bookish', 'books', 'experience', 'feelings', 'library', 'mood', 'read', 'reading', 'smell ']"
books,A censor is an expert in cutting remarks. A censor is a man who knows more than he thinks you ought to.,"['books', 'censorship', 'reading ']"
books,"For every book you buy, you should buy the time to read it.","['books', 'reading', 'time ']"
books,"We are so overwhelmed with quantities of books, that we hardly realize any more that a book can be valuable, valuable like a jewel, or a lovely picture, into which you can look deeper and deeper and get a more profound experience very time. It is far, far better to read one book six times, at intervals, than to read six several books.","['books', 'depth', 'reading', 'value ']"
books,Mother used to say escape is never further than the nearest book.,"['books', 'escape ']"
"soul,books","Who was it who said, ""I hold the buying of more books than one can peradventure read, as nothing less than the soul's reaching towards infinity; which is the only thing that raises us above the beasts that perish?""Whoever it was, I agree with him.","['books', 'buying-books', 'infinity', 'reading', 'soul ']"
books,"A big book is like a serious relationship; it requires a commitment. Not only that, but there's no guarantee that you will enjoy it, or that it will have a happy ending. Kind of like going out with a girl, having to spend time every day with her - with absolutely no guarantee of nailing her in the end. No thanks.","['books', 'reading ']"
books,It is time to browse through the precious books that have meant the most to you that you may rediscover illuminating phrases and sentences to light your pathway to the future...,"['books', 'inspirational ']"
books,"There was something appealing in thinking of a character with a secret life that her author knew nothing about. Slipping off while the author's back was turned, to find love in her own way. Showing up just in time to deliver the next bit of dialogue with an innocent face.",['books ']
books,Cakes are like books: There are new ones you want to read and old favorites you want to reread.,"['books', 'food ']"
books,Remind me not to piss you off Red. You might aim for the heart and shoot me in the balls.,"['books', 'nora', 'roberts ']"
books,"Амьдрал гэж нэг иймэрхүү авсаархан ном байлаа гэхэд, санаандгүй сөхөхөд тааралдах тохиолдлын ганц өгүүлбэрт л уг номыг унших учир шалтгаан бүрэн шингээстэй бий.",['books ']
books,What are a friend's books for if not to be borrowed?,['books ']
books,"The walls of books around him, dense with the past, formed a kind of insulation against the present world and its disasters.","['books', 'introversion', 'literature', 'reading', 'words ']"
"faith,success,books",أمقت تلك المسافات التي تفصلني عنك ،أتذمر من تلك المواقيت التي تسرقني منك ..أسخط على أعين تتأملك / على أنامل تلمسكعلى أنفاسك وهي تستنشقك !على نبضاتك وهي تستشعرك ، على ثيابك وهي تعانقك,"['books', 'faith', 'heart', 'love', 'reading', 'success', 'to-read', 'شعر', 'صام', 'قلب', 'كتاب ']"
"poetry,books","For books are more than books, they are the lifeThe very heart and core of ages past,The reason why men lived and worked and died,The essence and quintessence of their lives.","['books', 'poetry ']"
books,Reading is to the mind what exercise is to the body.,"['books', 'reading ']"
books,The words that strike us are those that awake an echo in a zone we have already made our own—the place where we live—and the vibration enables us to find fresh starting points within ourselves.,"['books', 'literature', 'reading', 'words ']"
books,"In my view, nineteen pounds of old books are at least nineteen times as delicious as one pound of fresh caviar.","['book', 'books ']"
"truth,wisdom,god,inspiration,relationship,romance,books","When I touched her body,I believed she was God.In the curves of her formI found the birth of Man,the creation of the world,and the origin of all life.","['adolescent', 'author', 'belonging', 'body', 'books', 'boy', 'bravery', 'cool', 'courage', 'creation', 'creation-myth', 'culture', 'desire', 'emotion', 'erotic', 'erotica', 'fearless', 'feminine', 'femininity', 'feminism-womanhood', 'feminist', 'femme', 'fiction', 'fight-for-love', 'fille', 'free', 'freedom', 'friendship', 'funny', 'girl', 'girls', 'god', 'growing-up', 'guy', 'honesty', 'human', 'humor', 'humour', 'imagination', 'individuality', 'inspiration', 'inspirational', 'inspirational-life', 'inspirational-love', 'inspirational-quotes', 'inspire', 'inspiring', 'jeune', 'jeune-fille', 'life', 'living', 'love', 'man', 'meaning-of-life', 'men', 'music', 'novel', 'novelist', 'paris', 'passion', 'passionate-life', 'passionate-love', 'payne', 'reality', 'relationships', 'roman', 'roman-payne', 'romance', 'self', 'sex', 'sexuality', 'society', 'society-s-increasing-stupidity', 'strength', 'technology', 'truth', 'unbreakable', 'unbreakable-spirit', 'wanderer', 'wanderess', 'wandering', 'wild', 'wildness', 'wisdom', 'womanliness', 'women', 'women-and-men', 'women-s-fiction', 'women-s-inspirational', 'women-s-rights', 'women-s-strength', 'young', 'youth ']"
books,"I go to books and to nature as the bee goes to a flower, for a nectar that I can make into my own honey.","['books', 'literature', 'nature', 'reading', 'words ']"
books,The truly cultured are capable of owning thousands of unread books without losing their composure or their desire for more.,"['books', 'composure', 'culture', 'unread ']"
books,"When I was in my twenties and broke, I'd buy books before food. A meal will sustain you for a few hours, a good book will sustain you for life.","['books', 'reading ']"
books,The world belongs to those who read.,"['books', 'inspirational', 'reading ']"
books,"If every library is in some sense a reflection of its readers, it is also an image of that which we are not, and cannot be.","['books', 'library', 'readers', 'reflection ']"
"happiness,books",Associate with the noblest people you can find; read the best books; live with the mighty; but learn to be happy alone.,"['books', 'happiness', 'life', 'reading', 'self-sufficiency ']"
books,"Book burnings. Always the forerunners. Heralds of the stake, the ovens, the mass graves.","['book-burning', 'books', 'censorship ']"
books,"Remember, when you don’t know what to do, it never hurts to play Scrabble. It’s like reading the I Ching or tea leaves.","['books', 'reading', 'scrabble ']"
books,Never trust anyone who has not brought a book with them,"['books', 'horseradish', 'lemony-snicket', 'true ']"
books,I would like my personal reading map to resemble a map of the British Empire circa 1900.,"['books', 'reading ']"
books,"Readers, censors know, are defined by the books they read.","['books', 'censors', 'reader', 'readers ']"
books,"I wanted to pull down a book, open it proper, and gobble up page after page","['books', 'reading ']"
