0,1,2
education,For every one pupil who needs to be guarded against a weak excess of sensibility there are three who need to be awakened from the slumber of cold vulgarity. The task of the modern educator is not to cut down jungles but to irrigate deserts.,['education ']
education,"To learn something new, take the path that you took yesterday.","['education', 'learning ']"
education,"In large part, we are teachers precisely because we remember what it was like to be a student. Someone inspired us. Someone influenced us. Or someone hurt us. And we’ve channeled that joy (or pain) into our own unique philosophies on life and learning and we’re always looking for an opportunity to share them—with each other, our students, parents, or in our communities.","['education', 'teachers ']"
education,Prison for the crime of puberty -- that was how secondary school had seemed.,"['education', 'puberty', 'school', 'teenage ']"
education,"Not with whom you are born, but with whom you are bred.",['education ']
education,Every maker of video games knows something that the makers of curriculum don't seem to understand. You'll never see a video game being advertised as being easy. Kids who do not like school will tell you it's not because it's too hard. It's because it's--boring,['education ']
education,"I am conscious of a soul-sense that lifts me above the narrow, cramping circumstances of my life. My physical limitations are forgotten- my world lies upward, the length and the breadth and the sweep of the heavens are mine!","['disability', 'education', 'literature ']"
"philosophy,happiness,hope,knowledge,education",The moon is the reflection of your heart and moonlight is the twinkle of your love.,"['education', 'happiness', 'heart', 'hope', 'inspirational', 'intelligence', 'knowledge', 'life', 'love', 'moon', 'moonlight', 'philosophy', 'reflection', 'truth', 'twinkle', 'wisdom ']"
"philosophy,education","The present convergence of crises––in money, energy, education, health, water, soil, climate, politics, the environment, and more––is a birth crisis, expelling us from the old world into a new.","['change', 'crises', 'economy', 'education', 'gift-economy', 'money', 'paradigm-shift', 'philosophy', 'societies-in-transition', 'spirituality ']"
education,"I've never done acid, finding it hard to go willingly to a place that could be frightening, hellish, and totally beyond my control. A place much like high school.","['education', 'going-bovine', 'hell', 'school ']"
education,"Nevertheless, (Jefferson) believed that the habit of skepticism is an essential prerequisite for responsible citizenship. He argued that the cost of education is trivial compared to the cost of ignorance, of leaving government to the wolves. He taught that the country is safe only when the people rule.","['education', 'ignorance', 'skepticism', 'thomas-jefferson ']"
education,"As regards moral courage, then, it is not so much that the public schools support it feebly, as that they suppress it firmly.","['education', 'homeschool', 'homeschooling', 'learning ']"
education,"No school can supply an anti-liberal education, or a fascist education, as these terms are contradictory. Liberalism and education are one.","['education', 'fascism', 'liberalism ']"
education,"Hey, Geekoid!""yelled Duncan Dougal, ""Why do you read so much? Don't you know how to watch TV?","['dumb-people', 'education', 'funny', 'humor', 'humour', 'learning', 'people-who-don-t-read', 'readers', 'reading', 'smart-people', 'stupid-people', 'television', 'tv ']"
education,[T]eaching has been for me an education (Lord knows what it has been for my students).,"['education', 'teaching ']"
education,"We do not trust educated people and rarely, alas, produce them, for we do not trust the independence of mind which alone makes a genuine education possible.","['88', 'education ']"
"philosophy,education,mind","With a philosophy education, one can infuriate his peers, intimidate his date, think of obscure, unreliable ways to make money, and never regret a thing.","['balance', 'composure', 'contentment', 'education', 'education-system', 'freedom', 'freedom-of-thought', 'funny', 'funny-but-true', 'humor', 'life', 'mind', 'peace', 'peace-of-mind', 'philosophy', 'poise', 'rationality', 'regrets', 'social', 'social-norms', 'sociality', 'thinking', 'thought', 'unstoppable', 'unstoppable-force ']"
"inspiration,education",You cannot live a nonviolent life as long as you are consuming violence. Please consider going vegan.,"['abolition', 'abolitionist', 'ahimsa', 'animals', 'education', 'exploitation', 'francione', 'inspirational-quotes', 'justice', 'life', 'nonviolence', 'nonviolence-jainism', 'peace-making', 'peace-movement', 'peace-on-earth', 'rights', 'sentience', 'slavery', 'veganism', 'vulnerable', 'wisdom ']"
"education,success",The success of my rule does not rely on my ability to recite obscure Latin verse.,"['education', 'latin', 'success ']"
education,"Life is still better than University. In school, your teacher is the fruit picker and you are the open fruit basket. Then you take those fruits and make cakes and pies. But life is going to give you the chance to go out there and pick those fruits yourself. Then you can eat them, or make them into something else; any which way, your own hands picked them!","['education', 'fruits', 'learning', 'life', 'life-and-living', 'life-experience', 'living-life', 'self-determination', 'university ']"
education,"If doctors are paid the same salary as bus drivers, community would not be crazy about making their children doctors","['career', 'consumerism', 'doctor', 'education', 'salary ']"
education,I didn't want any degrees if all the ill-read literates and radio announcers and pedagogical dummies I knew had them by the peck.,"['college', 'education ']"
"inspiration,education",To say that a being who is sentient has no interest in continuing to live is like saying that a being with eyes has no interest in continuing to see. Death—however “humane”—is a harm for humans and nonhumans alike.,"['abolition', 'abolitionist', 'ahimsa', 'animals', 'education', 'exploitation', 'francione', 'inspirational-quotes', 'justice', 'life', 'nonviolence', 'nonviolence-jainism', 'peace-making', 'peace-movement', 'peace-on-earth', 'rights', 'sentience', 'slavery', 'veganism', 'wisdom ']"
education,Perfect love has a breath of poetry which can exalt the relations of the least-instructed human beings.,"['education', 'love ']"
education,Who said to kill does not require gentleness?,"['education', 'humor ']"
education,"The soul of him who has education is whole and perfect and escapes the worst disease, but, if a man's education be neglected, he walks lamely through life and returns good for nothing to the world below.",['education ']
education,Education becomes most rich and alive when it confronts the reality of moral conflict in the world.,"['education', 'moral-conflict ']"
education,"Of all the purposes of education, I think the most useful is this: It prepares you to keep yourself entertained. It gives you a better chance of an interesting job.",['education ']
education,"I had always insisted that a good education was a synthesis of book learning and involvement in social action, that each enriched the other. I wanted my students to know that the accumulation of knowledge, while fascinating in itself, is not sufficient as long as so many people in the world have no opportunity to experience that fascination.","['action', 'education', 'educational-enrichment', 'educational-inequity', 'knowledge-acquisition', 'learning ']"
education,"Let children alone... the education of habit is successful in so far as it enables the mother to let her children alone, not teasing them with perpetual commands and directions - a running fire of Do and Don’t ; but letting them go their own way and grow, having first secured that they will go the right way and grow to fruitful purpose.","['child', 'children', 'education', 'parenting ']"
education,Librarians are essential players in the information revolution because they level that field. They enable those without money or education to read and learn the same things as the billionaire and the PhD.,"['education', 'information', 'librarians ']"
education,"Education...beyond all other devices of human origin, is a great equalizer of conditions of men --the balance wheel of the social machinery...It does better than to disarm the poor of their hostility toward the rich; it prevents being poor.",['education ']
education,"Like many highly educated people, I didn't have much in the way of actual skills.","['education', 'skills ']"
"philosophy,happiness,hope,knowledge,education",Happiness will grow if you plant the seeds of love in the garden of hope with compassion and care.,"['care', 'compassion', 'education', 'garden', 'happiness', 'hope', 'inspirational', 'intelligence', 'knowledge', 'life', 'love', 'philosophy', 'truth', 'wisdom ']"
education,"An English writer telephoned me from London, asking questions. One was, ‘What’s your alma mater?’ I told him, ‘Books.","['book', 'books', 'education ']"
education,Education: learning to find your purpose. Upon finding your purpose: what did I learn?,"['education', 'funny', 'humor ']"
education,"He warned Mother not to flout God's Will by expecting too much of us. ""Sending a girl to college is like pouring water in your shoes,' he still loves to say, as often as possible. 'It's hard to say which is worse, seeing it run out and waste the water, or seeing it hold in and wreck the shoes.","['education', 'girls ']"
education,Be generous with your smile and try not to frown.And you will see my children; your smile will never let you down ☺,"['children-s-literature', 'education', 'educational', 'humorous', 'poetry', 'wisdom ']"
education,"When you are growing up there are two institutional places that affect you most powerfully: the church, which belongs to God, and the public library, which belongs to you. The public library is a great equaliser.","['books', 'childhood', 'church', 'education', 'equality', 'growing-up', 'institutions', 'library', 'public-library', 'reading ']"
education,"We are in the school [or mortality] and keep learning and we do not expect to cease learning while we live on earth; and when we pass through the veil, we expect still to continue to learn and increase our fund of information.",['education ']
education,"Promote, then, as an object of primary importance, institutions for the general diffusion of knowledge. In proportion as the structure of a government gives force to public opinion, it is essential that public opinion should be enlightened.","['education', 'enlighten', 'importance', 'promote ']"
education,"I mean that they (students) should not play life, or study it merely, while the community supports them at this expensive game, but earnestly live it from beginning to end. How could youths better learn to live than by at once trying the experiment of living? Methinks this would exercise their minds as much as mathematics.","['college', 'education ']"
education,"As a teacher of fourth-graders in a public school, where corporal punishement was not allowed, she had years of violence stored up and was, truth be told, sort of enjoying letting it out on Kona, who she felt could have been the poster child for the failure of public education.","['chrisopher', 'education', 'moore', 'violence ']"
education,All of us must cross the line between ignorance and insight many times before we truly understand.,['education ']
"knowledge,education",Scoring well on tests is the sort of happy thing that gets the school district the greenbacks they crave. Understanding and appreciating the material are secondary.,"['education', 'knowledge', 'school', 'test ']"
"knowledge,education",An educated man should know everything about something and something about everything,"['education', 'knowledge ']"
education,The humanities should constitute the core of any university worth the name.,"['academia', 'education', 'humanities', 'university ']"
education,"It is very difficult to be learned; it seems as if people were worn out on the way to great thoughts, and can never enjoy them because they are too tired.","['distraction', 'education ']"
education,"I don’t think people realise how vital libraries are or what a colossal danger it would be if we were to lose any more. Having had a truncated school life myself, all of my education from the age of 17 has been self-taught. I wouldn’t be the person I am today if it wasn’t for the opportunities the library gave me.","['education', 'information', 'learning', 'libraries', 'save-libraries', 'self-taught ']"
education,"And there's this place called college! I mean, they want you to care, dig it, care about this education trip, and they don't care enough themselves to make it as attractive as the crap game across the street!","['college', 'education ']"
education,The bullet that has hit us Muslims today left the gun centuries ago when we let the clergy decide that knowledge and education were not important.,"['education', 'islamism', 'literature ']"
education,"But, Jefferson worried that the people - and the argument goes back to Thucydides and Aristotle - are easily misled. He also stressed, passionately and repeatedly, that it was essential for the people to understand the risks and benefits of government, to educate themselves, and to involve themselves in the political process. Without that, he said, the wolves will take over.","['education', 'government', 'politics', 'thomas-jefferson ']"
education,Much education today is monumentally ineffective. All too often we are giving young people cut flowers when we should be teaching them to grow their own plants.,['education ']
education,By starving the sensibility of our pupils we only make them easier prey to the propagandist when he comes. For famished nature will be avenged and a hard heart is no infallible protection against a soft head.,"['education', 'ethics', 'religion', 'students ']"
"philosophy,happiness,wisdom,hope,knowledge,education","The universe never complains.When you're wrong or right,She always loves and cares,She always gives and shares. When you get lost she becomes the light,Helps you to find what is right. But she never forgetsTo show you the light.","['care', 'complain', 'education', 'forget', 'give', 'happiness', 'hope', 'inspirational', 'intelligence', 'knowledge', 'life', 'light', 'lost', 'love', 'philosophy', 'right', 'share', 'truth', 'universe', 'wisdom', 'wrong ']"
education,"Truth persuades by teaching, but does not teach by persuading.","['education', 'persuasion', 'truth ']"
education,Getting an education is an awfully wearing process!,"['education', 'weary ']"
education,I have always had the greatest respect for students. There is nothing I hate more than condescension—the attitude that they are inferior to you. I always assume they have good minds.,"['education', 'students', 'teaching ']"
education,"Unless education promotes character making, unless it helps men to be more moral, more just to their fellows, more law abiding, more discriminatingly patriotic and public spirited, it is not worth the trouble taken to furnish it.","['education', 'homeschool', 'homeschooling', 'learning ']"
education,"Your sweet thank-you touches my heart, take my breath away, my only love. This day is only I have got.","['education', 'inspirational', 'love ']"
education,"I’d compare college tuition to paying for a personal trainer at an athletic club. We professors play the roles of trainers, giving people access to the equipment (books, labs, our expertise) and after that, it is our job to be demanding.","['college', 'education ']"
education,"In 1971, after seven years in college, with that magic piece of paper clutched triumphantly in my fist, the best job I was able to get was night watchman on a sewer project in Babylon, N.Y. guarding a hole in the ground to prevent anyone from stealing it. God bless the American educational system!","['college', 'education ']"
education,I am not simply teaching the reading; I am teaching the reader.,['education ']
education,"He never reckoned much to schooling and that. He said you could learn most what was worth knowing from keeping your eyes and ears peeled. Best way of learning, he always said, was doing.","['doing', 'education', 'experience', 'learning', 'observation', 'school ']"
education,...primarily the individual is going to study at home.,['education ']
"religion,education","We need to eliminate the concept of division by class, skills, race, income, religion, and nationality. Every human requires food and water to survive and every human has a heart that bleeds, loves, and grieves.","['bleed', 'blood', 'child', 'class', 'divide', 'division', 'education', 'equality', 'ethnicity', 'grief', 'grieve', 'grieves', 'heart', 'human', 'income', 'love', 'loves', 'man', 'nation', 'nationality', 'race', 'religion', 'skills', 'suzy-kassem', 'unite', 'united', 'woman ']"
education,"Last year, millions of students didn’t graduate from high school. They didn’t drop out, they were simply in elementary and middle schools.","['drop-out', 'education', 'elementary-school', 'graduate', 'high-school', 'humor', 'middle-school', 'school', 'students ']"
education,The ultimate goal of the educational system is to shift to the individual the burden of pursing his own education. This will not be a widely shared pursuit until we get over our odd conviction that education is what goes on in school buildings and nowhere else.,"['education', 'homeschool', 'homeschooling', 'learning ']"
education,You will not reap the fruit of individuality in your children if you clone their education.,"['education', 'homeschool', 'homeschooling', 'learning ']"
education,Some men never recover from education.,"['education', 'humor', 'irish ']"
education,We as economic society are going to have to pay our whole population to go to school and pay it to stay at school.,['education ']
education,"Most children, even very bright ones, need constant review and practice to truly own a concept in grammar, math or science. In schools today, on paper it may appear that kids are learning skills, but in reality they are only renting them, soon to forget what they've learned over the weekend or summer vacation.",['education ']
education,"Education is the preparation of a child intellectually, emotionally, spiritually, and physically for life and for eternity.","['education', 'kevin', 'school', 'swanson', 'upgrade ']"
education,Ready comprehension is often a knee-jerk response and the most dangerous form of understanding. It blinks an opaque screen over your ability to learn. Be warned. Understand nothing. All comprehension is temporary.,"['education', 'learning ']"
education,Most doctors are prisoners of their education and shackled by their profession.,"['doctors', 'education', 'prison', 'profession ']"
education,"What do teachers and curriculum directors mean by 'value' reading? A look at the practice of most schools suggests that when a school 'values' reading what it really means is that the school intensely focuses on raising state-mandated reading test scores- the kind of reading our students will rarely, if ever, do in adulthood.",['education ']
education,"I'm not trying to tell you,""he said ""that only educated men are able to contribute something valuable to the world. It's not so.But I do say that educated and scholarly men, if they're brilliant and creative to begin with--which, unfortunately, is rarely the case--tend to leave infinitely more valuable records behind them than men do who are MEREly brilliant and creative.","['creativity', 'education', 'wisdom ']"
education,"He did not like the grown-ups who talked down to him, but the ones who went on talking in their usual way, leaving him to leap along in their wake, jumping at meanings, guessing, clutching at known words, and chuckling at complicated jokes as they suddenly dawned. He had the glee of the porpoise then, pouring and leaping through strange seas.","['education', 'maturity ']"
education,"I've managed to bring the backlog down to a mere sixty-eight years,""she announced with some small sense of achievement. ""I hope to be able to start marking the papers of pupils who are still alive by the end of the decade.","['education', 'grades', 'grading', 'teachers', 'teaching ']"
"philosophy,happiness,hope,knowledge,education",The secret of happiness is love and secret of love is nonjudgmental care.,"['care', 'education', 'happiness', 'hope', 'inspirational', 'intelligence', 'knowledge', 'life', 'love', 'nonjudgmental', 'philosophy', 'secret', 'truth', 'wisdom ']"
"philosophy,happiness,hope,knowledge,education","Share your love, share you happiness, care for others; your wealth will be endless.","['care', 'education', 'endless', 'happiness', 'hope', 'inspirational', 'intelligence', 'knowledge', 'life', 'love', 'philosophy', 'share', 'truth', 'wealth', 'wisdom ']"
"philosophy,education",The goal of education is to enable individuals to continue their education.,"['education', 'philosophy ']"
"philosophy,happiness,wisdom,hope,knowledge,quotes,education",A friend is a friend who continues to love you and like you when you don't love him or like him any more.,"['education', 'happiness', 'hope', 'inspirational', 'intelligence', 'knowledge', 'life', 'love', 'philosophy', 'quotes', 'truth', 'wisdom ']"
"knowledge,education","Farms and food production should be, I submit, at least as important as who pierced their navel in Hollywood this week. Please tell me I'm not the only one who believes this. Please. As a culture, we think we're well educated, but I'm not sure that what we've learned necessarily helps us survive.","['educated', 'education', 'farms', 'food', 'knowledge ']"
"inspiration,education","Speciesism is morally objectionable because, like racism, sexism, and heterosexism, it links personhood with an irrelevant criterion. Those who reject speciesism are committed to rejecting racism, sexism, heterosexism, and other forms of discrimination as well.","['abolition', 'abolitionist', 'ahimsa', 'animals', 'education', 'exploitation', 'francione', 'inspirational-quotes', 'justice', 'life', 'nonviolence', 'nonviolence-jainism', 'peace-making', 'peace-movement', 'peace-on-earth', 'rights', 'sentience', 'slavery', 'veganism', 'wisdom ']"
education,It is among the commonplaces of education that we often first cut off the living root and then try to replace its natural functions by artificial means. Thus we suppress the child's curiosity and then when he lacks a natural interest in learning he is offered special coaching for his scholastic coaching for his scholastic difficulties.,"['children', 'education', 'fire', 'suppression ']"
education,You can't teach calculus to a chimpanzee. So just share your banana.,"['banana', 'calculus', 'chimpanzee', 'education', 'golden-rule', 'lyme-disease ']"
education,It was much more than bricks and stone - It was an idea.,"['education', 'goin-someplace-special ']"
education,"I have an unshaken conviction that democracy can never be undermined if we maintain our library resources and a national intelligence capable of utilizing them.""[Letter to Herbert Putnam; in: Waters, Edward N.: Herbert Putnam: the tallest little man in the world; Quarterly Journal of the Library of Congress 33:2 (April 1976), p. 171]","['democracy', 'education', 'libraries ']"
education,"In the end, it's not what we keep our children from that will save them. It's what we put into them in the first place.",['education ']
"mind,education",Wrote my way out of the hood...thought my way out of poverty! Don't tell me that knowledge isn't power. Education changes everything.,"['education', 'hard-work', 'knowledge-wisdom', 'mind', 'power', 'writing ']"
education,Some people get an education without going to college. The rest get it after they get out.,"['college', 'education ']"
education,"I was taught that I had to 'master' subjects. But who can 'master' beauty, or peace, or joy?","['education', 'ineffable ']"
education,"I would say, then, that you are faced with a future in which education is going to be number one amongst the great world industries.",['education ']
education,He worked with her as she was and not as he wanted her to be.,"['education', 'encouragement ']"
education,"Your life can be different, Young Ju. Study and be strong. In America, women have choices.","['american', 'assimilation', 'education', 'gender-equality', 'korean ']"
"philosophy,wisdom,happiness,hope,knowledge,education","You are happy when you are enthusiastic and action-oriented, not when you are luxury and pleasure oriented.","['action', 'education', 'enthusiastic', 'happiness', 'happy', 'hope', 'inspirational', 'intelligence', 'knowledge', 'life', 'love', 'luxury', 'oriented', 'philosophy', 'pleasure', 'truth', 'wisdom ']"
education,"I grew up in libraries, and I hope I've learned never to take them for granted. A thriving library is the heart of its community, providing access to information and educational opportunities, bringing people together, leveling the playing field, and archiving our history.","['community', 'education', 'information', 'libraries ']"
education,"There are all kinds of ignorance in the world. Education, learning to read and write, doesn't necessarily give us knowledge. We have to learn to use our minds to see what is really happening.","['education', 'ignorance', 'learning ']"
education,"Donde no hay libros hace frío. Vale para las casas, las ciudades, los países. Un frío cataclismo, un páramo de amnesia","['books', 'education', 'reading ']"
education,"An educated person is one who has learned that information almost always turns out to be at best incomplete and very often false, misleading, fictitious, mendacious - just dead wrong.",['education ']
