0,1,2
"knowledge,education","Yeah. Floyd is his batman.""His what?""Batman, like in the British army, each officer had a batman, a personal servant.""You spend too much time reading, Spenser. You know more stuff that don't make you money than anybody I know.","['army', 'britain', 'detectives', 'education', 'humor', 'irrelevance', 'knowledge', 'money', 'reading', 'spenser ']"
education,"I must judge for myself, but how can I judge, how can any man judge, unless his mind has been opened and enlarged by reading.","['discernment', 'education', 'reading ']"
education,Admission of ignorance is often the first step in our education.,"['admission', 'education', 'ignorance ']"
education,"The function of a child is to live his/her own life, not the life that his/her anxious parents think he/she should live, nor a life according to the purpose of the educators who thinks they knows best","['children', 'education', 'homeschooling ']"
education,"The plain fact is that education is itself a form of propaganda - a deliberate scheme to outfit the pupil, not with the capacity to weigh ideas, but with a simple appetite for gulping ideas ready-made. The aim is to make 'good' citizens, which is to say, docile and uninquisitive citizens.","['education', 'homeschool', 'homeschooling ']"
education,"They're so cold, these scholars!May lightning strike their foodso that their mouths learn howto eat fire!","['coldness', 'education', 'elitism', 'higher-education', 'scholars', 'scholarship ']"
education,It is always a much easier task to educate uneducated people than to re-educate the mis-educated.,"['education', 'ignorance', 'indoctrination', 'propaganda ']"
education,"A man's ethical behaviour should be based effectually on sympathy, education, and social ties and needs; no religious basis is necessary. Man would indeed be in a poor way if he had to be restrained by fear of punishment and hope of reward after death.","['education', 'ethics', 'morality', 'needs', 'religion', 'sociality', 'sympathy ']"
education,Segregation shaped me; education liberated me.,"['education', 'inspirational', 'learning', 'race ']"
education,"The older I grow, the more I am convinced that there is no education which one can get from books and costly apparatus that is equal to that which can be gotten from contact with great men and women.","['education', 'great-people', 'leaders ']"
"knowledge,education,science","Science replaces private prejudice with public, verifiable evidence.","['belief', 'education', 'enlighten', 'evidence', 'ignorance', 'knowledge', 'prejudice', 'proof', 'richard-dawkins', 'science ']"
"education,science","Even those who do not, or cannot, avail themselves of a scientific education, choose to benefit from the technology that is made possible by the scientific education of others.","['education', 'science ']"
education,"[Homeschooling]...recipe for genius: More of family and less of school, more of parents and less of peers, more creative freedom and less formal lessons.","['education', 'family', 'genius', 'homeschool', 'public-education ']"
education,The home environment can undo a lot you try to do at school.,['education ']
education,"Formal education teaches how to stand, but to see the rainbow you must come out and walk many steps on your own.","['education', 'education-reform', 'educational', 'educational-philosophy', 'educational-quotes', 'educational-system', 'formal-education', 'rainbow', 'stand-up-for-yourself', 'teaching', 'teachings', 'walk', 'walk-few-steps ']"
"inspiration,education","The effects you will have on your students are infinite and currently unknown; you will possibly shape the way they proceed in their careers, the way they will vote, the way they will behave as partners and spouses, the way they will raise their kids.","['education', 'inspiration', 'teachers', 'teaching', 'wisdom-quote', 'zen ']"
education,Educated men are so impressive!,"['education', 'play', 'shakespeare ']"
education,"Mistakes are a part of being human. Precious life lessons that can only be learned the hard way. Unless it's a fatal mistake, which, at least, others can learn from.","['education', 'error', 'humanity', 'lessons', 'mistakes ']"
education,Orang yang baca banyak buku kayak kamu dan menguasai sejarah nggak mungkin bodoh. Kamu cuma sial karena hidup di tempat dan waktu yang salah. Tempat dan waktu ketika kamu dianggap bodoh kalau kamu nggak pintar dalam hal yang namanya sains.,"['education', 'inspirational ']"
"religion,education","I said to my children, 'I'm going to work and do everything that I can do to see that you get a good education. I don't ever want you to forget that there are millions of God's children who will not and cannot get a good education, and I don't want you feeling that you are better than they are. For you will never be what you ought to be until they are what they ought to be.","['altruism', 'education', 'potential', 'religion ']"
education,"part of the art of teaching is the ability to rearrange the world for students - to force them to see things in a new way. i've known too many stupid intellectuals to believe that education and wisdom come as a package deal along with facts, it's your perspective that counts - your ability to see differently, not just to see a lot.","['education', 'teaching ']"
education,"Even if it were true that evolution, or the teaching of evolution, encouraged immorality that would not imply that the theory of evolution was false.","['education', 'evolution ']"
education,He believed that lack of education was the root of all of Pakistan’s problems. Ignorance allowed politicians to fool people and bad administrators to be re-elected.,"['education', 'inspirational', 'politics ']"
education,"She had observed that the more education they got, the less they could do. Their father had gone to a one-room schoolhouse through the eighth grade and he could do anything.",['education ']
education,"At the end of your lives you will not be judged by academic successes, the degrees or diplomas earned, the positions held, the material wealth acquired, or power and prestige, but rather on the basis of what you have become as persons and what you are in conduct and character.","['character', 'education', 'learning ']"
"education,books","A capacity, and taste, for reading, gives access to whatever has already been discovered by others. It is the key, or one of the keys, to the already solved problems. And not only so. It gives a relish, and facility, for successfully pursuing the [yet] unsolved ones.","['books', 'discovery', 'education', 'reading ']"
education,"Were all instructors to realize that the quality of mental process, not the production of correct answers, is the measure of educative growth something hardly less than a revolution in teaching would be worked.",['education ']
education,"Teachers don't just teach; they can be vital personalities who help young people to mature, to understand the world, and to understand themselves. A good education consists of much more than useful facts and marketable skills.",['education ']
education,"Everyone who is educated today wants to sit at a comfortable desk under a fan and live in an air-conditioned house surrounded by a garden, coming and going in an American car as wide as the street. If we do not tear out this disease by the roots we shall have with us a bourgeoisie that is in no way connected with the reality of our life...","['bourgeois', 'bourgeoisie', 'education', 'expectations', 'society ']"
education,"The best book is not one that informs merely, but one that stirs the reader up to inform himself.","['books', 'education', 'reading ']"
education,"To be changed by ideas was pure pleasure. But to learn ideas that ran counter to values and beliefs learned at home was to place oneself at risk, to enter the danger zone. Home was the place where I was forced to conform to someone else’s image of who and what I should be. School was the place where I could forget that self and, through ideas, reinvent myself.","['education', 'school ']"
education,"Wine can be a better teacher than ink, and banter is often better than books","['education', 'friendship', 'wine ']"
"wisdom,knowledge,education",Not all men (and especially the wisest) share the opinion that it is bad for women to be educated. But it is very true that many foolish men have claimed this because it displeased them that women knew more than they did.,"['abilities', 'education', 'empowerment', 'inequality', 'knowledge', 'men', 'superiority', 'suppression', 'wisdom', 'women ']"
education,"School has become the world religion of a modernized proletariat, and makes futile promises of salvation to the poor of the technological age.","['anarchism', 'deschooling-society', 'education', 'ivan-illich', 'pedagogic-philosophy', 'pedagogy', 'school ']"
education,The direction in which education starts a man will determine his future life,"['education', 'future', 'life', 'plato ']"
education,"Students never appreciate their teachers while they are learning. It is only later, when they know more of the world, that they understand how indebted they are to those who instructed them. Good teachers expect no praise or love from the young. They wait for it, and in time, it comes.","['education', 'teaching ']"
education,Learning is not cumpulsory... neither is survival.,['education ']
education,"We can best help children learn, not by deciding what we think they should learn and thinking of ingenious ways to teach it to them, but by making the world, as far as we can, accessible to them, paying serious attention to what they do, answering their questions -- if they have any -- and helping them explore the things they are most interested in.","['children', 'education ']"
education,The great aim of education is not knowledge but action.,['education ']
education,One learns from books and example only that certain things can be done. Actual learning requires that you do those things.,"['education', 'experience', 'learning', 'life-experience ']"
education,"…the greatest service we can do to education today is to teach fewer subjects. No one has time to do more than a very few things well before he is twenty, and when we force a boy to be a mediocrity in a dozen subjects, we destroy his standards, perhaps for life.",['education ']
education,Throwing herself into learning helped Miri ignore the painful chill of solitude around her.,"['education', 'learning', 'loneliness', 'school ']"
education,"That's what education should be,""I said, ""the art of orientation. Educators should devise the simplest and most effective methods of turning minds around. It shouldn't be the art of implanting sight in the organ, but should proceed on the understanding that the organ already has the capacity, but is improperly aligned and isn't facing the right way.","['education', 'teaching ']"
education,Intelligence and education that hasn't been tempered by human affection isn't worth a damn.,"['affection', 'education', 'flowers-for-algernon', 'intelligence ']"
education,"Art is a process, not a product.","['art', 'creavity', 'early-childhood', 'education ']"
education,"The question is not, -- how much does the youth know? when he has finished his education -- but how much does he care? and about how many orders of things does he care? In fact, how large is the room in which he finds his feet set? and, therefore, how full is the life he has before him?",['education ']
education,People need to be educated so that they can make intelligent moral choices,"['animal-rights', 'communication', 'companies', 'companion-animals', 'delusion', 'education', 'happy-meat', 'marketing', 'morality', 'vegan ']"
education,Too often we give children answers to remember rather than problems to solve.,"['education', 'homeschool', 'homeschooling ']"
education,We need the courage to learn from our past and not live in it.,"['buddhism', 'education', 'history ']"
education,"In those days a boy on the classical side officially did almost nothing but classics. I think this was wise; the greatest service we can to education today is to teach few subjects. No one has time to do more than a very few things well before he is twenty, and when we force a boy to be a mediocrity in a dozen subjects we destroy his standards, perhaps for life.","['concentration', 'distractions', 'education', 'focus ']"
education,"To understand life is to understand ourselves, and that is both the beginning and the end of education.",['education ']
"wisdom,knowledge,education",Education is beautification of the inner world and the outer world.,"['beautification', 'beauty', 'beauty-in-life', 'beauty-of-life', 'degrees', 'education', 'education-morality', 'education-reform', 'education-system', 'educational-philosophy', 'educational-quotes', 'educational-system', 'head', 'heart', 'knowledge', 'learning', 'learning-process', 'learning-quotes', 'wisdom ']"
education,"What is the most important thing one learns in school? Self-esteem, support, and friendship.","['education', 'lessons', 'school ']"
"inspiration,education","A man, whilst he is dreaming, believes in his dream; he is undeceived only when he is awakened from his slumber.","['education', 'inspirational ']"
education,The whole purpose of education is to turn mirrors into windows.,['education ']
education,"To reap a return in ten years, plant trees. To reap a return in 100, cultivate the people.","['education', 'growth', 'investment', 'progress', 'society ']"
education,"The problem is not the content of textbooks, but the very idea of them.","['education', 'history ']"
education,Education isn't for getting a job. It's about developing yourself as a human being.,['education ']
education,"The educated ones leave, the ones with the potential to right the wrongs. They leave the weak behind. The tyrants continue to reign because the weak cannot resist. Do you not see that it is a cycle? Who will break that cycle?","['education', 'fight', 'oppression', 'revolution', 'voice ']"
"faith,religion,education","The aim of all Christian education, moreover, is to train the believer in an adult faith that can make him a ""new creation"", capable of bearing witness in his surroundings to the Christian hope that inspires him.","['catholicism', 'christianity', 'education', 'faith', 'religion ']"
education,"My education was neglected, yet I was passionately fond of reading.","['education', 'letters', 'reading ']"
education,Never let your fear of the unknown and things being too difficult make your choices for you in life. One of the saddest lessons in life is finding out that your fear made the situation worse than what it was and a braver person stole the dream you gave up on.,"['anxiety', 'bravery', 'business', 'career-changes', 'choices', 'confidence', 'dating', 'education', 'fear', 'foolish', 'future', 'goals', 'paranoia', 'rising-above-it', 'scenarios', 'single', 'staying-positive', 'taking-chances ']"
education,"No mathematician in the world would bother making these senseless distinctions: 2 1/2 is a ""mixed number ""while 5/2 is an ""improper fraction.""They're EQUAL for crying out loud. They are the exact same numbers and have the exact same properties. Who uses such words outside of fourth grade?","['education', 'math', 'mathematics ']"
education,"If you teach a boy, you educate an individual; but if you teach a girl, you educate a community.","['community', 'education ']"
education,"Thought breeds thought; children familiar with great thoughts take as naturally to thinking for themselves as the well-nourished body takes to growing; and we must bear in mind that growth, physical, intellectual, moral, spiritual, is the sole end of education.","['children', 'education', 'growth', 'thought ']"
"knowledge,education",There is no knowing that does not begin with knowing God.,"['education', 'knowledge', 'theology ']"
"knowledge,education","Was not Hypatia the greatest philosopher of Alexandria, and a true martyr to the old values of learning? She was torn to pieces by a mob of incensed Christians not because she was a woman, but because her learning was so profound, her skills at dialectic so extensive that she reduced all who queried her to embarrassed silence. They could not argue with her, so they murdered her.","['abilities', 'dialectics', 'education', 'greatness', 'hypatia-of-alexandria', 'knowledge', 'learning', 'murder', 'philosophers', 'skills', 'superiority', 'suppression', 'women ']"
education,I used my history degree about twice a year whether I needed to or not.,"['education', 'humor ']"
education,"A child whose life is full of the threat and fear of punishment is locked into babyhood. There is no way for him to grow up, to learn to take responsibility for his life and acts. Most important of all, we should not assume that having to yield to the threat of our superior force is good for the child's character. It is never good for anyone's character.","['children', 'education ']"
education,"I want my children to understand the world, but not just because the world is fascinating and the human mind is curious. I want them to understand it so that they will be positioned to make it a better place","['children', 'education', 'intelligence ']"
education,The philosophy of the schoolroom in one generation is the philosophy of government in the next.,"['education', 'learning', 'school ']"
education,"When you wage war on the public schools, you're attacking the mortar that holds the community together. You're not a conservative, you're a vandal.",['education ']
education,"A tax-supported, compulsory educational system is the complete model of the totalitarian state.","['education', 'freedom', 'libertarian', 'liberty', 'political', 'statism', 'taxes', 'totalitarianism ']"
education,"I realize that some of you may have come in hopes of hearing tips on how tobecome a professional writer. I say to you, ""If you really want to hurt yourparents, and you don't have the nerve to be a homosexual, the least you cando is go into the arts. But do not use semicolons. They are transvestitehermaphrodites, standing for absolutely nothing. All they do is show you'vebeen to college.","['arts', 'education', 'hurt', 'writers-on-writing ']"
education,"In a properly automated and educated world, then, machines may prove to be the true humanizing influence. It may be that machines will do the work that makes life possible and that human beings will do all the other things that make life pleasant and worthwhile","['education', 'liberal-arts', 'machines ']"
education,"To quote the exceptional teacher Marva Collins, ""I will is more important than IQ.""It is wonderful to have a terrific mind, but it's been my experience that having outstanding intelligence is a very small part of the total package that leads to success and happiness. Discipline, hard work, perserverance, and generosity of spirit are, in the final analysis, far more important.","['education', 'parenting ']"
education,"There is something deeply hypocritical in a society that holds an inner-city child only eight years old ""accountable""for her performance on a high-stakes standardized exam but does not hold the high officials of our government accountable for robbing her of what they gave their own kids six or seven years before.","['children', 'education', 'government', 'poverty', 'standardized-tests ']"
education,"Don't try to make children grow up to be like you, or they may do it.","['children', 'education', 'growing-up', 'parenting ']"
"wisdom,inspiration,education","If you are not vegan, please consider going vegan. It’s a matter of nonviolence. Being vegan is your statement that you reject violence to other sentient beings, to yourself, and to the environment, on which all sentient beings depend.","['abolition', 'abolitionist', 'ahimsa', 'animals', 'education', 'exploitation', 'francione', 'inspirational-quotes', 'justice', 'life', 'nonviolence', 'nonviolence-jainism', 'peace-making', 'peace-movement', 'peace-on-earth', 'rights', 'sentience', 'slavery', 'veganism', 'wisdom ']"
"education,science",One of the penalties of an ecological education is that one lives alone in a world of wounds.,"['education', 'environment', 'science ']"
education,"A plongeur is a slave, and a wasted slave, doing stupid and largely unnecessary work. He is kept at work, ultimately, because of a vague feeling that he would be dangerous if he had leisure. And educated people, who should be on his side, acquiesce in the process, because they know nothing about him and consequently are afraid of him.","['class', 'down-and-out-in-paris-and-london', 'education', 'fear', 'george-orwell', 'hierarchy', 'labor', 'leisure', 'mob', 'poverty', 'slavery ']"
education,"Mental acuity of any kind comes from solving problems yourself, not from being told how to solve them.","['education', 'intelligence', 'problems ']"
education,Combinatory play seems to be the essential feature in productive thought.,"['education', 'learning', 'play ']"
education,…it’s not just learning that’s important. It’s learning what to do with what you learn and learning why you learn things that matters.,"['education', 'learning', 'phantom-tollbooth ']"
education,"The problem in our society and in our schools is to inclulcate, without overdoing it, the notion of education, as in the Latin educere--to lead, to bring out what is in someone rather than merely to indoctrinate him/her from the outside. (89)","['children', 'education ']"
education,"Upon the subject of education, not presuming to dictate any plan or system respecting it, I can only say that I view it as the most important subject which we as a people can be engaged in.","['abraham-lincoln', 'education', 'sangamo-county ']"
education,"For in spite of itself any movement that thinks and acts in terms of an ‘ism becomes so involved in reaction against other ‘isms that it is unwittingly controlled by them. For it then forms its principles by reaction against them instead of by a comprehensive, constructive survey of actual needs, problems, and possibilities.","['change', 'education', 'isms ']"
"mind,education","An open mind, in questions that are not ultimate, is useful. But an open mind about the ultimate foundations either of Theoretical or of Practical Reason is idiocy. If a man's mind is open on these things, let his mouth at least be shut. He can say nothing to the purpose. Outside the Tao there is no ground for criticizing either the Tao or anything else.","['analysis', 'culture', 'education', 'ethics', 'foundations', 'justice', 'logic', 'mind', 'morality', 'open-mindedness', 'post-modernism', 'right-and-wrong', 'thought', 'truth ']"
education,"Free curiosity has greater power to stimulate learning than rigorous coercion. Nevertheless, the free ranging flux of curiosity is channeled by discipline under Your Law.","['anxiety', 'curiosity', 'discipline', 'education ']"
education,Thank goodness my education was neglected.,"['education', 'homeschool', 'homeschooling', 'learning ']"
education,An educator should consider that he has failed in his job if he has not succeeded in instilling some trace of a divine dissatisfaction with our miserable social environment.,"['activism', 'awareness', 'conciousness', 'conscience', 'education', 'social-conscience', 'social-justice ']"
"wisdom,religion,education,science",Science is observing truth in the light of head. Religion is observing truth in the light of heart. Humanity is using both the lights. And education is developing that humanity.,"['education', 'heart', 'humanity', 'humanity-and-science', 'religion', 'religion-and-education', 'science', 'science-and-education', 'science-and-religion', 'wisdom', 'wisdom-inspirational', 'wisdom-quotes ']"
"writing,education","Everywhere I go, I am asked if I think university stifles writers. My opinion is that it doesn't stifle enough of them.","['education', 'humour', 'literary-criticism', 'writing ']"
education,Ignorance is ultimately the worst enemy of a people who want to be free.,"['education', 'freedom', 'ignorance ']"
education,"In the times of trouble, be like the strong wall. In the times of joy, be like the smiling sun.","['education', 'inspirational', 'life ']"
education,"What is most important and valuable about the home as a base for children's growth into the world is not that it is a better school than the schools, but that it isn't a school at all.","['education', 'homeschool', 'homeschooling ']"
education,"Well, Diotallevi and I are planning a reform in higher education. A School of Comparative Irrelevance, where useless or impossibe courses are given. The school's aim is to turn out scholars capable of endlessly increasing the number of unnecessary subjects.","['education', 'humor', 'nonsense ']"
education,Education does not mean teaching people what they do not know. It means teaching them to behave as they do not behave.,"['education', 'homeschool', 'homeschooling', 'learning ']"
education,"The function of the university is not simply to teach breadwinning, or to furnish teachers for the public schools, or to be a centre of polite society; it is, above all, to be the organ of that fine adjustment between real life and the growing knowledge of life, an adjustment which forms the secret of civilization.","['african-america', 'civilization', 'education ']"
education,"Parents teach children discipline for two different, indeed diametrically opposed, reasons: to render the child submissive to them and to make him independent of them. Only a self-disciplined person can be obedient; and only such a person can be autonomous.","['discipline', 'education ']"
education,Education is the manifestation of perfection already existing in man.,"['education', 'swami-vivekananda ']"
