0,1,2
happiness,"I think my quarry is illusion. I war against magic. I believe that, though illusion often cheers and comforts, it ultimately and invariably weakens and constricts the spirit.","['happiness', 'illusion', 'life', 'truth ']"
happiness,"It makes no difference where you go, there you are. And it makes no difference what you have, there’s always more to want. Until you are happy with who you are, you will never be happy because of what you have.","['grateful', 'happiness ']"
"happiness,truth","Always try to be joyful and proactively benign to the people. By doing so everyday, people have no control at all over my mood.","['benign', 'control', 'happiness', 'joyful', 'life', 'mood', 'people', 'proactive', 'proactively', 'secret', 'truth ']"
happiness,Stop wasting your time looking for the key to happiness… the door is open and unlocked… just walk through it.,"['happiness', 'inspirational', 'life', 'wasting-time ']"
happiness,You can be right or you can be happy.,['happiness ']
happiness,"She was happy, she knew she was happy, and knew she ought to be happy.",['happiness ']
happiness,"Ah, happiness courts the light so we deem the world is gay. But misery hides aloof so we deem that misery there is none.",['happiness ']
happiness,"There is a fine line between compassion and a victim mentality. Compassion though is a healing force and comes from a place of kindness towards yourself. Playing the victim is a toxic waste of time that not only repels other people, but also robs the victim of ever knowing true happiness.","['compassion', 'happiness', 'victim-mentality ']"
"happiness,wisdom",It is only possible to live happily ever after on a daily basis.,"['basis', 'daily', 'happily-ever-after', 'happiness', 'live', 'truth', 'wisdom ']"
happiness,"Hearts will break and people will hurt you, darling.” Her mother said. “But when you let those people control your outlook on the life, you only allow them to have a greater hold on your happiness. Once you accept the fact that every day is a new day to begin again, life becomes a much easier path to walk.","['believe', 'finding-love', 'happiness', 'lessons', 'lessons-in-life', 'lessons-learned', 'second-chances ']"
happiness,"if it makes you happy, then why the hell are you so sad?","['happiness', 'sadness ']"
happiness,"You know what my father told me when I was little, one day, when he found me crying? He told me that God gave people a fixed number of tears and are of two kinds: tears of sadness and tears of happiness. And that I should not waste my tears elsewhere, but keep them for the moments of happiness. Would be a shame to not have tears to cry then ...","['happiness', 'sadness ']"
happiness,You will realize one day that all the money in the world cannot buy you happiness. Nor can it make you a person of good character.,"['happiness', 'learning', 'life-lessons', 'money', 'richelle', 'richelle-goodrich ']"
happiness,I've always believed that happiness is just around the corner. The trick is fining the right corner.,['happiness ']
happiness,"People, he thought, were as hungry for a sight of joy as he had always been--for a moment's relief from that gray load of suffering which seemed so inexplicable and unnecessary. He had never been able to understand why men should be unhappy.","['absence-of-suffering', 'happiness', 'happy', 'joy', 'pain', 'relief', 'suffering ']"
happiness,"I learned from a very young age that if I persued the things that truly excited me, that they would reward in more important ways, like happiness.",['happiness ']
happiness,I do not care about happiness simply because I believe that joy is something worth fighting for.,"['fighting-battles', 'greater-glory', 'greater-good', 'happiness', 'hard-work', 'joy', 'motivational', 'value', 'value-of-work', 'worth ']"
happiness,"The decision is mine, and I choose happiness","['decisions', 'happiness ']"
happiness,Pure joy is rare. That’s why for every meal I eat a really bloody steak.,"['funny', 'happiness', 'humor ']"
happiness,"There is no happiness in love, except at the end of an English novel.","['books', 'happiness', 'love ']"
"happiness,hope,faith,inspiration","People will always notice something about you. It might be the way you walk or the way you talk, or just simply your personality. Live each day in the way you want to be remembered. Live in such a way that people will be inspired by those unique qualities that you have and strive to live better lives for themselves.","['compassion', 'faith', 'happiness', 'hope', 'inspiration', 'kindness', 'life', 'living', 'love', 'passionate', 'peace', 'peace-of-mind', 'rememberance ']"
"happiness,death","I want that. I want that awful intense and serious unhappiness, cos then I might feel better, and then I might be happy.","['death', 'happiness', 'sadness ']"
happiness,"She still cared for me, and the best way I could make amends to her was to be happy.I do have a knack for finding great women.","['amends', 'divorce', 'happiness', 'women ']"
happiness,Our purest form of joy comes when people we envy get hurt. That most genuine form of joy.,"['happiness', 'joy ']"
happiness,"If you're not getting happier as you get older, then you're fuckin' up","['age', 'ani-difranco', 'happiness', 'older ']"
happiness,"Everyone has a right to be a little happy, asshole.",['happiness ']
"philosophy,happiness","Many married women who have deliberately spurned the ""hour""of childbearing are unhappy and frustrated. They never discovered the joys of marriage because they refused to surrender to the obligation of their state. In saving themselves, they lost themselves!","['catholicism', 'childbirth', 'christianity', 'expectation', 'family-planning', 'happiness', 'joy-of-marriage', 'marriage', 'philosophy', 'pro-life', 'religion', 'spirituality', 'unhappy-marriage ']"
happiness,In the whole history of the world there is but one thing that money cannot buy...to wit--the wag of a dog's tail.,"['devotion', 'dog', 'happiness', 'love ']"
happiness,"Where happiness was not a possibility, the illusion of it was always more important.",['happiness ']
happiness,"We try to fix the outside so much, but our control of the outer world is limited, temporary, and often, illusory.","['happiness', 'life', 'problems', 'sadness ']"
happiness,Suffering just means you’re having a bad dream. Happiness means you’re having a good dream. Enlightenment means getting out of the dream altogether.,"['dreams', 'enlightenment', 'happiness', 'suffering ']"
happiness,What is your idea of earthly happiness? To be vindicated in my own lifetime.,"['happiness', 'vindication ']"
happiness,"ولمّا فتحت قلبي لكي ارى السعادة, وجدت مرآتها وسريرها وملابسها, لكنّي لم اجدها.","['happiness', 'السعادة ']"
happiness,"As Venus within Eros does not really aim at pleasure, so Eros does not aim at happiness. We may think he does, but when he is brought to the test it proves otherwise... For it is the very mark of Eros that when he is in us we had rather share unhappiness with the Beloved than be happy on any other terms.","['beloved', 'eros', 'happiness', 'love ']"
"happiness,purpose","You will be your best self when you take time to understand what you really need, feel and want.","['feelings', 'happiness', 'needs', 'purpose', 'self-esteem ']"
"happiness,positive",Happiness doesn't have to be chased...it merely has to be chosen.,"['being-happy', 'chasing', 'choosing-happiness', 'happiness', 'happy', 'positive-thinking', 'stop-the-chase', 'the-single-woman ']"
happiness,People with a grudge against the world are always dangerous. They seem to think life owes them something. I've known many an invalid who has suffered worse and been cut off from life much more . . . and they've managed to lead happy contented lives. It's what's in yourself that makes you happy or unhappy.,"['happiness', 'inspirational', 'miss-marple ']"
happiness,"I had always been taught that the pursuit of happiness was my natural (even national) birthright. It is the emotional trademark of my culture to seek happiness. Not just any kind of happiness, either, but profound happiness, even soaring happiness. And what could possibly bring a person more soaring happiness than romantic love.","['happiness', 'love ']"
happiness,Sometimes you just have to jump in a mud puddle because it's there. Never get so old that you forget about having fun.,"['fun', 'happiness', 'happy', 'youth', 'youthfulness ']"
"happiness,success","This moment is yours and yours alone! Take charge, seize this moment and allow it to propel you to the high levels of an empowered life. Allow upon this fertile moment to be planted the seeds of your happiness and success.","['carpe-diem', 'empowerment', 'happiness', 'life', 'motivational', 'seize-the-day', 'success ']"
happiness,".. she believed a great happiness awaited her somewhere, and for this reason she remained calm as the days flew by.","['happiness', 'life ']"
"happiness,success",Challenges in life can either enrich you or poison you. You are the one who decides.,"['challenges', 'happiness', 'life', 'poison', 'success ']"
happiness,"Why did I hope we would be happy abroad? A change of environment is that traditional fallacy upon which doomed loves, and lungs, rely.","['happiness', 'lolita', 'nabokov ']"
happiness,"تعرفون اني لم أكن ملاكا طيلة الوقت , و أن الخلافات كانت تحدث من حيت لآخر , لكن لو نظرت للصورة الإجمالية من بعيد -حين تختفي البقع السوداء الصغيرةلأدركت اننا سعيدين حقا ..","['happiness', 'life ']"
happiness,You can be happy with money and you can be wretched with it. It depends on what kind of person you are. -- A Prologue to Love,"['happiness', 'life', 'love', 'money ']"
happiness,"Happiness is spiritual, born of truth and love. It is unselfish; therefore it cannot exist alone, but requires all mankind to share it.","['happiness', 'love ']"
happiness,"Dear me! how happy and good we'd be, if we had no worries!","['happiness', 'little-women', 'louisa-may-alcott ']"
happiness,"The British do not expect happiness. I had the impression, all the time that I lived there, that they do not want to be happy; they want to be right.","['british', 'happiness', 'humour ']"
happiness,"Taking a risk to survive isn’t that impressive. Taking a risk to be happy, that takes guts.","['happiness', 'having-guts', 'survival', 'taking-a-risk ']"
happiness,"The advance of regret can be so gradual that it is impossible to say ""yesterday I was happy, today I am not.","['happiness', 'regret ']"
happiness,"Happiness is not a state of being. Happiness is a vector, it is movement.",['happiness ']
happiness,It's hard to say. Sometimes people have had terrible childhoods. And sometimes they just haven't found their special place in life. And sometimes they're dogs from hell and must be destroyed.,"['childhood', 'happiness ']"
happiness,People who say that money can't buy happiness just don't know where to shop.,"['happiness', 'kathy-lette', 'money', 'nip-tuck', 'shop ']"
happiness,"Human happiness is defined by the hardships and conflicts you have been through. The greater they are, the greater is your happiness.","['conflicts', 'happiness', 'hardships ']"
happiness,Happiness is a big joke; let us laugh at it loud.,"['happiness', 'joke', 'laugh ']"
happiness,But the happiest people are the ones who understand that good things occur when one allows them to.,['happiness ']
happiness,"But, like all happiness, it did not last long…","['happiness', 'little-women', 'louisa-may-alcott ']"
happiness,"... too much brooding, not enough doing.","['action', 'happiness', 'inspirational ']"
happiness,Those who wish to sing always find a song.,"['happiness', 'happy', 'joy', 'joyful-living', 'joyfulness', 'music', 'singing', 'song ']"
happiness,"Freddie often fold me that you've got to be happy when you can, because life won't wait for you to take the time. And she was right.","['happiness', 'life ']"
happiness,"Then the world will be for the common people, and the sounds of happiness will reach the deepest springs. Ah! Come! People of every land, how can you not be roused.","['common-people', 'communism', 'equality', 'happiness ']"
happiness,"The formula of happiness and success is just, being actually yourself, in the most vivid possible way you can.","['happiness', 'inspirational ']"
happiness,You don’t have to be happy to smile.,"['happiness', 'happy', 'life', 'smile', 'smiling ']"
"happiness,inspiration",Why sadness was created?So we could rest from laughing.,"['happiness', 'humor-inspirational', 'inspiration', 'life ']"
happiness,"I don't know whether it is beautiful or sad, that I find such blissful happiness within the confines of my own mind, more so than I do in the reality that surrounds me.","['happiness', 'inner-peace', 'life', 'reality', 'soul-searching ']"
happiness,"And so it turned out that only a life similar to the life of those around us, merging with it without a ripple, is genuine life, and that an unshared happiness is not happiness.",['happiness ']
happiness,"It almost seemed as if there must be some random and of course unfair thrift in the emotional housekeeping of the world, if the great happiness--however temporary, however flimsy--of one person could come out of the great unhappiness of another.","['happiness', 'unhappiness ']"
"happiness,god","Happiness is inseparably connected with decent, clean behavior.","['god', 'happiness ']"
"happiness,hope","Life isn't all grand, but it isn't all miserable either. There's both sweet and sour in every day. So why focus on the ugly when you can gaze at what's beautiful? Concentrate on the good.","['beauty', 'goodness', 'happiness', 'hope', 'inspirational', 'life', 'richelle', 'richelle-goodrich ']"
happiness,"Lord, make me nowAs happy as the field.With flowers enriched...","['contentment', 'flowers', 'happiness ']"
"wisdom,happiness","A day unemployed is like a bagel- even when it's bad, it's still pretty good...","['happiness', 'inspirational', 'leisure', 'life', 'unemployment', 'wisdom ']"
happiness,"The bitterness of joy lies in the knowledge that it cannot last. Nor should joy last beyond a certain season, for, after that season, even joy would become merely habit.","['happiness', 'mortality ']"
happiness,"There is nothing around me but money, money, money.","['abundance-creation', 'cosmic-ordering', 'focus', 'goal-setting', 'goals', 'happiness', 'law-of-attraction', 'life-changing', 'manifestation', 'manifesting', 'metaphysical', 'millionaire', 'mind-body-spirit', 'mind-power', 'money', 'new-age', 'new-age-movement', 'new-thought', 'positive-thought', 'positive-thoughts', 'self-belief', 'self-growth', 'self-help', 'self-limiting-beliefs', 'self-motivation', 'self-realization', 'spiritual', 'spirituality', 'stephen-richards', 'synchronicity', 'visualization', 'wealth-creation ']"
happiness,"Happiness had never been like this before. Now it came like sun showers, the sun and the rain together. Happiness was happier than it had been - sharp, piercing, and snatched, like a breath while swimming in surf.",['happiness ']
happiness,The happiness of love is in action; its test is what one is willing to do for others.,"['action', 'happiness', 'happy', 'love', 'others', 'sacrifice ']"
happiness,"A dim vastness is spread before our souls; the perceptions of our mind are as obscure as those of our vision... But alas! when we have attained our object, when the distant 'there' becomes the present 'here,' all is changed; we are as poor and circumscribed as ever, and our souls still languish for unattainable happiness.","['happiness', 'satisfaction ']"
happiness,"The only way I can be angry at you is when I have thought, said, or done something that is unkind in my own opinion.","['happiness', 'self-enquiry ']"
happiness,"He saw in happiness the seeds of independence, and in independence the seeds of revolt.","['happiness', 'independence', 'revolt ']"
"happiness,hope,soul","All things, even the deepest sorrow or the most profound happiness are all temporary. Hope is fuel for the soul, without hope, forward motion ceases.","['happiness', 'hope', 'inspirational', 'life', 'profound', 'sorrow', 'soul ']"
happiness,These men are worth your tears. You are not worth their merriment.,"['happiness', 'merriment', 'tears', 'war ']"
happiness,"If you are a dreamer, come in,If you are a dreamer, a wisher, a liar,A hope-er, a pray-er, a magic bean buyer...If you're a pretender, come sit by my fireFor we have some flax-golden tales to spin. Come in!Come in!","['children-books', 'crete', 'dreams', 'greece', 'happiness', 'jack-r-kearns', 'mrs-sjostrom', 'nostalgia', 'third-grade ']"
happiness,The man with toothache thinks everyone happy whose teeth are sound.The poverty stricken man makes the same mistake about the rich man.,"['happiness', 'money', 'poverty ']"
happiness,"Honest, open communication is the only street that leads us into the real world... We then begin to grow as never before. And once we are on this road, happiness cannot be far away.","['communication', 'happiness ']"
happiness,"I drink to the general joy o’ the whole table.""Macbeth","['happiness', 'joy', 'life', 'party', 'shakespeare', 'toast ']"
happiness,Unhappiness is caused when we cannot let go of our memories.,"['happiness', 'memories ']"
happiness,"You would not want to be responsible for someone else’s happiness, so please do not hold someone else responsible for yours!","['happiness', 'inspirational', 'inspirational-books', 'motivational-quotes ']"
happiness,"If you stay in the company of anger, pain, or hurt, happiness will find someone else to visit. Make the choice to view all of your past relationships as a gift. Throw out what hasn’t worked in the past and incorporate new concepts. Focus on being happy .","['anger', 'happiness', 'hurt', 'relationships ']"
"happiness,faith,hope","I am thankful when I am hungry because then I know that when I eat, the food will taste better. Life has taught me that my true contentment rests in hope, and the pleasure itself is secondary. It is self-awareness, not happiness, that maintains peace.","['eating', 'enjoyment', 'faith', 'food', 'happiness', 'hope', 'hunger', 'peace', 'thanks ']"
happiness,"Happiness is good, but well-overrated: what we hate most are the very motivators that put us in gear. A man drifts along with little to contribute until something agitates him enough to make a difference, whether for himself or for his communities.","['agitation', 'community', 'contribution', 'difference', 'happiness', 'overrated ']"
"happiness,quotes","Happiness is attained, not through self-interest, but through unconditional fidelity in endless love of eternal light.","['acceptance', 'eternal', 'happiness', 'light', 'love', 'quote', 'quotes', 'self', 'self-interest', 'unconditional', 'wisdom ']"
"happiness,inspiration","To live long and achieve happiness, cultivate the art of radiating happiness.","['happiness', 'inspiration ']"
happiness,"Happiness, it has been observed, is best achieved by those who have been most unhappy heretofore.","['happiness', 'page-177 ']"
happiness,"The process of discovering your fearless self is of refinement, not adding. The best way to reconnect with your freedom is to look at the rules you have that govern your freedom.","['choice', 'fearless', 'freedom', 'happiness', 'inspirational', 'refinement', 'rules ']"
happiness,My happiness has to come from within myself or it is too fragile a thing to be of any use to me and too much of a burden to benefit any of my loved ones.,['happiness ']
"happiness,inspiration,quotes","I Am In Love With Myself, With My Heart.","['balanced', 'challenge', 'conceit', 'denoting', 'desition', 'egotism', 'elitism', 'happiness', 'happy', 'healthy', 'i-love-myself', 'indifference', 'individual-s', 'inspirational-love', 'inspirational-quotes', 'learning-to-love-yourself', 'life', 'like', 'limit', 'live', 'logic', 'loving-yourself', 'lovingly', 'luck', 'major', 'me', 'myself', 'others', 'perception', 'personality', 'quotes', 'relation', 'selfishness', 'simple', 'think', 'thought', 'trait', 'vanity', 'who-am-i', 'wisdom-quotes', 'words', 'you', 'you-and-me ']"
happiness,"How was life before Pop-Tarts, Prozac and padded playgrounds? They ate strudel, took opium and played on the grass.","['happiness', 'history ']"
happiness,Everyone who is not happy must be shot.,"['happiness', 'oppression', 'shooting', 'violence ']"
happiness,I silently smiled at my incessant good fortune.,"['happiness', 'smile ']"
happiness,"Remember the botched brothel-visit in L’Education sentimentale and remember its lesson. Do not participate: happiness lies in the imagination, not the act. Pleasure is found first in anticipation, later in memory.","['anticipation', 'happiness', 'life', 'memory', 'pleasure ']"
happiness,"Culture is an elevated expression of the inner voice which the different peoples of the Earth have heard in the depths of their being, a voice which conveys the vibrant compassion and wisdom of the cosmic life. For different cultures to engage in interaction is to catalyze each other's souls and foster mutual understanding.","['buddhism', 'destiny', 'happiness', 'humanism', 'inspirational', 'karma', 'peace', 'self-reformation ']"
happiness,"Suffering sucks. Don't do it. Go home and love your wife. Go home and love yourself. Go homeand base your happiness on one thing and one thing only: freedom. Choose freedom, not suffering. Create a life of freedom, not wanting. Have some really good coffee and listen to the red-winged blackbirds in the marsh. Ignore the mosquitoes.","['commitment', 'freedom', 'happiness', 'suffering ']"
happiness,"It's about the quality of the worry,""I said. ""I have happier worries now than I used to.","['david-gilmour', 'happiness', 'happy', 'life', 'quality', 'the-film-club', 'worries', 'worry ']"
happiness,"Nourishing yourself in a way that helps you blossom in the direction you want to go is attainable, and you are worth the effort.","['happiness', 'nurturing', 'self-esteem', 'self-help', 'self-love ']"
happiness,"Well, I am happy, and I won't fret, but it does seem as if the more one gets the more one wants…","['happiness', 'little-women', 'louisa-may-alcott ']"
"happiness,positive","Live your life, sing your song. Not full of expectations. Not for the ovations. But for the joy of it.","['being-content', 'expectations', 'finding', 'finding-peace', 'finding-your-path-in-life', 'happiness', 'joy-for-life', 'letting-go-of-expectations', 'letting-go-of-stuff', 'living-life-to-the-full', 'positive-thinking', 'self-acceptance ']"
happiness,"This idea of perpetual happiness is crazy and overrated, because those dark moments fuel you for the next bright moments; each one helps you appreciate the other.",['happiness ']
happiness,"Children must early learn the the beauty of generosity. They are taught to give what they prize most, that they may taste the happiness of giving.","['children', 'generosity', 'happiness', 'life-lessons ']"
happiness,The secret to happiness is low expectations.,"['expectation-s', 'happiness ']"
happiness,"Happiness is something you lay siege to, it is a battle like a game of go. I will take hold of all the pain and snuff it out.","['go', 'happiness ']"
happiness,"In Kilanga, people knew nothing of things they might have had - a Frigidaire? a washer-dryer combination? Really, they'd sooner imagine a tree that could pull up its feet and go bake bread. It didn't occur to them to feel sorry for themselves.","['africa', 'happiness', 'poverty ']"
"happiness,positive","It's not strength, it's PERCEPTION that makes you stronger. If you change how you SEE it, you'll change how you FEEL about it.","['happiness', 'joy', 'perception', 'positive-thinking', 'strength ']"
happiness,"Happiness is like a cat. If you try to coax it or call it, it will avoid you. It will never come. But if you pay no attention to it and go about your business, you'll find it rubbing up against your legs and jumping into your lap.",['happiness ']
happiness,"And he, like many jaded people, had few pleasures left in life save good food and drink.","['gastronomy', 'gluttony', 'happiness', 'pleasure ']"
happiness,"When it comes down to it, even on the natural plane, it is much happier and more enlivening to love than to be loved.","['happiness', 'love ']"
happiness,I think instead [of happiness] we should be working for contentment... an inner sense of fulfillment that's relatively independent of external circumstances.,"['circumstances', 'contentment', 'fulfillment', 'happiness', 'life ']"
"happiness,success",Everything is easier said than done. Wanting something is easy. Saying something is easy. The challenge and the reward are in the doing.,"['action', 'happiness', 'motivational', 'saying', 'success', 'wanting ']"
happiness,Sometimes happiness consists of finding the right balance of misery.,['happiness ']
happiness,"Frugality, I've learned, has its own cost, one that sometimes lasts forever.","['frugality', 'happiness', 'money ']"
happiness,Mother earth cried so much that she has pool of tears more than the land of happiness.,"['earth', 'happiness', 'tears ']"
happiness,He tapped my chest. 'Happy is here.' He tapped his own chest. 'Here.'I looked down past my chin. 'Inside?''Inside.'It was getting crowded in there. First angel. Now happy. It seemed there was more to me than cabbage and turnips.,"['happiness', 'happy', 'milkweed', 'warsaw ']"
happiness,You are so intense. Like a storm. It's shocking how intense you are.,['happiness ']
happiness,Helping others is the secret sauce to a happy life.,"['happiness', 'happy', 'helping-others', 'joy', 'life', 'secret ']"
