0,1,2
"life,happiness",You will never be happy if you continue to search for what happiness consists of. You will never live if you are looking for the meaning of life.,"['attributed-no-source', 'happiness', 'meaning-of-life ']"
"inspiration,happiness",Happiness is not something ready made. It comes from your own actions.,"['happiness', 'inspirational ']"
"wisdom,happiness","Count your age by friends, not years. Count your life by smiles, not tears.","['happiness', 'timelessness', 'wisdom ']"
"life,happiness",Every man has his secret sorrows which the world knows not; and often times we call a man cold when he is only sad.,"['coldness', 'depression', 'happiness', 'life', 'sad', 'sadness', 'sorrow ']"
"success,happiness","When a small child, I thought that success spelled happiness. I was wrong, happiness is like a butterfly which appears and delights us for one brief moment, but soon flits away.","['Happiness', 'Butterfly', 'Small']"
happiness,"If more of us valued food and cheer and song above hoarded gold, it would be a merrier world.","['food', 'happiness ']"
"life,happiness",The most important thing is to enjoy your life—to be happy—it's all that matters.,"['happiness', 'life ']"
"humor,happiness",Happiness is a warm puppy.,"['animals', 'dogs', 'happiness', 'humor', 'puppies ']"
happiness,You cannot protect yourself from sadness without protecting yourself from happiness.,"['happiness', 'sadness ']"
"hope,love,happiness","They say a person needs just three things to be truly happy in this world: someone to love, something to do, and something to hope for.","['happiness', 'hope', 'joy', 'love', 'wishing ']"
happiness,No medicine cures what happiness cannot.,['happiness ']
"life,inspiration,happiness",It isn't what you have or who you are or where you are or what you are doing that makes you happy or unhappy. It is what you think about it.,"['attitude', 'contentment', 'happiness', 'inspirational', 'life ']"
"humor,happiness","Happiness is having a large, loving, caring, close-knit family in another city.","['family', 'happiness', 'humor ']"
happiness,The only way to find true happiness is to risk being completely cut open.,"['chance', 'happiness', 'risk ']"
happiness,Let us be grateful to the people who make us happy; they are the charming gardeners who make our souls blossom.,"['gratitude', 'happiness ']"
happiness,"You can't be happy unless you're unhappy sometimes"".","['contrast', 'happiness', 'unhappiness ']"
"inspiration,happiness,hope","HopeSmiles from the threshold of the year to come, Whispering 'it will be happier'...","['happiness', 'hope', 'inspirational', 'new-year ']"
"love,happiness","Of all forms of caution, caution in love is perhaps the most fatal to true happiness.","['happiness', 'love ']"
happiness,Sanity and happiness are an impossible combination.,"['happiness', 'sanity ']"
"hope,love,happiness","They say a person needs just three things to be truly happy in this world: someone to love, something to do, and something to hope for.","['Love', 'Happy', 'Three']"
"life,happiness",I've got nothing to do today but smile.,"['happiness', 'life ']"
"happiness,success","Success is getting what you want, happiness is wanting what you get","['happiness', 'success ']"
"life,happiness","The more you praise and celebrate your life, the more there is in life to celebrate.","['Birthday', 'Celebrate', 'Praise']"
"love,inspiration,happiness",Happiness [is] only real when shared,"['family', 'happiness', 'inspirational', 'love', 'marriage ']"
"inspiration,humor,happiness,success",The worst part of success is trying to find someone who is happy for you.,"['friendship', 'happiness', 'humor', 'inspirational', 'jealousy', 'success ']"
"love,happiness",Happiness is holding someone in your arms and knowing you hold the whole world.,"['happiness', 'love ']"
happiness,"Learn to value yourself, which means: fight for your happiness.","['fight', 'happiness', 'learn ']"
happiness,"I felt my lungs inflate with the onrush of scenery—air, mountains, trees, people. I thought, ""This is what it is to be happy.","['ecstasy', 'happiness', 'nature ']"
happiness,It's been my experience that you can nearly always enjoy things if you make up your mind firmly that you will.,['happiness ']
"life,inspiration,happiness,success","Letting go means to come to the realization that some people are a part of your history, but not a part of your destiny.","['destiny', 'happiness', 'history', 'inspirational', 'let-go', 'letting-go', 'life', 'motivational', 'moving-on', 'success ']"
happiness,I'm happy. Which often looks like crazy.,['happiness ']
"life,inspiration,happiness","please believe that things are good with me, and even when they're not, they will be soon enough. And i will always believe the same about you.","['happiness', 'inspirational', 'life ']"
happiness,"When the first baby laughed for the first time, its laugh broke into a thousand pieces, and they all went skipping about, and that was the beginning of fairies.",['happiness ']
happiness,"It's like Tolstoy said. Happiness is an allegory, unhappiness a story.","['fiction', 'happiness', 'stories ']"
happiness,All happiness depends on courage and work.,"['courage', 'happiness', 'work ']"
happiness,The best way to cheer yourself is to try to cheer someone else up.,['happiness ']
"inspiration,happiness","The grand essentials to happiness in this life are something to do, something to love, and something to hope for.","['happiness', 'inspirational', 'misattributed-to-chalmers', 'misattributed-to-joseph-addison', 'misattributed-to-kant', 'misattributed-tom-bodett', 'widely-misattributed ']"
happiness,"Let no one ever come to you without leaving better and happier. Be the living expression of God's kindness: kindness in your face, kindness in your eyes, kindness in your smile.",['happiness ']
happiness,"I think and think and think, I‘ve thought myself out of happiness one million times, but never once into it.","['happiness', 'thinking', 'wisedom ']"
happiness,"I am not proud, but I am happy; and happiness blinds, I think, more than pride.","['happiness', 'pride ']"
"life,happiness,inspiration,success",Cry. Forgive. Learn. Move on. Let your tears water the seeds of your future happiness.,"['cry', 'forgive', 'happiness', 'inspiration', 'learn', 'letting-go', 'life', 'motivational', 'moving-on', 'seeds', 'success', 'tears', 'water ']"
happiness,"So we shall let the reader answer this question for himself: who is the happier man, he who has braved the storm of life and lived or he who has stayed securely on shore and merely existed?","['gonzo', 'happiness', 'risk ']"
happiness,"And hand in hand, on the edge of the sand, They danced by the light of the moon.","['dance', 'happiness', 'nursery-rhymes ']"
happiness,Happiness quite unshared can scarcely be called happiness; it has no taste.,"['happiness', 'sharing ']"
happiness,I must learn to be content with being happier than I deserve.,['happiness ']
happiness,Man only likes to count his troubles; he doesn't calculate his happiness.,"['happiness', 'man', 'trouble ']"
happiness,The advantage of a bad memory is that one enjoys several times the same good things for the first time.,"['forgetfulness', 'forgetting', 'happiness', 'memory ']"
happiness,One of the keys to happiness is a bad memory.,"['bad-memory', 'forgiveness', 'happiness', 'memory ']"
happiness,Happiness depends upon ourselves.,['happiness ']
"life,happiness",Now and then it's good to pause in our pursuit of happiness and just be happy.,"['happiness', 'life ']"
"life,happiness","I felt once more how simple and frugal a thing is happiness: a glass of wine, a roast chestnut, a wretched little brazier, the sound of the sea. Nothing else.","['happiness', 'life', 'sea ']"
"love,happiness","I know that's what people say-- you'll get over it. I'd say it, too. But I know it's not true. Oh, youll be happy again, never fear. But you won't forget. Every time you fall in love it will be because something in the man reminds you of him.","['happiness', 'lost-love', 'love ']"
"life,happiness,inspiration","It was only a sunny smile, and little it cost in the giving, but like morning light it scattered the night and made the day worth living.","['happiness', 'inspiration', 'life ']"
happiness,I'd far rather be happy than right any day.,"['happiness', 'rightness ']"
happiness,The happiness of your life depends upon the quality of your thoughts.,['happiness ']
happiness,Happiness makes up in height for what it lacks in length.,['happiness ']
"love,happiness,relationship","People like to say love is unconditional, but it's not, and even if it was unconditional, it's still never free. There's always an expectation attached. They always want something in return. Like they want you to be happy or whatever and that makes you automatically responsible for their happiness because they won't be happy unless you are ... I just don't want that responsibility.","['happiness', 'love', 'relationships', 'responsibility', 'unconditional-love ']"
happiness,"Generally speaking, the most miserable people I know are those who are obsessed with themselves; the happiest people I know are those who lose themselves in the service of others...By and large, I have come to see that if we complain about life, it is because we are thinking only of ourselves.",['happiness ']
"life,inspiration,happiness,success","Sometimes life knocks you on your ass... get up, get up, get up!!! Happiness is not the absence of problems, it's the ability to deal with them.","['ability', 'action', 'gratitude', 'happiness', 'inspirational', 'life', 'motivational', 'moving-forward', 'problems', 'success ']"
"inspiration,happiness","Happiness is not the absence of problems, it's the ability to deal with them.","['empowerment', 'happiness', 'inspirational', 'life-lessons', 'motivational', 'problems ']"
happiness,"Happiness is an accident of nature, a beautiful and flawless aberration.",['happiness ']
happiness,"Maybe the truth is, there's a little bit of loser in all of us. Being happy isn't having everything in your life be perfect. Maybe it's about stringing together all the little things.","['bailey', 'happiness', 'loser', 'sisterhood ']"
happiness,"Happiness is the meaning and the purpose of life, the whole aim and end of human existence.",['happiness ']
"life,inspiration,happiness","There is some kind of a sweet innocence in being human- in not having to be just happy or just sad- in the nature of being able to be both broken and whole, at the same time.","['being-human', 'happiness', 'human', 'human-nature', 'humanism', 'humanity', 'inspirational', 'inspirational-quotes', 'inspiring', 'life', 'life-and-living', 'living', 'sadness ']"
happiness,With mirth and laughter let old wrinkles come.,"['birthday', 'happiness', 'laughter', 'shakespeare ']"
happiness,"I am the happiest creature in the world. Perhaps other people have said so before, but not one with such justice. I am happier even than Jane; she only smiles, I laugh.","['happiness', 'laughter', 'smiles ']"
happiness,"Actual happiness always looks pretty squalid in comparison with the overcompensations for misery. And, of course, stability isn't nearly so spectacular as instability. And being contented has none of the glamour of a good fight against misfortune, none of the picturesqueness of a struggle with temptation, or a fatal overthrow by passion or doubt. Happiness is never grand.",['happiness ']
happiness,"Those who are not looking for happiness are the most likely to find it, because those who are searching forget that the surest way to be happy is to seek happiness for others.",['happiness ']
happiness,"The secret of happiness is freedom, the secret of freedom is courage.","['courage', 'freedom', 'happiness ']"
"love,happiness","Happily ever after, or even just together ever after, is not cheesy,” Wren said. “It’s the noblest, like, the most courageous thing two people can shoot for.","['happiness', 'happy-endings', 'love ']"
happiness,"I do not miss childhood, but I miss the way I took pleasure in small things, even as greater things crumbled. I could not control the world I was in, could not walk away from things or people or moments that hurt, but I took joy in the things that made me happy.","['childhood', 'happiness ']"
happiness,It is the very mark of the spirit of rebellion to crave for happiness in this life,['happiness ']
"life,inspiration,happiness,success","There is nothing more rare, nor more beautiful, than a woman being unapologetically herself; comfortable in her perfect imperfection. To me, that is the true essence of beauty.","['be-yourself', 'beauty', 'body-image', 'comfortable', 'happiness', 'imperfection', 'inspirational', 'life', 'rare', 'success', 'women ']"
"happiness,success","When you do what you fear most, then you can do anything.","['abundance-creation', 'author-stephen-richards', 'believe', 'cosmic-ordering', 'fear', 'focus', 'goal-setting', 'happiness', 'law-of-attraction', 'life-changing', 'manifestation', 'manifesting', 'millionaire-mindset', 'mind-body-spirit', 'mind-power', 'new-age', 'new-thought', 'opportunity', 'positive-thoughts', 'positivity', 'self-belief', 'self-growth', 'self-help', 'self-motivation', 'self-realization', 'spirituality', 'stephen-richards', 'success', 'synchronicity', 'visualization', 'wealth-creation ']"
"life,happiness",You will never be happy if you continue to search for what happiness consists of. You will never live if you are looking for the meaning of life.,"['Happiness', 'Looking', 'Happy']"
"happiness,inspiration","True happiness is to enjoy the present, without anxious dependence upon the future, not to amuse ourselves with either hopes or fears but to rest satisfied with what we have, which is sufficient, for he that is so wants nothing. The greatest blessings of mankind are within us and within our reach. A wise man is content with his lot, whatever it may be, without wishing for what he has not.","['attitude', 'gratitude', 'happiness', 'inspirational-quotes', 'satisfaction ']"
"life,happiness,books","A quiet secluded life in the country, with the possibility of being useful to people to whom it is easy to do good, and who are not accustomed to have it done to them; then work which one hopes may be of some use; then rest, nature, books, music, love for one's neighbor — such is my idea of happiness.","['books', 'conduct-of-life', 'contentment', 'country', 'happiness', 'life', 'music', 'nature', 'neighborliness', 'rest', 'usefulness', 'work ']"
happiness,"I'm choosing happiness over suffering, I know I am. I'm making space for the unknown future to fill up my life with yet-to-come surprises.","['future', 'happiness', 'space ']"
happiness,Whoever is happy will make others happy.,['happiness ']
happiness,There are two ways to get enough. One is to continue to accumulate more and more. The other is to desire less.,"['happiness', 'satisfaction', 'serenity ']"
happiness,I think happiness is what makes you pretty. Period. Happy people are beautiful. They become like a mirror and they reflect that happiness.,"['beauty', 'happiness ']"
"inspiration,happiness",A mathematical formula for happiness:Reality divided by Expectations.There were two ways to be happy:improve your reality or lower your expectations.,"['advice', 'happiness', 'inspirational', 'mathematical ']"
"life,love,happiness,hope,success","Keep your best wishes, close to your heart and watch what happens","['abundance', 'balance', 'better', 'book', 'change', 'empowerment', 'expression', 'freedom', 'fulfillment', 'fun', 'greater', 'happiness', 'health', 'help', 'hope', 'improvement', 'joy', 'life', 'love', 'meditation', 'money', 'more', 'peace', 'perfect', 'power', 'relaxation', 'self', 'self-expression', 'self-help-book', 'self-improvement-book', 'self-realization', 'success', 'wealth', 'your ']"
happiness,"This planet has - or rather had - a problem, which was this: most of the people living on it were unhappy for pretty much of the time. Many solutions were suggested for this problem, but most of these were largely concerned with the movement of small green pieces of paper, which was odd because on the whole it wasn't the small green pieces of paper that were unhappy.","['happiness', 'money ']"
"inspiration,happiness","With all its sham, drudgery, and broken dreams,it is still a beautiful world.Be cheerful.Strive to be happy.","['happiness', 'inspirational', 'philosophical ']"
"love,happiness","After all, what is happiness? Love, they tell me. But love doesn't bring and never has brought happiness. On the contrary, it's a constant state of anxiety, a battlefield; it's sleepless nights, asking ourselves all the time if we're doing the right thing. Real love is composed of ecstasy and agony.","['anxiety', 'happiness', 'love', 'torment ']"
happiness,"I have no faith in human perfectibility. I think that human exertion will have no appreciable effect upon humanity. Man is now only more active - not more happy - nor more wise, than he was 6000 years ago.","['happiness', 'human-nature', 'humanity', 'perfection', 'time ']"
happiness,"I, not events, have the power to make me happy or unhappy today. I can choose which it shall be. Yesterday is dead, tomorrow hasn't arrived yet. I have just one day, today, and I'm going to be happy in it.","['carpe-diem', 'happiness', 'live-in-the-moment', 'self-determination ']"
"life,happiness","Sadness gives depth. Happiness gives height. Sadness gives roots. Happiness gives branches. Happiness is like a tree going into the sky, and sadness is like the roots going down into the womb of the earth. Both are needed, and the higher a tree goes, the deeper it goes, simultaneously. The bigger the tree, the bigger will be its roots. In fact, it is always in proportion. That's its balance.","['happiness', 'life', 'sadness ']"
happiness,"Children are happy because they don't have a file in their minds called ""All the Things That Could Go Wrong.",['happiness ']
"love,life,inspiration,happiness","I will not try to convince you to love me, to respect me, to commit to me. I deserve better than that; I AM BETTER THAN THAT...Goodbye.","['breakup', 'commit', 'deserve', 'goodbye', 'happiness', 'inspirational', 'life', 'love', 'motivational', 'relationship', 'respect ']"
"life,happiness",Happiness is not a goal...it's a by-product of a life well lived.,"['contentment', 'goals', 'happiness', 'life', 'satisfaction ']"
happiness,"The greater part of our happiness or misery depends upon our dispositions, and not upon our circumstances.","['attitude', 'circumstances', 'contentment', 'happiness ']"
"life,love,wisdom,happiness","Don’t sacrifice yourself too much, because if you sacrifice too much there’s nothing else you can give and nobody will care for you.","['altruism', 'care', 'caring', 'designer', 'ego', 'happiness', 'life', 'love', 'nobody', 'self-love', 'self-sacrifice', 'selfish', 'wisdom ']"
"life,love,wisdom,happiness,poetry","She is free in her wildness, she is a wanderess, a drop of free water. She knows nothing of borders and cares nothing for rules or customs. 'Time' for her isn’t something to fight against. Her life flows clean, with passion, like fresh water.","['adventuress', 'aesthete', 'allegory', 'ambition', 'beautiful', 'bravery', 'children', 'compass', 'courage', 'daring', 'desire', 'direction', 'dreams', 'drive', 'empowerment', 'enjoying', 'exile', 'expatriate', 'female', 'female-beauty', 'female-characters', 'female-empowerment', 'female-hero', 'female-liberation', 'females', 'feminine', 'femininity', 'feminism', 'femme', 'filles', 'first-love', 'freedom', 'gentle', 'girl', 'girl-power', 'girl-quotes', 'girls', 'goal', 'goals', 'happiness', 'hearts', 'hiding', 'imagination', 'inspire', 'jeune-fille', 'kid', 'kiss', 'life', 'life-philosophy', 'literature', 'living', 'love', 'loving', 'map', 'memory', 'motivation', 'passion', 'passionate', 'payne', 'poetess', 'poetry', 'power', 'pretty', 'risk', 'roaming', 'roman', 'roman-payne', 'romantic', 'running', 'sacred', 'secretive', 'seductive', 'sensual', 'strength', 'surrender', 'sweet', 'the-wanderess', 'time', 'travel', 'wander', 'wanderer', 'wanderess', 'wandering', 'wanderlust', 'wayfaring', 'wildness', 'wisdom', 'woman', 'woman-s-character', 'woman-s-strength', 'womanhood', 'women', 'women-s-inspirational', 'women-s-liberation', 'women-s-strength', 'young-love ']"
happiness,That's the difference between me and the rest of the world! Happiness isn't good enough for me! I demand euphoria!,"['ecstasy', 'happiness ']"
happiness,Laughter is poison to fear.,"['a-game-of-thrones', 'catelyn-stark', 'fear', 'george-r-r-martin', 'happiness', 'laughter', 'poison', 'wise ']"
"love,inspiration,happiness",The power of finding beauty in the humblest things makes home happy and life lovely.,"['beauty', 'happiness', 'inspirational', 'love ']"
"love,inspiration,happiness",The power of finding beauty in the humblest things makes home happy and life lovely.,"['beauty', 'happiness', 'inspirational', 'love ']"
"inspiration,happiness","I am a happy camper so I guess I’m doing something right. Happiness is like a butterfly; the more you chase it, the more it will elude you, but if you turn your attention to other things, it will come and sit softly on your shoulder.","['happiness', 'inspirational ']"
"inspiration,happiness","I heard a definition once: Happiness is health and a short memory! I wish I'd invented it, because it is very true.","['happiness', 'inspirational ']"
happiness,"Happiness is not a possession to be prized, it is a quality of thought, a state of mind.",['happiness ']
"life,happiness",I don't think that there are any limits to how excellent we could make life seem.,"['happiness', 'life ']"
happiness,I am very happyBecause I have conquered myselfAnd not the world.I am very happyBecause I have loved the worldAnd not myself.,"['agape', 'happiness', 'self-control ']"
"love,happiness",I have a million things to talk to you about. All I want in this world is you. I want to see you and talk. I want the two of us to begin everything from the beginning.,"['happiness', 'love ']"
happiness,And I can't be running back and fourth forever between grief and high delight.,"['ambivalence', 'confusion', 'grief', 'happiness ']"
happiness,"We don’t even ask happiness, just a little less pain.","['bukowski', 'happiness', 'pain', 'unhappiness', 'unhappy ']"
happiness,A thing of beauty is a joy forever.,"['beauty', 'happiness', 'joy ']"
"happiness,inspiration","Everyone wants to live on top of the mountain, but all the happiness and growth occurs while you're climbing it.","['growth', 'happiness', 'inspiration ']"
happiness,"Action may not always bring happiness, but there is no happiness without action.","['action', 'happiness', 'motivational', 'work ']"
"humor,happiness",I've always thought people would find a lot more pleasure in their routines if they burst into song at significant moments.,"['bollywood', 'happiness', 'humor', 'music ']"
happiness,"The sense of unhappiness is so much easier to convey than that of happiness. In misery we seem aware of our own existence, even though it may be in the form of a monstrous egotism: this pain of mine is individual, this nerve that winces belongs to me and to no other. But happiness annihilates us: we lose our identity.","['happiness', 'pain ']"
happiness,"What can I do with my happiness? How can I keep it, conceal it, bury it where I may never lose it? I want to kneel as it falls over me like rain, gather it up with lace and silk, and press it over myself again.",['happiness ']
happiness,"Letting go gives us freedom, and freedom is the only condition for happiness. If, in our heart, we still cling to anything - anger, anxiety, or possessions - we cannot be free.","['anger', 'buddhism', 'freedom', 'happiness', 'peace ']"
happiness,I'm a kind of paranoiac in reverse. I suspect people of plotting to make me happy.,['happiness ']
happiness,"If only we'd stop trying to be happy, we could have a pretty good time.",['happiness ']
"life,happiness","Life is not a PG feel-good movie. Real life often ends badly. Literature tries to document this reality, while showing us it is still possible for us to endure nobly.","['endurance', 'feelings-of-weakness', 'happiness', 'life', 'literature', 'movie', 'sadness ']"
happiness,"Happiness is a risk. If you’re not a little scared, then you’re not doing it right.","['happiness', 'risk ']"
"philosophy,happiness",Happiness consists in frequent repetition of pleasure,"['happiness', 'philosophy ']"
"love,happiness,relationship,success","I find the best way to love someone is not to change them, but instead, help them reveal the greatest version of themselves.","['be-yourself', 'change', 'choices', 'compassion', 'greatest-version', 'happiness', 'helping', 'love', 'relationships', 'success ']"
happiness,The pain I feel now is the happiness I had before. That's the deal.,"['happiness', 'pain ']"
"life,happiness","The more you praise and celebrate your life, the more there is in life to celebrate.","['happiness', 'life ']"
"love,life,inspiration,happiness",This life is yours. Take the power to choose what you want to do and do it well. Take the power to love what you want in life and love it honestly. Take the power to walk in the forest and be a part of nature. Take the power to control your own life. No one else can do it for you. Take the power to make your life happy.,"['forest', 'happiness', 'honesty', 'inspirational', 'life', 'love', 'nature', 'power ']"
