0,1,2
"life,love,humor,happiness,relationship","The love of my life has made me the happiest man ever. This ever-smiling man/mannequin is so happy because he’s got no brain, and in this way is identical to anyone who still rah-rahs for either a Republican or a Democrat.","['absurd', 'brain', 'cheer', 'cheerleader', 'cheerleading', 'corrupt', 'corruption', 'democrat', 'happiness', 'happy', 'humor', 'life', 'love', 'mannequin', 'political', 'politician', 'politics', 'relationships', 'republican', 'smile', 'smiling', 'word-junkies', 'xazaqazax ']"
"life,inspiration,happiness","I consider myself a stained-glass window. And this is how I live my life. Closing no doors and covering no windows; I am the multi-colored glass with light filtering through me, in many different shades. Allowing light to shed and fall into many many hues. My job is not to direct anything, but only to filter into many colors. My answer is destiny and my guide is joy. And there you have me.","['destiny', 'freedom', 'happiness', 'humanism', 'inspirational', 'inspirational-attitude', 'inspirational-life', 'inspirational-quotes', 'inspiring', 'life', 'life-and-living', 'living', 'spirit', 'stained-glass-window ']"
happiness,Everybody in the world is seeking happiness—and there is one sure way to find it. That is by controlling your thoughts. Happiness doesn't depend on outward conditions. It depends on inner conditions.,"['happiness', 'life-lessons', 'self-control ']"
"life,inspiration,truth,happiness","Destiny is real. And she's not mild-mannered. She will come around and hit you in the face and knock you over and before you know what hit you, you're naked- stripped of everything you thought you knew and everything you thought you didn't know- and there you are! A bloody nose, bruises all over you, and naked. And it's the most beautiful thing.","['beautiful', 'beauty', 'belief', 'belief-quotes', 'destiny', 'happiness', 'inspirational', 'inspirational-life', 'inspirational-quotes', 'life', 'life-and-living', 'life-experience', 'living', 'spirit', 'truth ']"
happiness,The foolish man seeks happiness in the distance. The wise grows it under his feet.,"['destiny', 'determination', 'happiness', 'motivation ']"
"happiness,books","Ahhh. Bed, book, kitten, sandwich. All one needed in life, really.","['books', 'calpurnia', 'happiness', 'reading ']"
happiness,Those who are happiest are those who do the most for others.,"['charity', 'compassion', 'happiness', 'helping-others', 'service ']"
"life,happiness","I like to believe that you don't need to reach a certain goal to be happy. I prefer to think that happiness is always there, and that when things don't go the way we might like them to, it's a sign from above that something even better is right around the corner.","['goal', 'happiness', 'life', 'life-lessons', 'thought ']"
happiness,A large income is the best recipe for happiness I ever heard of.,['happiness ']
"love,happiness","Perfect love casts out fear. Where there is love there are no demands, no expectations, no dependency. I do not demand that you make me happy; my happiness does not lie in you. If you were to leave me, I will not feel sorry for myself; I enjoy your company immensely, but I do not cling.","['awareness', 'happiness', 'love ']"
"life,happiness","So he tasted the deep pain that is reserved only for the strong, just as he had tasted for a little while the deep happiness.","['deep', 'feel', 'happiness', 'happy', 'life', 'little', 'pain', 'strong', 'taste ']"
"inspiration,happiness","Maybe you think you’ll be entitled to more happiness later by forgoing all of it now, but it doesn’t work that way. Happiness takes as much practice as unhappiness does. It’s by living that you live more. By waiting you wait more. Every waiting day makes your life a little less. Every lonely day makes you a little smaller. Every day you put off your life makes you less capable of living it.","['happiness', 'inspirational', 'living', 'unhappiness', 'waiting ']"
happiness,There is a kind of happiness and wonder that makes you serious. It is too good to waste on jokes.,"['happiness', 'narnia ']"
happiness,"The reason people find it so hard to be happy is that they always see the past better than it was, the present worse than it is, and the future less resolved than it will be.","['happiness', 'way-to-be ']"
happiness,"Age does not make us childish, as some say; it finds us true children.","['age', 'children', 'happiness ']"
"life,inspiration,happiness,success","Be happy with who you are and what you do, and you can do anything you want.","['appreciation', 'gratitude', 'happiness', 'inspirational', 'knowing-oneself', 'life', 'motivational', 'self-empowerment', 'success ']"
"life,love,wisdom,happiness,poetry","I was an adventurer, but she was not an adventuress. She was a 'wanderess.' Thus, she didn’t care about money, only experiences - whether they came from wealth or from poverty, it was all the same to her.","['adventurer', 'adventuress', 'aesthete', 'allegory', 'ambition', 'beautiful', 'bravery', 'courage', 'daring', 'direction', 'drive', 'empowerment', 'enjoying', 'exile', 'expatriate', 'experience', 'female', 'female-beauty', 'female-characters', 'female-empowerment', 'female-hero', 'female-liberation', 'females', 'feminine', 'femininity', 'feminism', 'femme', 'filles', 'freedom', 'girl', 'girl-power', 'girl-quotes', 'girls', 'goal', 'goals', 'happiness', 'hearts', 'hiding', 'imagination', 'inspire', 'jeune-fille', 'kid', 'kiss', 'life', 'life-philosophy', 'literature', 'living', 'love', 'loving', 'memory', 'money', 'motivation', 'passion', 'passionate', 'payne', 'poetess', 'poetry', 'povery', 'power', 'pretty', 'richness', 'risk', 'roaming', 'roman', 'roman-payne', 'romantic', 'running', 'sacred', 'secretive', 'seductive', 'sensual', 'strength', 'surrender', 'sweet', 'the-wanderess', 'time', 'travel', 'wander', 'wanderer', 'wanderess', 'wandering', 'wanderlust', 'wayfaring', 'wealth', 'wisdom', 'woman', 'woman-s-character', 'woman-s-strength', 'womanhood', 'women', 'women-s-inspirational', 'women-s-liberation', 'women-s-strength', 'young-love ']"
"love,happiness","Dustfinger still clearly remembered the feeling of being in love for the first time. How vulnerable his heart had suddenly been! Such a trembling, quivering thing, happy and miserably unhappy at once.","['happiness', 'love ']"
"life,happiness","That’s how stories happen — with a turning point, an unexpected twist. There’s only one kind of happiness, but misfortune comes in all shapes and sizes. It’s like Tolstoy said. Happiness is an allegory, unhappiness a story.","['happiness', 'life', 'misfortune', 'stories', 'unhappiness ']"
happiness,"Puritanism: The haunting fear that someone, somewhere, may be happy.","['attitude', 'definitions', 'fear', 'happiness', 'orthodoxy', 'puritanism', 'strictness ']"
"life,happiness",إن السعادة هي أن أشرب كوب شاي.. مع صديق.. في لحظة رضا.,"['friendship', 'happiness', 'life ']"
happiness,Happiness is like those palaces in fairytales whose gates are guarded by dragons: We must fight in order to conquer it.,['happiness ']
happiness,"For those who are poor in happiness, each time is a first time; happiness never becomes a habit.","['habit', 'happiness', 'marilyn-monroe', 'my-story ']"
"life,happiness","I am not good at noticing when I'm happy, except in retrospect.","['happiness', 'life ']"
"life,inspiration,happiness,success","If you are not the hero of your own story, then you're missing the whole point of your humanity.","['happiness', 'hero', 'humanity', 'inspirational', 'life', 'motivational', 'story', 'success ']"
happiness,"I shall take the heart. For brains do not make one happy, and happiness is the best thing in the world.","['55', 'happiness', 'life-lesson', 'thoughts ']"
"life,happiness","That’s life for you. All the happiness you gather to yourself, it will sweep away like it’s nothing. If you ask me I don’t think there are any such things as curses. I think there is only life. That’s enough.","['curses', 'happiness', 'heartbreak', 'life ']"
"life,happiness","Those born to wealth, and who have the means of gratifying every wish, know not what is the real happiness of life, just as those who have been tossed on the stormy waters of the ocean on a few frail planks can alone realize the blessings of fair weather.","['blessings', 'happiness', 'life', 'wealth ']"
"inspiration,happiness","My happiness grows in direct proportion to my acceptance, and in inverse proportion to my expectations.","['acceptance', 'happiness', 'inspirational ']"
"inspiration,happiness,god,religion","Happiness is the object and design of our existence; and will be the end thereof, if we pursue the path that leads to it; and this path is virtue, uprightness, faithfulness, holiness, and keeping all the commandments of God.","['god', 'happiness', 'inspirational', 'mormonism', 'religion', 'virtue ']"
happiness,"Happiness is a gift and the trick is not to expect it, but to delight in it when it comes.",['happiness ']
"philosophy,happiness","It isn't what you have, or who you are, or where you are, or what you are doing that makes you happy or unhappy. It is what you think about.","['happiness', 'humor', 'philosophy', 'thought ']"
happiness,"Exactly. How can you know it makes you happy if you’ve never experienced it?”“There are different kinds of happy,” she said. “Some kinds don’t need any proof.",['happiness ']
happiness,"If you wish to be happy,Eragon, Think not of what is to come nor of that which you have no control over but rather of the now and that which you are able to change""~Oromis to eragon ,Brisingr~618",['happiness ']
"life,love,happiness,hope,success",Happiness is part of who we are. Joy is the feeling,"['abundance', 'balance', 'better', 'book', 'change', 'empowerment', 'expression', 'freedom', 'fulfillment', 'fun', 'greater', 'happiness', 'health', 'help', 'hope', 'improvement', 'joy', 'life', 'love', 'meditation', 'money', 'more', 'peace', 'perfect', 'power', 'relaxation', 'self', 'self-expression', 'self-help-book', 'self-improvement-book', 'self-realization', 'success', 'wealth', 'your ']"
happiness,"Happiness is the most natural thing in the world when you have it, and the slowest, strangest, most impossible thing when you don't. It's like learning a foreign language: You can think about the words all you want, but you'll never be able to speak it until you suck up your courage and say them out loud.",['happiness ']
happiness,"In the end, the number of prayers we say may contribute to our happiness, but the number of prayers we answer may be of even greater importance.","['good-will', 'happiness', 'prayer', 'service ']"
happiness,"dear today, i spend all of you pretending i'm okay when i'm not, pretending i'm happy when i'm not, pretending about everything to everyone.","['faking-it', 'happiness', 'letters', 'okay', 'pretending ']"
happiness,"I was something that lay under the sun and felt it, like the pumpkins, and I did not want to be anything more. I was entirely happy. Perhaps we feel like that when we die and become a part of something entire, whether it is sun and air, or goodness and knowledge. At any rate, that is happiness; to be dissolved into something complete and great. When it comes to one, it comes as naturally as sleep.","['happiness', 'nature ']"
"inspiration,happiness",Happiness is a choice that requires effort at times.,"['happiness', 'inspirational ']"
happiness,"Happiness is excitement that has found a settling down place, but there is always a little corner that keeps flapping around.",['happiness ']
happiness,"When you are joyful, when you say yes to life and have fun and project positivity all around you, you become a sun in the center of every constellation, and people want to be near you.","['attitude', 'attraction', 'character', 'eulogy', 'friends', 'frienship', 'fun', 'fun-loving', 'good-times', 'happiness', 'happy', 'joy', 'joyful', 'kindness', 'law-of-attraction', 'memories', 'negative', 'personality', 'positive', 'positive-attitude', 'positivity', 'staying-positive', 'stayingpositiveu-com', 'upbeat ']"
happiness,"To be stupid, selfish, and have good health are three requirements for happiness, though if stupidity is lacking, all is lost.",['happiness ']
happiness,"Sometimes we must undergo hardships, breakups, and narcissistic wounds, which shatter the flattering image that we had of ourselves, in order to discover two truths: that we are not who we thought we were; and that the loss of a cherished pleasure is not necessarily the loss of true happiness and well-being. (109)","['breakups', 'emotional-wounds', 'happiness', 'hardships', 'self-image', 'suffering', 'true-happiness', 'well-being ']"
"happiness,success",Having a low opinion of yourself is not 'modesty.' It's self-destruction. Holding your uniqueness in high regard is not 'egotism.' It's a necessary precondition to happiness and success.,"['egotism', 'happiness', 'modesty', 'opinion', 'precondition', 'regard', 'sef', 'self-destruction', 'success', 'unique ']"
"life,happiness",Happiness is not the absence of problems; it's the ability to deal with them.,"['challenges', 'happiness', 'life', 'problems ']"
happiness,"I do not think we have a ""right""to happiness. If happiness happens, say thanks.",['happiness ']
happiness,"Happiness depends on being free, and freedom depends on being courageous.","['courage', 'freedom', 'happiness ']"
happiness,"A happy person is not a person in a certain set of circumstances, but rather a person with a certain set of attitudes.","['happiness', 'optimism', 'way-to-be ']"
happiness,"I may never be happy, but tonight I am content.",['happiness ']
"life,wisdom,happiness,inspiration","The way I define happiness is being the creator of your experience, choosing to take pleasure in what you have, right now, regardless of the circumstances, while being the best you that you can be.","['choice', 'circumstance', 'happiness', 'inspiration', 'life', 'pleaure', 'wisdom ']"
happiness,"He whose face gives no light, shall never become a star.",['happiness ']
"inspiration,happiness","I am still determined to be cheerful and happy, in whatever situation I may be; for I have also learned from experience that the greater part of our happiness or misery depends upon our dispositions, and not upon our circumstances. a","['attitude', 'happiness', 'inspirational ']"
"success,happiness",Happiness lies in the joy of achievement and the thrill of creative effort.,['happiness ']
"happiness,success",Stop trying to 'fix' yourself; you're NOT broken! You are perfectly imperfect and powerful beyond measure.,"['broken', 'fix', 'happiness', 'imperfect', 'life', 'perfect', 'powerful', 'self-esteem', 'success ']"
happiness,Happiness and the absurd are two sons of the same earth. They are inseparable.,"['absurdity', 'happiness ']"
happiness,You can't buy happiness,"['apothegm', 'happiness', 'kurt-cobian', 'misattributed ']"
happiness,"If you've got nothing to dance about, find a reason to sing.","['dance', 'freedom', 'happiness', 'happy', 'liberation', 'motivational', 'motivational-quotes', 'sing', 'smile ']"
happiness,"Really high-minded people are indifferent to happiness, especially other people's.",['happiness ']
happiness,"The secret of happiness is to face the fact that the world is horrible, horrible, horrible.","['happiness', 'realism', 'reality ']"
happiness,Some day you will find out that there is far more happiness in another's happiness than in your own.,"['happiness', 'self-sacrifice ']"
happiness,A woman laughing is a woman conquered.,"['happiness', 'life', 'relationship-advice ']"
"happiness,relationship","Laughter is more than just a pleasurable activity...When people laugh together, they tend to talk and touch more and to make eye contact more frequently.","['affection', 'happiness', 'laughter', 'pleasure', 'relationships ']"
happiness,You have everything you need for complete peace and total happiness right now.,"['fulfillment', 'happiness', 'peace ']"
happiness,"...is ignorance bliss, I don't know, but it's so painful to think, and tell me, what did thinking ever do for me, to what great place did thinking ever bring me? I think and think and think, I've thought myself out of happiness one million times, but never once into it.",['happiness ']
"happiness,relationship",The true measure of a man is how he treats you when others are not looking.,"['happiness', 'love', 'marriage', 'relationships', 'relationships-love', 'respecting-others', 'respecting-yourself ']"
"life,truth,happiness","I think, that if the world were a bit more like ComicCon, it would be a better place.","['comiccon', 'doctor-who', 'geeks', 'happiness', 'life', 'nerds', 'truth', 'words-of-wisdom ']"
happiness,Human happiness and moral duty are inseparably connected.,"['duty', 'happiness', 'honor ']"
happiness,"Most people would rather be certain they're miserable, than risk being happy.",['happiness ']
"inspiration,happiness",Leave behind the passive dreaming of a rose-tinted future. The energy of happiness exists in living today with roots sunk firmly in reality's soil.,"['buddhism', 'destiny', 'happiness', 'humanism', 'inspirational', 'karma', 'peace', 'self-reformation ']"
happiness,"Of all the means to insure happiness throughout the whole life, by far the most important is the acquisition of friends.","['friendship', 'happiness ']"
"happiness,relationship,success","The greatest love stories are not those in which love is only spoken, but those in which it is acted upon.","['action', 'happiness', 'inspirational', 'life', 'love', 'motivational', 'relationships', 'soulmates', 'success', 'true-love ']"
"wisdom,happiness","Happiness is not in the mere possession of money; it lies in the joy of achievement, in the thrill of creative effort.","['achievement', 'happiness', 'wealth', 'wisdom ']"
happiness,"She had been proud of his decision to serve his country, her heart bursting with love and admiration the first time she saw him outfitted in his dress blues.","['happiness', 'love', 'military ']"
happiness,"When she absently worried her bottom lip with one of her adorable little fangs, he sighed.The Enemy of Old fucking sighed.Dear gods, it’d finally happened to him.Happiness.Then his own fangs sharpened.I will kill anyone who tries to take this feeling away from me.","['elizabeth', 'funny', 'happiness', 'immortals-after-dark', 'kresley-cole', 'lothaire ']"
happiness,Happiness is a myth. It was invented to make us buy new things.,['happiness ']
"happiness,books","With my eyes closed, I would touch a familiar book and draw its fragrance deep inside me. This was enough to make me happy.","['books', 'happiness', 'reading ']"
happiness,"I don't know what your destiny will be, but one thing I know: the only ones among you who will be really happy are those who have sought and found how to serve.","['destiny', 'happiness', 'service ']"
"happiness,hope","It was their secret, a secret meant for just the two of them, and she'd never been able to imagine how it would sound coming from someone else. But, somehow, Logan made it sound just right.","['happiness', 'hope', 'love ']"
happiness,"It is almost as if happiness is an acquired taste, like coconut cordial or ceviche, to which you can eventually become accustomed, but despair is something surprising each time you encounter it.","['despair', 'happiness ']"
"happiness,success",Our way of thinking creates good or bad outcomes.,"['abundance-creation', 'author-stephen-richards', 'cosmic-ordering', 'focus', 'goal-setting', 'happiness', 'law-of-attraction', 'life-changing', 'manifestation', 'manifesting', 'millionaire-mindset', 'mind-body-spirit', 'mind-power', 'new-age', 'new-thought', 'opportunity', 'positive-thoughts', 'positivity', 'self-belief', 'self-growth', 'self-help', 'self-motivation', 'self-realization', 'spirituality', 'success', 'synchronicity', 'visualization', 'wealth-creation ']"
happiness,I needed to stop being what everyone thought I was.,"['freedom', 'happiness ']"
happiness,We have to go. I'm almost happy here.,"['ender', 'happiness ']"
happiness,"There are a few moments in your life when you are truly and completely happy, and you remember to give thanks. Even as it happens you are nostalgic for the moment, you are tucking it away in your scrapbook.","['happiness', 'nostalgia ']"
"happiness,soul",Beauty is the purest feeling of the soul. Beauty arises when soul is satisfied.,"['beautiful', 'beauty', 'beauty-in-nature', 'feeling', 'happiness', 'purity', 'purpose-of-life', 'satisfaction', 'soul', 'soul-mate', 'soulmates ']"
happiness,"Happiness is not a life without pain, but rather a life in which the pain is traded for a worthy price.",['happiness ']
happiness,Happiness is a state of activity.,"['activity', 'happiness ']"
happiness,The secret of happiness is not doing what we like but in liking what we do.,['happiness ']
happiness,"To serve is beautiful, but only if it is done with joy and a whole heart and a free mind.","['happiness', 'joy', 'purpose-of-life', 'social-justice ']"
happiness,That's the secret to life... replace one worry with another....,"['happiness', 'puppy ']"
"happiness,success","If you fuel your journey on the opinions of others, you are going to run out of gas.","['fuel', 'gas', 'happiness', 'inspirational', 'journey', 'life', 'motivational', 'opinion', 'success ']"
happiness,"Got no checkbooks, got no banks. Still I'd like to express my thanks - I've got the sun in the mornin' and the moon at night.","['gratitude', 'happiness', 'money', 'thanks ']"
"happiness,poetry",Ink runs from the corners of my mouth.There is no happiness like mine.I have been eating poetry.,"['happiness', 'poetry ']"
"life,happiness,success",Love yourself. Forgive yourself. Be true to yourself. How you treat yourself sets the standard for how others will treat you.,"['be-true', 'forgive', 'happiness', 'life', 'love-yourself', 'success ']"
"life,happiness","Hurt is a part of life. To be honest, I think hurt is a part of happiness, that our definition of happiness has gotten very narrow lately, very nervous, a little afraid of this brawling, fabulous, unpredictable world.","['happiness', 'hurt', 'life ']"
happiness,I'll never wake up in a good mood again.I'm tired of these stinky boots,"['fashion', 'happiness', 'hopelessness', 'sadness', 'sleep ']"
happiness,Anne was always glad in the happiness of her friends; but it is sometimes a little lonely to be surrounded everywhere by happiness that is not your own.,"['happiness', 'sadness ']"
"happiness,poetry",Recipe For Happiness Khaborovsk Or Anyplace'One grand boulevard with treeswith one grand cafe in sunwith strong black coffee in very small cups.One not necessarily very beautifulman or woman who loves you.One fine day.,"['happiness', 'poetry ']"
"wisdom,happiness",I don’t think man was meant to attain happiness so easily. Happiness is like those palaces in fairy tales whose gates are guarded by dragons: we must fight in order to conquer it.,"['happiness', 'wisdom ']"
"happiness,positive","The lesson will always repeat itself, unless you see yourself as the problem--not others.","['acting-differently', 'advice', 'applying', 'applying-what-you-know', 'change', 'choices', 'chosen', 'consequences', 'crossroads', 'different-path', 'dignity', 'fixing-ourself', 'full-circle', 'happiness', 'helpful', 'helping', 'helping-others', 'imperfections', 'integrity', 'joy', 'just-a-moment-in-time', 'learning', 'lessons', 'letting-go', 'life-coach', 'life-s-little-university', 'lifting-others', 'living', 'living-in-the-present', 'moving-forward', 'one-path', 'our-fault', 'positive-choices', 'positive-thinking', 'proactive-vs-reactive', 'problem-solving', 'reaching-out', 'reactions', 'relationships-101', 'repeat-mistakes', 'repeated-patterns', 'repeating-the-past', 'seeing-people', 'self-caused', 'self-help', 'self-love', 'self-work', 'spiritual-growth', 'standing-up-for-right', 'staying-positive', 'stayingpositiveu-com', 'therapy', 'trusting', 'we-control-our-reactions', 'well-intended', 'wide-awake ']"
happiness,My only regrets are the moments when i doubted myself and took the safe route. Life is too short to waste time being unhappy.,"['dan-howell', 'danisnotonfire', 'happiness', 'inspirational', 'life', 'youtube ']"
happiness,"Be happy in the moment, that's enough. Each moment is all we need, not more.","['happiness', 'mindfulness', 'moment ']"
happiness,"If everything really does get better, the way everyone claims, then happiness should be graphable. But that's crap, because better isn't quantifiable.",['happiness ']
"happiness,success",Do not sabotage your new relationship with your last relationship’s poison.,"['happiness', 'inspirational', 'motivational', 'poison', 'relationship', 'sabotage', 'success ']"
"inspiration,happiness,success","You have a unique gift to offer this world. Be true to yourself, be kind to yourself, read and learn about everything that interests you and keep away from people who bring you down. When you treat yourself kindly and respect the uniqueness of those around you, you will be giving this world an amazing gift... YOU!","['be-you', 'be-yourself', 'happiness', 'inspirational', 'kindness', 'motivational', 'respect', 'self-esteem', 'success ']"
"happiness,poetry","Laugh, and the world laughs with you;Weep, and you weep alone;For the sad old earth must borrow its mirth,But has trouble enough of its own.","['happiness', 'poetry', 'sadness ']"
"life,philosophy,happiness",Freedom is the only worthy goal in life. It is won by disregarding things that lie beyond our control.,"['control', 'freedom', 'goal', 'happiness', 'life', 'philosophy ']"
happiness,The discovery of a new dish does more for the happiness of the human race than the discovery of a star.,"['astronomy', 'astronomy-vs-gastronomy', 'food', 'happiness ']"
