0,1,2
happiness,"Finding happiness should not be seen as finding a needle in a haystack. Happiness is within. Each day is a blessing that brings an abundance of happiness. Therefore, finding happiness should be like finding a gift in a stack of gifts.","['appreciation', 'blessing', 'choice', 'gifts', 'happiness', 'inspirational', 'life ']"
"life,happiness","Personally I am very pessimistic. But when, for instance, one of my staff has a baby you can't help but bless them for a good future. Because I can't tell that child, 'Oh, you shouldn't have come into this life.' And yet I know the world is heading in a bad direction. So with those conflicting thoughts in mind, I think about what kind of films I should be making.","['happiness', 'life ']"
happiness,I guess money can't buy happiness if you shop in the wrong places.,"['happiness', 'money ']"
"happiness,success",You are forgiven for your happiness and your successes only if you generously consent to share them.,"['forgiveness', 'happiness', 'sharing', 'success', 'you ']"
"life,wisdom,happiness,poetry","When she was a child, my love carried a road-map in her hand the way other girls carried handkerchiefs. She always knew the way. Her feet were little wings. And her beautiful head was a compass.","['adventuress', 'aesthete', 'allegory', 'ambition', 'beautiful', 'bravery', 'children', 'compass', 'courage', 'daring', 'direction', 'drive', 'enjoying', 'exile', 'expatriate', 'female', 'feminine', 'femininity', 'first-love', 'gentle', 'girl', 'girls', 'goal', 'happiness', 'hiding', 'kid', 'kiss', 'life', 'literature', 'living', 'love', 'map', 'memory', 'motivation', 'payne', 'poetess', 'poetry', 'power', 'pretty', 'roaming', 'roman', 'roman-payne', 'romantic', 'running', 'secretive', 'seductive', 'sensual', 'strength', 'sweet', 'the-wanderess', 'travel', 'wander', 'wanderer', 'wanderess', 'wandering', 'wayfaring', 'wisdom', 'young-love ']"
"happiness,relationship,success",The only real battle in life is between hanging on and letting go.,"['adversity', 'battles', 'beginnings', 'blog', 'classes', 'freedom', 'friendships', 'future', 'hanging-on', 'happiness', 'joy', 'letting-go', 'life', 'life-coach', 'living-life-to-the-fullest', 'moving-on', 'past', 'pinterest', 'positive-outlook', 'problems', 'relationships', 'relationships-101', 'starting-over', 'staying-positive', 'staying-positive-university', 'stayingpositiveu-com', 'success', 'trials', 'website ']"
"happiness,books","When we are collecting books, we are collecting happiness.","['books', 'happiness ']"
happiness,After all the world is indeed beautiful and if we were any other creature than man we might be continuously happy in it.,"['beautiful', 'happiness', 'happy', 'world ']"
happiness,"Happiness is not a state to arrive at, but a manner of traveling.","['happiness', 'keep-it-light ']"
happiness,Marriage becomes hard work once you have poured the entirety of your life’s expectations for happiness into the hands of one mere person. Keeping that going is hard work.,"['happiness', 'marriage ']"
"happiness,success","Learn from your history, but don’t live in it.","['happiness', 'history', 'inspirational', 'learn', 'live', 'mistakes', 'motivational', 'success ']"
happiness,We have no more right to consume happiness without producing it than to consume wealth without producing it.,['happiness ']
happiness,"Why not let people differ about their answers to the great mysteries of the Universe? Let each seek one's own way to the highest, to one's own sense of supreme loyalty in life, one's ideal of life. Let each philosophy, each world-view bring forth its truth and beauty to a larger perspective, that people may grow in vision, stature and dedication.",['happiness ']
happiness,"Happiness is such a fragile thing, isn't it? So easily burst, like a bubble blown by a child, and always on the verge of being carried away.",['happiness ']
happiness,"Money does not buy you happiness, but lack of money certainly buys you misery.","['happiness', 'misery', 'money ']"
happiness,"Sometimes you get everything you ever wanted, only it doesn't look like what you wanted anymore.","['happiness', 'heartbreak', 'love', 'relationships ']"
happiness,"Truly amazing, what people can get used to, as long as there are a few compensations.","['happiness', 'human-nature', 'psychology', 'social-commentary ']"
"happiness,success",Sky is not a limit for me; because I have no limit for myself in life. Because life is a world full of risk taking and possibilities. No matter how hard or easy life is; I will always find a way to enjoy myself; even in the mist of circumstances; because problems is a sense of adventure in sheep's clothing.,"['existentialism', 'happiness', 'opportunity', 'success ']"
happiness,"And for a moment―for a split second―everything else falls away, the whole pattern and order of my life, and a huge joy crests in my chest. I am no one, and I owe nothing to anybody, and my life is my own.","['freedom', 'happiness', 'joy ']"
happiness,In the midst of happiness or despairin sorrow or in joyin pleasure or in pain:Do what is right and you will be at peace.,"['despair', 'happiness', 'joy', 'pain', 'peace', 'personality', 'pleasure', 'right', 'sorrow ']"
"happiness,god",We will never be happy until we make God the source of our fulfillment and the answer to our longings. He is the only one who should have power over our souls.,"['god', 'happiness', 'inspirational ']"
happiness,We are all happy if we but knew it.,['happiness ']
"life,inspiration,happiness","Cake is happiness! If you know the way of the cake, you know the way of happiness! If you have a cake in front of you, you should not look any further for joy!","['cake', 'cakes', 'happiness', 'inspirational', 'inspirational-life', 'inspirational-quotes', 'joy', 'life', 'life-and-living', 'living', 'looking-no-further', 'the-way-of-the-cake', 'the-way-to-happiness', 'understanding-happiness', 'understanding-joy ']"
happiness,There is no greater power than that of a laugh and happiness is a force which can save a person from the horrors of the world.,"['comedy', 'happiness', 'laughter ']"
happiness,A grateful mindset can set you free from the prison of disempowerment and the shackles of misery.,"['appreciation', 'gratitude', 'happiness', 'inspirational', 'letting-go', 'life ']"
happiness,I think the saddest people always try their hardest to make people happy because they know what it’s like to feel absolutely worthless and they don’t want anyone else to feel like that.,"['happiness', 'sadness ']"
"life,inspiration,happiness",Allow yourself to enjoy each happy moment in your life.,"['carpe-diem', 'happiness', 'inspirational', 'life', 'self-love ']"
happiness,"Watch any plant or animal and let it teach you acceptance of what is, surrender to the Now.Let it teach you Being.Let it teach you integrity — which means to be one, to be yourself, to be real.Let it teach you how to live and how to die, and how not to make living and dying into a problem.","['animals', 'eckhart-tolle', 'happiness', 'integrity', 'peace', 'serenity ']"
happiness,"Three o'clock in the morning. The soft April night is looking at my windows and caressingly winking at me with its stars. I can't sleep, I am so happy.","['happiness', 'love ']"
happiness,"Happiness is always a by-product. It is probably a matter of temperament, and for anything I know it may be glandular. But it is not something that can be demanded from life, and if you are not happy you had better stop worrying about it and see what treasures you can pluck from your own brand of unhappiness.","['happiness', 'pessimism', 'unhappiness ']"
happiness,"The secret of being miserable is to have leisure to bother about whether you are happy or not. The cure for it is occupation, because occupation means pre-occupation; and the pre-occupied person is neither happy nor unhappy, but simply alive and active. That is why it is necessary to happiness that one should be tired.",['happiness ']
happiness,Be happy without picking flaws.,"['advice', 'happiness ']"
"happiness,hope","There's a taste in the air, sweet and vaguely antiseptic, that reminds him of his teenage years in these streets, and of a general state of longing, a hunger for life to begin that from this distance seems like happiness.","['happiness', 'hope', 'longing ']"
"life,inspiration,happiness","Happiness has to do with your mindset, not with outside circumstance.","['action', 'agreement-with-reality', 'circumstances', 'happiness', 'inspirational', 'life', 'mindset ']"
"life,happiness","Be happy -- if you're not even happy, what's so good about surviving?","['depression', 'happiness', 'life', 'optimism', 'struggle', 'survival ']"
"happiness,wisdom,truth","Non-violence, which is the quality of the heart, cannot come by an appeal to the brain.","['happiness', 'satyagraha', 'truth', 'violence', 'wisdom ']"
happiness,"For the likes of you, the path to happiness is one mean son of a bitch of a path.","['happiness', 'path ']"
happiness,Control of consciousness determines the quality of life.,"['consciousness', 'happiness', 'quality-of-life ']"
happiness,The happiest man is he who learns from nature the lesson of worship,"['happiness', 'lessons', 'nature', 'worship ']"
happiness,"Well, I always know what I want. And when you know what you want--you go toward it. Sometimes you go very fast, and sometimes only an inch a year. Perhaps you feel happier when you go fast. I don't know. I've forgotten the difference long ago, because it really doesn't matter, so long as you move.","['forward', 'fulfillment', 'growth', 'happiness', 'innovation', 'movement', 'progress ']"
"happiness,success",Success is getting what you want; happiness is wanting what you get.,"['happiness', 'success ']"
happiness,"He went to the church, and walked about the streets, and watched the people hurrying to and for, and patted the children on the head, and questioned beggars, and looked down into the kitchens of homes, and up to the windows, and found that everything could yield him pleasure. He had never dreamed of any walk, that anything, could give him so much happiness. (p. 119)","['christmas', 'happiness', 'pleasure ']"
happiness,"Fate never promises to tell you everything up front. You aren't always shown the path in life you're supposed to take. But if there was one thing she'd learned in the past few weeks, it was that sometimes, when you're really lucky, you meet someone with a map.",['happiness ']
happiness,"It is essential to happiness that our way of living should spring from our own deep impulses and not from the accidental tastes and desires of those who happen to be our neighbors, or even our relations.",['happiness ']
happiness,We are often insane with happiness. We are also very unhappy for reasons neither of us can do anything about. Like being separated.,"['happiness', 'separation ']"
happiness,Almost all of our sorrows spring out of our relations with other people. There is no more mistaken path to happiness than worldliness.,"['happiness', 'mistake', 'people', 'worldliness ']"
happiness,We must have the stubbornness to accept our gladness in the ruthless furnace of this world.,['happiness ']
happiness,"The best parts of life are the things we can't plan. And it's a lot harder to find happiness if you're only searching in one place. Sometimes, you just have to throw away the map. Admit that you don't know where you're going and stop pressuring yourself to figure it out. Besides...a map is a life someone else already lived. It's more fun to make your own.","['happiness', 'journey', 'life', 'living-life', 'map ']"
happiness,"To make a prairie it takes a clover and one bee,One clover, and a bee,And revery.The revery alone will do,If bees are few.","['bees', 'clover', 'happiness', 'lightheartedness', 'prairie', 'revery ']"
"philosophy,happiness","True happiness, we are told, consists in getting out of one's self; but the point is not only to get out - you must stay out; and to stay out you must have some absorbing errand.","['altruism', 'happiness', 'mindfulness', 'philosophy ']"
happiness,Action may not always bring happiness; but there is no happiness without action.,"['action', 'happiness ']"
"life,happiness","I think probably kindness is my number one attribute in a human being. I'll put it before any of the things like courage or bravery or generosity or anything else.Brian Sibley: Or brains even?Oh gosh, yes, brains is one of the least. You can be a lovely person without brains, absolutely lovely. Kindness - that simple word. To be kind - it covers everything, to my mind.If you're kind that's it.","['happiness', 'life', 'love', 'people ']"
happiness,"Cheer up and dry your damp eyes,And tell me when it rains,And I'll blend up that rainbow above you & shoot it through your veins...'Cause your heart has a lack of color,And we should've known That we'd grow up sooner or later,'Cause we wasted all our free time alone. <3","['happiness', 'love', 'owl-city', 'rainbow-veins', 'songs ']"
happiness,"It is my observations, though, that happiness limits the amount of suffering one is willing to inflict upon others","['happiness', 'sorrow ']"
happiness,I don't want to be the one who says life is beautiful. I want to be the one who feels it.,"['beauty', 'feeling', 'happiness ']"
happiness,"A disciplined mind leads to happiness, and an undisciplined mind leads to suffering.","['discipline', 'happiness', 'suffering ']"
happiness,"If you have done something meritorious, you experience pleasure and happiness; if wrong things, suffering. A happy or unhappy life is your own creation. Nobody else is responsible. If you remember this, you won’t find fault with anybody. You are your own best friend as well as your worst enemy. (99)","['happiness', 'pleasure', 'suffering', 'unhappiness ']"
"happiness,success",At any given moment the choice to be happy is present- we just have to choose to be happy.,"['choice', 'happiness', 'inspirational', 'life', 'success', 'today ']"
"happiness,faith","Much of what we called ""depression""was really dissatisfaction, a result of setting a bar impossibly high or expecting treasures we weren't willing to work for.","['dissatisfaction', 'faith', 'happiness', 'mitch-albom', 'satisfaction ']"
happiness,Indeed there has never been any explanation of the ebb and flow in our veins--of happiness and unhappiness.,"['happiness', 'unhappiness ']"
happiness,"Happiness does not depend on outward circumstances, but on the state of the heart.",['happiness ']
"happiness,success",Free yourself from the burden of feeling the need to hold on to anything. Let go… you are a part of everything.,"['burden', 'free', 'happiness', 'inspirational', 'let-go', 'motivational', 'success ']"
happiness,"Each morning when I open my eyes I say to myself: I, not events, have the power to make me happy or unhappy today.","['happiness', 'inspirational ']"
"happiness,inspiration","I find no importance in showing others that I am happy; it's not important to me that they know or think that I am happy but what is important to me is that I am happy. I am interested in being happy, not in making others think or know that I am.","['being-happy', 'genuineness', 'happiness', 'inspirational-happiness', 'inspirational-quotes', 'life-and-living', 'true-happiness ']"
happiness,"I've learned .... That when you harbor bitterness, happiness will dock elsewhere.",['happiness ']
happiness,"Life is about balance. The good and the bad. The highs and the lows. The thing everyone should realize is that the key to happiness is being happy by yourself and for yourself. Happiness comes from within. You have the power to change your own mindset so that all the negative, horrible thoughts that try to invade your psyche are replaced with happy, positive, wonderful thoughts.",['happiness ']
"happiness,success","When you fail, that is when you get closer to success.","['abundance-creation', 'author-stephen-richards', 'cosmic-ordering', 'focus', 'goal-setting', 'happiness', 'law-of-attraction', 'life-changing', 'manifestation', 'manifesting', 'millionaire-mindset', 'mind-body-spirit', 'mind-power', 'new-age', 'new-thought', 'opportunity', 'positive-thoughts', 'positivity', 'self-belief', 'self-growth', 'self-help', 'self-motivation', 'self-realization', 'spirituality', 'success', 'synchronicity', 'visualization', 'wealth-creation ']"
"happiness,success","It’s not about working for money, it’s about having money work for you.","['abundance-creation', 'author-stephen-richards', 'cosmic-ordering', 'focus', 'goal-setting', 'happiness', 'law-of-attraction', 'life-changing', 'manifestation', 'manifesting', 'millionaire-mindset', 'mind-body-spirit', 'mind-power', 'new-age', 'new-thought', 'opportunity', 'positive-thoughts', 'positivity', 'self-belief', 'self-growth', 'self-help', 'self-motivation', 'self-realization', 'spirituality', 'success', 'synchronicity', 'visualization', 'wealth-creation ']"
happiness,"How simple and frugal a thing is happiness: a glass of wine, a roast chestnut, a wretched little brazier, the sound of the sea. . . . All that is required to feel that here and now is happiness is a simple, frugal heart.",['happiness ']
happiness,"Last weekend a young man asked me how I remain so positive. “It seems all the negativity in the world doesn’t affect you,” he said. I had no more than a minute with the young man so I offered this: It’s all about where you choose to put your attention, and I choose to be happy.","['happiness', 'life', 'love ']"
happiness,"I wish I had never been born,""she said. ""What are we born for?""""For infinite happiness,""said the Spirit. ""You can step out into it at any moment...","['happiness', 'life', 'spirituality ']"
happiness,"I like living in my head because in there, everyone is kind and innocent. Once you start integrating yourself into the world, you realize that people are nasty, mean creatures. They're worse than zombies. People try to crush your soul and destroy your happiness, but zombies just want to have a little nibble of your brain.","['apocalypse', 'apocalyptic', 'brain', 'brains', 'craziness', 'crazy', 'creatures', 'happiness', 'happy', 'head', 'human', 'human-nature', 'humanity', 'humans', 'innocence', 'innocent', 'integrating', 'integration', 'kind', 'kindness', 'like', 'little-nibble', 'live', 'living', 'living-life', 'mean', 'mean-people', 'mental-health', 'mental-illness', 'nasty', 'nasty-people', 'nibble', 'nibbling', 'people', 'post-apocalyptic', 'reality', 'realization', 'realize', 'world', 'yourself', 'zombie', 'zombie-apocalypse', 'zombies', 'zompoc ']"
happiness,"If you're not making someone else's life better, then you're wasting your time. Your life will become better by making other lives better.","['goodness', 'happiness', 'helping-others ']"
happiness,I remember watching it all and getting the tickling in my chest and thinking to myself: This is what happiness feels like.,"['gayle-forman', 'happiness', 'if-i-stay', 'mia', 'page-225 ']"
happiness,"Have you noticed how nobody ever looks up? Nobody looks at chimneys, or trees against the sky, or the tops of buildings. Everybody just looks down at the pavement or their shoes. The whole world could pass them by and most people wouldn't notice.","['attitude', 'happiness', 'inspirational', 'observation', 'optimism', 'umbrellas ']"
"inspiration,happiness","Money can't buy happiness, but it certainly is a stress reliever.","['happiness', 'inspirational', 'money', 'stress-relief ']"
"inspiration,happiness,success",Your life begins to change the day you take responsibility for it.,"['change', 'happiness', 'inspirational', 'life', 'motivational', 'responsibility', 'success ']"
happiness,"The primary cause of unhappiness is never the situation, but you thoughts about it. Be aware of the thoughts you are thinking.","['cognitive-distortions', 'emotion', 'happiness', 'psychology', 'situation', 'thinking', 'thought', 'thoughts ']"
happiness,"Even if happiness forgets you a little bit, never completely forget about it.",['happiness ']
happiness,We are a noisy and blessed little family,"['family', 'happiness ']"
"inspiration,happiness","Love and compassion are the mother and father of a smile. We need to create more smiles in our world today. Smiles, after all, pave the way to a happy world.","['compassion', 'happiness', 'inspirational', 'kindness', 'love', 'smiles ']"
happiness,"You know, people ask me. They say 'Dan, three years later do you really want to be drawing cat whiskers on your face?' but they don't understand. The cat whiskers, they come from within.","['future', 'growing-up', 'happiness', 'identity', 'life', 'lifestyle', 'silly', 'unique-purpose ']"
happiness,"Sometimes I think of you and I feel giddy. Memory makes me lightheaded, drunk on champagne. All the things we did. And if anyone has said this was the price I would have agreed to pay it. That surprises me; that with the hurt and the mess comes a shift of recognition. It was worth it. Love is worth it.","['happiness', 'heartache', 'hurt', 'love', 'memory', 'pain', 'worth ']"
happiness,To be happy--one must find one's bliss,"['bliss', 'happiness', 'joy ']"
happiness,"...the face has limited space. My mother used to say, if you fill your face with laughing, there will be no more room for crying.",['happiness ']
"happiness,wisdom,truth",They'll say you are bador perhaps you are mador at least you should stay undercover.Your mind must be bareif you would dareto think you can love more than one lover.,"['agape', 'believe', 'betrayal', 'break-up', 'broken', 'cheat', 'cheater', 'cheating', 'closet', 'commitment', 'communication', 'consent', 'control', 'cry', 'depressed', 'desire', 'dirty', 'divorce', 'divorced', 'dream', 'empowering', 'end', 'ended', 'eros', 'family', 'fear', 'feelings', 'feminism', 'forever', 'freedom', 'friends', 'friendship', 'gone', 'happiness', 'heartbreak', 'heartbroken', 'hearts', 'honesty', 'horny', 'human', 'humanity', 'hurt', 'infidelity', 'jealousy', 'jerk', 'keep', 'keeper', 'keepers', 'live', 'lost', 'lovers', 'monogamy', 'nasty', 'need', 'nonmonogamy', 'pain', 'partners', 'peace', 'plural', 'polyamory', 'polyandry', 'polycule', 'polygamy', 'polygyny', 'possessive', 'quad', 'queer', 'real', 'relationship', 'respect', 'romantic', 'sad', 'share', 'sharing', 'slut', 'sluts', 'sorrow', 'spice', 'spouse', 'stay', 'suffering', 'sweet', 'sweethearts', 'swinging', 'team', 'threesome', 'time', 'triad', 'trouble', 'truth', 'undercover', 'unfaithful', 'unicorn', 'unity', 'valentine', 'valentines', 'value', 'wisdom', 'wishes', 'yolo ']"
happiness,"I don't want anyone to look to me, not for protection, not for happiness, not for love, not for anything.","['happiness', 'love', 'protection', 'responsibility', 'self-sufficiency', 'solitude ']"
happiness,"De pronto tuve conciencia de que ese momento, de que esa rebanada de cotidianidad, era el grado máximo de bienestar, era la Dicha. Nunca había sido tan plenamente feliz como en ese momento, pero tenía la hiriente sensación de que nunca más volvería a serlo, por lo menos en ese grado, con esa intensidad",['happiness ']
happiness,"Happiness. It comes onunexpectedly. And goes beyond, really,any early morning talk about it.","['happiness', 'poetry ']"
happiness,Children are gifts. They are not ours for the breaking. They are ours for the making.,"['anger', 'arguing', 'break', 'child', 'children', 'dads', 'fathers', 'happiness', 'hurt', 'kindness', 'labeling', 'love', 'parenting', 'parents', 'praise', 'words', 'yelling ']"
"happiness,death,romance,books",At the end of the day your ability to connect with your readers comes down to how you make them feel.,"['anger', 'art', 'authors', 'babies', 'birth', 'books', 'boredom', 'death', 'depression', 'disdain', 'disease', 'disgust', 'distance', 'dying', 'enjoyment', 'family', 'fondness', 'friendship', 'grieving', 'happiness', 'hate', 'illness', 'knowlege', 'literature', 'love', 'marriage', 'mourning', 'obsession', 'passion', 'reading', 'romance', 'sadness', 'thirst ']"
"inspiration,happiness","Often, moreover, it is...that aspect of our being that society finds eccentric, ridiculous, or disagreeable, that holds our sweet waters, our secret well of happiness, the key to our equanimity in malevolent climes.","['disagreeable', 'eccentric', 'happiness', 'hard-times', 'inspirational', 'ridiculous ']"
happiness,"If you pursue happiness, you are an ordinary person. If happiness pursues you, you are an extraordinary person. Do not chase happiness; let it chase you.","['chase', 'extraordinary', 'happiness', 'ordinary', 'pursue ']"
"happiness,success","Don't wait for other people to be loving, giving, compassionate, grateful, forgiving, generous, or friendly... lead the way!","['compassionate-grateful', 'forgiving', 'friendly', 'generous', 'giving', 'happiness', 'life', 'loving', 'success ']"
happiness,To like many people spontaneously and without effort is perhaps the greatest of all sources of personal happiness.,"['community', 'effort', 'friendship', 'happiness', 'spontaneity ']"
happiness,What good is money if it can't buy happiness?,"['happiness', 'money', 'wealth ']"
"philosophy,happiness","My advice to you is get married: if you find a good wife you'll be happy; if not, you'll become a philosopher.","['happiness', 'humour', 'marriage', 'philosophy ']"
happiness,The only way to avoid being miserable is not to have enough leisure to wonder whether you are happy or not.,"['happiness', 'life', 'misery ']"
happiness,"I want him to be happy. And I want you to be happy, too. Even if you can only find that happiness without me.","['happiness', 'love ']"
happiness,"It will hurt.""said Petra. ""But let's make the most of what we have, and not let future pain ruin present happiness.","['happiness', 'love', 'pain', 'shadow-puppets ']"
"happiness,death","Call no man happy, said Shadow, until he is dead","['american-gods', 'death', 'happiness ']"
