0,1,2
hope,"My advice would be to follow your dream. Most of my life, I was in second place before I came in first place. I hope that inspired people to never give up.","['Life', 'Dream', 'Advice']"
"hope,poetry","Hope and Memory have one daughter and her name is Art, and she has built her dwelling far from the desperate field where men hang out their garments upon forked boughs to be banners of battle. O beloved daughter of Hope and Memory, be with me for a while.","['art', 'hope', 'literature', 'memory', 'poetry ']"
"life,inspiration,hope","Things will get easier, people's minds will change, and you should be alive to see it.","['bullying', 'ellen-degeneres', 'hope', 'inspirational', 'life ']"
"hope,inspiration",Hope is but the dream of those who wake.,"['Inspirational', 'Dream', 'Wake']"
hope,"What makes a hero? Courage, strength, morality, withstanding adversity? Are these the traits that truly show and create a hero? Is the light truly the source of darkness or vice versa? Is the soul a source of hope or despair? Who are these so called heroes and where do they come from? Are their origins in obscurity or in plain sight?","['courage', 'darkness', 'despair', 'fall', 'heroes', 'hope', 'rise', 'strength ']"
"life,faith,hope",I feel no need for any other faith than my faith in the kindness of human beings. I am so absorbed in the wonder of earth and the life upon it that I cannot think of heaven and angels.,"['angel', 'being', 'earth', 'faith', 'heaven', 'hope', 'human', 'kindness', 'later', 'life', 'now ']"
"inspiration,hope,poetry,relationship,quotes,writing",A tamed woman will never leave her mark in the world.,"['happyquotes', 'hope', 'inspirational', 'inspirationalquotes', 'inspired', 'instadaily', 'instaquote', 'lovequotes', 'pinquotes', 'poems', 'poetry', 'quote', 'quoteoftheday', 'quotes', 'relationships', 'rmdrake', 'sadquotes', 'sayings', 'spokenword', 'tattoo', 'typewriter', 'vsco', 'writer', 'writing ']"
"inspiration,truth,god,hope,religion",There is nothing more important than your eternal salvation.,"['eternity', 'god', 'hope', 'important', 'inspirational', 'religion', 'salvation', 'truth ']"
hope,Hope is the crystal meth of emotions. It hooks you fast and kills you hard.,"['drugs', 'emotions', 'hope', 'metaphor ']"
"hope,inspiration,soul",I want to be the best version of myself for anyone who is going to someday walk into my life and need someone to love them beyond reason.,"['anxiety', 'art', 'beach', 'born-ready', 'cape-cod', 'coming-of-age', 'constellations', 'depression', 'destiny', 'fate', 'friends', 'girls', 'growing', 'growing-up', 'healing', 'hope', 'inspiration', 'jennifer-elisabeth', 'learning', 'life', 'love', 'lovers', 'ocean', 'pray', 'prayer', 'red-thread', 'red-thread-of-destiny', 'red-thread-of-fate', 'self-acceptance', 'self-love', 'self-reflection', 'soul', 'soul-mates', 'stars', 'teenagers', 'teens', 'time', 'universe', 'wish ']"
hope,"I do believe that most men live lives of quiet desperation. For despair, optimism is the only practical solution. Hope is practical. Because eliminate that and it's pretty scary. Hope at least gives you the option of living.","['Men', 'Optimism', 'Solution']"
hope,"You see, we cannot draw lines and compartments and refuse to budge beyond them. Sometimes you have to use your failures as stepping-stones to success. You have to maintain a fine balance between hope and despair.' He paused, considering what he had just said. 'Yes', he repeated. 'In the end, it's all a question of balance.","['balance', 'despair', 'hope ']"
"inspiration,hope","It was stupid to hope, she knew. But sometimes hope was all you had.","['hope', 'inspirational', 'love', 'romantic ']"
hope,"I just can't think how I would go on without children having lost Edith already... It's too upsetting for me to write about them. Naturally, I still hope, and wait, wait, wait.","['Lost', 'Wait', 'Naturally']"
hope,"I dont know whats in the box, but I love it. Unopened gifts contain hope.","['gift', 'hope', 'hopeful', 'hoping', 'imagination', 'imagine', 'life', 'yearn', 'yearning ']"
"life,truth,hope,faith","We never know when our last day on earth will be. So, love with full sincerity, believe with true faith, and hope with all of your might. Better to have lived in truth and discovered life, than to have lived half heartedly and died long before you ever ceased breathing.","['cristina-marrero', 'faith', 'hope', 'life', 'living', 'love', 'truth ']"
"inspiration,hope","Never give up. It's like breathingonce you quit, your flame dies letting total darkness extinguish every last gasp of hope. You can't do that. You must continue taking in even the shallowest of breaths, continue putting forth even the smallest of efforts to sustain your dreams. Don't ever, ever, ever give up.","['ambition', 'desires', 'dreams', 'drive', 'effort', 'hope', 'inspirational', 'perserverance', 'richelle', 'richelle-goodrich', 'trying ']"
hope,"Overcoming the Cold War required courage from the people of Central and Eastern Europe and what was then the German Democratic Republic, but it also required the steadfastness of Western partner over many decades when many had long lost hope of integration of the two Germanys and Europe.","['Courage', 'War', 'Overcoming']"
hope,"Whether we wound or are wounded, the blood that flows is red.","['hope', 'one-piece', 'pirates', 'respect ']"
hope,"As long as there's life, there's hope.","['hope', 'life', 'thought-provoking ']"
"life,inspiration,faith,hope,romance",It is our wounds that create in us a desire to reach for miracles. The fulfillment of such miracles depends on whether we let our wounds pull us down or lift us up towards our dreams.,"['breakup', 'broken', 'broken-heart', 'broken-hearted', 'broken-hearted-quotes', 'dating', 'faith', 'healing', 'heartache', 'heartbreak', 'heartbroken', 'hope', 'hurt', 'hurt-feelings', 'hurting', 'hurting-heart', 'inspirational', 'life', 'life-lessons', 'love', 'romance ']"
"inspiration,hope,relationship,romance","Her love used to be my lighthouse, and now it feels like I'm treading water in the dark. Ill bet as soon as I start swimming, the sun will rise and color the sky with the romance of rose.","['color', 'dark', 'darkness', 'hope', 'hopeful', 'inspiration', 'inspirational', 'inspire', 'lighthouse', 'lit-on-literature', 'litonliterature', 'love', 'positive', 'relationships', 'romance', 'rose', 'sky', 'sunrise', 'swim', 'swimming', 'treading-water', 'water', 'word-junkies ']"
"hope,inspiration,romance,books",I could recognise his soul in mine as much as he could find me in his. Our sole existences seemed to have been for this very moment when nothing else mattered.,"['books', 'hope', 'inspirational-quotes', 'life', 'love', 'paranormal-romance', 'romance', 'soul-mate ']"
hope,"Hope is a horrible thing, you know. I don't know who decided to package hope as a virtue because it's not. It's a plague. Hope is like walking around with a fishhook in your mouth and somebody just keeps pulling it and pulling it.",['hope ']
hope,"May your choices reflect your hopes, not your fears.","['choices', 'fear', 'hope ']"
"hope,religion","The gospel is this: We are more sinful and flawed in ourselves than we ever dared believe, yet at the very same time we are more loved and accepted in Jesus Christ than we ever dared hope.","['christianity', 'hope', 'love', 'religion', 'sin ']"
hope,I hope that no American will waste his franchise and throw away his vote by voting either for me or against me solely on account of my religious affiliation. It is not relevant.,"['Voting', 'Vote', 'Waste']"
"hope,success",The way to screw up somebody's life is to give them what they want.,"['aspirations', 'dreams', 'failure', 'hope', 'life', 'success ']"
hope," l'aurore, arms d'une ardente patience, nous entrerons aux splendides Villes. (In the dawn, armed with a burning patience, we shall enter the splendid Cities.)","['dawn', 'desire', 'heaven', 'hope', 'resurrection', 'splendor ']"
"hope,romance",You make the rest of the beautiful things in the world cry for even trying at all. You make it hard for me to breathe.,"['hope', 'livia-and-blake', 'love', 'romance ']"
"wisdom,hope,faith,inspiration,quotes,success,books,positive",The worlds greatest achievers have been those who have always stayed focussed on their goals and have been consistent in their efforts.,"['attitude', 'authors', 'books', 'coaching', 'connect', 'counseling', 'courage', 'dare', 'daring', 'determination', 'dreams', 'faith', 'famous', 'goals', 'hope', 'idea', 'inspiration', 'inspire', 'judge', 'leadership', 'life', 'motivation', 'motivator', 'never-give-up', 'passion', 'positive-thinking', 'promo', 'publishing', 'quotes', 'self-confidence', 'self-esteem', 'success', 'successful', 'triumph', 'victory', 'willpower', 'wisdom', 'words', 'you-can-do-it ']"
hope,How wonderful that we have met with a paradox. Now we have some hope of making progress.,"['Progress', 'Wonderful', 'Paradox']"
"hope,faith",Fear is the glue that keeps you stuck. Faith is the solvent that sets you free.,"['believing', 'faith', 'freedom', 'god-s-plan', 'hope', 'love-one-another', 'patience', 'prayer', 'stuck', 'trusting-god', 'waiting ']"
hope,"Keep a light, hopeful heart. But expect the worst.","['best', 'hope', 'optimism', 'pessimism', 'pragmatism', 'worst ']"
"hope,faith",Sometimes it's easy to lose faith in people. And sometimes one act of kindness is all it takes to give you hope again.,"['faith', 'hope', 'kindness ']"
hope,"Now science has presented us with a hope called stem cell research, which may provide our scientists with many answers that have for so long been beyond our grasp.","['Science', 'Research', 'Beyond']"
hope,Ill make a swing so I can reach the places I cant reach yet.,"['hold-still', 'hope', 'nina-lacour ']"
"inspiration,hope","When you have a great and difficult task, something perhaps almost impossible, if you only work a little at a time, every day a little, suddenly the work will finish itself.","['hope', 'inspirational', 'perseverance ']"
"inspiration,hope,books","Right now, we're living in an ugly chapter of our lives, but books always get better!","['books', 'fantasy', 'hope', 'inspirational', 'self-help ']"
hope,"Look, he said, the point is theres no way to be a hundred percent sure about anyone or anything. So youre left with a choice. Either hope for the best, or just expect the worst.If you expect the worst, youre never disappointed, I pointed out.Yeah, but who lives like that?","['choices', 'expect', 'hope', 'lock-and-key', 'negative', 'positive ']"
hope,I wish you a tolerable Thursday. That's all any of us can hope for.,"['Wish', 'Thursday', 'Tolerable']"
"life,hope",We all give up great expectations along the way.,"['hope', 'life ']"
hope,what we call our despair is often only the painful eagerness of unfed hope.,['hope ']
hope,What hurts so bad about youth isn't the actual butt whippings the world delivers. It's the stupid hopes playacting like certainties.,"['disappointment', 'hope', 'youth ']"
"arts,hope","You cannot live to please everyone else. You have to edify, educate and fulfill your own dreams and destiny, and hope that whatever your art is that you're putting out there, if it's received, great, I respect you for receiving it. If it's not received, great, I respect you for not.","['Art', 'Respect', 'Dreams']"
hope,"He'd do what he always did, find the sweet among the bitter.",['hope ']
"hope,poetry","Hope springs eternal in the human breast; Man never Is, but always To be blest. The soul, uneasy, and confin'd from home, Rests and expatiates in a life to come.","['hope', 'poetry ']"
hope,"Yes, well I really hope I can make a difference, even in the smallest way. I am looking forward to helping as much as I can.","['Forward', 'Looking', 'Difference']"
hope,"I caught myself thinking about falling in love with someone who I hoped was out there right now thinking about the possibility of me, but I quickly banished the notion. It was that kind of thinking that landed me in this situation to begin with. Hope can ruin you.","['disappointment', 'failure', 'hope', 'love', 'unrequited-love ']"
hope,"Pray, hope, and don't worry. Worry is useless. God is merciful and will hear your prayer.","['god', 'hope', 'prayer', 'worry ']"
hope,But hope is no less realistic than despair. It is still our choice whether to live in light or lie down in darkness.,"['darkness', 'despair', 'hope', 'light ']"
"life,hope","Whatever happens in your life, no matter how troubling things might seem, do not enter the neighbourhood of despair.Even when all doors remain closed, God wil open up a new path only for you. Be thankful! It is easy to be thankful when all is well. A Sufi is thankful not only for what he has been given but also for all that has been denied.","['despair', 'hope', 'life', 'sufi ']"
hope,"I am not afraid of dying. I have lived longer than most people in the world. What scares me is to have a body that works but a brain that is waving goodbye. If that happens, I hope I die quickly.","['Goodbye', 'Brain', 'Dying']"
hope,There is nothing more majestic than the determined courage of individuals willing to suffer and sacrifice for their freedom and dignity.,['hope ']
"life,inspiration,death,hope",Remembering that you are going to die is the best way I know to avoid the trap of thinking you have something to lose.,"['death', 'hope', 'inspirational', 'life', 'motivatonal ']"
hope,"I can hardly wait for tomorrow, it means a new life for me each and every day.","['hope', 'renewal ']"
hope,"It all counts,' Adam said again. 'And the bottom line is, what defines you isn't how many times you crash, but the number of times you get back on the bike. As long as it's one more, you're all good.-pg 325 Along for the Ride","['along-for-the-ride', 'hope', 'sarah-dessen ']"
"hope,life","When we have lost everything, including hope, life becomes a disgrace, and death a duty.","['Hope', 'Death', 'Lost']"
hope,"I hope that what it comes down to at the end of the day is that people believe that I believe what I'm singing. It comes down to being believable. You don't have to be likeable; generally, though, I think I am.","['Singing', 'Believable']"
hope,Love is only one fine star away.,"['astronomy', 'hope', 'love', 'stars ']"
hope,"Sometimes my fancy gets to floating inside me, threatening to carry me away like a leaf on a wind. Better to be a stone.","['hope', 'reality ']"
"truth,hope,god,inspiration,religion","Therefore, since we are receiving a kingdom that cannot be shaken, let us be thankful, and so worship God acceptably with reverence and awe, for our God is a consuming fire.","['fire', 'god', 'hope', 'inspiration', 'kingdom', 'life', 'love', 'religion', 'reverence', 'thankful', 'truth', 'verse', 'worship ']"
hope,"Reader, do you think it is a terrible thing to hope when there is really no reason to hope at all? Or is it (as the soldier said about happiness) something that you might just as well do, since,in the end, it really makes no difference to anyone but you?",['hope ']
hope,"There was a moment in my life when I really wanted to kill myself. And there was one other moment when I was close to that. But even in my most jaded times, I had some hope.","['Life', 'Moment', 'Close']"
hope,"Above all shadows rides the Sunand Stars for ever dwell:I will not say the Day is done,nor bid the Stars farewell.","['hope', 'song ']"
hope,"When you don't know where you're going, you drive on the highway.","['drama', 'hope', 'modern-life ']"
"truth,hope","when you feel like hope is gone, look inside you and be strong and you'll finally see the truth- that hero lies in you.","['heroes', 'heroism', 'hope', 'strength', 'truth ']"
hope,Hope is nature's veil for hiding truth's nakedness.,"['Nature', 'Truth', 'Hiding']"
"inspiration,hope,relationship,poetry,quotes,writing",The best kind of humans are the ones who stay.,"['happyquotes', 'hope', 'inspirational', 'inspirationalquotes', 'inspired', 'instadaily', 'instaquote', 'lovequotes', 'pinquotes', 'poems', 'poetry', 'quote', 'quoteoftheday', 'quotes', 'relationships', 'rmdrake', 'sadquotes', 'sayings', 'spokenword', 'tattoo', 'typewriter', 'vsco', 'writer', 'writing ']"
"hope,poetry",Poets are damned but see with the eyes of angels.,"['angels', 'beauty', 'eyes', 'hope', 'perspective', 'poetry', 'poets', 'sight', 'vision ']"
"truth,hope,faith,god,relationship","When you look at the past without Gods eyes, you subject yourself to deception. The past no longer exists and God doesnt linger there. However, Satan will show you whatever you want to see and believe, so you will be trapped in an emotion that cannot communicate truth, beyond what you want to remember.","['acceptance', 'adultery', 'adversity', 'angels', 'anger', 'belief', 'betrayal', 'better-life', 'boyfriend', 'cheating', 'choices', 'christ', 'commitment', 'communication', 'competition', 'conflict', 'deception', 'deciding', 'decisions', 'desire', 'destinations', 'disclosure', 'emotions', 'faith', 'false-emotions', 'false-memories', 'feelings', 'fixated', 'freedom', 'games', 'girlfriend', 'glued', 'god', 'grass-is-greener', 'hope', 'information', 'insecurity', 'issues', 'jealousy', 'job', 'letting-go', 'liars', 'lies', 'listening', 'love', 'memories', 'men', 'mislead', 'moving-on', 'needs', 'obsessed', 'overhearing', 'perception', 'plans', 'players', 'poor-perception', 'positiveness', 'present', 'redemption', 'relationships', 'rose-colored-glasses', 'satan', 'secrets', 'see', 'seeing', 'self-righteousness', 'signs', 'smoke-screens', 'spirituatility', 'stages-of-growth', 'stalked', 'stalkers', 'stories', 'stuck', 'stupidity', 'tests', 'the-past', 'trapped', 'trials', 'trust', 'trust-issues', 'truth', 'unable-to-decide', 'value', 'vanity', 'wants', 'wishy-washy', 'women ']"
hope,"In an age of hope men looked up at the night sky and saw the heavens.""In an age of hopelessness they call it simply space.","['hope', 'hopelessness', 'humanity', 'peter-kreeft ']"
hope,"Every time you dive, you hope you'll see something new - some new species. Sometimes the ocean gives you a gift, sometimes it doesn't.","['Time', 'Ocean', 'Gift']"
hope,We're here for a reason. I believe a bit of the reason is to throw little torches out to lead people through the dark.,"['guidance', 'hope', 'leadership ']"
hope,"The times are chaotic. For me, I would hope that people look at [Angel] and gain strength by it. With everything that I do, I hope that they see people struggling to live decent, moral lives in a completely chaotic world. They see how hard it is, how often they fail, and how they get up and keep trying. That, to me, is the most important message I'm ever going to tell.","['hope', 'inspiration-through-art', 'strength ']"
hope,"We look into each other's eyes as we shake. His are still full of death and horror, but in them I see my face reflected, and inside my tiny eyes inside his, I think I see some hope.","['depth', 'hope', 'life ']"
"hope,faith",Faith is the very first thing you should pack in a hope chest.,"['faith', 'hope ']"
hope,Tell me whats the differencebetween hope and waitingbecause my heart doesnt knowIt constantly cuts itself on the glass of waitingIt constantly gets lost in the fog of hope,"['hope', 'patience ']"
hope,Courage will now be your best defence against the storm that is at hand-that and such hope as I bring.,"['courage', 'gandalf', 'hope', 'war ']"
hope,We need never be without hope because we can never be irreparably broken.,"['hope', 'nerdfighters ']"
"hope,inspiration,soul","For so many years, I couldnt understand why every time I thought that someone finally loved me, like for real, they would eventually turn to vapor. Every person whom Ive ever loved is trapped inside of my chest. Ive breathed all of them in so deeply that Ive nearly choked and died on every soul that Ive ever given myself to.","['anxiety', 'art', 'beach', 'born-ready', 'cape-cod', 'coming-of-age', 'constellations', 'depression', 'destiny', 'fate', 'friends', 'girls', 'growing', 'growing-up', 'hope', 'inspiration', 'jennifer-elisabeth', 'learning', 'life', 'love', 'lovers', 'ocean', 'pray', 'prayer', 'red-thread', 'red-thread-of-destiny', 'red-thread-of-fate', 'self-acceptance', 'self-love', 'self-reflection', 'soul', 'soul-mates', 'stars', 'teenagers', 'teens', 'universe', 'wish ']"
"inspiration,hope,poetry,relationship,quotes,writing",Sometimes the most beautiful people are beautifully broken.,"['happyquotes', 'hope', 'inspirational', 'inspirationalquotes', 'inspired', 'instadaily', 'instaquote', 'lovequotes', 'pinquotes', 'poems', 'poetry', 'quote', 'quoteoftheday', 'quotes', 'relationships', 'rmdrake', 'sadquotes', 'sayings', 'spokenword', 'tattoo', 'typewriter', 'vsco', 'writer', 'writing ']"
"philosophy,hope",A child who does not think about what happens around him and is content with living without wondering whether he lives honestly is like a man who lives from a scoundrel's work and is on the road to being a scoundrel.,"['communism', 'democracy', 'freedom', 'history', 'hope', 'individualism', 'philosophy', 'politics', 'revolution', 'socialism ']"
"inspiration,hope,relationship,poetry,quotes,writing",We swallowed the chaos because we knew we didn't want to be ordinary.,"['happyquotes', 'hope', 'inspirational', 'inspirationalquotes', 'inspired', 'instadaily', 'instaquote', 'lovequotes', 'pinquotes', 'poems', 'poetry', 'quote', 'quoteoftheday', 'quotes', 'relationships', 'rmdrake', 'sadquotes', 'sayings', 'spokenword', 'tattoo', 'typewriter', 'vsco', 'writer', 'writing ']"
hope,"Chemistry is one of these crazy things you can't teach or learn or you can't fake. You go in hoping it will work, hope that you will connect with the other actors. I was fortunate on 'Modern Family' and 'The Procession.' They are great people, very easy to like.","['Family', 'Work', 'Great']"
"life,hope","But then, life is a constant withering of possibilities. Some are stolen with the lives of people you love. Others are let go, with regret and reluctance and deep, deep sorrow. But there is compensation for lives unlived in the intoxicating joy of knowing that the life you have - right here, right now - if the one you have chosen. There is power in that, and hope.","['hope', 'life', 'life-lessons ']"
hope,All cannot be lost when there is still so much being found,['hope ']
hope,"While there is tea, there is hope.""(Sweet Lavender)","['hope', 'tea ']"
hope,"Hope is not the conviction that something will turn out well, but the certainty that something makes sense, regardless of how it turns out.",['hope ']
"inspiration,hope,relationship,poetry,quotes,writing","But dear, dont be afraid of love its only magic.","['happyquotes', 'hope', 'inspirational', 'inspirationalquotes', 'inspired', 'instadaily', 'instaquote', 'lovequotes', 'pinquotes', 'poems', 'poetry', 'quote', 'quoteoftheday', 'quotes', 'relationships', 'rmdrake', 'sadquotes', 'sayings', 'spokenword', 'tattoo', 'typewriter', 'vsco', 'writer', 'writing ']"
hope,Hope keeps you alive.,"['before-i-fall', 'hope', 'lauren-oliver ']"
hope,"I am heartbroken, but I have been heartbroken before, and this might be the best for which I can hope.","['disapointment', 'heartbroken', 'hope', 'sad ']"
"god,hope,purpose","Without God, life has no purpose, and without purpose, life has no meaning. Without meaning, life has no significance or hope.","['god', 'hope', 'life', 'purpose', 'significance ']"
hope,"I hope people don't think I'm crazy, because I'm not.",['Crazy']
"inspiration,hope",Believe it is possible to solve your problem. Tremendous things happen to the believer. So believe the answer will come. It will.,"['hope', 'inspirational ']"
hope,I am hope.,['hope ']
"happiness,hope","There's a taste in the air, sweet and vaguely antiseptic, that reminds him of his teenage years in these streets, and of a general state of longing, a hunger for life to begin that from this distance seems like happiness.","['happiness', 'hope', 'longing ']"
hope,"And in that moment, everything I knew to be true about myself up until then was gone. I was acting like another woman, yet I was more myself than ever before.","['awareness', 'discovery', 'hope', 'self-realization', 'truth', 'women ']"
"hope,life",Maybe all one can do is hope to end up with the right regrets.,"['Life', 'Regrets', 'Maybe']"
hope,Euripedes. Nothing is hopeless; we must hope for everything.,['hope ']
"death,hope","Saving YouThe darkness takes him over, the sickness pulls him in; his eyesa blown out candle, I wish to go with him.Sometimes I see a flicker a light that shone from them; I hold him to me tightly, before he's gone again.","['death', 'grief', 'hope', 'illness', 'loss ']"
"god,faith,hope","To have faith is to be sure of the things we hope for, to be certain of the things we cannot see.","['faith', 'god', 'hope', 'pleasing-to-god ']"
hope,Bursts of hope make despair harder to live with.,"['araby', 'hope ']"
"philosophy,hope",Hope does not leave without being given permission.,"['hope', 'inspirational-life', 'percy-jackson', 'philosophy', 'the-last-olympian ']"
hope,"The future is uncertain, but that can be a good thing.","['all-the-bright-places', 'future', 'hope', 'look-for-the-positive', 'smile ']"
hope,I would rather entertain and hope that people learned something than educate people and hope they were entertained.,"['Education', 'Rather', 'Educate']"
hope,And worse I may be yet: the worst is notSo long as we can say 'This is the worst.,"['hope', 'king-lear', 'motivational', 'worst ']"
hope,"Time has taught me not to lose hope, yet not to trust too much in hope either.","['hope', 'time ']"
hope,"It felt like I'd been living underground, and for a moment, I'd been given this glimpse of the sky. Once you've seen that, how can you go back where you came from?",['hope ']
hope,Hope is the magic carpet that transports us from the present moment into the realm of infinite possibilities.,"['Moment', 'Magic', 'Present']"
