0,1,2
hope,"The best way to not feel hopeless is to get up and do something. Dont wait for good things to happen to you. If you go out and make some good things happen, you will fill the world with hope, you will fill yourself with hope.","['determination', 'helping-others', 'hope', 'initiative', 'just-do-it', 'proactivity', 'service', 'volunteerism', 'work ']"
hope,Do not spoil what you have by desiring what you have not; remember that what you now have was once among the things you only hoped for.,"['desire', 'gratitude', 'hope ']"
hope,"There is no despair so absolute as that which comes with the first moments of our first great sorrow, when we have not yet known what it is to have suffered and be healed, to have despaired and have recovered hope.","['Sad', 'Great', 'Moments']"
hope,There is a crack in everything.That's how the light gets in.,"['hope', 'light ']"
hope,"Logic is one thing, the human animal another. You can quite easily propose a logical solution to something and at the same time hope in your heart of hearts it won't work out.","['Work', 'Time', 'Heart']"
hope,"My mum thought my TV and film addiction was laziness. If you're an immigrant, you know you'll never be an accepted part of society, but you hope your children will be, and you try to make them essential to the community in a practical way - being a doctor or a lawyer. Acting was beyond their comprehension.","['Society', 'Community']"
hope,"When it was dark, you always carried the sun in your hand for me.","['hope', 'sun ']"
"hope,inspiration","Hope is some extraordinary spiritual grace that God gives us to control our fears, not to oust them.","['Inspirational', 'God']"
hope,I hope I have helped to raise the profile of science and to show that physics is not a mystery but can be understood by ordinary people.,"['Science', 'Mystery', 'Physics']"
hope,"If you keep thinking about what you want to do or what you hope will happen, you don't do it, and it won't happen.","['Thinking', 'Happen']"
hope,One of the most difficult things everyone has to learn is that for your entire life you must keep fighting and adjusting if you hope to survive. No matter who you are or what your position is you must keep fighting for whatever it is you desire to achieve.,"['Life', 'Learn', 'Fighting']"
hope,"Hope founded upon a human being, a man-made philosophy or any institution is always misplaced... because these things are unreliable and fleeting.","['Philosophy', 'Fleeting']"
hope,"I am not the same man I was 35 years ago. And I hope that five years and ten years from now, I'll be a better man, a more mature man, a wiser man, a more humble man and a more spirited man to serve the good of my people and the good of humanity.","['Good', 'Humble', 'Humanity']"
hope,Hope is a necessity for normal life and the major weapon against the suicide impulse.,"['Life', 'Suicide', 'Against']"
hope,"When you are kind to someone in trouble, you hope they'll remember and be kind to someone else. And it'll become like a wildfire.","['Remember', 'Trouble', 'Wildfire']"
hope,"I have a 6-year-old niece who doesn't look like the majority of girls on the covers of magazines. I hope that by the time she's 16, the world will have changed.","['Time', 'Girl', 'Niece']"
hope,Marriage is like putting your hand into a bag of snakes in the hope of pulling out an eel.,"['Marriage', 'Hand', 'Snakes']"
hope,"Solitude is not something you must hope for in the future. Rather, it is a deepening of the present, and unless you look for it in the present you will never find it.","['Future', 'Solitude', 'Present']"
hope,"The most effective leaders are actually better at guarding against danger when they acknowledge it that it exists. Cowards, in contrast, cling to the hope that failure will never happen and may be sloppy in the face of danger - not because they don't acknowledge that it exists, but because they are just too afraid of it to look it in the eye.","['Failure', 'Eye', 'Leaders']"
hope,"Stalinism is linked with a cult of personality and massive violations of the law, with repression and camps. There is nothing like that in Russia and, I hope, will never again be.","['Law', 'Camps', 'Cult']"
hope,"My No. 1 focus was on my foundation, the Tim Tebow Foundation, to bring faith, hope and love to those needing a brighter day in the darkest hour of need.","['Love', 'Faith', 'Focus']"
"arts,hope","Vulnerability is the essence of romance. It's the art of being uncalculated, the willingness to look foolish, the courage to say, 'This is me, and I'm interested in you enough to show you my flaws with the hope that you may embrace me for all that I am but, more important, all that I am not.'","['Romantic', 'Courage', 'Hope']"
hope,"I'm moving on. I should have made that clear when I made the announcement. I guess I wasn't clear. If people think you're leaving a show after all these years, you might be retiring. So I understand where they're coming from, but I should have impressed the fact that I hope I'm just moving on right now.","['Moving', 'Leaving', 'Understand']"
hope,"When I was in elementary school, I used to write letters to myself. I'd write letters and go 'Dear Kristen-at-16-years-old, happy birthday. I hope you're doing something.'","['Birthday', 'Happy', 'Letters']"
hope,"When I go on holiday and people ask me what I do, I tell them I do some internet stuff and I've done a couple of books and I hope they just leave it at that.","['Internet', 'Holiday', 'Leave']"
hope,"The road that is built in hope is more pleasant to the traveler than the road built in despair, even though they both lead to the same destination.","['despair', 'hope ']"
hope,"I hope telling stories though 'Making a Difference' - as in my academic work and nonprofit work - will help me to live my grandmother's adage of 'Life is not about what happens to you, but about what you do with what happens to you.'","['Life', 'Work', 'Help']"
hope,"There is hope and a kind of beauty in there somewhere, if you look for it.","['Beauty', 'Somewhere']"
"inspiration,hope","Shoot for the moon, even if you fail, you'll land among the stars","['hope', 'inspirational ']"
hope,"If you don't like me, if you like me; both are equally cool. I send love and positive energy to all those people in their lives. I hope they find where they're meant to be.","['Positive', 'Love', 'Cool']"
hope,"I hope that in future Congresses there will reemerge a recognition that climate change is a reality, that our policies to meet our energy needs must also deal responsibly with environmental issues, including the damage caused by greenhouse gas emissions.","['Change', 'Future', 'Reality']"
hope,We never had a huge squad and we never had a great deal of choice. But in many ways that helps because you've got to make do with what you've got. You don't have too many problems about picking the team you just hope that everyone turns up on the day.,"['Great', 'Team', 'Choice']"
hope,"I am saying that in Wales here we have a very clear election commitment and I hope, and I will express this view, I hope that every individual member of the Labour Party, will understand that and will strive to achieve unity so that we can deliver the yes vote in the Autumn.","['Vote', 'Election', 'Commitment']"
hope,"Hope smiles from the threshold of the year to come, whispering, 'It will be happier.'","[""New Year's"", 'Year']"
hope,This suspense is terrible. I hope it will last.,"['Funny', 'Suspense', 'Last']"
hope,I hope the millions of people I've touched have the optimism and desire to share their goals and hard work and persevere with a positive attitude.,"['Attitude', 'Positive', 'Work']"
hope,"When I die, I hope to go to Heaven, whatever the Hell that is.","['Death', 'Hell', 'Heaven']"
hope,"We should not moor a ship with one anchor, or our life with one hope.","['Brainy', 'Life', 'Ship']"
hope,"I hope it is true that a man can die and yet not only live in others but give them life, and not only life, but that great consciousness of life.","['Death', 'Life', 'Great']"
hope,I do know this... I seem to reach a lot of previously unchurched people. So many people have told me they never went to church until they heard our message of hope that God is a good God who desires to bless those who are faithful and obedient to Him through Jesus Christ.,"['God', 'Good', 'Church']"
hope,"On every front there are clear answers out there that can make this country stronger, but we're going to break through the fear and the frustration people are feeling. Our job is to make sure that even as we make progress, that we are also giving people a sense of hope and vision for the future.","['Future', 'Fear', 'Progress']"
"faith,hope","I am fundamentally an optimist. Whether that comes from nature or nurture, I cannot say. Part of being optimistic is keeping one's head pointed toward the sun, one's feet moving forward. There were many dark moments when my faith in humanity was sorely tested, but I would not and could not give myself up to despair. That way lays defeat and death.","['faith', 'hope', 'optimism ']"
hope,"In motivating people, you've got to engage their minds and their hearts. I motivate people, I hope, by example - and perhaps by excitement, by having productive ideas to make others feel involved.","['Motivational', 'Ideas']"
hope,The only way I'd be caught without makeup is if my radio fell in the bathtub while I was taking a bath and electrocuted me and I was in between makeup at home. I hope my husband would slap a little lipstick on me before he took me to the morgue.,"['Home', 'Husband', 'Makeup']"
hope,"Wherever my story takes me, however dark and difficult the theme, there is always some hope and redemption, not because readers like happy endings, but because I am an optimist at heart. I know the sun will rise in the morning, that there is a light at the end of every tunnel.","['Morning', 'Happy', 'Light']"
"hope,religion",A baby is God's opinion that the world should go on.,"['children', 'hope', 'religion ']"
"hope,life,death",One lives in the hope of becoming a memory.,"['death', 'hope', 'immortality', 'life', 'memory', 'remembrance ']"
"hope,love","No matter how dark the moment, love and hope are always possible.","['Hope', 'Dark', 'Moment']"
hope,"Faith is not simply a patience that passively suffers until the storm is past. Rather, it is a spirit that bears things - with resignations, yes, but above all, with blazing, serene hope.","['Faith', 'Patience', 'Past']"
hope,"And I hope that five years and 10 years from now, I'll be a better man, a more mature man, a wiser man, a more humble man and a more spirited man to serve the good of my people and the good of humanity.","['Good', 'Humble', 'Humanity']"
"love,hope","If you can love someone with your whole heart, even one person, then there's salvation in life. Even if you can't get together with that person.","['hope', 'love ']"
hope,"Remember, Hope is a good thing, maybe the best of things, and no good thing ever dies.",['hope ']
hope,"If children have the ability to ignore all odds and percentages, then maybe we can all learn from them. When you think about it, what other choice is there but to hope? We have two options, medically and emotionally: give up, or Fight Like Hell.","['Fight', 'Choice', 'Learn']"
hope,We need never be hopeless because we can never be irreperably broken.,['hope ']
hope,I knew I was a winner back in the late sixties. I knew I was destined for great things. People will say that kind of thinking is totally immodest. I agree. Modesty is not a word that applies to me in any way - I hope it never will.,"['Great', 'Thinking', 'Winner']"
hope,"If you hope for happiness in the world, hope for it from God, and not from the world.","['Happiness', 'God']"
hope,I hope I am remembered by my children as a good father.,"['Dad', 'Good', 'Father']"
hope,"Like all parents, my husband and I just do the best we can, hold our breath and hope we've set aside enough money for our kid's therapy.","['Best', 'Money', 'Parents']"
hope,He is the best physician who is the most ingenious inspirer of hope.,"['Best', 'Physician', 'Ingenious']"
"hope,love",My great hope is to laugh as much as I cry; to get my work done and try to love somebody and have the courage to accept the love in return.,"['being-loved', 'courage', 'laugh', 'love', 'loving ']"
hope,"At twenty a man is full of fight and hope. He wants to reform the world. When he is seventy he still wants to reform the world, but he know he can't.","['Fight', 'Seventy', 'Reform']"
"arts,hope","You cannot live to please everyone else. You have to edify, educate and fulfill your own dreams and destiny, and hope that whatever your art is that you're putting out there, if it's received, great, I respect you for receiving it. If it's not received, great, I respect you for not.","['Hope', 'Respect', 'Dreams']"
"hope,life,love","It is my goal to love everyone. I hate no one. Regardless of their race, religion, their proclivities, the desire of their heart and how they want to live their life and the decisions that they make. I can even respect people's decisions and lifestyle choices just as I hope they have the courtesy to respect my decisions and my choices.","['Life', 'Hope', 'Respect']"
hope,This year I hope to introduce legislation that would require Power Administrations to list direct and indirect costs associated with ESA compliance as a line item on customer's power bills.,"['Power', 'Customer', 'Year']"
hope,"Democracy still has a real hope and chance in Iraq, and true freedom in this country would be the greatest testament to those who gave their lives for it.","['Freedom', 'Chance', 'Democracy']"
hope,"I can only hope the federal aid made available today will be sufficient in our recovery efforts, and pray that our citizens continue to be safe from the fallout of this dangerous natural disaster.","['Today', 'Dangerous', 'Pray']"
hope,"And God help Bruce Springsteen when they decide he's no longer God... They'll turn on him, and I hope he survives it.","['God', 'Help', 'Turn']"
hope,One thing I hope I'll never be is drunk with my own power. And anybody who says I am will never work in this town again.,"['Work', 'Power', 'Drunk']"
"inspiration,hope","For like a shaft, clear and cold, the thought pierced him that in the end the Shadow was only a small and passing thing: there was light and high beauty for ever beyond its reach.","['hope', 'inspirational ']"
hope,"America is an empire. I hope you know that now. All empires, by definition, are bumbling, shambolic, bullying, bureaucratic affairs, as certain of the rightness of their cause in infancy, as they are corrupted by power in their dotage.","['Power', 'Bullying', 'Empires']"
hope,We are all here to be a service to those who can't be a service to themselves. We can give people hope and more reasons for being human.,"['Service', 'Reasons', 'Themselves']"
hope,"It isn't as bad as you sometimes think it is. It all works out. Don't worry. I say that to myself every morning. It all works out in the end. Put your trust in God, and move forward with faith and confidence in the future. The Lord will not forsake us. He will not forsake us. If we will put our trust in Him, if we will pray to Him, if we will live worthy of His blessings, He will hear our prayers.","['adversity', 'hope', 'trust ']"
"hope,success","Urgent optimism is the desire to act immediately to tackle an obstacle, combined with the belief that we have a reasonable hope of success.","['Success', 'Optimism', 'Belief']"
hope,"The murder of Lumumba, in which the U.S. was involved, in the Congo destroyed Africa's major hope for development. Congo is now total horror story, for years.","['Africa', 'Horror', 'Involved']"
hope,"Conservatism is not about leaving people behind. Conservatism is about empowering people to catch up, to give them the tools at their disposable that make it possible for them to access all the hope, all the promise, all the opportunity that America offers. And our programs to help them should reflect that.","['Help', 'Leaving', 'Tools']"
hope,"We must accept finite disappointment, but never lose infinite hope.",['hope ']
hope,"When I consider life, it is all a cheat. Yet fooled with hope, people favor this deceit.","['Life', 'Cheat', 'Deceit']"
"hope,love","Love recognizes no barriers. It jumps hurdles, leaps fences, penetrates walls to arrive at its destination full of hope.",['love ']
hope,"In the central place of every heart, there is a recording chamber; so long as it receives messages of beauty, hope, cheer and courage, you are young.","['Beauty', 'Courage', 'Heart']"
"hope,success","I'm different, and I have to be a warrior to be that way. But I have had some success; I hope I have touched the lives of some wonderful people, all by being what I see as myself but some others people see as different.","['Success', 'Warrior', 'Others']"
"hope,love","No matter how dark the moment, love and hope are always possible.","['Love', 'Dark', 'Moment']"
hope,"I get nostalgic for British negativity. There is an inherent hope and positive drive to New Yorkers. When you go back to Britain, everybody is just running everything down. It's like whatever the opposite of a hug is.","['Positive', 'Negativity', 'Hug']"
"philosophy,hope",The first duty of a man is to think for himself,"['communism', 'democracy', 'freedom', 'history', 'hope', 'individualism', 'philosophy', 'politics', 'revolution', 'socialism ']"
"hope,success","A little more persistence, a little more effort, and what seemed hopeless failure may turn to glorious success.","['Hope', 'Failure', 'Effort']"
hope,The United Nations is our one great hope for a peaceful and free world.,"['Great', 'Free', 'Peaceful']"
hope,Fairy tales do not tell children the dragons exist. Children already know that dragons exist. Fairy tales tell children the dragons can be killed.,"['fairy-tales', 'hope', 'paraphrased', 'possiblity ']"
hope,"The less we deserve good fortune, the more we hope for it.","['Good', 'Deserve', 'Fortune']"
hope,My life is a perfect graveyard of buried hopes.,"['despair', 'hope ']"
hope,I never really thought of myself as depressed so much as paralyzed by hope.,"['Depressed', 'Paralyzed']"
hope,"Whenever you have an ex, and they're like, 'I hope we can still be friends!' and you weren't friends before you started dating, then what do you go back to, really?","['Dating', 'Whenever']"
hope,"Hope cannot be said to exist, nor can it be said not to exist. It is just like roads across the earth. For actually the earth had no roads to begin with, but when many men pass one way, a road is made.","['Men', 'Road', 'Earth']"
hope,Sometimes I only hope to make a good popcorn movie.,"['Good', 'Popcorn']"
hope,"I think if you show up and you work hard and you're straightforward, you can always create your own opportunities. I hope I'm right.","['Work', 'Create']"
hope,"I hope that Americans will give careful and well-informed thought to root causes and historical realities, in which case I think they will question why a supposedly 'legitimate' state such as Israel has had to conduct decades of war against a subject refugee population without ever achieving its goals.","['War', 'Goals', 'Achieving']"
hope,Testimony is an integral part of the Black religious tradition. It is the occasion where the believer stands before the community of faith in order to give account of the hope that is in him or her.,"['Faith', 'Community', 'Black']"
hope,"Let there be freedom for the Indians, wherever they may be in the American Continent or elsewhere in the world, because while they are alive, a glow of hope will be alive as well as a true concept of life.","['Life', 'Freedom', 'True']"
hope,"From too much love of living, From hope and fear set free, We thank with brief thanksgiving Whatever gods may be That no life lives for ever; That dead men rise up never; That even the weariest river Winds somewhere safe to sea.","['Thankful', 'Life', 'Love']"
hope,"I try to give people hope. Even though life is bleak, there's hope out there.","['Life', 'Bleak', 'Though']"
hope,"I hope that any expansion of London will learn from the planning examples of some of its most desirable areas such as Chelsea, Notting Hill, Belgravia and Mayfair. All are characterised by high density and a generosity of green spaces. They are all pedestrian-friendly with shops, entertainment, restaurants and pubs within easy walking distance.","['Planning', 'Walking', 'Learn']"
hope,Drugs are the enemies of ambition and hope - and when we fight against drugs we are fighting for the future.,"['Future', 'Against', 'Ambition']"
hope,I hope you love birds too. It is economical. It saves going to heaven.,"['Love', 'Heaven', 'Birds']"
hope,We need to keep hope alive and strive to do better.,"['Strive', 'Alive']"
"inspiration,hope","Since I was young, I have always known this: Life damages us, every one. We cant escape that damage. But now, I am also learning this: We can be mended. We mend each other","['hope', 'inspirational', 'pain ']"
hope,"From faith, hope, and love, the virtues of religion referring to God, there arises a double act which bears on the spiritual communion exercised between God and us; the hearing of the word and prayer.","['Love', 'Faith', 'God']"
hope,"I hope people half my age and twice my age will listen to my music - I want it to live forever and for my audience to feel like they have a friend in my music. Music is a spirit. It heals. It's an amazing thing to be loved and appreciated, and sometimes, music has not just been my best friend, it's been my only friend.","['Music', 'Best', 'Age']"
hope,"I've got a lot of dreams I want to achieve, and I hope someone can cheer me on as I'll cheer them on in their dreams.","['Dreams', 'Achieve', 'Cheer']"
"hope,life","We have always held to the hope, the belief, the conviction that there is a better life, a better world, beyond the horizon.","['Hope', 'Conviction', 'Belief']"
hope,"We're in an emergency situation. The United States has become an absolutely terrifying country, and I would hope that I could participate in some way in stopping the horror and the brutality.","['Situation', 'Emergency']"
hope,"I hope there's a tinge of disgrace about me. Hopefully, there's one good scandal left in me yet.","['Good', 'Left', 'Disgrace']"
"hope,life","Imagine all the people living life in peace. You may say I'm a dreamer, but I'm not the only one. I hope someday you'll join us, and the world will be as one.","['Peace', 'Hope', 'Dreamer']"
"life,love,happiness,hope,success","Keep your best wishes, close to your heart and watch what happens","['abundance', 'balance', 'better', 'book', 'change', 'empowerment', 'expression', 'freedom', 'fulfillment', 'fun', 'greater', 'happiness', 'health', 'help', 'hope', 'improvement', 'joy', 'life', 'love', 'meditation', 'money', 'more', 'peace', 'perfect', 'power', 'relaxation', 'self', 'self-expression', 'self-help-book', 'self-improvement-book', 'self-realization', 'success', 'wealth', 'your ']"
hope,"We live in a world of constant juxtaposition between joy that's possible and pain that's all too common. We hope for love and success and abundance, but we never quite forget that there is always lurking the possibility of disaster.","['Love', 'Success', 'Pain']"
hope,"I hope to make people realize how totally helpless animals are, how dependent on us, trusting as a child must that we will be kind and take care of their needs.","['Care', 'Animals', 'Child']"
hope,"All you have in comedy, in general, is just going with your instincts. You can only hope that other people think that what you think is funny is funny. I don't have an answer but I just try to plough straight ahead.","['Funny', 'Comedy', 'Ahead']"
"hope,life",You may not always have a comfortable life and you will not always be able to solve all of the world's problems at once but don't ever underestimate the importance you can have because history has shown us that courage can be contagious and hope can take on a life of its own.,"['Hope', 'Courage', 'History']"
hope,We need to move into a culture of peace. What I hope to promote is the idea that we all need each other and that the greatest happiness in life is not how much we have but how much we give. That's a wealth that's priceless. You can't buy compassion.,"['Life', 'Happiness', 'Peace']"
"death,hope","Books are finite, sexual encounters are finite, but the desire to read and to fuck is infinite; it surpasses our own deaths, our fears, our hopes for peace.","['death', 'fear', 'hope', 'peace', 'reading', 'sex ']"
hope,I do hope that our spring will be starting shortly and we will all be able to enjoy some sunshine again.,"['Spring', 'Sunshine', 'Enjoy']"
hope,I never make a movie for awards consideration. I will use the hope of getting an Academy Award a) to honor the people who work so hard and also b) it's the greatest Good Housekeeping seal in the world. It's the greatest brand. It's as good as Louis Vuitton and Dior in the world of moviemaking. It's the Super Bowl.,"['Work', 'Good', 'Honor']"
hope,"Hope is generally a wrong guide, though it is good company along the way.","['Good', 'Company', 'Wrong']"
hope,To be truly radical is to make hope possible rather than despair convincing.,"['Despair', 'Rather', 'Possible']"
"love,life,hope","We are all the pieces of what we remember. We hold in ourselves the hopes and fears of those who love us. As long as there is love and memory, there is no true loss.","['clary-fray', 'fear', 'hope', 'jem-carstairs', 'life', 'loss', 'love', 'memory', 'shadowhunters', 'the-infernal-devices ']"
"hope,inspiration",Hope is but the dream of those who wake.,"['Hope', 'Dream', 'Wake']"
