0,1,2
hope,"There is no reason why challenging themes and engaging stories have to be mutually exclusive - in fact, each can fuel the other. As a filmmaker, I want to entertain people first and foremost. If out of that comes a greater awareness and understanding of a time or a circumstance, then the hope is that change can happen.","['Change', 'Time', 'Reason']"
hope,"To me, one of the best faces America has ever projected is the face of a Peace Corps volunteer. That face symbolizes this country: young, curious, brimming with idealism and hope - and a real, honest compassion.","['Best', 'Peace', 'Compassion']"
"hope,success","If you wish to succeed in life, make perseverance your bosom friend, experience your wise counselor, caution your elder brother, and hope your guardian genius.","['Life', 'Hope', 'Experience']"
"hope,love","Woe to the man whose heart has not learned while young to hope, to love - and to put its trust in life.","['Love', 'Life', 'Trust']"
"hope,humor",Yesterday I was a dog. Today I'm a dog. Tomorrow I'll probably still be a dog. Sigh! There's so little hope for advancement.,"['Today', 'Dog', 'Tomorrow']"
hope,The secret is not to give up hope. It's very hard not to because if you're really doing something worthwhile I think you will be pushed to the brink of hopelessness before you come through the other side.,"['Secret', 'Worthwhile', 'Brink']"
hope,"The essence of optimism is that it takes no account of the present, but it is a source of inspiration, of vitality and hope where others have resigned; it enables a man to hold his head high, to claim the future for himself and not to abandon it to his enemy.","['Future', 'Optimism', 'Enemy']"
hope,"People don't believe or understand that a community can lose hope. You can have a whole community where hopelessness is the norm, where folks don't have faith that things will get better because history and circumstances have proven over 30, 40, or 50 years that things don't get better.","['Faith', 'History', 'Community']"
hope,"I totally disagree with the view that the Tibet struggle will die, and there will be no hope for Tibet, after the Dalai Lama passes away.","['Struggle', 'View', 'Disagree']"
hope,"If a man like Malcolm X could change and repudiate racism, if I myself and other former Muslims can change, if young whites can change, then there is hope for America.","['Change', 'Racism', 'Muslims']"
hope,"Hope is necessary in every condition. The miseries of poverty, sickness and captivity would, without this comfort, be insupportable.","['Poverty', 'Sickness', 'Comfort']"
"hope,life",Maybe all one can do is hope to end up with the right regrets.,"['Hope', 'Regrets', 'Maybe']"
hope,"I hope that I inspire women to believe in themselves, no matter where they come from; no matter what education they have; what particular background they originate from.","['Education', 'Women', 'Inspire']"
hope,"It's true that General Musharraf opposes my return, seeing me as a symbol of democracy in the country. He is comfortable with dictatorship. I hope better sense prevails.","['Democracy', 'True', 'Seeing']"
hope,"The sparrow that is twittering on the edge of my balcony is calling up to me this moment a world of memories that reach over half my lifetime, and a world of hope that stretches farther than any flight of sparrows.","['Memories', 'Moment', 'Edge']"
hope,"God gives me hope that there is something greater than us, something better and bigger than the here and now, that can help us live.","['God', 'Help', 'Bigger']"
hope,Hope and Change has become Divide and Conquer.,"['Change', 'Conquer', 'Divide']"
hope,"There is a part of me that still wants to go out and grab a backpack and unplug - not take a cellphone or even a camera and just get out there and experience the world and travel. I have yet to do that, but someday I hope.","['Travel', 'Experience', 'Camera']"
hope,"I think you grow wherever God plants you. I hope I'm growing as a person of faith, as a Christian. That should be our number one objective this journey of life. That all starts with a personal intimate relationship with Christ and then being in prayer every single day about all of those things - being tenacious about it.","['Life', 'Faith', 'God']"
hope,The great hope of society is in individual character.,"['Great', 'Society', 'Character']"
hope,"I hope that by modeling feminism in my own life, work and relationships that it will haut become an organic part of my daughter's life. But I'm also fully prepared for her to become a Republican as a way to rebel as a teenager - that would be just my luck!","['Life', 'Work', 'Daughter']"
hope,"I hope that I'm always struggling, really. You develop when you're struggling. When you're struggling, you get stronger.","['Stronger', 'Struggling']"
hope,I do feel strongly that string theory is our best hope for making progress at unifying gravity and quantum mechanics.,"['Best', 'Progress', 'Gravity']"
hope,"Religion kept some of my relatives alive, because it was all they had. If they hadn't had some hope of heaven, some companionship in Jesus, they probably would have committed suicide, their lives were so hellish.","['Religion', 'Suicide', 'Heaven']"
hope,"Together we will build an America where hope is a new job with a paycheck, not a faded word on an old bumper sticker.","['Together', 'Build', 'Word']"
hope,"Like all of us in this storm between birth and death, I can wreak no great changes on the world, only small changes for the better, I hope, in the lives of those I love.","['Love', 'Death', 'Great']"
hope,We must not lose hope. Hope is an anchor to the souls of men. Satan would have us cast away that anchor.,"['Men', 'Satan', 'Anchor']"
hope,"We need international support so that our people live a life of normality, of dignity, of liberty and freedom. I hope that our cry for freedom may be heard.","['Life', 'Freedom', 'Support']"
"hope,inspiration,life,love",Your ordinary acts of love and hope point to the extraordinary promise that every human life is of inestimable value.,"['Inspirational', 'Love', 'Hope']"
hope,"A lot of presidential memoirs, they say, are dull and self-serving. I hope mine is interesting and self-serving.","['Mine', 'Dull', 'Memoirs']"
hope,Without hope we are lost.,['Lost']
"arts,hope","What thoughts are to the individual, art is to the community as a whole. That's where you reflect on who you are, who you hope to be, what you've gone through, and where you hope to go.","['Art', 'Community', 'Thoughts']"
hope,"I hope somebody falls in love with me - other than my fiancee. But that's what you want. As a player you want a team that really wants you; head coach, GM, owner, everybody that really wants you in their place and the players believe in you. I'm looking forward to making somebody fall in love with me.","['Love', 'Team', 'Forward']"
hope,"Even in the hardest circumstances, dreams can give you the courage to live, and I hope I can share that message with children in need.","['Courage', 'Dreams', 'Message']"
hope,"Friends from the press, China needs to learn more about the world, and the world also needs to learn more about China. I hope you will continue to make more efforts and contributions to deepening the mutual understanding between China and the countries of the world.","['Learn', 'China', 'Press']"
hope,"Hope lies in having more faith in the power of God to heal us than in the power of anything to hurt or destroy us. In realizing that as children of God we are bigger than our problems, we have the power at last to confront them.","['Faith', 'God', 'Power']"
hope,"I'm going to sit back, light up, and hope I don't chew the cigarette to pieces.","['Light', 'Cigarette', 'Chew']"
"love,hope,inspiration","When we love, we always strive to become better than we are. When we strive to become better than we are, everything around us becomes better too.","['hope', 'inspiration', 'love', 'santiago ']"
hope,"Our hope in life beyond death is a hope made possible, not by some general sentimental belief in life after death, but by our participation in the life of Christ.","['Life', 'Death', 'Belief']"
hope,"Hope, the best comfort of our imperfect condition.","['Best', 'Comfort', 'Imperfect']"
hope,"My hope is that we continue to nurture the places that we love, but that we also look outside our immediate worlds.","['Love', 'Nurture', 'Outside']"
hope,"Why do people play the lottery, or why do people gamble, period? You know, it's with the hope of winning something more.","['Winning', 'Lottery', 'Gamble']"
hope,"Over the years, I had nurtured the hope to be able to fly; to handle a machine as it rose higher and higher in the stratosphere was my dearest dream.","['Rose', 'Dream', 'Fly']"
hope,"Man's only true happiness is to live in hope of something to be won by him. Reverence something to be worshipped by him, and love something to be cherished by him, forever.","['Love', 'Happiness', 'True']"
hope,Few people know so clearly what they want. Most people can't even think what to hope for when they throw a penny in a fountain.,"['Penny', 'Fountain', 'Throw']"
hope,Fear cannot be without hope nor hope without fear.,"['Wisdom', 'Fear', 'Cannot']"
hope,I sincerely hope I can contribute to the progress there has been in relations between Jews and Catholics since the Second Vatican Council in a spirit of renewed collaboration.,"['Progress', 'Spirit', 'Catholics']"
hope,"Of the big horror movies of the '70s, you have 'The Omen,' 'The Sentinel,' 'Rosemary's Baby,' 'The Stepford Wives,' 'Burnt Offerings' - these are all romantic fatalist movies where there's a sort of glimmer of hope... but darkness wins.","['Romantic', 'Movies', 'Baby']"
hope,"I really feel like life will dictate itself. You should allow it to unfold as naturally as possible. Just go with the flow. When you're really desperate, you say a few prayers and hope for the best. That's the way I've always lived my life.","['Life', 'Best', 'Flow']"
hope,All parents hope and pray that their children will make wise decisions. Children who are obedient and responsible bring to their parents unending pride and satisfaction.,"['Wise', 'Parents', 'Pride']"
hope,"I had to stop going to auditions thinking, 'Oh, I hope they like me.' I had to go in thinking I was the answer to their problem.","['Thinking', 'Problem', 'Stop']"
hope,I hope all you young girls see yourself up there... we were just like you.,['Girl']
hope,"When you put something out there into the world, there's all these words you don't want to hear, that you hope people don't say. I don't like anything that starts with 're' - like retro, reinvent, recreate - I hate that. It's always like living in the past - copying, emulating.","['Past', 'Words', 'Hate']"
hope,"I hope people remember me as a guy who brought magic to the people. You know, pushed the boundaries of wonder.","['Remember', 'Magic', 'Boundaries']"
hope,"I get asked to read new works a lot, in the hope that I will give a quotation and I will only give a 'puff' for a book I truly love.","['Love', 'Book', 'Quotation']"
"hope,life","When we have lost everything, including hope, life becomes a disgrace, and death a duty.","['Life', 'Death', 'Lost']"
hope,It's a good place when all you have is hope and not expectations.,['Good']
hope,Do not spoil what you have by desiring what you have not; remember that what you now have was once among the things you only hoped for.,"['Remember', 'Spoil', 'Among']"
hope,"I like the night. Without the dark, we'd never see the stars.","['bella-swan', 'dreams', 'edward', 'hope', 'night', 'stars ']"
"hope,life,death",One lives in the hope of becoming a memory.,"['Memory', 'Becoming']"
hope,"There is hope in dreams, imagination, and in the courage of those who wish to make those dreams a reality.","['Courage', 'Dreams', 'Reality']"
hope,The capacity for hope is the most significant fact of life. It provides human beings with a sense of destination and the energy to get started.,"['Life', 'Energy', 'Fact']"
hope,Extreme hopes are born from extreme misery.,"['Born', 'Misery', 'Hopes']"
hope,A whole stack of memories never equal one little hope.,"['Memories', 'Equal', 'Stack']"
"wisdom,hope,knowledge,inspiration","Hold fast to dreams,For if dreams dieLife is a broken-winged bird,That cannot fly.","['dreams', 'hope', 'inspiration', 'knowledge', 'wisdom ']"
hope,He that lives upon hope will die fasting.,"['Die', 'Fasting', 'Lives']"
"hope,life","When we meet real tragedy in life, we can react in two ways - either by losing hope and falling into self-destructive habits, or by using the challenge to find our inner strength. Thanks to the teachings of Buddha, I have been able to take this second way.","['Strength', 'Hope', 'Challenge']"
hope,The sudden disappointment of a hope leaves a scar which the ultimate fulfillment of that hope never entirely removes.,"['Ultimate', 'Scar', 'Sudden']"
hope,I always entertain great hopes.,"['Great', 'Hopes', 'Entertain']"
hope,Hope is like peace. It is not a gift from God. It is a gift only we can give one another.,"['God', 'Peace', 'Gift']"
hope,"With optimism, you look upon the sunny side of things. People say, 'Studs, you're an optimist.' I never said I was an optimist. I have hope because what's the alternative to hope? Despair? If you have despair, you might as well put your head in the oven.","['Optimism', 'Head', 'Sunny']"
hope,"You all know that I have been sustained throughout my life by three saving graces - my family, my friends, and a faith in the power of resilience and hope. These graces have carried me through difficult times and they have brought more joy to the good times than I ever could have imagined.","['Life', 'Family', 'Faith']"
hope,But Hopes are Shy Birds flying at a great distance seldom reached by the best of Guns.,"['Best', 'Great', 'Guns']"
hope,Lord save us all from old age and broken health and a hope tree that has lost the faculty of putting out blossoms.,"['Health', 'Age', 'Tree']"
hope,God grant me the courage not to give up what I think is right even though I think it is hopeless.,"['Courage', 'God', 'Hopeless']"
hope,"All kids need is a little help, a little hope and somebody who believes in them.","['Help', 'Believes', 'Somebody']"
hope,"The theological virtue of hope is the patient and trustful willingness to live without closure, without resolution, and still be content and even happy because our Satisfaction is now at another level, and our Source is beyond ourselves.","['Happy', 'Virtue', 'Beyond']"
hope,Tomorrow hopes we have learned something from yesterday.,"['Tomorrow', 'Yesterday', 'Learned']"
"inspiration,hope",I believe that imagination is stronger than knowledge. That myth is more potent than history. That dreams are more powerful than facts. That hope always triumphs over experience. That laughter is the only cure for grief. And I believe that love is stronger than death.,"['hope', 'imagination', 'inspirational ']"
hope,Hope is a waking dream.,"['Dream', 'Waking']"
hope,"In the end, that's what this election is about. Do we participate in a politics of cynicism or a politics of hope?","['Politics', 'Election', 'Cynicism']"
hope,"There is no medicine like hope, no incentive so great, and no tonic so powerful as expectation of something tomorrow.","['Great', 'Tomorrow', 'Medicine']"
hope,"Be prepared, work hard, and hope for a little luck. Recognize that the harder you work and the better prepared you are, the more luck you might have.","['Work', 'Luck', 'Prepared']"
hope,Hopeful thinking can get you out of your fear zone and into your appreciation zone.,"['Fear', 'Thinking', 'Hopeful']"
hope,"There can be hope only for a society which acts as one big family, not as many separate ones.","['Family', 'Society', 'Separate']"
hope,"One loves to possess arms, though they hope never to have occasion for them.","['Loves', 'Occasion', 'Arms']"
hope,"On the first day of school, you got to be real careful where you sit. You walk into the classroom and just plunk your stuff down on any old desk, and the next thing you know the teacher is saying, 'I hope you all like where you're sitting, because these are your permanent seats.'","['Teacher', 'Walk', 'Classroom']"
"arts,hope","Feelings aroused by the touch of someone's hand, the sound of music, the smell of a flower, a beautiful sunset, a work of art, love, laughter, hope and faith - all work on both the unconscious and the conscious aspects of the self, and they have physiological consequences as well.","['Love', 'Work', 'Music']"
hope,Behaving morally because of a hope of reward or a fear of punishment is not morality. Morality is not bribery or threats. Religion is bribery and threats. Humans have morality. We don't need religion.,"['Fear', 'Religion', 'Punishment']"
hope,The youth is the hope of our future.,"['Future', 'Youth']"
hope,"Any people anywhere, being inclined and having the power, have the right to rise up, and shake off the existing government, and form a new one that suits them better. This is a most valuable - a most sacred right - a right, which we hope and believe, is to liberate the world.","['Freedom', 'Power', 'Government']"
"hope,love","We must restore hope to young people, help the old, be open to the future, spread love. Be poor among the poor. We need to include the excluded and preach peace.","['Love', 'Future', 'Peace']"
"hope,inspiration,life,love",Your ordinary acts of love and hope point to the extraordinary promise that every human life is of inestimable value.,"['Inspirational', 'Life', 'Love']"
hope,"I hope we shall crush in its birth the aristocracy of our monied corporations which dare already to challenge our government to a trial by strength, and bid defiance to the laws of our country.","['Business', 'Strength']"
hope,Most of the important things in the world have been accomplished by people who have kept on trying when there seemed to be no hope at all.,"['Business', 'Seemed', 'Kept']"
"hope,love",Courage is like love; it must have hope for nourishment.,"['Hope', 'Courage']"
hope,What greater aspiration and challenge are there for a mother than the hope of raising a great son or daughter?,"['Mom', 'Great', 'Daughter']"
hope,I only hope that we don't lose sight of one thing - that it was all started by a mouse.,"['Imagination', 'Sight']"
hope,The human body experiences a powerful gravitational pull in the direction of hope. That is why the patient's hopes are the physician's secret weapon. They are the hidden ingredients in any prescription.,"['Medical', 'Powerful', 'Direction']"
hope,We all hope for breakthrough rebirth moments.,"['Moments', 'Rebirth']"
hope,"If the skies fall, one may hope to catch larks.","['Fall', 'Catch', 'Skies']"
hope,"Hope, like faith, is nothing if it is not courageous; it is nothing if it is not ridiculous.","['Courage', 'Faith', 'Courageous']"
hope,"It's really a wonder that I haven't dropped all my ideals, because they seem so absurd and impossible to carry out. Yet I keep them, because in spite of everything, I still believe that people are really good at heart.","['hope', 'human-nature ']"
hope,"Hope, deceiving as it is, serves at least to lead us to the end of our lives by an agreeable route.","['Lead', 'Deceiving', 'Route']"
hope,"Hope is itself a species of happiness, and, perhaps, the chief happiness, which this world affords.","['Happiness', 'Species', 'Chief']"
hope,"We hope that through these trade arrangements, through collaboration in training, in manpower development, and what have you, ASEAN in, say, ten years' time, will be a very different ASEAN.","['Time', 'Training', 'Trade']"
hope,"I have had extremely good relations with the United States and with both parties (Republicans and Democrats), and I hope to continue to have these good relations, which I, again repeating, do not consider to be mutually exclusive with having good relations with Venezuela or Ecuador or whichever country in South America.","['Good', 'Again', 'Consider']"
hope,"I certainly notice the vitality in Belfast, which wasn't there in the Seventies. There was a war going on then. Now there are cranes everywhere. There really is a sense of renewal and hope.","['War', 'Seventies', 'Notice']"
hope,"I'd be happy to live till 80 as long as I was comfortable and in good health. Mind you, ask me again on the eve of my 80th birthday. Even so, I hope we don't all start living to be 120. I'm not sure I'd cope with another 60 years.","['Birthday', 'Health', 'Good']"
hope,The planet's hope and salvation lies in the adoption of revolutionary new knowledge being revealed at the frontiers of science.,"['Knowledge', 'Science', 'Planet']"
"hope,inspiration","I hope that at the end of the seven years, people will say that I have been of some inspirational value to them at home in terms of inclusiveness and abroad, I look forward to representing Ireland.","['Home', 'Forward', 'Value']"
"hope,love","We must restore hope to young people, help the old, be open to the future, spread love. Be poor among the poor. We need to include the excluded and preach peace.","['Hope', 'Future', 'Peace']"
hope,"Candidate Obama was either exceptionally naive or willfully disingenuous when he vowed to change the way Washington works. The very promise of Hope and Change was rooted in uprooting the Washington modus operandi. But instead of rejecting it, he embraced it all - the secrecy, the closed doors, the political favors, the near-criminal negligence.","['Change', 'Political', 'Doors']"
hope,"When it comes down to it, it's giving people a good night out in a basic way and I think my company guarantees that. There's always something new and something to excite us and surprise us, and that's why people come back, I hope.","['Good', 'Giving', 'Night']"
"hope,inspiration,life,love",Your ordinary acts of love and hope point to the extraordinary promise that every human life is of inestimable value.,"['Inspirational', 'Life', 'Hope']"
"hope,love",The only way of knowing a person is to love them without hope.,"['Love', 'Knowing']"
hope,"When a man becomes a Christian, he becomes industrious, trustworthy and prosperous. Now, if that man, when he gets all he can and saves all he can, does not give all he can, I have more hope for Judas Iscariot than for that man!","['Christian', 'Gets', 'Prosperous']"
hope,"So many people grew up with challenges, as I did. There weren't always happy things happening to me or around me. But when you look at the core of goodness within yourself - at the optimism and hope - you realize it comes from the environment you grew up in.","['Happy', 'Optimism', 'Challenges']"
hope,"I do protect human rights, and I hope I shall always be looked up as a champion of human rights.","['Champion', 'Rights', 'Protect']"
hope,"That's all a man can hope for during his lifetime - to set an example - and when he is dead, to be an inspiration for history.","['History', 'Dead', 'Lifetime']"
hope,"You accept that this civilisation could be abolished and life will begin later on after a few thousand years because that is something that has happened in the history of this planet. When you have peace in yourself and accept, then you are calm enough to do something, but if you are carried by despair there is no hope.","['Life', 'History', 'Peace']"
hope,"Art is the most beautiful deception of all. And although people try to incorporate the everyday events of life in it, we must hope that it will remain a deception lest it become a utilitarian thing, sad as a factory.","['Life', 'Art', 'Sad']"
hope,"To withdraw is not to run away, and to stay is no wise action, when there's more reason to fear than to hope.","['Fear', 'Wise', 'Action']"
hope,"God's way of answering the Christian's prayer for more patience, experience, hope and love often is to put him into the furnace of affliction.","['Patience', 'Love', 'God']"
hope,I hope I never get so old I get religious.,"['Religion', 'Religious']"
hope,"Between the fear that something would happen and the hope that still it wouldn't, there is much more space than one thinks. On that narrow, hard, bare and dark space a lot of us spend their lives.","['Fear', 'Dark', 'Space']"
hope,"When we create hope and opportunity in the lives of others, we allow love, decency and promise to triumph over cowardice and hate.","['Love', 'Hate', 'Create']"
hope,"When Nelson Mandela walked free, the world sang with joy. Ever since, South Africa has stood as a beacon of hope for Africa.","['Joy', 'Free', 'Africa']"
hope,"Corporations, consumers, and citizens must begin acting in concert to create a powerful third pillar of social transformation if we hope to meet the social challenges we currently face with equal force. This begins with corporations that choose to alter how they practice capitalism in two ways to serve the greater good.","['Good', 'Challenges', 'Practice']"
hope,"In acting, there's a type of courage you're recognized for all the time. You lose 100 pounds and play a guy with AIDS, and you get rewarded. But, in life, doing what is courageous is quiet, and no one knows about it. Courage is someone making sacrifices for their family or making selfless decisions for what they hope or feel.","['Life', 'Family', 'Time']"
hope,"I hope people remember me for the kind of person that I am, not because of what I do.",['Remember']
hope,As I hope it doesn't come to the point where I need to take a day off. I feel pretty good right now and I'm not resting or saving for any other game.,"['Good', 'Game', 'Point']"
hope,"If there's a golf course in heaven, I hope it's like Augusta National. I just don't want an early tee time.","['Time', 'Golf', 'Heaven']"
"hope,life","When I stand before God at the end of my life, I would hope that I would not have a single bit of talent left, and could say, 'I used everything you gave me'.","['Hope', 'God', 'Talent']"
