0,1,2
hope,"I have no word of yours to assure me that our brief friendship held for you the same significance it held for me, but I must go on believing so. Every hope of the future is meaningless unless I have faith that you and I will share it together.","['connaturality', 'future', 'hope', 'letter', 'love', 'together ']"
"hope,faith,success","Hope and faith goes hand-in-hand, because without hope there is no faith. The same goes with want and needs, without any wants, there no need to have a need","['believe-in-yourself', 'faith', 'hope', 'needs', 'success', 'wants ']"
hope,"When Im feeling down, I make myself a big bowl of Up Soup. The bowl only looks empty, but in reality its full of hope. Grab a spoon, theres plenty for both of us.","['abundance', 'bowl', 'depressed', 'depression', 'eat', 'empty', 'feeling-down', 'food', 'hope', 'plenty', 'share', 'sharing', 'spoon', 'up-soup ']"
hope,The cruelest thing you can do to a person who's living in panic is to offer him or her hope that turns out false. When the crash comes its intolerable.,"['hope', 'hurt', 'pain', 'panic ']"
hope,"He will not succeed in this,""Taran said. ""Somehow, we must find a way to escape. We dare not lose hope.""""I agree absolutely,""Fflewddur answered. ""Your general idea is excellent; it's only the details that are lacking...","['1965', 'hope ']"
hope,To travel hopefully is better than to have arrived.,"['hope', 'travel ']"
hope,May be its mine bad-luck Or yours not to get me But I still have hope Of being yours,"['bad-luck', 'fail', 'failure', 'hope', 'love', 'lovers', 'pain', 'poem', 'poetry', 'sad', 'sadness', 'truth', 'unlucky ']"
hope,"All beautiful distractions, ignites from you.","['art', 'friendship-and-love', 'hope', 'love', 'lovers', 'poetry-love', 'poetry-quotes', 'romance ']"
hope,"I know now, just quite howMy life and love might still go onIn your heart, in your mindI'll stay with you for all of time.","['hope', 'loss', 'unconditional-love ']"
"hope,faith","Ive learned that no matter how inspired, fired up and motivated you might be, the dark clouds will always set in","['faith', 'hope', 'inspirational', 'motivational ']"
hope,With the need for the self in the time of another / I left my seaport grim and dear / knowing good work could be made / in the state governed by both Hope and Despair.,"['aloneness', 'choices', 'decisions', 'despair', 'hope', 'hope-and-despair', 'life', 'poem', 'poems', 'poetry', 'seaport', 'travel', 'work ']"
"hope,relationship,poetry,quotes,writing","With all honesty, somewhere between the hello and the dreams I saw you in I fell in love.","['happyquotes', 'hope', 'inspirational', 'inspirationalquotes', 'inspired', 'instadaily', 'instaquote', 'lovequotes', 'pinquotes', 'poems', 'poetry', 'quote', 'quoteoftheday', 'quotes', 'relationships', 'rmdrake', 'sadquotes', 'sayings', 'spokenword', 'tattoo', 'typewriter', 'vsco', 'writer', 'writing ']"
"hope,relationship,poetry,quotes,writing","She wasn't broken. She was just bent, over the chance of being ignored by the one she loved.","['happyquotes', 'hope', 'inspirational', 'inspirationalquotes', 'inspired', 'instadaily', 'instaquote', 'lovequotes', 'pinquotes', 'poems', 'poetry', 'quote', 'quoteoftheday', 'quotes', 'relationships', 'rmdrake', 'sadquotes', 'sayings', 'spokenword', 'tattoo', 'typewriter', 'vsco', 'writer', 'writing ']"
hope,"I am hopeful, though not full of hope, and the only reason I don't believe in happy endings is because I don't believe in endings.","['happy-endings', 'hope ']"
hope,Being generous or doing things for others actually makes me feel good so I don't do it because I hope karma will come round and get me and I'll benefit from it.,"['Good', 'Karma', 'Others']"
"philosophy,hope,faith","...you're either gonna spend your life fucking pussy, or taking it to church.","['alcoholism', 'ambition', 'autumn', 'bible', 'blood', 'booze', 'bottle', 'bravery', 'cocaine', 'cock', 'coke', 'comedy', 'crack', 'cynical', 'daydreaming', 'death', 'deep-end', 'denial', 'destiny', 'destruction', 'drama', 'dreams', 'drugs', 'drunk', 'ecstasy', 'erotic', 'erotica', 'escape', 'faith', 'fall', 'famous', 'fear', 'future', 'growing-up', 'guns', 'half-empty', 'half-full', 'heroin', 'history', 'hope', 'humor', 'infamous', 'innocence', 'intuition', 'life', 'living', 'loss', 'love', 'lust', 'money', 'moon', 'morning', 'music', 'narration', 'narrator', 'neglect', 'night', 'nightmares', 'parallelism', 'party', 'people', 'pesticide', 'philosophy', 'phoenix', 'plans', 'point-of-view', 'rape', 'rebirth', 'reincarnation', 'responsibility', 'rock-star', 'romance', 'sad', 'sex', 'shallow', 'sister', 'sleep', 'slut', 'small', 'smart', 'suicide', 'sunrise', 'tragedy', 'trains', 'truth', 'weed', 'whiskey', 'whistles', 'whore ']"
hope,"I think how hope may be the thing that pulls you forward, may be the thing that keeps you going, but that it's dangerous, too, that it's painful and risky, that it's making a dare to the world and when has the world ever let us win a dare?",['hope ']
hope,"Tomorrow, you promise yourself, things will be different, yet, tomorrow is too often a repetition of today. And you disappoint yourself again and again.","['change', 'dissapointment', 'hope', 'tomorrow ']"
"hope,faith",Hope is faith holding out its hand in the dark.,"['faith', 'hope ']"
hope,And I sometimes think that a moment of touching is the difference between complete utter despair and the ability to carry on.,"['hope', 'touching ']"
hope,Children are the world's most valuable resource and its best hope for the future.,"['children', 'future', 'hope ']"
hope,I hope suffering don't exist.,"['hope', 'suffering ']"
hope,I have found there to be little distance between the unlatching of a chain and the spreading of a womans legs. As if they can never unbar only a single entrance. Its a disease called hope. Women suffer from it greatly.,"['hope', 'sex ']"
hope,"A person, who no matter how desperate the situation, gives others hope, is a true leader.","['Leader', 'True', 'Situation']"
hope,I'm beginning to think that to hope isn't the same as to expect something. To hope is to believe that life is an acceptable chaos.,"['chaos', 'expect', 'hope', 'life ']"
hope,"Even in darkness it is possible to create light and encourage compassion. That it is possible to feel free inside a prison. That even in exile, friendship exists and can become an anchor. That one instant before dying, man is still immortal.","['hope', 'humanity ']"
"hope,faith",This worlds anguish is no different from the love we insist on holding back.,"['afghanistan-war', 'agape-love', 'anguish', 'casualties-of-war', 'child-victims-of-war', 'children-killed-in-war', 'conflict-resolution', 'faith', 'fear', 'grief', 'hope', 'love', 'nonviolent-conflict-resolution', 'pain', 'peace', 'peace-movement', 'peacemaking', 'russia-and-ukraine-conflict', 'spiritual-love', 'syrian-civil-war', 'tragedy', 'unconditional-love', 'violence', 'war ']"
hope,Farming is a profession of hope,"['farming', 'hope ']"
"hope,inspiration,soul",Everything hurts right now and nothing is helping because as the pain is getting worse  so is the love.,"['anxiety', 'art', 'beach', 'born-ready', 'cape-cod', 'coming-of-age', 'constellations', 'depression', 'destiny', 'fate', 'friends', 'girls', 'growing', 'growing-up', 'healing', 'hope', 'hurt', 'inspiration', 'jennifer-elisabeth', 'learning', 'life', 'love', 'lovers', 'ocean', 'pain', 'pray', 'prayer', 'red-thread', 'red-thread-of-destiny', 'red-thread-of-fate', 'self-acceptance', 'self-love', 'self-reflection', 'soul', 'soul-mates', 'stars', 'teenagers', 'teens', 'time', 'universe', 'wish ']"
"hope,inspiration,soul",Does our purpose on Earth directly link to the people whom we end up meeting? Are our relationships and experiences actually the required dots that connect and then lead us to our ultimate destinies?,"['anxiety', 'art', 'beach', 'born-ready', 'cape-cod', 'coming-of-age', 'constellations', 'depression', 'destiny', 'fate', 'friends', 'girls', 'growing', 'growing-up', 'healing', 'hope', 'inspiration', 'jennifer-elisabeth', 'learning', 'life', 'love', 'lovers', 'ocean', 'pray', 'prayer', 'red-thread', 'red-thread-of-destiny', 'red-thread-of-fate', 'self-acceptance', 'self-love', 'self-reflection', 'soul', 'soul-mates', 'stars', 'teenagers', 'teens', 'time', 'universe', 'wish ']"
"hope,relationship,quotes","Maybe what this is. What we have, is something that will save us from ourselves.","['happyquotes', 'hope', 'inspirational', 'inspirationalquotes', 'inspired', 'instadaily', 'instaquote', 'lovequotes', 'pinquotes', 'poems', 'poetry', 'quote', 'quoteoftheday', 'quotes', 'relationships', 'rmdrake', 'sadquotes', 'sayings', 'spokenword', 'tattoo', 'typewriter', 'vsco', 'writer', 'writing ']"
hope,"And hope is like love...a ridiculous, wonderful, powerful thing.","['hope', 'love ']"
hope,"The door', replied Maimie, 'will always, always be open, and mother will always be waiting at it for me.","['desperate', 'door', 'hope', 'j-m-barrie', 'kensington-gardens', 'maimie', 'open', 'peter-pan', 'trust ']"
"hope,death","Now hollow fires burn out to black,And lights are fluttering low:Square your shoulders, lift your packAnd leave your friends and go.O never fear, lads, naughts to dread,Look not left nor right: In all the endless road you treadTheres nothing but the night.","['death', 'dread', 'fear', 'future', 'hope', 'inspirational ']"
"hope,inspiration,soul",I fantasize the night sky to be like a cosmic blue print of my life as I close my eyes and unbutton my heart. just in case anyone up there is listening.,"['anxiety', 'art', 'beach', 'born-ready', 'cape-cod', 'coming-of-age', 'constellations', 'depression', 'destiny', 'fate', 'friends', 'girls', 'growing', 'growing-up', 'healing', 'hope', 'inspiration', 'jennifer-elisabeth', 'learning', 'life', 'love', 'lovers', 'ocean', 'pray', 'prayer', 'red-thread', 'red-thread-of-destiny', 'red-thread-of-fate', 'self-acceptance', 'self-love', 'self-reflection', 'soul', 'soul-mates', 'stars', 'teenagers', 'teens', 'time', 'universe', 'wish ']"
hope,"Mother can beat me all she wants, but I havent let her take away my will to somehow survive.","['abuse', 'hope', 'survival ']"
hope,"hope could betray youbut if you had no hope, life could actuallysurprise you in the best of ways.",['hope ']
hope,Your hope is the most beautiful and the saddest in the world.,"['hope', 'hopelessness ']"
hope,***A KEY WORD*** Imagined,"['hope', 'imagine ']"
hope,"Even on the poorest streets people could be heard laughing. Some of these streets were completely dark, like black holes, and the laughter that came from who knows where was the only sign, the only beacon that kept residents and strangers from getting lost.","['633', 'hope', 'night ']"
"inspiration,hope",Great hopes make great men.,"['Great', 'Men', 'Hopes']"
hope,You can be diagnosed and treated early. And there is hope for the future.,"['Future', 'Early', 'Treated']"
"philosophy,happiness,hope,knowledge,education",The moon is the reflection of your heart and moonlight is the twinkle of your love.,"['education', 'happiness', 'heart', 'hope', 'inspirational', 'intelligence', 'knowledge', 'life', 'love', 'moon', 'moonlight', 'philosophy', 'reflection', 'truth', 'twinkle', 'wisdom ']"
"hope,quotes",A King and Queen cannot support a crown with eyes looking down. Their universe expands as far as you can see.,"['crown', 'destiny', 'eyes', 'future', 'hope', 'king', 'queen', 'quotes', 'support', 'universe ']"
hope,"Man must use what he has, not hope for what is not.",['hope ']
hope,"This is what it means to live on. When granted hope, a person uses it as fuel, as a guidepost to life. It is impossible to live without hope.","['hope', 'life ']"
hope,"For a flicker of a moment I imagined a world completely different from the one I'd always known, a world in which I was treated with fairness, even kindness-- a world in which fathers didn't sell their daughters.","['geisha', 'hope ']"
"hope,god,faith","There are certain mortal moments and minutes that matter. Certain hingepoints in the history of each human. Some seconds are so decisive they shrink the soul, while others are spent, so as to stretch the soul.","['accountiblity', 'choices', 'courage', 'destiny', 'faith', 'god', 'heavenly-father', 'history', 'hope', 'human', 'humanity ']"
hope,"Fiction cannot recite the numbing numbers, but it can be that witness, that memory. A storyteller can attempt to tell the human tale, can make a galaxy out of the chaos, can point to the fact that some people survived even as most people died. And can remind us that the swallows still sing around the smokestacks.","['holocaust', 'hope', 'life ']"
"hope,faith","May the sun come, it's a new day; In the pure land of fantasy; That our darkness enlightened","['faith', 'hope', 'light ']"
hope,"But that's just it; I can either focus on what I have lost, or what I have gained, and I choose the latter.","['grief', 'hope', 'joy', 'loss', 'saddness ']"
hope,"I like the immaterial world. I like to live among thoughts and images of the past and the possible, and even of the impossible, now and then.","['fantasy', 'hope', 'imagination ']"
hope,"If you are seeking, seek us with joyFor we live in the kingdom of joy.Do not give your heart to anything elseBut to the love of those who are clear joy,Do not stray into the neighborhood of despair.For there are hopes: they are real, they exist Do not go in the direction of darkness I tell you: suns exist.",['hope ']
hope,Never Give up! Where theres life theres hope!...,['hope ']
"hope,inspiration,soul","Ive grown up defined by this desperate, undeniable, cant breathe kind of space inside of myself and Im afraid that the diagnosis is fatal.","['anxiety', 'art', 'beach', 'born-ready', 'cape-cod', 'coming-of-age', 'constellations', 'depression', 'destiny', 'fate', 'friends', 'girls', 'growing', 'growing-up', 'healing', 'hope', 'inspiration', 'jennifer-elisabeth', 'learning', 'life', 'love', 'lovers', 'ocean', 'pray', 'prayer', 'red-thread', 'red-thread-of-destiny', 'red-thread-of-fate', 'self-acceptance', 'self-love', 'self-reflection', 'soul', 'soul-mates', 'stars', 'teenagers', 'teens', 'time', 'universe', 'wish ']"
hope,"I try to be rational and suppress the hope that this is for real, but hope has a way of closing its eyes to reason and it just keeps growing.",['hope ']
hope,Might. Is there any opiate more powerful than that word?,['hope ']
hope,"We are mosaics - pieces of light, love, history, stars -- glued together with magic and music and words.","['hope', 'inspirational', 'love ']"
hope,To believe and yet to have no hope is to thirst beside a fountain.,"['belief', 'hope ']"
hope,"The day will bring hope for me,""said Aragorn. ""Is it not said that no foe has ever taken the Hornburg, if men defended it?""""So the minstrels say,""said omer.""Then let us defend it, and hope!","['hope', 'inspirational ']"
hope,"Be a craftsman in speech that thou mayest be strong, for the strength of one is the tongue, and speech is mightier than all fighting.","['advice', 'courageous', 'crafty', 'diplomacy', 'fighthing', 'heroic', 'hope', 'speech', 'strength', 'valiant', 'war', 'wisdom ']"
hope,President Kennedy understood the importance of equal pay for equal work and signed historic legislation that gave women around the country hope that one day their wages would be on par with that of their male counterparts.,"['Work', 'Women', 'President']"
hope,"I wonder if it's like this for mountain climbers, he thought. You climb bigger and bigger mountains and you know that one day one of them is going to be just that bit too steep. But you go on doing it, because its so-o good when you breathe the air up there. And you know you'll die falling.","['hope', 'inspirational', 'people ']"
"faith,hope","Flowers don't tell, they show. That's the way good books should be too.""--Stephanie Skeem. Author of Flotsam","['books', 'faith', 'flowers', 'hope', 'inspirational', 'love', 'writing ']"
hope,"Trust to some was placing all your insecurities and beliefs in one single person, and hoping he or she wouldnt squash them.","['hope', 'life', 'love', 'trust ']"
hope,"Don't you miss it?""I say. ""Being free.""He laughs.","['freedom', 'hope ']"
"hope,faith","Deep down under where his heart resided, strangled up in thorny vines of guilt, anger, fear and longing, there lay something deeper in him, something that he couldnt see but she could.","['faith', 'hope', 'humanity', 'love', 'relationships ']"
hope,"When we only name the problem, when we state complaint without a constructive focus or resolution, we take hope away. In this way critique can become merely an expression of profound cynicism, which then works to sustain dominator culture.",['hope ']
hope,a cynic who was still saddened whenever his jaundiced view of mankind was confirmed...,"['cynicism', 'hope ']"
"hope,inspiration,soul",I know that this process of me changing my life doesnt just end once I set fire to this list of things I hate about myself. Tonight isnt as much of a new beginning as it is a violent end and I know the real work hasnt even started yet.,"['anxiety', 'art', 'beach', 'born-ready', 'cape-cod', 'coming-of-age', 'constellations', 'depression', 'destiny', 'fate', 'friends', 'girls', 'growing', 'growing-up', 'healing', 'hope', 'inspiration', 'jennifer-elisabeth', 'learning', 'life', 'love', 'lovers', 'ocean', 'pray', 'prayer', 'red-thread', 'red-thread-of-destiny', 'red-thread-of-fate', 'self-acceptance', 'self-love', 'self-reflection', 'soul', 'soul-mates', 'stars', 'teenagers', 'teens', 'time', 'universe', 'wish ']"
"hope,inspiration,soul",Im going to follow this invisible red thread until I find myself again until I finally figure out who Im meant to be.,"['anxiety', 'art', 'beach', 'born-ready', 'cape-cod', 'coming-of-age', 'constellations', 'depression', 'destiny', 'fate', 'friends', 'girls', 'growing', 'growing-up', 'healing', 'hope', 'inspiration', 'jennifer-elisabeth', 'learning', 'life', 'love', 'lovers', 'ocean', 'pray', 'prayer', 'red-thread', 'red-thread-of-destiny', 'red-thread-of-fate', 'self-acceptance', 'self-love', 'self-reflection', 'soul', 'soul-mates', 'stars', 'teenagers', 'teens', 'time', 'universe', 'wish ']"
hope,"...stooping very low, He engraves with careHis Name, indelible, upon our dust;And from the ashes of our self-despair,Kindles a flame of hope and humble trust.He seeks no second site on which to build,But on the old foundation, stone by stone,Cementing sad experience with grace,Fashions a stronger temple of His own.","['christ', 'despair', 'grace', 'holy-spirit', 'hope', 'love', 'salvation', 'trust ']"
hope,"You can tell people of the need to struggle, but when the powerless start to see that they really can make a difference, nothing can quench the fire.","['hope', 'power', 'struggle', 'women ']"
hope,"Everyone runs around trying to find a place where they still serve breakfast because eating breakfast, even if it's 5 o'clock in the afternoon, is a sign that the day has just begun and good things can still happen. Having lunch is like throwing in the towel.","['breakfast', 'hope', 'lunch ']"
hope,"but a sanguine temper, though for ever expecting more good than occurs, does not always pay for its hopes by any proportionate depression. it soon flies over the present failure, and begins to hope again.","['hope', 'inspirational ']"
hope,"There is no medicine like hope, no incentive so great, and no tonic so powerful as expectation of something tomorrow.",['hope ']
hope,"Yet some men say in many parts of England that King Arthur is not dead, but had by the will of our Lord Jesu into another place; and men say that he shall come again, and he shall win the holy cross.","['arthurian', 'england', 'hope', 'immortality', 'king-arthur', 'matter-of-britain', 'resurrection ']"
hope,It brings hope and peace of mind knowing that God gave His only begotten Son for us. I'm able to look back and know that on this day Jesus was born and gave us the opportunity to have eternal life.,"['Life', 'God', 'Peace']"
hope,"If there is nothing new under the sun, at least the sun itself is always new, always re-creating itself out of its own inexhaustible fire.","['hope', 'rebirth', 'renewal', 'sun ']"
hope,"There was something better in life than this rubbish, if only he could get to itlovenobilitybig spaces where passion clasped peace, spaces no science could reach, but they existed for ever, full of woods some of them, and arched with majestic sky and a friend. . .","['hope', 'love ']"
hope,What can you do how much can you give to bring grace and salvation unto even one soul,"['dark-divine', 'grace', 'hope', 'mercy', 'principal-conway ']"
hope,"Competition is healthy. Especially when all your competitors are unhealthy, and hopefully sick and absent during the competition.","['absent', 'competition', 'competitors', 'healthy', 'hope', 'sick', 'unhealthy ']"
"hope,inspiration","Remember this, - where there is life there is hope. You're alive. Embrace this, because YOU CAN DO ANYTHING while there is breath in your body.","['hope', 'inspiration', 'life ']"
hope,"Here's a funny question:What is your favorite word?Think about itmaybe it's a word that makes you absolutely happy, or a word that sounds gloriously beautiful, or a word that evokes awe and wonder. Maybe you are reminded of a great time when you hear it, or maybe it represents your life's dream.So, what is it? What is your favorite word of all words?Thought about it yet?Good.And now, think why.","['aspirations', 'dream', 'dreams', 'favorite', 'hope', 'personal', 'word ']"
hope,"She was famous, and she was insane.Her voice soared out over the audience, holding them spellbound and enraptured, delivering their hopes and fears tangled in chords and rhythm. They called her an angel, her voice a gift.She was famous, and she was a liar.","['fear', 'hope', 'liar', 'music ']"
hope,"It is only goodness which gives extras, and so I say again that we have much to hope from the flowers.","['arthur-conan-doyle', 'blessings', 'flowers', 'goodness', 'hope', 'inspirational', 'sherlock-holmes ']"
hope,"Though it's cold and lonely in the deep dark night, I can see paradise by the dashboard light.","['hope', 'schmaltz ']"
"faith,hope","We are preaching hope, standing on the bones of the past.","['bones', 'faith', 'forgiveness', 'genocide', 'hope', 'rwanda ']"
"hope,poetry,relationship,quotes","Suddenly I remembered that laugh, it told a different story, our story.","['happyquotes', 'hope', 'inspirational', 'inspirationalquotes', 'inspired', 'instadaily', 'instaquote', 'lovequotes', 'pinquotes', 'poems', 'poetry', 'quote', 'quoteoftheday', 'quotes', 'relationships', 'rmdrake', 'sadquotes', 'sayings', 'spokenword', 'tattoo', 'typewriter', 'vsco', 'writer', 'writing ']"
hope,"With every year that I grow older, I also draw closer to (my loved ones) to the day when we will once again be together. So I march through the deepening shadows, serene and unafraid, because I know that at the end of my journey they will be waiting for me.","['death', 'heaven', 'hope ']"
hope,Home was not a perfect place. But it was the only home they had and they could hope to make it better.,"['home', 'hope ']"
"hope,faith",Failure is just another way to learn how to do something right.,"['failure', 'faith', 'hope', 'inspirational', 'learning ']"
hope,"People are just too hopeful, and sometimes hope is the biggest weapon of all to use against us. People will believe anything.",['hope ']
hope,"What cracks had he left in their hearts? Did they love less now and settle for less in return, as they held onto parts of themselves they did not want to give and lose again? Or - and he wished this - did they love more fully because they had survived pain, so no longer feared it?","['divorce', 'hope', 'love', 'pain ']"
hope,"Your mother sets you up blind dates? With guys like that?""The corners of his mouth twitched. ""She doesn't like you very much, does she?","['chaotic', 'hope', 'mateson ']"
hope,"A lot of people, because of my contempt for the false consolations of religion, think of me as a symbolic public opponent of that in extremis. And sometimes that makes me feel a bit alarmed, to be the repository of other people's hope.","['Religion', 'Opponent', 'False']"
"philosophy,happiness,hope,knowledge,education",Happiness will grow if you plant the seeds of love in the garden of hope with compassion and care.,"['care', 'compassion', 'education', 'garden', 'happiness', 'hope', 'inspirational', 'intelligence', 'knowledge', 'life', 'love', 'philosophy', 'truth', 'wisdom ']"
"philosophy,hope","Love as a concrete foundation for an authentically functional civilization requires the around-the-clock labors of forgiveness. Without it, Love fails, Friendship fails, Intelligence fails, Humanity: fails.","['agape-love', 'civilization', 'forgiveness', 'friendship', 'grace', 'hope', 'humanity', 'integrity', 'intelligence', 'love', 'moving-on-and-letting-go', 'philosophy', 'society', 'spirituality ']"
hope,"I thought that the light-house looked lovely as hope,That star on life's tremulous ocean.",['hope ']
hope,"Hope was always out ahead of fact, possibility obscured the outlines of reality.",['hope ']
hope,"As I age in the world it will rise and spread,and be for this place horizonand orison, the voice of its winds.I have made myself a dream to dreamof its rising, that has gentled my nights.Let me desire and wish well the lifethese trees may live when Ino longer rise in the morningsto be pleased with the green of themshining, and their shadows on the ground, and the sound of the wind in them.","['future', 'hope', 'transcience', 'trees ']"
