0,1,2
love,I love deadlines. I like the whooshing sound they make as they fly by.,"['Funny', 'Deadlines', 'Fly']"
love,"Black as the devil, hot as hell, pure as an angel, sweet as love.","['Hell', 'Black', 'Sweet']"
love,We loved with a love that was more than love.,['Loved']
"hope,love","Woe to the man whose heart has not learned while young to hope, to love - and to put its trust in life.","['Love', 'Life', 'Trust']"
love,For small creatures such as we the vastness is bearable only through love.,"['Vastness', 'Small']"
love,"Man must evolve for all human conflict a method which rejects revenge, aggression and retaliation. The foundation of such a method is love.","['Aggression', 'Conflict']"
love,A woman knows the face of the man she loves as a sailor knows the open sea.,"['Woman', 'Sailor', 'Sea']"
love,Affection is responsible for nine-tenths of whatever solid and durable happiness there is in our lives.,"['Happiness', 'Affection']"
"life,love",Life without love is like a tree without blossoms or fruit.,"['Life', 'Tree', 'Fruit']"
love,"Lord, grant that I might not so much seek to be loved as to love.","['Loved', 'Seek', 'Lord']"
love,"You are, and always have been, my dream.",['love ']
love,At the center of non-violence stands the principle of love.,"['Center', 'Principle', 'Stands']"
love,"Love has no age, no limit; and no death.","['Death', 'Age', 'Limit']"
love,A part of kindness consists in loving people more than they deserve.,"['Kindness', 'Deserve']"
love,"Love is the joy of the good, the wonder of the wise, the amazement of the Gods.","['Good', 'Wonder', 'Wise']"
love,"You are my best friend as well as my lover, and I do not know which side of you I enjoy the most. I treasure each side, just as I have treasured our life together.","['friendship', 'love ']"
"love,poetry",We love the things we love for what they are.,"['love', 'poetry ']"
love,"Whatever our souls are made of, his and mine are the same.","['Whatever', 'Mine', 'Souls']"
love,One is loved because one is loved. No reason is needed for loving.,['love ']
love,"As the Father has loved me, so have I loved you.","['Father', 'Loved']"
love,"Love has no errors, for all errors are the want for love.",['Errors']
love,"Perhaps all the dragons in our lives are princesses who are only waiting to see us act, just once, with beauty and courage. Perhaps everything that frightens us is, in its deepest essence, something helpless that wants our love.",['love ']
love,Be of love a little more careful than of anything.,['Careful']
love,"Love is always bestowed as a gift - freely, willingly and without expectation. We don't love to be loved; we love to love.","['Loved', 'Gift', 'Bestowed']"
love,Love is a game that two can play and both win.,"['Win', 'Game', 'Both']"
love,"True love cannot be found where it does not exist, nor can it be denied where it does.","['True', 'Found', 'Exist']"
love,I would die for you. But I won't live for you.,['love ']
love,"As soon go kindle fire with snow, as seek to quench the fire of love with words.","['Fire', 'Kindle', 'Words']"
love,In vain have I struggled. It will not do. My feelings will not be repressed. You must allow me to tell you how ardently I admire and love you.,"['love', 'mr-darcy ']"
love,Love is the greatest gift that God has given us. It's free.,"['God', 'Greatest', 'Free']"
love,A kiss is a rosy dot over the 'i' of loving.,"['Kiss', 'Loving', 'Dot']"
love,"Love does not begin and end the way we seem to think it does. Love is a battle, love is a war; love is a growing up.","['War', 'Battle', 'Growing']"
love,"Promise me you'll always remember: You're braver than you believe, and stronger than you seem, and smarter than you think.","['christopher-robin', 'friendship', 'love', 'pooh', 'sweet', 'the', 'winnie ']"
love,Love is a hole in the heart.,"['Heart', 'Hole']"
love,I don't know that love changes. People change. Circumstances change.,"['Change', 'Changes']"
"hope,inspiration,life,love",Your ordinary acts of love and hope point to the extraordinary promise that every human life is of inestimable value.,"['Inspirational', 'Love', 'Hope']"
love,"I am happier when I love than when I am loved. I adore my husband, my son, my grandchildren, my mother, my dog, and frankly, I don't know if they even like me. But who cares? Loving them is my joy.","['Mother', 'Son', 'Dog']"
love,"Nowadays love is a matter of chance, matrimony a matter of money and divorce a matter of course.","['Money', 'Chance', 'Divorce']"
"life,love","My life path has been a blessing and a great learning experience. Skateboarding is my passion and I don't see that changing. When I'm not skating, I love to surf. I'm open to the new experiences and opportunities.","['Life', 'Learning', 'Experience']"
love,"The one thing I don't consume during 'Today' - which surprises many people - is coffee. I find that a lot of water helps wake me up, without the buzz. I love coffee, but usually reserve a double espresso as an afternoon pick-me-up before settling in to do the weekend 'Nightly News.'","['Coffee', 'Today', 'Water']"
love,I love a vintage look that's also a bit rock n' roll.,"['Vintage', 'Rock', 'Roll']"
love,Wine comes in at the mouth And love comes in at the eye; That's all we shall know for truth Before we grow old and die.,"['Dating', 'Truth', 'Wine']"
love,"If a person loves only one other person and is indifferent to all others, his love is not love but a symbiotic attachment, or an enlarged egotism.","['Others', 'Attachment', 'Loves']"
love,"I think relationships are work, but love is a gift.","['Work', 'Gift']"
love,"Lot's wife, of course, was told not to look back where all those people and their homes had been. But she did look back, and I love her for that, because it was so human.","['Wife', 'Course', 'Homes']"
"love,hope,inspiration","When we love, we always strive to become better than we are. When we strive to become better than we are, everything around us becomes better too.","['hope', 'inspiration', 'love', 'santiago ']"
love,It is in the thirties that we want friends. In the forties we know they won't save us any more than love did.,"['Save', 'Forties', 'Thirties']"
"life,love","Being a survivor doesn't mean being strong - it's telling people when you need a meal or a ride, company, whatever. It's paying attention to heart wisdom, feelings, not living a role, but having a unique, authentic life, having something to contribute, finding time to love and laugh. All these things are qualities of survivors.","['Love', 'Wisdom', 'Time']"
love,"I honestly, sincerely love what I do.","['Honestly', 'Sincerely']"
love,They are always saying God loves us. If that's love I'd rather have a bit of kindness.,"['God', 'Kindness', 'Rather']"
love,"Sometimes you're afraid to fall in love with a chick, but she sucks you in anyway.","['Afraid', 'Fall', 'Sucks']"
"life,love",I went to a psychoanalyst. He explained things about my love life that I found very impressive... almost scary.,"['Life', 'Explained', 'Found']"
love,"People like to think of you as a certain person, or a certain type of person, and they do love to give you a label. We like luggage labels, and we like people labels.","['Labels', 'Luggage', 'Certain']"
love,"Love is not altogether a delirium, yet it has many points in common therewith.","['Points', 'Common', 'Altogether']"
love,"I love going to the movie theatre, seeing live comedy, and going to amusement parks.","['Theatre', 'Comedy', 'Seeing']"
love,I love mankind; it's people I can't stand.,"['Stand', 'Mankind']"
love,"To put yourself in another's place requires real imagination, but by doing so each Girl Scout will be able to love among others happily.","['Girl', 'Scout', 'Others']"
love,The only thing worse than a boy who hates you: a boy that loves you.,"['boys', 'hate', 'love ']"
love,The elusive nature of love... it can be such a fleeting thing. You see it there and it's just fluttering and it's gone.,"['Nature', 'Fleeting', 'Gone']"
"life,love",Bitterness imprisons life; love releases it.,"['Love', 'Bitterness']"
love,"I like the idea of being warm and secure. That's what home should be. That you have a sense of warmth, security, love, and you love the things around you and surround yourself with beauty.","['Beauty', 'Home', 'Security']"
"life,love",Where there is love there is life.,"['life', 'love ']"
love,"I'm a big believer than a great bit is a great bit - if I go and see someone I love, like Robert Klein. I want to hear some classics and some new stuff. But a great stand-up bit takes a long time to really polish and perfect, and they're beautiful things when they're done.","['Time', 'Great', 'Beautiful']"
love,"I love Thanksgiving because it's a holiday that is centered around food and family, two things that are of utmost importance to me.","['Family', 'Food', 'Holiday']"
love,Loving someone liberates the lover as well as the beloved. And that kind of love comes with age.,"['Age', 'Lover', 'Loving']"
love,"So, I love you because the entire universe conspired to help me find you.",['love ']
love,"Americans, who make more of marrying for love than any other people, also break up more of their marriages, but the figure reflects not so much the failure of love as the determination of people not to live without it.","['Failure', 'Break', 'Marriages']"
love,"I love Christopher Bailey and Burberry, Mulberry for bags, and Hudson for jeans.","['Jeans', 'Bags', 'Bailey']"
love,"As far as love is concerned, possession, power, fusion and disenchantment are the Four Horsemen of the Apocalypse.","['Power', 'Four', 'Apocalypse']"
"life,love","I love sleep. My life has the tendency to fall apart when I'm awake, you know?","['Dreams', 'Love', 'Sleep']"
"life,love","If you were to destroy the belief in immortality in mankind, not only love but every living force on which the continuation of all life in the world depended, would dry up at once.","['Life', 'Living', 'Belief']"
"life,love","One mustn't ask apple trees for oranges, France for sun, women for love, life for happiness.","['Life', 'Happiness', 'Women']"
love,"If you don't like it, learn to love it!",['Learn']
"arts,love","I have never denied my background or my culture. I have taught my child to embrace her Mexican heritage, to love my first language, Spanish, to learn about Mexican history, music, folk art, food, and even the Mexican candy I grew up with.","['Music', 'Art', 'Food']"
love,"God tells me that I need to provide for my family, discipline and teach my children, and love my wife as Christ loves the church. If I don't do that, I'm being unfaithful and sinful.","['Family', 'God', 'Discipline']"
love,"I still believe that love is the most powerful force in the world, even though I am yet to experience it fully.","['Experience', 'Powerful', 'Force']"
love,The love of liberty and the sense of human dignity are the basic elements of the Anarchist creed.,"['Liberty', 'Dignity', 'Elements']"
love,"We fell in love, despite our differences, and once we did, something rare and beautiful was created. For me, love like that has only happened once, and that's why every minute we spent together has been seared in my memory. I'll never forget a single moment of it.",['love ']
love,"Love never reasons, but profusely gives; it gives like a thoughtless prodigal its all, and then trembles least it has done to little.","['Reasons', 'Prodigal', 'Gives']"
love,"There has always been this narrator in me - I loved ideas, and part of the great love affair I would have with ideas consisted of talking about them.","['Great', 'Ideas', 'Loved']"
love,"The thing about Chicago is that it really isn't like any other place. The architecture and the layout of the city are the best. I'm from the Midwest, and consider myself a Midwesterner. I feel most at home there. I love California. I have great friends in California. I just have always considered Illinois to be home.","['Best', 'Home', 'Great']"
love,"There's got to be something you want to tell and that's the engine which spurs all of the work you have to do in order to create the story, but you have to love some sort of nugget of what you're telling to be a filmmaker.","['Work', 'Create', 'Order']"
love,"Nobody has ever measured, not even poets, how much the heart can hold.",['love ']
love,"I wanted to write a very simple story about a boy, a wolf, a girl, a bear and a forest, so I thought I might set it in the past. I didn't realise that it went back to when I was 10: I used to love the Stone Age when I was a kid and wanted to live in it, and I got rid of my bed and slept on the floor, but I didn't remember it.","['Age', 'Past', 'Simple']"
"life,love,success","My success set me up for life, and it meant that I could retire from the music industry at 27 to spend time with my newborn daughter and my wife. My time away from the spotlight allowed me to rediscover my love for music, and I'm doing it for me now and no one else.","['Life', 'Success', 'Music']"
"love,romance","The best love is the kind that awakens the soul and makes us reach for more, that plants a fire in our hearts and brings peace to our minds. And that's what you've given me. That's what I'd hoped to give you forever","['love', 'nicholas-sparks', 'romance', 'the-notebook ']"
love,"Once upon a time there was a boy who loved a girl, and her laughter was a question he wanted to spend his whole life answering.",['love ']
"life,love","If you are lucky enough to find a way of life you love, you have to find the courage to live it.","['Courage', 'Life', 'Lucky']"
"life,love","With me, what you see is what you get. Yes, call me naive, but I love life. I am happy, and for that, I make no apologies. I do like to see the best in people, and when someone is nice to my face, I tend to believe them.","['Love', 'Best', 'Happy']"
love,I love pointy nails! A cute way to add a pop of color to your nails is to make a V-shape at the ends of them in a pastel color.,"['Cute', 'Color', 'Nails']"
love,Love is the delightful interval between meeting a beautiful girl and discovering that she looks like a haddock.,"['Beautiful', 'Girl', 'Meeting']"
love,To be happy with a man you must understand him a lot and love him a little. To be happy with a woman you must love her a lot and not try to understand her at all.,"['Happy', 'Woman', 'Understand']"
love,I would always rather be happy than dignified.,"['love', 'pride', 'women ']"
"love,success",I'd rather be a failure at something I love than a success at something I hate.,"['Success', 'Failure', 'Hate']"
love,There are many little ways to enlarge your child's world. Love of books is the best of all.,"['Best', 'Child', 'Books']"
love,"He who loves with purity considers not the gift of the lover, but the love of the giver.","['Gift', 'Lover', 'Purity']"
love,There is no love that is not an echo.,['Echo']
love,"Love doesn't just sit there, like a stone; it has to be made, like bread, remade all the time, made new.","['Time', 'Stone', 'Bread']"
"love,success","I'm not really easy to live with! There needs to be unlimited patience and unconditional love. Men I've known before loved my independent spirit and were proud of my success, to the point that they'd become jealous of the time I devote to my career.","['Jealousy', 'Success', 'Time']"
love,"When I really love someone, I can only show it by making aggressive and bad-taste remarks.","['Aggressive', 'Remarks']"
"friendship,love","I've always wanted to be a mom because I want to give a kid all of the magical gifts my mom gave to me, such as love and friendship. She and I had this incredible connection that was so unbelievable.","['Friendship', 'Mom', 'Connection']"
love,"Pasta isn't just for Italian food anymore. Now there are tasty pasta recipes found in Asian cuisine, and it's emerging as a newfound love for vegans.","['Food', 'Asian', 'Emerging']"
"love,romance","Some women choose to follow men, and some women choose to follow their dreams. If you're wondering which way to go, remember that your career will never wake up and tell you that it doesn't love you anymore.","['love', 'romance', 'work ']"
love,"Beauty, sweet love, is like the morning dew, Whose short refresh upon tender green, Cheers for a time, but till the sun doth show And straight is gone, as it had never been.","['Romantic', 'Morning', 'Time']"
"love,success","I do not think there is any thrill that can go through the human heart like that felt by the inventor as he sees some creation of the brain unfolding to success... such emotions make a man forget food, sleep, friends, love, everything.","['Success', 'Food', 'Sleep']"
love,Never love anyone who treats you like you're ordinary.,"['love', 'ordinary', 'people ']"
love,Part of growing up is realizing you learn to love so many people. It's about forming those relationships and finding what will last forever.,"['Learn', 'Forever', 'Growing']"
love,"Every age has its storytelling form, and video gaming is a huge part of our culture. You can ignore or embrace video games and imbue them with the best artistic quality. People are enthralled with video games in the same way as other people love the cinema or theatre.","['Best', 'Age', 'Culture']"
"life,love","I love sleep. My life has the tendency to fall apart when I'm awake, you know?",['sleep ']
"hope,love","We must restore hope to young people, help the old, be open to the future, spread love. Be poor among the poor. We need to include the excluded and preach peace.","['Love', 'Future', 'Peace']"
love,"I seriously feel like the best days are ahead, and I like the idea of getting to do everything I did before but with more knowledge, experience, and street smarts. There's a certain love, appreciation, and gratitude that you have at 40 that you don't have when you're younger, and it makes every accomplishment feel so much better.","['Best', 'Knowledge', 'Experience']"
"hope,inspiration,life,love",Your ordinary acts of love and hope point to the extraordinary promise that every human life is of inestimable value.,"['Inspirational', 'Life', 'Love']"
love,What does love look like? It has the hands to help others. It has the feet to hasten to the poor and needy. It has eyes to see misery and want. It has the ears to hear the sighs and sorrows of men. That is what love looks like.,"['Sympathy', 'Men', 'Eyes']"
"love,motivation",Money is not a motivating factor. Money doesn't thrill me or make me play better because there are benefits to being wealthy. I'm just happy with a ball at my feet. My motivation comes from playing the game I love. If I wasn't paid to be a professional footballer I would willingly play for nothing.,"['Money', 'Happy', 'Motivation']"
"hope,love",Courage is like love; it must have hope for nourishment.,"['Hope', 'Courage']"
love,"I love to go to the zoo. But not on Sunday. I don't like to see the people making fun of the animals, when it should be the other way around.","['Fun', 'Animals', 'Sunday']"
love,"And so the lion fell in love with the lamb…""he murmured. I looked away, hiding my eyes as I thrilled to the word.""What a stupid lamb,""I sighed.""What a sick, masochistic lion.","['bella', 'edward', 'love ']"
"life,love",A dream is what makes people love life even when it is painful.,"['Life', 'Dream', 'Painful']"
"arts,love","People discuss my art and pretend to understand as if it were necessary to understand, when it's simply necessary to love.","['Art', 'Understand', 'Discuss']"
"life,love","Life is short and we have never too much time for gladdening the hearts of those who are travelling the dark journey with us. Oh be swift to love, make haste to be kind.","['Life', 'Time', 'Journey']"
love,"I love the man that can smile in trouble, that can gather strength from distress, and grow brave by reflection. 'Tis the business of little minds to shrink, but he whose heart is firm, and whose conscience approves his conduct, will pursue his principles unto death.","['Fear', 'Smile', 'Strength']"
love,"This is a good sign, having a broken heart. It means we have tried for something.","['heartache', 'love ']"
love,It is necessary to fall in love... if only to provide an alibi for all the random despair you are going to feel anyway.,"['Fall', 'Random', 'Despair']"
love,"Love cannot endure indifference. It needs to be wanted. Like a lamp, it needs to be fed out of the oil of another's heart, or its flame burns low.","['Heart', 'Oil', 'Flame']"
"love,romance","I heard what you said. I’m not the silly romantic you think. I don’t want the heavens or the shooting stars. I don’t want gemstones or gold. I have those things already. I want…a steady hand. A kind soul. I want to fall asleep, and wake, knowing my heart is safe. I want to love, and be loved.","['love', 'romance ']"
"life,love",I went to a psychoanalyst. He explained things about my love life that I found very impressive... almost scary.,"['Love', 'Explained', 'Found']"
love,"No matter how you're feeling, a little dog gunna love you.","['Dog', 'Feeling', 'Matter']"
love,"It's tangible, it's solid, it's beautiful. It's artistic, from my standpoint, and I just love real estate.","['Beautiful', 'Solid', 'Artistic']"
"love,success","The love of what you do, combined with your belief in what you do, will not determine your success. It will determine how hard you will work and how dedicated you will be to achieving it. Success just shows up from there.","['Love', 'Work', 'Achieving']"
love,"My thoughts on gay marriage are that everyone has the right to love and be loved, and that's the position I take.","['Marriage', 'Thoughts', 'Gay']"
love,We loved with a love that was more than love.,"['logic', 'love ']"
love,"Even from their infancy we frame them to the sports of love: their instruction, behavior, attire, grace, learning and all their words azimuth only at love, respects only affection. Their nurses and their keepers imprint no other thing in them.","['Learning', 'Sports', 'Words']"
love,"I love dressing up. It's the best part of being a girl, I think.","['Best', 'Girl', 'Dressing']"
"humor,love","I love people who make me laugh. I honestly think it's the thing I like most, to laugh. It cures a multitude of ills. It's probably the most important thing in a person.","['Humor', 'Honestly', 'Laugh']"
"hope,love","We must restore hope to young people, help the old, be open to the future, spread love. Be poor among the poor. We need to include the excluded and preach peace.","['Hope', 'Future', 'Peace']"
love,"I love everything that's old, - old friends, old times, old manners, old books, old wine.","[""Saint Patrick's Day"", 'Wine']"
"hope,inspiration,life,love",Your ordinary acts of love and hope point to the extraordinary promise that every human life is of inestimable value.,"['Inspirational', 'Life', 'Hope']"
"hope,love",The only way of knowing a person is to love them without hope.,"['Love', 'Knowing']"
love,"Bad food is made without pride, by cooks who have no pride, and no love. Bad food is made by chefs who are indifferent, or who are trying to be everything to everybody, who are trying to please everyone... Bad food is fake food... food that shows fear and lack of confidence in people's ability to discern or to make decisions about their lives.","['Fear', 'Food', 'Confidence']"
love,He who does not love his own language is worse than an animal and smelly fish.,"['Language', 'Animal', 'Fish']"
"love,relationship","A guy and a girl can be just friends, but at one point or another, they will fall for each other...Maybe temporarily, maybe at the wrong time, maybe too late, or maybe forever","['dave-matthews', 'friends', 'love', 'relationships ']"
love,"You know, all that really matters is that the people you love are happy and healthy. Everything else is just sprinkles on the sundae.","['Health', 'Happy', 'Healthy']"
love,"Whatever you want to do, if you want to be great at it, you have to love it and be able to make sacrifices for it.","['Great', 'Whatever', 'Sacrifices']"
"life,love",I argue thee that love is life. And life hath immortality.,"['Love', 'Argue', 'Hath']"
love,Knowledge is love and light and vision.,"['Knowledge', 'Light', 'Vision']"
"love,poetry","Every heart sings a song, incomplete, until another heart whispers back. Those who wish to sing always find a song. At the touch of a lover, everyone becomes a poet.","['love', 'poetry', 'song ']"
love,Love is what we were born with. Fear is what we learned here.,"['Fear', 'Born', 'Learned']"
"arts,love",The art of love is largely the art of persistence.,"['Love', 'Largely']"
love,"You're imperfect, and you're wired for struggle, but you are worthy of love and belonging.","['Struggle', 'Belonging']"
"love,relationship","I think you still love me, but we can’t escape the fact that I’m not enough for you. I knew this was going to happen. So I’m not blaming you for falling in love with another woman. I’m not angry, either. I should be, but I’m not. I just feel pain. A lot of pain. I thought I could imagine how much this would hurt, but I was wrong.","['breakup', 'infidelity', 'love', 'pain', 'relationships ']"
"life,love","It is really rare to find someone you really, really love and that you want to spend your life with and all that stuff that goes along with being married. I am one of those lucky people. And I think she feels that way too. So the romantic stuff is easy because you want them to be happy.","['Romantic', 'Life', 'Happy']"
love,"Thank you for reminding Canada that I'm a disappointment to them. I like hockey, I love it, but I'm not an avid hockey - let's face it, true Canadian - fan. I've always been more into snowboarding and skateboarding and sort of the alternative sports, I'm not crazy about hockey - but love it!","['Sports', 'Hockey', 'Crazy']"
"arts,love",Words may be false and full of art; Sighs are the natural language of the heart.,"['Love', 'Heart', 'Language']"
