0,1,2
"love,inspiration",I'm beginning to think that maybe it's not just how much you love someone. Maybe what matters is who you are when you're with them.,"['inspirational', 'love ']"
"love,life","There is love of course. And then there's life, its enemy.","['life', 'lost', 'love ']"
love,Traveling in the company of those we love is home in motion.,"['family', 'love ']"
"love,truth,faith,religion",The most confused you will ever get is when you try to convince your heart and spirit of something your mind knows is a lie.,"['acceptance', 'actions', 'beliefs', 'common-sense', 'confusion', 'disbelief', 'evidence', 'faith', 'family', 'hoping', 'life-purpose', 'love', 'mixed-signals', 'obvious', 'outrage', 'proof', 'reality', 'religion', 'sorrow', 'timing', 'truth', 'unrequited-love ']"
"love,romance",I am as wrapped up in her as a vine that clings to a tree seeking for sustenance. She’s tied me to her for eternity. She’s my home. She’s my reason for being. To win and hold her heart is my only purpose.,"['love', 'romance ']"
love,"When I was 12 years old, I read 'Nancy Drew' mysteries and biographies of Madame Curie and Florence Nightingale and books about girls who love horses or go to nursing school. I belonged to the Girl Scouts and got A's in school and rarely disobeyed my parents. I still kept a collection of Barbie dolls in my room, and I almost never spoke to boys.","['Parents', 'Girl', 'Girl']"
love,"Touchstone watched, suddenly conscious that he probably only had five seconds left to be alone with Sabriel, to say something, to say anything. Perhaps the last five seconds they ever would have alone together.I am not afraid, he said to himself.""I love you,""he whispered. ""I hope you don't mind.","['love', 'sabriel ']"
"love,humor",Two butterflies in two socks could walk faster than I can run. A love song will jog your memory like I jog like Roger Bannister in a wheelchair.,"['butterflies', 'humor', 'jog', 'love', 'memory', 'roger-bannister', 'run', 'running', 'socks', 'walk', 'wheelchair', 'word-junkies ']"
"love,humor","Knees suddenly weak, she reached for his forearms to stabilize herself. “You came for me.”He beamed, looking for all the world like a selfless, daring hero.“Don’t sound so surprised.” Dropping the cane, he pulled her into a crushing embrace that tore her away from Wolf and lifted her clean off the floor. “It turns out you are worth a lot of money on the black market.","['carswell', 'cress', 'humor', 'love', 'moment', 'thorne ']"
love,صديقي..الذي تحوّلَ إلى عدوِّي فجأة..بلا سببٍ تحوَّل!رغم أني لم أكُن سببًا في عداوته!ولا أعرفُ ما الدّاعي من غضبهِ وتحوّله..إنك عالقٌ في رأسي على شكلكَ القَديم..شكلكَ وأنت صَديقي!,"['friendship', 'love ']"
love,"The fiercest anger of all, the most incurable,Is that which rages in the place of dearest love.","['anger', 'bitterness', 'love ']"
love,"You are mine,I am yours; you may be sure of this. You've been locked inside my heart, the key has been thrown away; within it, you must always stay.",['love ']
"love,life,god","It's good to let God pick a man for you. We don't do so well when we pick them ourselves. They end up lipsticks in a drawer, all those wrong colors you thought looked so good in the package.","['choose', 'color', 'god', 'life', 'lipstick', 'love', 'man', 'men', 'package', 'pick ']"
"love,humor","If my last name were Hunter, I’d probably be a fisherman. That’s just the kind of lover I am.","['fisherman', 'humor', 'hunter', 'love', 'word-junkies ']"
love,"Nobody in my life has ever known me the way you do. Nobody in my life has ever made me feel as good as you do. You know me, you know everything about me, and when you leave me, you're going to be leaving the real me, the me nobody else has ever seen, that's who you're going to be rejecting.",['love ']
"love,humor","The salesman said the sale was happening because all the gizmos in the store had to be liquidated. It was a lot of solidfluid, and I would have bought something, but the only thing I was thirsty for was her love.","['absurd', 'gizmo', 'humor', 'liquidated', 'love', 'sale', 'sales', 'salesman', 'store', 'thirst', 'thirsty', 'word-junkies ']"
love,"Time is too slow for those who wait, too swift for those who fear, too long for those who grieve, too short for those who rejoice, but for those who love, time is eternity.","['love', 'time ']"
love,"Well, it's simple to love someone,""she said. ""But it's hard to know when you need to say it out loud.",['love ']
"love,life,romance",We live in a dark and romantic and quite tragic world.,"['dark', 'designer', 'fashion', 'karl-lagerfeld', 'life', 'live', 'living', 'love', 'romance', 'tragic', 'world ']"
"life,love,wisdom,relationship,romance","Relationships are like water. If you grab tight, clamping and clenching to gain control, you’ll lose it all. Instead, cup your hand gently, so she feels free to drink until her thirst is quenched.","['clamp', 'clench', 'control', 'cup', 'drink', 'drinking', 'free', 'freedom', 'gentle', 'gentleness', 'hand', 'hands', 'life', 'loss', 'love', 'relationships', 'romance', 'thirst', 'water', 'wisdom', 'wise', 'word-junkies ']"
"love,life,humor,relationship,funny",It’s easier to hide your smoking habit on a foggy day. Let that be a lesson for you and your secret lover.,"['cheat', 'cheating', 'fog', 'foggy', 'funny', 'hide', 'hiding', 'humor', 'lesson', 'life', 'love', 'lover', 'relationships', 'secret', 'smoking', 'weather', 'word-junkies ']"
love,"I love you,""I whisper. ""I love you exactly as you are.",['love ']
love,"I didn't care who kissed you first as long as I kissed you last.""-George from If We Kiss","['kissing', 'love ']"
"love,truth","I believe that unarmed truth and unconditional love will have the final word in reality. This is why right, temporarily defeated, is stronger than evil triumphant.","['good-and-evil', 'love', 'truth ']"
love,"In a strange way, I had fallen in love with my depression. Dr. Sterling was right about that. I loved it because I thought it was all I had. I thought depression was the part of my character that made me worthwhile. I thought so little of myself, felt that I had such scant offerings to give to the world, that the one thing that justified my existence at all was my agony.","['depression', 'existance', 'love', 'prozac ']"
love,"I don't want to be in my car all day. I love getting up in the morning in Venice and walking my dogs down to the cafe to get my tea, and then perhaps going to a bookstore and sitting and reading, then walking to the beach.","['Morning', 'Car', 'Reading']"
"love,life","They had an ordinary life, full of ordinary things-if love can ever be called that.","['life', 'love ']"
love,"I say, “In the contract we said we wouldn’t break each other’s hearts. What if we do it again?” Fiercely he says, “What if we do? If we’re so guarded, it’s not going to be anything. Let’s do it fucking for real, Lara Jean. Let’s go all in. No more contract. No more safety net. You can break my heart. Do whatever you want with it.",['love ']
"love,humor,relationship,funny","Love is a bronze statue sinking in quicksand. But if I hand you a lasso, will you try to save the statue—or use the lasso to hang yourself? If you need me, I’ll be here to kick the chair out from under your feet.","['art', 'bronze-statue', 'chair', 'friendship', 'funny', 'furniture', 'genius', 'hang', 'humor', 'lasso', 'love', 'noose', 'quicksand', 'relationships', 'save', 'sinking', 'statue', 'suicide', 'word-junkies ']"
love,"But you've slipped under my skin, invaded my blood and seized my heart.","['love', 'maria-v-snyder', 'poison-study', 'valek ']"
"life,love,inspiration,relationship","When you say ""I""and ""my""too much, you lose the capacity to understand the ""we""and ""our"".","['inspirational', 'life', 'love', 'relationships', 'understanding-others ']"
"love,humor,funny","What is pink, blurry, and always leaving when you’re arriving? Love.","['creative', 'funny', 'humor', 'love', 'love-quotes', 'silly', 'strange', 'wonderful', 'word-junkies ']"
love,"A first child is your own best foot forward, and how you do cheer those little feet as they strike out. You examine every turn of flesh for precocity, and crow it to the world. But the last one: the baby who trails her scent like a flag of surrender through your life when there will be no more coming after--oh, that' s love by a different name.","['babies', 'children', 'love', 'motherhood ']"
love,It is very difficult to live among people you love and hold back from offering them advice.,"['advice', 'love ']"
"love,god","God is love,""she said. ""And he respects love, whether it's between a parents, and child, a man and woman, or friends. I don't think he cares about religion one little bit. Live your life right. Love with all your heart. Don't hurt others, and help those in need. That is all you need to know. And don't worry about heaven. If it exists, you'll be welcome.","['god', 'love ']"
"love,humor,funny","With friends like me, who needs mannequins? My love for you is statuesque. Come, let us dance like we’re made of stone.","['absurd', 'dance', 'dancing', 'funny', 'humor', 'love', 'mannequins', 'statue', 'word-junkies ']"
"life,love","That's what I love about Aibileen, she can take the most complicated things in life and wrap them up so small and simple, they'll fit right in your pocket.","['friend', 'friendship', 'life', 'love', 'problems ']"
love,"Love comes with a knife, not some shy question, and not with fears for its reputation!",['love ']
"love,humor,relationship,romance",Combine a fog machine and a cotton candy maker to create delicious mystery. This is the heart of romance.,"['cotton-candy', 'delicious', 'fog', 'fog-machine', 'food', 'heart', 'humor', 'invention', 'love', 'mysterious', 'mystery', 'relationships', 'romance', 'romantic', 'surreal', 'taste', 'word-junkies ']"
love,"No matter how long or how difficult, we will undo whatever that Moroi boy has done to you.""I managed a wavering smile, tasting blood in my mouth. ""You sure about that, Dad? Because he's done everything to me.","['adrian-and-sydney', 'adrian-ivashkov', 'love', 'otp', 'otp-foreva', 'otp-in-love', 'rochelle-mead', 'sex', 'star-crossed-lovers', 'sydney-sage', 'sydrian', 'the-fiery-heart ']"
"love,humor","Man...heats up like a lightbulb: red hot in the twinkling of an eye and cold again in a flash. The female, on the other hand...heats up like an iron. Slowly, over a low heat, like tasty stew. But then, once she has heated up, there's no stopping her.","['humor', 'love', 'men', 'sex', 'women ']"
love,We are asleep until we fall in Love!,['love ']
"love,humor,relationship,funny","She asked if I loved another woman, so I answered honestly and said, “Dinner was great, but I could go for dessert.","['dinner', 'food', 'funny', 'honesty', 'humor', 'love', 'relationships', 'word-junkies ']"
love,"I thought I was going to sweat five years before I'd feel like this.""""I wanted it as much as you did. I've just got a hell of a poker face""I smiled, pressing my lips against his.","['love', 'poker-face ']"
"humor,life,love","If we went by the world's definition of who I'm supposed to be because I look weird... 'Well, surely, this guy can't have a productive life, surely, he doesn't have a sense of humor. Surely, he can't love life.' We stereotype people in this world. And so... if the world thinks you're not good enough, it's a lie, you know. Get a second opinion.","['Love', 'Good', 'Humor']"
love,A first love always occupies a special place.,"['Special', 'Occupies']"
"arts,love","I have never denied my background or my culture. I have taught my child to embrace her Mexican heritage, to love my first language, Spanish, to learn about Mexican history, music, folk art, food, and even the Mexican candy I grew up with.","['Love', 'Music', 'Food']"
love,"I made such a fool of myself,” she lamented.“Love does not make you a fool.”“He didn’t love me back.”“That does not make you a fool, either.”“Just tell me …” Her voice cracked. “When does it stop hurting?”“Sometimes never.","['hurt', 'love ']"
"love,humor,funny",I have never seduced a fish taco for selfish reasons. I am an altruistic lover.,"['absurd', 'creative', 'funny', 'humor', 'love', 'love-quotes', 'silly', 'strange', 'wonderful', 'word-junkies ']"
"love,humor,funny","A string of burglaries is a crime necklace. Everything I have can be stolen except love, because I give it all away.","['creative', 'funny', 'humor', 'love', 'love-quotes', 'silly', 'strange', 'wise', 'wonderful', 'word-junkies ']"
"love,humor,relationship","The summer temperature outside was 45 degrees, so I turned 45 degrees and went right back inside. It was so cold outside because that’s where all her love for me was.","['cold', 'frigid', 'humor', 'love', 'outside', 'relationships', 'summer', 'temperature', 'word-junkies ']"
"love,humor","I have an inconsequential errand to run tomorrow so I’ll get up at 5, be there at 5:30, and wait for them to open up at 10. I’m never late, except in love.","['humor', 'love', 'word-junkies ']"
"love,relationship",A man is lucky if he is the first love of a woman. A woman is lucky if she is the last love of a man.,"['first-love', 'gender-roles', 'last-love', 'love', 'love-makes-you-do-the-wacky', 'men', 'men-mars-women-venus', 'relationships', 'women ']"
"love,humor,funny",I coiled my empty straw wrapper around like a snake. Then I bit it before it could bite me. My love is as dangerous as my drinking habits.,"['bite', 'coil', 'danger', 'dangerous', 'drink', 'drinking', 'empty', 'funny', 'habit', 'habits', 'humor', 'love', 'snake', 'straw', 'word-junkies', 'wrapper ']"
love,"You know that place between sleep and awake, that place where you still remember dreaming? That’s where I’ll always love you. That’s where I’ll be waiting.","['dreams', 'love ']"
"love,humor,relationship","We made love like a goat has four legs like a table. If your dining room table can walk, it’s best to eat while sitting in wheelchairs.","['absurd', 'chairs', 'dining-room-table', 'dinner', 'eat', 'food', 'goat', 'humor', 'legs', 'love', 'meal', 'relationships', 'sex', 'surreal', 'table', 'wheelchair', 'wheelchairs', 'word-junkies ']"
love,"I could still smell her on my fur. It clung to me, a memory of another world.I was drunk with it, with the scent of her. I'd got too close.The smell of summer on her skin, the half-recalled cadence of her voice, the sensation of her fingers on my fur. Every bit of me sang with the memory of her closeness.Too close.I couldn't stay away.",['love ']
love,Stains are even worse when you're the only one who can see them.,"['love', 'stains', 'willem ']"
love,"I will be with her again, or I will die. There aren’t any other options","['ash', 'love', 'meghan-chase', 'obsession', 'the-iron-fey ']"
"life,love",A kiss may ruin a human life,"['kiss', 'life', 'love ']"
love,"It's usually the selfish people who are loved the most. They do what you deny yourself, and you love them for it. You give them your heart.",['love ']
"love,mind",I do my best thinking at night when everyone else is sleeping. No interruptions. No noise. I like the feeling of being awake when no one else is.,"['happy', 'love', 'mind', 'peace', 'relaxation', 'sleep', 'thoughts ']"
love,"Follow me, reader! Who told you that there is no true, faithful, eternal love in this world! May the liar's vile tongue be cut out! Follow me, my reader, and me alone, and I will show you such a love!",['love ']
"love,life","The problem, of course, was that [he] saw the world in black and white. And he got to decide what was black and what was white. You can't love a person who lives that way without fearing him too. Maybe even hating him a little.","['fear', 'life', 'love ']"
"love,humor","I am the three minutes of 180 seconds, and I don’t do refills. I’m a lover, not a farmer.","['absurd', 'creative', 'funny', 'humor', 'love', 'love-quotes', 'silly', 'strange', 'wonderful', 'word-junkies ']"
"love,humor,funny",My love is meatloaf flavored. I just wish my meatloaf was also meatloaf flavored.,"['absurd', 'desire', 'flavor', 'food', 'funny', 'humor', 'love', 'love-quotes', 'meatloaf', 'wish', 'word-junkies ']"
"love,humor","Love is like 9.75 plus .25. That’s 10, for all of you people trying to add fractions on your fingers. I can only count using eight, because I’m too busy using my middle fingers to tell the politicians how much I love them.","['anger', 'counting', 'fingers', 'fractions', 'fuck-you', 'humor', 'love', 'middle-finger', 'politicians', 'politics', 'word-junkies ']"
love,"You have to be very fond of men. Very, very fond. You have to be very fond of them to love them. Otherwise they're simply unbearable.","['love', 'men ']"
"love,humor,funny",Love waits patiently. In the lobby. I’ll be with you as soon as I can.,"['funny', 'humor', 'love', 'patience ']"
"love,humor","And besides . . . I don’t want to leave you. Er, you guys.”He smiled, and it lit up his whole face. “Well, ‘we’ are certainly happy to hear that. Oh, and I’m also happy to watch our darling little love child dragon while you’re in St. Louis.”I grinned back.","['adrian-ivashkov', 'awww', 'contentment', 'conversation', 'humor', 'love', 'marrieds-tbh', 'otp', 'relationship', 'sydney-sage ']"
love,"He must love you very much,' Gavril said once I had my footing.I couldn't look at him. 'What makes you say that?' Gavril sighed. 'I've known Maxon since he was a child. He's never stood up to his father like that.","['america', 'gavril', 'love', 'maxon ']"
"life,love","In the film world, we can all be heroes. In the real world, where heroism can cost you your life or the life of the ones you love, people aren't so willing to make those sacrifices. When they do, they are set apart from the rest of us.","['Love', 'Heroism', 'Rest']"
love,"Listen to the inner light; it will guide you. Listen to inner peace; it will feed you. Listen to inner love; it will transform you, it will divinise you, it will immortalise you.","['Peace', 'Light', 'Listen']"
love,"They said that love was terrifying and tender, wild and sweet, and none of it made any sense.But now I knew that every mad word was true.","['love', 'words ']"
love,"You know what’s a great metaphor for love? Sleeping beauty. Because you have to plow through this incredible thicket of thorns in order to get to beauty, and even then, when you get there, you still have to wake her up.— Tiny Cooper",['love ']
"love,romance","To return to love, to get the love we always wanted but never had, to have the love we want but are not prepared to give, we seek romantic relationships. We believe these relationships, more than any other, will rescue and redeem us. True love does have the power to redeem but only if we are ready for redemption. Love saves us only if we want to be saved.","['love', 'romance ']"
love,Sometimes loneliness makes the loudest noise.,"['aching-heart', 'billy-holiday', 'breakups', 'central-features', 'circumstances', 'comeback', 'desperation', 'dwelling', 'edna-st-vincent-millay', 'ex-lovers', 'feelings', 'hole-in-the-world', 'imagination', 'impressive-comeback', 'intense-desire', 'love', 'mental-environment', 'negative-experiences', 'nostalgia', 'phenomenon', 'reciprocity', 'romantic-life', 'scars', 'st-vincent-millay ']"
love,"how sad and bad and mad it was - but then, how it was sweet","['love', 'nostalgia', 'reflection', 'the-past ']"
"love,humor,funny","If I could bronze my love, it’d be worthy of a silver medal.","['bronze', 'funny', 'humor', 'love', 'medal', 'silver-medal', 'value', 'word-junkies', 'worth', 'worthy ']"
"love,relationship","Falling in love in a Christian way is to say,'I am excited about your future and I want to be part of getting you there. I'm signing up for the journey with you. Would you sign up for the journey to my true self with me? It's going to be hard but I want to get there.","['falling-in-love', 'keller', 'love', 'relationships ']"
love,"You don't have to say I love you to say I love you,""you said with a shrug. ""All you have to do is say my name and I know.""...""Can't you hear it?""you said. ""When you love someone, you say their name different. Like it's safe inside your mouth.","['handle-with-care', 'love', 'picoult ']"
love,"breathtaking, adj.Those mornings when we kiss and surrender for an hour before we say a single word.","['breathtaking', 'dictionary', 'kiss', 'love ']"
"love,humor,relationship","I once loved a girl who almost loved me, but not as much as she loved John Cusack.","['humor', 'love', 'relationships ']"
love,Love is like a virus. It can happen to anybody at any time.,['love ']
love,"You know I'm old in some ways-in others-well, I'm just a little girl. I like sunshine and pretty things and cheerfulness-and I dread responsibility.",['love ']
love,You can’t leave yet. I’m not finished falling in love with you.,['love ']
love,We all have an old knot in the heart we wish to untie.,"['longing', 'loss', 'love', 'memory ']"
love,"Love is the kind of thing that's already happening by the time you notice it, that's how it works, and no matter how old you get, that doesn't change. Except that you can break it up into two entirely distinct types -- love where there's an end in sight and love where there isn't.",['love ']
love,"If I have learned anything in this long life of mine, it is this: in love we find out who we want to be; in war we find out who we are.","['discovery', 'discovery-of-oneself', 'love', 'love-quotes', 'self-discovery', 'war ']"
"love,death","It never gets easier, missing you. And sometimes I wonder if it ever will.","['death', 'love', 'parents', 'vlad ']"
love,"He who is in love is wise and is becoming wiser, sees newly every time he looks at the object beloved, drawing from it with his eyes and his mind those virtues which it possesses.",['love ']
love,But you're so busy changing the worldJust one smile can change all of mine,"['change', 'couples', 'love', 'smile', 'song ']"
love,"Every time I read to her, it was like I was courting her, because sometimes, just sometimes, she would fall in love with me again, just like she had a long time ago. And that's the most wonderful feeling in the world. How many people are ever given that chance? To have someone you love fall in love with you over and over?","['alzheimer-s', 'chance', 'love', 'nicholas', 'nicholas-sparks', 'sparks', 'the-wedding ']"
love,"I only have so much willpower, Helen,""he whispered. ""And since you apparently sleep in the most ridiculously transparent tank top I've ever seen, I'm going to have to ask you to get under the covers before I do something stupid.","['humorous', 'love', 'lucas ']"
love,"If you didn't remember something happening, was it because it never had happened? Or because you wished it hadn't?","['hopeful', 'jodi-picoult', 'loss', 'love', 'memory', 'plain-truth', 'remember', 'sad', 'wish ']"
"love,funny",Unrequited love is the only possible way to give yourself to another without being held in indentured servitude.,"['funny', 'love', 'unrequited-love ']"
"love,humor,romance",Love is an art. Mine could fill a museum the size of your heart.,"['art', 'heart', 'humor', 'love', 'museum', 'romance', 'word-junkies ']"
love,"I have a lucky perfume. I love beautiful smells, but I save one of my favorite perfumes to wear only when I feel like I need some extra luck.","['Beautiful', 'Luck', 'Extra']"
"love,humor","My love is rare, like a hornless unicorn.","['horse', 'humor', 'love', 'rare', 'unicorn', 'word-junkies ']"
"love,humor",I love when my cat crushes his forehead into mine like my skull is an empty beer can. But it’s not—there’s still a sip left.,"['affection', 'beer', 'beer-can', 'brain', 'brains', 'cat', 'cats', 'drink', 'drinking', 'forehead', 'head', 'humor', 'love', 'pet', 'pets', 'sip', 'skull', 'word-junkies ']"
love,You know that I could as soon forget you as my existence!,['love ']
love,"Love is not primarily a relationship to a specific person; it is an attitude, an ordination of character which determines the relatedness of the person to the whole world as a whole, not toward one object of love","['fromm', 'love ']"
"love,hope","I really don't even know you, and yet, in my life, you are forever entangled; to my history, inextricably bound.","['forever', 'hope', 'love ']"
love,"Growth in love comes from a place of absence, where the imagination is left to it’s own devices and creates you to be much more then reality would ever allow.","['absence', 'heartbreak', 'jamie-weise', 'love', 'missing-someone', 'missing-you', 'missing-you-quotes', 'passion ']"
love,"If music be the food of love, play on.","['love', 'music ']"
love,"Think how you love me,""she whispered. ""I don’t ask you to love me always like this, but I ask you to remember. Somewhere inside me there’ll always be the person I am to-night.",['love ']
"love,life,humor,wisdom,truth,relationship",Lightning doesn’t thunder twice. Let that be a lesson in love.,"['humor', 'lesson', 'life', 'lightning', 'love', 'relationships', 'storms', 'teach', 'teacher', 'thunder', 'truth', 'valuable', 'value', 'wisdom', 'wise', 'word-junkies ']"
"love,humor,relationship","I love you the way ice melts in vodka—slowly, seamlessly, and invisibly. It’s a feel-good feeling whether you see it or not.","['alcohol', 'humor', 'ice', 'invisible', 'love', 'relationships', 'vodka', 'word-junkies ']"
