0,1,2
love,"I wore your promise on my finger for one yearI'll wear your name on my heart til I dieBecause you were my boy, you were my only boy forever.","['breaking-up', 'breakups', 'broken-heart', 'broken-hearted', 'broken-hearted-quotes', 'love', 'love-at-first-sight', 'love-hurts', 'lovers', 'lovers-love-story', 'lovers-quarrels-lovers', 'lovers-sadness', 'moving-on', 'passion', 'stories', 'truths ']"
"love,wisdom","Don’t take the high ground and assume you already know what you’ll do. The truth is, when it comes to someone you love, you’ll find there isn’t anything you won’t do.","['abe-mazur', 'love', 'wisdom ']"
love,"Deep in her heart, she wasn't sure she deserved to be happy, nor did she believe that she was worthy of someone who seemed...normal.","['deserve-love', 'love', 'love-worth', 'nicholas-sparks', 'safe-haven ']"
love,"I have come from the End of the World. From the River of Dreams, through the gauntlet and the Briar and the Deep Wyld, in order to stand before you today. I have but one request—to take my place at your side. To resume my duty as your knight, and to protect you and your kingdom for as long as I draw breath.",['love ']
love,Love takes off the masks we fear we cannot live without and know we cannot live within.,['love ']
love,"And in the end, we were all just humans.. drunk on the idea that love, only love, could heal our brokenness.","['brokenness', 'drunk', 'love', 'misattributed-f-scott-fitzgerald ']"
"love,inspiration",Hate looks like everybody else until it smiles,"['dystopia', 'hate', 'inspirational', 'love', 'shatter-me', 'young-adult ']"
"life,love,inspiration,relationship,romance","If it’s the last kiss, we’d better make it last. I hope you don’t have anywhere to be, because I have the rest of my life free.","['aspirational', 'commitment', 'forever', 'free', 'freedom', 'inspirational', 'inspire', 'instaquote', 'kiss', 'kissing', 'lasting', 'life', 'love', 'lovers', 'marriage', 'motivate', 'motivational', 'quote-for-instagram', 'quotes-for-instagram', 'relationships', 'romance', 'romantic', 'sweet', 'word-junkies ']"
"love,romance",Cut the ending. Revise the script. The man of her dreams is a girl.,"['girls', 'lesbian', 'love', 'romance ']"
love,"For each of us, life is a journey. Heavenly Father designed it for us out of love. Each of us has unique experiences and characteristics, but our journey began in the same place before we were born into this world.","['Life', 'Journey', 'Father']"
love,"We are not people who touch each other carelessly; every point of contact between us feels important, a rush of energy and relief.","['affection', 'four', 'love', 'touch', 'tris ']"
"love,romance","I wanted to be his life preserver, the thing that would keep him afloat. Instead, he became my anchor. And I’m tired of drowning.","['hurt', 'love', 'romance', 'teen', 'ya ']"
love,"We should love, not fall in love, because everything that falls, gets broken.","['broken', 'love', 'quote', 'taylor-swift ']"
"love,life,humor,truth,wisdom,relationship,poetry,inspiration",Unreturned love is like trying to make a sandwich with one slice of bread. Don’t stress—fold it in half and love yourself.,"['aspirational', 'beautiful', 'beauty', 'bread', 'food', 'humor', 'inspiration', 'inspire', 'instagram', 'instagram-quote', 'instaquote', 'life', 'love', 'motivate', 'motivation', 'motivational', 'poem', 'poet', 'poetic', 'poetry', 'quote-for-instagram', 'quotes-for-instagram', 'relationships', 'sandwich', 'self-love', 'stress', 'true', 'truism', 'truth', 'unrequited-love', 'unreturned-love', 'wisdom', 'wise', 'word-junkies', 'words-of-wisdom ']"
love,Remember. The way you make love is the way God will be with you.,['love ']
"love,romance",It's so much easier to convince yourself you're madly in love with someone when you know nothing about him.,"['love', 'romance ']"
love,"كما قلت لك : ( قلب الرجل لا يخلو من امرأة ) , قد تكون امرأة حية أو ميتة, قد تكون زوجة أو صديقة, وقد تكون شيئًا آخر. دائمًا توجد امرأة.أمّا إذا رأيت رجلاً ليس في قلبه امرأة فتأكّد أن ما تراه ليس رجلاً, إنه جثّة تريد قبرًا.",['love ']
love,It ought to make us feel ashamed when we talk like we know what we're talking about when we talk about love.,['love ']
love,"You were a summer gift, one I'll always treasure. You were a dream I never wanted to wake up from. You opened my eyes to things I'll never really see. You're the best thing that will ever happen to me.",['love ']
"love,romance","I don't want to be somebody's crush. If somebody likes me, I want them to like the real me, not what they think I am.","['love', 'romance ']"
"love,wisdom",Hate is... It's too easy. Love. Love takes courage.,"['hate', 'love', 'wisdom ']"
love,"I can do pain. That’s the easy part of life. It’s everything else, happiness, laughter, love, that’s fucking complicated.","['callie-and-kayden', 'jessica-sorensen', 'love ']"
"love,truth","Truth without love is brutality, and love without truth is hypocrisy.","['diplomacy', 'hypocrisy', 'love', 'tact', 'truth', 'truth-telling ']"
love,The only queer people are those who don't love anybody.,"['gay', 'lesbian', 'lgbt', 'love', 'queer ']"
love,"Everyone always wants to know how you can tell when it's true love, and the answer is this: when the pain doesn't fade and the scars don't heal, and it's too damned late.","['hurt', 'love', 'pain', 'scars', 'true', 'true-love ']"
love,I love the spirit of Halloween and the energy that comes with it.,"['Energy', 'Spirit', 'Halloween']"
"life,love,inspiration,relationship,poetry,romance,soul","She has a sly smile, and eyes that seem to see my essence as they explore my soul and implore my spirit to enter her. I look at her and I see love.","['aspiration', 'aspire', 'beauty', 'explore', 'eyes', 'implore', 'inspiration', 'inspirational', 'inspire', 'instaquote', 'life', 'love', 'motivate', 'motivation', 'motivational', 'poem', 'poet', 'poetry', 'quote-for-instagram', 'quotes-for-instagram', 'relationships', 'romance', 'romantic', 'sight', 'sly', 'smile', 'soul', 'spirit', 'vision', 'word-junkies ']"
love,My soul sees its equal in you.,"['khalid', 'love', 'shahrzard ']"
"love,hope,inspiration","Sometimes good things fall apart, so better things can fall together.","['hope', 'inspiration', 'love ']"
"love,happiness",I don't understand the point of being together if you're not the happiest.,"['happiness', 'love', 'relationship ']"
"love,life","And life  definitely  doesn't want me To just let it  tell  me that the  girl  I met,The  beautiful, amazing, strong, resilient girl That I fell so  hard  forShould only come in  third Life  knows. Life is trying to  tell  neThat the  girl  I  love The girl I fellSo  hard  for?There's room for her in  first. I'm putting  her  first.","['falling-in-love', 'girl', 'life', 'love ']"
"love,humor,romance","A girl can still admire, can’t she? Even those who can’t afford to go in the store can still window-shop. Right? Knowing he wasn’t for me didn’t mean I couldn’t covet the merchandise.","['attractiveness', 'humor', 'love', 'male-beauty', 'romance', 'sex-appeal ']"
love,How could I have ever been ashamed of loving Dante Quintana?,['love ']
love,"Well my music was different in high school; I was singing about love—you know, things I don't care about anymore.","['high-school', 'lady-gaga', 'love', 'music', 'school ']"
love,"Dexter, I love you so much. So, so much, and I probably always will. I just don't like you anymore. I'm sorry.","['love', 'one-day', 'one-day-david-nicholls', 'sorry ']"
love,"It's interesting. People go to an animal shelter and pick a dog that's been kicked, beaten, and has lost a leg and an eye, and they'll take that dog home and give it love and support, but they don't do that with people.","['Home', 'Support', 'Dog']"
love,What's a fuck when what I want is love?,"['love', 'sex ']"
love,"If one wanted to depict the whole thing graphically, every episode, with its climax, would require a three-dimensional, or, rather, no model: every experience is unrepeatable. What makes lovemaking and reading resemble each other most is that within both of them times and spaces open, different from measurable time and space.","['love', 'reading', 'sex ']"
"love,poetry","I love you because no two snowflakes are alike, and it is possible, if you stand tippy-toe, to walk between the raindrops.","['love', 'poetry', 'rain', 'snow ']"
love,Not like this. He wanted it to be real.,"['fake', 'haymitch', 'katniss', 'love', 'marriage', 'peeta', 'proposal ']"
love,"Love's gift cannot be given, it waits to be accepted.",['love ']
"love,inspiration",Don't marry a rich man. Marry a good man. He will spend his life trying to keep you happy. No rich man can buy that!,"['inspirational', 'inspirational-love', 'love', 'women ']"
love,"Heart, we will forget him,You and I, tonight!You must forget the warmth he gave,I will forget the light.",['love ']
love,Because...because...she came here with me.,"['katniss-everdeen', 'love', 'peeta-mellark', 'the-hunger-games ']"
"love,inspiration","The world is so empty if one thinks only of mountains, rivers & cities; but to know someone who thinks & feels with us, & who, though distant, is close to us in spirit, this makes the earth for us an inhabited garden.","['community', 'connection', 'friendship', 'goethe', 'inspirational', 'love ']"
love,I'm sorry. I know you loved her. It was hard not to.,['love ']
love,I don't let nobody see me wishin' he was mine,"['i-d-lie', 'love', 'lyrics', 'songs', 'taylor-swift', 'unknown-love ']"
love,"You can't hurt me the way you think you can. But even if you could? I would rather die with the taste of you on my tongue than live and never touch you again. I'm in love with you, Mara. I love you. No matter what you do.","['consequences', 'hurt', 'live', 'love', 'taste ']"
"love,humor,relationship",How could I be sleeping with this particular man.... Surely only true love could justify my lack of taste.,"['humor', 'love', 'relationships ']"
love,Perhaps people like us cannot love. Ordinary people can - that is their secret.,['love ']
love,"After all my erstwhile dear, my no longer cherished; Need we say it was not love, just because it perished?","['heartbreak', 'love ']"
love,A kiss on the beach when there is a full moon is the closest thing to heaven.,"['kiss', 'love ']"
"love,romance",We all know interspecies romance is weird.,"['aliens', 'animals', 'biology', 'genetics', 'interspecies', 'love', 'romance', 'sci-fi', 'science-fiction', 'scifi', 'weird', 'weirdness ']"
"friendship,love","Forgiveness is that subtle thread that binds both love and friendship. Without forgiveness, you may not even have a child one day.","['Friendship', 'Child', 'Thread']"
"life,love,inspiration,wisdom,truth,relationship,poetry","Life, it’s made up of two things—time and love. A watch tells one, but what tells the other? We tell each other.","['aspirational', 'aspire', 'beautiful', 'beauty', 'inspiration', 'inspirational', 'inspire', 'instagram-quote', 'instaquote', 'life', 'love', 'lovely', 'motivate', 'motivation', 'motivational', 'poem', 'poet', 'poetry', 'quote-for-instagram', 'quotes-for-instagram', 'relationships', 'time', 'truth', 'watch', 'wisdom', 'wise', 'word-junkies', 'words-of-wisdom ']"
love,"There used to be days that I thought I was okay, or at least that I was going to be. We'd be hanging out somewhere and everything would just fit right and I would think 'it will be okay if it can just be like this forever' but of course nothing can ever stay just how it is forever.","['forever', 'friendship', 'love', 'okay', 'suicide', 'suicide-note ']"
love,I have been loving you a little more every minute since this morning.,['love ']
"love,humor","Huh,""Leo said. ""Well, if you ever get off this island and want a job, let me know. You're not a total klutz.""She smirked. ""A job, eh?""Making things in your forge?""""Nah, we could start our own shop,""Leo said, surprising himself. Starting a machine shop had always been one of his dreams, but he'd never told anyone about it. ""Leo and Calypso's Garage: Auto Repair and Mechanical Monsters.","['calypso', 'funny', 'humor', 'leo-valdez', 'love ']"
"love,poetry","I crave your mouth, your voice, your hair.Silent and starving, I prowl through the streets. Bread does not nourish me, dawn disrupts me, all day I hunt for the liquid measure of your steps.","['love', 'passion', 'poetry', 'sonnet-xi ']"
love,"When people fall in love, they burst into flames.",['love ']
love,"When it comes to men, deal with them as they are, not how you’d like them to be.","['love', 'men', 'relationship ']"
love,Nobody ever gets what they want when it comes to love.,"['disappointment', 'love', 'melancholy ']"
love,"I love you,’ he whispered, and kissed my brow. ‘Thorns and all.","['feyre', 'love', 'tamlin', 'thorns ']"
love,"Herondales.""Zachariah's voice was a breath, half laughter, half pain. ""I had almost forgotten. No other family does so much for love, or feels so much guilt for it. Don't carry the weight of the world on you, Jace. It's too heavy for even a Herondale to bear.","['herondales', 'jace-herondale', 'jem-carstairs', 'love', 'pg-234 ']"
"love,inspiration","I love you, in my mind where my thoughts reside, in my heart where my emotions live, and in my soul where my dreams are born. I love you.","['inspirational', 'love', 'romantic ']"
"love,relationship,positive",One of the best times for figuring out who you are & what you really want out of life? Right after a break-up.,"['breaking-up', 'breakups', 'dating', 'finding-yourself', 'fresh-starts', 'letting-go', 'love', 'loving-yourself', 'moving-on', 'new-beginnings', 'not-settling', 'positive-thinking', 'relationships', 'self-improvement', 'the-end', 'the-single-woman ']"
"love,inspiration","Every day People straighten up the hair, why not the heart?","['inspirational', 'love', 'motivation', 'passion ']"
love,It's hard to love a woman and do anything.,"['love', 'woman ']"
"love,wisdom",الحب هو ذكاء المسافة، ألّا تقترب كثيرًا فتلغي اللهفة، ولا تبتعد طويلًا فتُنسى.,"['love', 'wisdom ']"
love,"I had parents who instilled in me the importance of love, morals and hard work. I give God all the glory because he has brought me through so much.","['Work', 'God', 'Parents']"
love,"Oh, it's always the same,' she sighed, 'if you want men to behave well to you, you must be beastly to them; if you treat them decently they make you suffer for it.","['love', 'men ']"
love,"Love is not patronizing and charity isn't about pity, it is about love. Charity and love are the same -- with charity you give love, so don't just give money but reach out your hand instead.","['charity', 'christian-behavior', 'compassion', 'helping-others', 'love', 'paraphrased', 'service ']"
"love,humor,truth,romance","We're taught that in life, we should try to look on the bright side. Not in this case. In this case, assume rejection first. Assume you're the rule, not the exception. It's liberating. But we also know it's not an easy concept. -He's not just into you","['dating', 'greg-behrendt', 'he-s-not-just-into-you', 'humor', 'humour', 'love', 'marriage', 'romance', 'truth ']"
"love,humor,god,relationship,writing","Making love to me is amazing. Wait, I meant: making love, to me, is amazing. The absence of two little commas nearly transformed me into a sex god.","['absence', 'amazement', 'amazing', 'commas', 'editing', 'funny', 'god', 'humor', 'love', 'lover', 'relationships', 'sex', 'sex-god', 'transform', 'transformation', 'word-junkies', 'writer', 'writing ']"
"love,relationship",Thought I couldn't live without youIt's gonna hurt when it heals tooEven though I really love youI'm gonna smile cause I deserve toQuickly I'm learning to love againAll I know is I'mma be ok,"['breakup', 'couples', 'heartbreak', 'love', 'relationships', 'sad ']"
"love,happiness,faith,hope,positive","Dance. Smile. Giggle. Marvel. TRUST. HOPE. LOVE. WISH. BELIEVE. Most of all, enjoy every moment of the journey, and appreciate where you are at this moment instead of always focusing on how far you have to go.","['appreciation', 'attitude', 'believe', 'counting-your-blessings', 'dance', 'dancing', 'faith', 'faith-in-yourself', 'gratitude', 'happiness', 'happy-life', 'hope', 'journey-of-life', 'live-in-the-moment', 'living-a-happy-life', 'living-life-to-the-fullest', 'love', 'positive-thinking', 'seizing-the-day', 'smile', 'the-here-and-now', 'the-present', 'the-single-woman', 'trust', 'wish', 'your-journey ']"
"love,philosophy,relationship,poetry","The words ‘I Love You’ kill, and resurrect millions, in less than a second.","['intimacy', 'life-lessons', 'love', 'peace', 'peacekeeping', 'philosophy', 'poetry', 'relationships', 'spirituality', 'trust', 'war ']"
love,"This time I wouldn't forget him, because I couldn't ever forgive him - for breaking my heart twice.","['broken-heart', 'forgetting', 'love ']"
"life,love,inspiration,philosophy,relationship,romance,poetry","Our love went from fly to flower to butterfly, and it was meant to beautifully flutter, not sit still on a shelf like a trophy to be collected.","['aspirational', 'beautiful', 'beauty', 'butterflies', 'butterfly', 'collect', 'collection', 'flight', 'flower', 'flowers', 'flutter', 'fly', 'inner-dialogue', 'inspirational', 'inspire', 'instaquote', 'language', 'life', 'love', 'meaning', 'metaphor', 'motivate', 'motivation', 'motivational', 'nature', 'philosophy', 'poem', 'poet', 'poetic', 'poetry', 'quote-for-instagram', 'quotes-for-instagram', 'relationship', 'relationships', 'romance', 'romantic', 'shelf', 'trophy', 'wings', 'word-junkies ']"
love,"It hurts to breathe. It hurts to live. I hate her, yet I do not think I can exist without her.","['betrayal', 'lindsay', 'lost-love', 'love', 'yearning ']"
love,I didn't have a fireworks moment for my salvation. I had a falling in love with Jesus in Sunday school when I was a very young child.,"['Moment', 'Child', 'Sunday']"
"life,love","Kiss a lover, Dance a measure, Find your name And buried treasure. Face your life, It's pain, It's pleasure, Leave no path untaken.","['choice', 'dancing', 'life', 'love', 'name', 'neil-gaiman', 'pain', 'personality', 'pleasure', 'the-graveyard-book', 'treasure ']"
"life,love,wisdom",Voici mon secret. Il est très simple: on ne voit bien qu'avec le cœur. L'essentiel est invisible pour les yeux.,"['le-petit-prince', 'life', 'love', 'wisdom ']"
"love,humor",Love is like breakfast with Mildred. Who’s Mildred? How the heck should I know? I don’t eat breakfast.,"['absurd', 'breakfast', 'food', 'funny', 'humor', 'love', 'word-junkies ']"
love,"Just for the record, she still loves you. She wouldn't bother to torture you if she didn't.",['love ']
love,"Aside from the obvious, Francesca, what do you want in return for supplying information?” Bones asked, getting back to the subject. “You to take me,” she replied at once. “Not gonna happen!” I spat, squeezing him possessively. Three sets of widened eyes fixed on me. That’s when I realized that what I had a firm grip on was no longer his hand.","['funny', 'love', 'vampire ']"
"love,relationship","...the opposite of love is not hate -- it's apathy. It's not giving a damn. If somebody hates me, they must ""feel""something ... or they couldn't possibly hate. Therefore, there's some way in which I can get to them.","['apathy', 'hatred', 'love', 'relationships ']"
love,"The key to a successful relationship isn’t just in the words, it’s in the choice of punctuation. When you’re in love with someone, a well-placed question mark can be the difference between bliss and disaster, and a deeply respected period or a cleverly inserted ellipsis can prevent all kinds of exclamations.",['love ']
love,"But I miss screamin' and fightin' and kissin' in the rain and it's 2 a.m. and I'm cursin' your name. You're so in love the you act insane, and that's the way I loved you.","['insane', 'love', 'the-way-i-loved-you ']"
love,"Isn't it funny.I'm enjoying my hatred so much more than i ever enjoyed love. Love is temperamental. Tiring. It makes demands. Love uses you, changes its mind. But hatred, now, that's something you can use. Sculpt. Wield. It's hard, or soft, however you need it. Love humiliates you, but Hatred cradles you.","['cradle', 'enjoy', 'hate', 'hatred', 'humiliate', 'love', 'sculpt', 'soft', 'tiring', 'use ']"
"love,humor,relationship","We made eyes at each other, and then we made love. We also made other things too, like meatloaf.","['cook', 'flirting', 'food', 'humor', 'love', 'meatloaf', 'relationships', 'sex', 'word-junkies ']"
"love,death","What greater thing is there for two human souls, than to feel that they are joined for life--to strengthen each other in all labor, to rest on each other in all sorrow, to minister to each other in all pain, to be one with each other in silent unspeakable memories at the moment of the last parting?","['couples', 'death', 'fellowship', 'love', 'marriage', 'memory', 'relationship', 'sadness', 'sorrow ']"
"love,humor,relationship","When we make love, I orgasm much sooner than her. That’s because I know a shortcut on my bicycle.","['absurd', 'bicycle', 'humor', 'love', 'orgasm', 'relationships', 'sex', 'word-junkies ']"
love,"I love you more than songs can say, but I can't keep running after yesterday...","['goodbye', 'love ']"
"love,inspiration",The right thing at the wrong tme is the wrong thing.,"['inspirational', 'love', 'timing ']"
love,"The truth was...he was in love with her. Totally over-the-line, no-going-back, not-even-dead-would-he-part kind of shit.","['john-matthew', 'love', 'obsession ']"
love,What does the brain matter compared with the heart?,"['logic', 'love ']"
love,"All the most powerful emotions come from chaos -fear,anger,love- especially love. Love is chaos itself. Think about it! Love makes no sense. It shakes you up and spins you around. And then, eventually , it falls apart.","['chaos', 'lost-love', 'love ']"
love,"When you know my love, my love will warm you.","['amity', 'love ']"
love,"But the you who you are tonight is the same you I was in love with yesterday, the same you I’ll be in love with tomorrow.","['in-love', 'love', 'time ']"
"love,relationship","I believe in love the verb, not the noun.","['love', 'relationships ']"
"love,faith",Dogs have given us their absolute all. We are the center of their universe. We are the focus of their love and faith and trust. They serve us in return for scraps. It is without a doubt the best deal man has ever made.,"['dogs', 'faith', 'love ']"
love,The thing with your heart's desire is that your heart doesn't even know what it desires until it turns up.,['love ']
love,What I love about my husband is that he really allows me to be the best person I can.,"['Best', 'Husband']"
"love,relationship",It’s hard to communicate anything exactly and that’s why perfect relationships between people are difficult to find.,"['love', 'relationships ']"
love,You have my whole heart. You always did.,"['faithfulness', 'fidelity', 'love ']"
love,"I'm not married,""he said softly, ""because I can't stomach the idea of marrying a woman inferior to me in mind and spirit. It would mean the death of my soul.","['love', 'marriage ']"
"love,romance","Before I fellin love with words,with setting skies and singing birds—it was you I fellin love with first.","['love', 'romance ']"
love,This thing about you that you think is your flaw - it's the reason I'm falling in love with you.,"['falling-in-love', 'flaws', 'love ']"
love,"It was brave,""countered Issa. ""It was rare. It was love, and it was beautiful.","['issa', 'love ']"
"love,humor,relationship","It’s me and you, or me and knitting. Don’t make me choose. Ugh, #love.","['choices', 'choose', 'clothing', 'crafts', 'fashion', 'humor', 'knit', 'knitting', 'love', 'relationships', 'word-junkies ']"
"love,romance",Love is a rebellious bird that nobody can tame.,"['ficbookreview-s-fave', 'love', 'romance ']"
love,"Half the night I waste in sighs,Half in dreams I sorrow afterThe delight of early skies;In a wakeful dose I sorrowFor the hand, the lips, the eyes,For the meeting of the morrow,The delight of happy laughter,The delight of low replies.","['love', 'sorrow ']"
"life,love,funny",New streets should be Twitter friendly and be named with hashtags up front. I’d build a house on ‪#‎LoversLane‬.,"['architecture', 'brand', 'branding', 'build', 'building', 'construction', 'content-marketing', 'development', 'friendly', 'funny', 'hashtags', 'home', 'house', 'houses', 'humorous', 'lane', 'life', 'love', 'lover', 'lovers', 'lovers-lane', 'market', 'marketing', 'name', 'names', 'naming', 'plan', 'planning', 'random', 'street', 'streets', 'twitter', 'word-junkies ']"
love,"Their fingers seemed to fit together in just the right way- effortlessly clasped,like perfect complements.",['love ']
"love,romance","Had I been in love, I could not have been more wretchedly blind. But vanity, not love, has been my folly.","['affection', 'blindness', 'denial', 'folly', 'love', 'refusal', 'romance', 'vanity ']"
love,Do not allow me to forget you,"['forgetting', 'love ']"
love,Empty packets of hot sauce remind me of the love I used to have for her. Now all I’m left with is this yummy taco.,"['emptiness', 'empty', 'food', 'hot-sauce', 'love', 'reminder', 'taco', 'word-junkies ']"
love,"I love sleepwalking, because when else would I get to combine exercise and rest?","['brilliant', 'combine', 'exercise', 'funny', 'humor', 'love', 'rest', 'sleep', 'sleeping', 'sleepwalking', 'word-junkies ']"
