0,1,2
"philosophy,poetry","No man was ever yet a great poet, without at the same time being a profound philosopher.","['philosophy', 'poetry ']"
"philosophy,wisdom,poetry,quotes,books",Even if you are alone you wage war with yourself.,"['alone', 'books', 'dejan-stojanovic', 'literature', 'literature-quotes', 'philosophy', 'poetry', 'poetry-quotes', 'poets', 'quotes', 'the-sun-watches-the-sun', 'war', 'wars', 'wisdom', 'yourself ']"
"hope,poetry","Mind led bodyto the edge of the precipice.They stared in desireat the naked abyss.If you love me, said mind,take that step into silence.If you love me, said body,turn and exist.","['hope', 'poetry', 'suicide', 'survival ']"
poetry,You see how I tryTo reach with wordsWhat matters mostAnd how I fail.,"['loss', 'poetry', 'words ']"
poetry,"I should combine a car bumper with a belt, for a fashion accessory that’s safe for office romances. Powdered love poetry sold separately.","['absurd', 'accessory', 'belt', 'bumper', 'car', 'car-bumper', 'fashion', 'humor', 'lit-on-literature', 'love', 'love-poetry', 'office-romance', 'poetry', 'powdered-love-poetry', 'romance', 'romantic', 'safe', 'safety', 'sales', 'salesman', 'salesmanship', 'surreal', 'word-junkies ']"
poetry,"Even this late it happens:the coming of love, the coming of light.",['poetry ']
poetry,"Sometimes with one I love, I fill myself with rage, for fear I effuse unreturn'd love; But now I think there is no unreturn'd love—the pay is certain, one way or another; (I loved a certain person ardently, and my love was not return'd; Yet out of that, I have written these songs.)",['poetry ']
poetry,Twas the night before Thanksgiving. All the food's in the oven. And I'm in the bedroom performin' self lovin'.,"['food', 'masturbation', 'poem', 'poetry', 'thanksgiving ']"
"poetry,books","It is time to float on the waters of the night. Time to wrap my arms around this book and press it to my chest, life preserver in a sea of unremarkable men and women, anonymous faces on the street, a hundred thousand unalphabetized things, a million forgotten hours.","['books', 'poetry ']"
"poetry,relationship",Love me like a wrong turn on a bad roadlate at night.,"['love', 'poetry', 'relationships ']"
poetry,"Alone, alone, all, all alone, Alone on a wide wide sea! And never a saint took pity on My soul in agony.","['lonliness', 'pain', 'poetry', 'suffering ']"
"hope,poetry",You call it hope — that fire of fire!It is but agony of desire.,"['hope', 'poetry ']"
"hope,poetry","There are three lessons I would write-Three words, as with a burning pen, In tracings of eternal light,Upon the heart of men.Have hope! though clouds environ round,And gladness hides her face in scorn,Put thou the shadow from thy brow,No night but hath its morn.Have love! not love alone for one, But man as man thy brother call,And scatter like the circling sun,Thy charities on all.","['hope', 'inspirational', 'lessons', 'love', 'poetry ']"
poetry,The lamb misused breeds public strifeAnd yet forgives the butcher's knife.,"['animal-cruelty', 'hypocrisy', 'poetry', 'vegetarianism ']"
poetry,part memory part distance remainingmine in the ways that I learn to miss you,"['love', 'poetry', 'yearning ']"
poetry,"Every beginning has an end and every end has a new beginning, don't worry, broken soul, life will one day come to an end.","['love', 'poetry ']"
"wisdom,poetry,quotes",To risk life to save a smile on a face of a woman or a child is the secret of chivalry.,"['child', 'chivalry', 'dejan-stojanovic', 'life', 'literature', 'literature-quotes', 'poetry', 'poetry-quotes', 'quotes', 'quotes-to-live-by', 'risk-life', 'secret', 'smile', 'thoughts', 'wisdom', 'woman ']"
"faith,poetry",God moves in mysterious waysHis wonders to performs,"['faith', 'poetry', 'strength ']"
poetry,"It costs me never a stab nor squirm / To tread by chance upon a worm. / Aha, my little dear, / I say, Your clan will pay me back one day.","['awesome-women', 'humor', 'poetry ']"
"poetry,inspiration,writing",Don't you know no one can escapethe power of creatures reaching outwith breath alone?,"['inspiration', 'poetry', 'power', 'russian-author', 'writing ']"
poetry,"Haiku is not a shriek, a howl, a sigh, or a yawn; rather, it is the deep breath of life.","['composition', 'creating', 'haiku', 'japanese', 'poetry', 'zen', 'zen-monks ']"
poetry,"McGough: I'm sorry. I'm afraid I've caught poetry. Mr Bones: Oh really? Well, don't worry, sir - I used to suffer from short stories.McGough: Really? When?Mr Bones: Oh, once upon a time ...","['humor', 'poetry ']"
poetry,"A black cat among roses,phlox, lilac-misted under a quarter moon,the sweet smells of heliotrope and night-scented stock. The garden is very still.It is dazed with moonlight,contented with perfume...","['cats', 'garden', 'lilac', 'poetry ']"
poetry,"You know, there are good reasons to learn how to read. Poetry isn't one of them. I mean, so what if two roads go two ways in a wood? So what? Who cares if it made all that big a difference? What difference? And why should I have to guess what the difference is? Isn't that what he's supposed to say?Why can't poets just say what they want to say and then shut up?","['philistine', 'poetry ']"
"poetry,writing","No one wants to read poetry. You have to make it impossible for them to put the poem down--impossible for them to stop reading it, word after word. You have to keep them from closing the book.","['muriel-rukeyser', 'poetcast', 'poetry', 'poets-org', 'sharon-olds', 'writing ']"
poetry,"Resolve, and thou art free.","['poetry', 'resolution ']"
poetry,"I am—yet what I am none cares or knows; My friends forsake me like a memory lost: I am the self-consumer of my woes— They rise and vanish in oblivious host, Like shadows in love’s frenzied stifled throes And yet I am, and live—like vapours tossed",['poetry ']
poetry,Il pleure dans mon coeurComme il pleut sur la ville.Tears are shed in my heart like the rain on the town.,['poetry ']
"poetry,soul","Love's mysteries in souls do grow,But yet the body is his book.","['body', 'love', 'poetry', 'sexuality', 'soul ']"
"poetry,writing",How to Write a PoemCatch the airaround the butterfly.,"['air', 'butterfly', 'poetry', 'writing ']"
poetry,"One fine day, in the middle of the night, two dead boys got up to fight. Back to back they faced each other. They pulled out their swords and shot one another. One deaf cop, on the beat heard the noise, and came and shot the two dead boys.","['faeries', 'poetry', 'valiant ']"
poetry,"We are all instruments pulling the bows across our own lungs. Windmills, still startling in every storm. Have you ever seen a newborn blinking at the light? I wanna do that every day. I wanna know what the kite called itself when it got away, when it escaped into the night...",['poetry ']
poetry,My brain hums with scraps of poetry and madness.,['poetry ']
poetry,You shall create beauty not to excite the sensesbut to give sustenance to the soul.,"['chilean', 'poetry ']"
poetry,It is strange how a scrap of poetry works in the mind and makes the legs move in time to it along the road.,"['poem', 'poems', 'poetry ']"
poetry,I've got mixed feelings about poetry cause done well poetry is fantastic. But not many people are capable of doing it well. I think you should have some kind of license to perform poetry. A poetic license perhaps.,['poetry ']
poetry,"Our love was bornoutside the walls,in the wind,in the night,in the earth,and that's why the clay and the flower,the mud and the rootsknow your name.","['earth', 'love', 'nature', 'pablo-neruda', 'poetry ']"
poetry,forsan et haec olim meminisse iuvabit.and perhaps it will be pleasing to have remembered these things one day,"['4-203', 'forsan', 'meminisse', 'optimism', 'perhaps', 'poetry ']"
poetry,We have seen the best minds of our generation destroyed by boredom at poetry readings.,"['humor', 'paraphrased', 'poetry ']"
poetry,She dealt her pretty words like Blades --How glittering they shone --And every One unbared a NerveOr wantoned with a Bone --She never deemed -- she hurt --That -- is not Steel's Affair --A vulgar grimace in the Flesh --How ill the Creatures bear --To Ache is human -- not polite --The Film upon the eyeMortality's old Custom --Just locking up -- to Die.,['poetry ']
"poetry,inspiration","won't you celebrate with mewhat i have shaped intoa kind of life? i had no model.born in babylonboth nonwhite and womanwhat did i see to be except myself?i made it uphere on this bridge betweenstarshine and clay,my one hand holding tightmy other hand; come celebratewith me that everydaysomething has tried to kill meand has failed.","['african-american-poets', 'inspiration', 'life', 'national-poetry-month', 'poem-in-your-pocket-day', 'poetry', 'positive-motivation ']"
"poetry,writing","When you write about what you dream, you become a writer.When you dream about what you write, you become haunted by a curse.","['curse', 'poetry', 'writer', 'writing ']"
poetry,"Anyone who says, “Here’s my address,write me a poem,” deserves something in reply.So I’ll tell a secret instead:poems hide. In the bottoms of our shoes,they are sleeping. They are the shadowsdrifting across our ceilings the moment before we wake up. What we have to dois live in a way that lets us find them.",['poetry ']
poetry,Everything comes down so pasteurizedeverything comes down 16 degreesthey say your amplifier is too loudturn your amplifier downare we high all alone on our kneesmemory is just hips that swinglike a clockthe past projects fantastic scenestic/toc tic/toc tic/tocfuck the clock!,"['patti-smith', 'poetry ']"
poetry,"When no one is looking,I swallow deserts and cloudsand chew on mountainsknowing they are sweet bones!When no one is lookingand I want to kiss God,I just lift my own hand to my mouth.","['poetry', 'sufi ']"
poetry,"The inmost spirit of poetry, in other words, is at bottom, in every recorded case, the voice of pain – and the physical body, so to speak, of poetry, is the treatment by which the poet tries to reconcile that pain with the world.","['pain', 'poetry ']"
"hope,poetry,relationship,quotes,writing",Maybe I hope too much. Maybe I dream too much or maybe I love too much to just give up on you.,"['happyquotes', 'hope', 'inspirational', 'inspirationalquotes', 'inspired', 'instadaily', 'instaquote', 'lovequotes', 'pinquotes', 'poems', 'poetry', 'quote', 'quoteoftheday', 'quotes', 'relationships', 'rmdrake', 'sadquotes', 'sayings', 'spokenword', 'tattoo', 'typewriter', 'vsco', 'writer', 'writing ']"
poetry,"How does the ordinary person come to the transcendent? For a start, I would say, study poetry. Learn how to read a poem. You need not have the experience to get the message, or at least some indication of the message. It may come gradually. (92)","['poetry', 'transcendence ']"
poetry,"Some men are born sodomites, some achieve sodomy, and some have sodomy thrust upon them...","['poetry', 'satire', 'sodomy ']"
"poetry,writing",Between my finger and my thumb The squat pen rests; snug as a gun.,"['digging', 'poetry', 'writing ']"
poetry,"What would the world be, once bereft Of wet and of wildness? Let them be left, O let them be left, wildness and wet; Long live the weeds and the wilderness yet.","['nature', 'poetry ']"
poetry,"In the bleak midwinter Frosty wind made moan, Earth stood hard as iron, Water like a stone; Snow had fallen, Snow on snow, Snow on snow, In the bleak midwinter, Long ago.","['hymn', 'poetry ']"
poetry,Valentine's Day is the poet's holiday.,"['poetry', 'valentine-s-day ']"
poetry,"That's not a run in your stocking, it's a hand on your leg.",['poetry ']
"hope,poetry,relationship,writing,quotes","She was broken from moment to moment, watching her world collide she felt lost inside herself. She fell apart for a passion that flamed beneath her. She waited and died a hundred times, it dripped from her pores. The moment she let go, she soared over the stillness like the star she was born to be.","['happyquotes', 'hope', 'inspirational', 'inspirationalquotes', 'inspired', 'instadaily', 'instaquote', 'lovequotes', 'pinquotes', 'poems', 'poetry', 'quote', 'quoteoftheday', 'quotes', 'relationships', 'rmdrake', 'sadquotes', 'sayings', 'spokenword', 'tattoo', 'typewriter', 'vsco', 'writer', 'writing ']"
"hope,poetry,relationship,quotes,writing","It was never about the world being too big, it was more like she was too much for the world to handle.","['happyquotes', 'hope', 'inspirational', 'inspirationalquotes', 'inspired', 'instadaily', 'instaquote', 'lovequotes', 'pinquotes', 'poems', 'poetry', 'quote', 'quoteoftheday', 'quotes', 'relationships', 'rmdrake', 'sadquotes', 'sayings', 'spokenword', 'tattoo', 'typewriter', 'vsco', 'writer', 'writing ']"
poetry,"Wild Nights – Wild Nights!Were I with theeWild Nights should beOur luxury!Futile – the winds –To a heart in port –Done with the compass –Done with the chart!Rowing in Eden –Ah, the sea!Might I moor – Tonight –In thee!","['passion', 'poetry ']"
poetry,The courage of the poet is to keep ajar the door that leads into madness.,['poetry ']
"poetry,books","For books are more than books, they are the lifeThe very heart and core of ages past,The reason why men lived and worked and died,The essence and quintessence of their lives.","['books', 'poetry ']"
poetry,"They are not long, the days of wine and roses:Out of a misty dreamOur path emerges for awhile, then closesWithin a dream.","['life', 'poetry', 'transience ']"
"love,poetry",Take away love and our earth is a tomb.,"['Earth', 'Tomb']"
"wisdom,poetry,quotes",Words rich in meaning can be cheap in sound effects.,"['cheap', 'dejan-stojanovic', 'effects', 'literature', 'literature-quotes', 'meaning', 'poetry', 'poetry-quotes', 'quotes', 'quotes-to-live-by', 'rich', 'thoughts', 'wisdom', 'words ']"
poetry,"The rain set early in tonight,The sullen wind was soon awake,It tore the elm-tops down for spite,And did its best to vex the lake:I listened with heart fit to break.When glided in Porphyria; straightShe shut the cold out and the storm,And kneeled and made the cheerless grateBlaze up and all the cottage warm;","['abnormal', 'insane', 'lover', 'murder', 'poetry', 'porphyria', 'storm', 'strangle ']"
poetry,"...But...to sing,to dream, to smile, to walk, to be alone, be free,with a voice that stirs and an eye that still can see!To cock your hat to one side, when you pleaseat a yes, a no, to fight, or- make poetry!To work without a thought of fame or fortune,on that journey, that you dream of, to the moon!Never to write a line that's not your own...","['inspirational', 'poetry', 'writers-quotes ']"
poetry,"Come windless invaderI am a carnival ofStars, a poem of blood.","['haiku', 'poetry ']"
poetry,"This is perhaps the most noble aim of poetry, to attach ourselves to the world around us, to turn desire into love, to embrace, finally what always evades us, what is beyond, but what is always there – the unspoken, the spirit, the soul.",['poetry ']
poetry,"And, even yet, I dare not let it languish,Dare not indulge in memory’s rapturous pain;Once drinking deep of that divinest anguish,How could I seek the empty world again?","['memories', 'poetry ']"
"hope,poetry,relationship,quotes,writing","She wildly burned for the one she loved and he stood there watching, hoping he too would catch a blaze from the violence stirring in her heart.","['happyquotes', 'hope', 'inspirational', 'inspirationalquotes', 'inspired', 'instadaily', 'instaquote', 'lovequotes', 'pinquotes', 'poems', 'poetry', 'quote', 'quoteoftheday', 'quotes', 'relationships', 'rmdrake', 'sadquotes', 'sayings', 'spokenword', 'tattoo', 'typewriter', 'vsco', 'writer', 'writing ']"
poetry,The master said You must write what you see.But what I see does not move me.The master answered Change what you see.,"['perception', 'poetry ']"
poetry,"If you cannot be a poet, be the poem.",['poetry ']
poetry,"Sometimes I dreamthat everything in the world is here, in my room, in a great closet, named and orderly,and I am here too, in front of it, hardly able to see for the flash and the brightness—and sometimes I am that madcap person clapping my hands and singing; and sometimes I am that quiet person down on my knees.",['poetry ']
poetry,Love is the poetry of the senses!,"['poetry', 'quote ']"
poetry,I am sore wounded but not slainI will lay me down and bleed a whileAnd then rise up to fight again,"['perseverance', 'poetry ']"
poetry,"Soul receives from soul that knowledge, therefore not by book nor from tongue. If knowledge of mysteries come after emptiness of mind, that is illumination of heart.","['inspirational', 'poetry', 'spiritual ']"
"poetry,soul","Sometimes I think,I need a spare heart to feel all the things I feel.","['deep', 'deep-feelings', 'deep-love', 'depth', 'emotions', 'heart', 'poetry', 'poetry-quotes', 'sensitive', 'sensitive-souls', 'sensitivity', 'soul ']"
poetry,The war to preserve the privilege of mythmaking,"['iraq', 'line', 'motivation', 'poetry', 'politics', 'prodigal', 'war ']"
"wisdom,poetry",Wordsare powerfulforces of nature.they are destruction.they are nourishment. they are flesh. they are water.they are flowers and bone.they burn. they cleansethey erase. they etch. they can eitherleave youfeelinghomelessor brimmingwith home.,"['indian-authors', 'poetry', 'poetry-quotes', 'powerful', 'wisdom', 'words', 'words-have-power ']"
"wisdom,poetry","WisdomWhen I have ceased to break my wings Against the faultiness of things, And learned that compromises wait Behind each hardly opened gate, When I can look Life in the eyes, Grown calm and very coldly wise, Life will have given me the Truth, And taken in exchange -- my youth.","['ageing', 'life', 'poetry', 'wisdom', 'youth ']"
poetry,"My soul is wrapped in harsh repose,Midnight descends in raven-colored clothes,But soft... behold!A sunlight beamButting a swath of glimmering gleam.My heart expands,'tis grown a bulge in it,Inspired by your beauty...Effulgent.",['poetry ']
poetry,"Poetry is the language of intensity. Because we are going to die, an expression of intensity is justified.",['poetry ']
poetry,We didn't start the fireIt was always burningSince the world's been turningWe didn't start the fireNo we didn't light itBut we tried to fight it,"['inspirational', 'lessons', 'life', 'music', 'poetry ']"
poetry,I Still Have Everything You Gave MeIt is dusty on the edges.It is slightly rotten.I guard it without thinking.I focus on it once a yearwhen I shake it out in the wind.I do not ache.I would not trade.,['poetry ']
poetry,The grass as bristly and stout as chives and me wondering when the ground will break and me wondering how anything fragile survives,['poetry ']
poetry,"Rather than words comes the thought of high windows:The sun-comprehending glass,And beyond it, the deep blue air, that showsNothing, and is nowhere, and is endless.",['poetry ']
poetry,John Keats / John Keats / John / Please put your scarf on.,"['glass', 'more', 'poetry', 'see ']"
"poetry,writing","Rem tene, verba sequentur: grasp the subject, and the words will follow. This, I believe, is the opposite of what happens with poetry, which is more a case of verba tene, res sequenter: grasp the words, and the subject will follow.","['poetry', 'writing ']"
"hope,poetry,relationship,quotes,writing",She needed the chaos within her in order to discover the extraordinary no man could ever reach.,"['happyquotes', 'hope', 'inspirational', 'inspirationalquotes', 'inspired', 'instadaily', 'instaquote', 'lovequotes', 'pinquotes', 'poems', 'poetry', 'quote', 'quoteoftheday', 'quotes', 'relationships', 'rmdrake', 'sadquotes', 'sayings', 'spokenword', 'tattoo', 'typewriter', 'vsco', 'writer', 'writing ']"
poetry,We real cool. We Left school. We Lurk late. We Strike straight. We Sing sin. We Thin gin. We Jazz June. We Die soon.,['poetry ']
poetry,All I know is a door into the dark,"['darkness', 'poetry ']"
poetry,The characters in my novels are my own unrealised possibilities. That is why I am equally fond of them all and equally horrified by them. Each one has crossed a border that I myself have circumvented.,"['characters', 'poetic', 'poetry', 'prose', 'writers ']"
poetry,I'd rather be thin than famousbut I'm fatpaste that in your broadway show,['poetry ']
poetry,A grain of poetry suffices to season a century.,['poetry ']
poetry,You will never be alone with a poet in your pocket.,['poetry ']
poetry,you will never catch up.Walk around feeling like a leafknow you could tumble at any second.Then decide what to do with your time.--The Art of Disappearing,['poetry ']
"poetry,writing","Writing is not a matter of time, but a matter or of space. If you don't keep space in your head for writing, you won't write even if you have the time.","['balance', 'creativity', 'poetry', 'space', 'time', 'writing ']"
"poetry,writing","Green in nature is one thing, green in literature another. Nature and letters seem to have a natural antipathy; bring them together and they tear each other to pieces.","['antipathy', 'drama', 'green', 'literature', 'nature', 'poetry', 'writing ']"
poetry,Inebriate of Air — am I —And Debauchee of Dew —Reeling — thro endless summer days —From Inns of Molten Blue —,"['nature', 'poetry ']"
poetry,You are ice and fire The touch of you burns my hands like snow,"['longing', 'love', 'poetry ']"
poetry,"Fireflies in the GardenBy Robert Frost 1874–1963 Here come real stars to fill the upper skies, And here on earth come emulating flies, That though they never equal stars in size, (And they were never really stars at heart) Achieve at times a very star-like start. Only, of course, they can't sustain the part.","['fireflies', 'frost', 'nature', 'poetry', 'robert', 'stars ']"
"poetry,writing",Writing poetry and reading books causes brain damage.,"['humor', 'poetry', 'writing ']"
poetry,When soul meets soul on lovers' lips.,"['poetry', 'shelley ']"
poetry,all they want to dois tie the poem to a chair with ropeand torture a confession out of it.They begin beating it with a hoseto find out what it really means.,['poetry ']
poetry,"There is another world, and it is in this one.",['poetry ']
poetry,"I wake to sleep, and take my waking slow. I feel my fate in what I cannot fear. I learn by going where I have to go.","['poetry', 'sleep ']"
"poetry,writing",He drove his mind into the abyss where poetry is written.,"['poetry', 'writing ']"
poetry,There is no poetry where there are no mistakes.,['poetry ']
poetry,Rocket shipsare excitingbut so are roseson a birthday.,"['genius', 'poetry', 'space-exploration ']"
poetry,"And must I then, indeed, Pain, live with youall through my life?-sharing my fire, my bed,Sharing-oh, worst of all things!-the same head?-And, when I feed myself, feeding you too?","['depression', 'pain', 'poetry', 'suffering ']"
poetry,One must read poetry with one's nerves.,['poetry ']
poetry,Poetry is a life-cherishing force.,['poetry ']
poetry,"I believe in the flesh and the appetites; Seeing, hearing, feeling, are miracles, and each part and tag of me is a miracle. Divine am I inside and out, and I make holy whatever I touch or am touch’d from;The scent of these arm-pits, aroma finer than prayer; This head more than churches, bibles, and all the creeds.","['poetry', 'sensuality ']"
poetry,i don't want to hate the presidenti don't want to go to harvardi don't want to win the pulitzer prizei just want to sit in my bathtuband think about relationships i will never havewith people i will never meetand then go lay in my bedwith a magnifying glassand count all the stiches in my sheetsuntil i fall asleepand wake upto repeat again.,['poetry ']
poetry,Where do the words gowhen we have said them?,"['poetry', 'words ']"
"poetry,education",Great poetry needs no interpreter other than a responsive heart.,"['education', 'poetry ']"
poetry,"This poetry. I never know what I'm going to say.I don't plan it.When I'm outside the saying of it,I get very quiet and rarely speak at all.","['poetry', 'silence ']"
"hope,relationship,poetry,quotes,writing",Its dark and I’m reading my scars because our moments remind me of where I should be.,"['happyquotes', 'hope', 'inspirational', 'inspirationalquotes', 'inspired', 'instadaily', 'instaquote', 'lovequotes', 'pinquotes', 'poems', 'poetry', 'quote', 'quoteoftheday', 'quotes', 'relationships', 'rmdrake', 'sadquotes', 'sayings', 'spokenword', 'tattoo', 'typewriter', 'vsco', 'writer', 'writing ']"
poetry,even in the loneliest momentsi have been therefor myself.,"['inspirational', 'loneliness', 'lonely', 'love-yourself', 'poetry', 'poetry-quotes', 'self-empowerment', 'self-esteem', 'self-help ']"
poetry,Love shall be our token; love be yours and love be mine.,"['love', 'poetry ']"
poetry,Good poetry makes the universe reveal a secret.,['poetry ']
poetry,In fact she herself once blamed meKyprogeneiabecause I prayed this word:I want.,"['poetry', 'poetry-quotes ']"
"poetry,inspiration","Doubt not, O poet, but persist. Say 'It is in me, and shall out.' Stand there, balked and dumb, stuttering and stammering, hissed and hooted, stand and strive, until at last rage draw out of thee that dream-power which every night shows thee is thine own; a power transcending all limit and privacy, and by virtue of which a man is the conductor of the whole river of electricity.","['art', 'inspiration', 'poetry ']"
poetry,"All days are nights to see till I see thee, And nights bright days when dreams do show thee me.","['dreams', 'love', 'poetry', 'sonnet-43', 'sonnet-xliii ']"
"philosophy,wisdom,poetry,quotes,books","You not only are hunted by others, you unknowingly hunt yourself.","['books', 'dejan-stojanovic', 'hunted', 'hunting', 'literature', 'literature-quotes', 'others', 'philosophy', 'poetry', 'poetry-quotes', 'poets', 'quotes', 'the-sun-watches-the-sun', 'wisdom', 'yourself ']"
