0,1,2
religion,"Man created God in his image: intolerant, sexist, homophobic and violent.","['misattributed-marie-de-france', 'religion ']"
religion,"No religion is perfect, not after man gets through with it.","['christopher-pike', 'religion ']"
"god,faith,religion","I believe in God the way I believe in quarks. People whose business it is to know about quantum physics or religion tell me they have good reason to believe that quarks and God exist. And they tell me that if I wanted to devote my life to learning what they've learned, I'd find quarks and God just like they did.","['agnosticism', 'atheism', 'faith', 'god', 'religion ']"
religion,"أخرج الله سبحانه الأبوين من الجنة بذنب واحد ارتكباه, وخالفا فيه نهيه.ولعن إبليس, وطرده, وأخرجه من ملكوت السماء بذنب ارتكبه, وخالف فيه أمره.ونحن معاشر الحمقى_ كما قيل_ : نصل الذنوب إلى الذنوب ونرتجي**درك الجنان لدى النعيم الخالد ..ولقد علمنا أخرج الأبوين من** ملكوتها الأعلى بذنب واحد",['religion ']
"religion,education","Untilled ground, however rich, will bring forth thistles and thorns; so also the mind of man.","['education', 'inspirational', 'religion ']"
religion,Conflict is inevitable but combat is optional.,['religion ']
religion,"The Reformer is always right about what's wrong. However, he's often wrong about what is right.","['catholicism', 'christianity', 'humor', 'protestantism', 'reformation', 'religion ']"
religion,"Yet rather than calling the earliest religions, which embraced such an open acceptance of all human sexuality, 'fertility cults,' we might consider the religions of today as strange in that they seem to associate shame and even sin with the very process of conceiving new human life. Perhaps centuries from now scholars and historians will be classifying them as 'sterility cults.","['beliefs', 'goddess', 'pagan', 'religion', 'religions', 'sexuality ']"
religion,أخسر الناس صفقة من اشتغل عن الله بنفسه، بل أخسر منه من اشتغل عن نفسه بالناس,['religion ']
religion,"You believe in God?""demanded Billy Karma.""I believe in thirty-seven separate and distinct gods,""answered Argyle proudly. ""That puts me thirty-six ahead of you.""""It makes you a pagan.""""It makes you a man of limited vision,""said Argyle.",['religion ']
religion,Churches thrive on martyrdom and persecution.,['religion ']
"philosophy,faith,religion",All religions are based on obsolete terminology.,"['faith', 'philosophy', 'philosophy-of-religion', 'religion', 'theology', 'translation ']"
"faith,religion,science",What we call rational grounds for our beliefs are often extremely irrational attempts to justify our instincts.,"['belief', 'faith', 'religion', 'science', 'skepticism ']"
"faith,knowledge,religion","I am more afraid that this people have so much confidence in their leaders that they will not inquire for themselves of God whether they are led by him. I am fearful they settle down in a state of blind self security. Let every man and woman know, by the whispering of the Spirit of God to themselves, whether their leaders are walking in the path the Lord dictates, or not.","['faith', 'knowledge', 'religion', 'spirituality ']"
"knowledge,religion",To know much and taste nothing-of what use is that?,"['catholicism', 'christianity', 'inspirational', 'knowledge', 'life', 'religion', 'spirituality ']"
"religion,science",Do those people who hold up the Bible as an inspiration tomoral rectitude have the slightest notion of what is actually writtenin it?,"['evil', 'good', 'religion', 'science ']"
religion,"I'm not out to disturb anybody's faith. I happen to be happy and comfortable with a belief system that has a dual deity and operates on a lunar schedule. It suits my needs. If you happen to be happy and comfortable with a belief system that features a single masculine deity and operates on a solar schedule, fine. I don't give a fat damn. What matters is what you do, not who's name you do it in.","['beliefs', 'religion', 'tolerance ']"
religion,"For me, religion is like a rhinoceros: I don't have one, and I'd really prefer not to be trampled by yours.","['religion', 'tolerance ']"
religion,"I need Christ, not something that resembles Him.","['christ', 'need', 'religion ']"
religion,"religion is about having the right answers, and some of their answers are right... but i am about the process that takes you to the living answer... it will change you from the inside. there are a lot of smart people who are able to say a lot of right things from their brain because they have been told what the right answers are, but they don't know me at all.","['religion', 'the-shack ']"
"philosophy,religion","Nobody understands the nature of the Church, or the ringing note of the creed descending from antiquity, who does not realize that the whole world once very nearly died of broadmindedness and the brotherhood of all religions.","['philosophy', 'religion ']"
"god,religion",All men are Prophets or else God does not exist.,"['atheism', 'equality', 'god', 'humanism', 'prophecy', 'religion', 'responsbility ']"
religion,"With the moon walk, the religious myth that sustained these notions could no longer be held. With our view of earthrise, we could see that the earth and the heavens were no longer divided but that the earth is in the heavens. (105)","['earth', 'heaven', 'moon', 'myth', 'perspective', 'religion ']"
religion,"Finaly, my brethren, be strong in the Lord and in the power of His might. Put on the whole armor of God, that you may be able to stand against the wiles of the devil. -Ephesians 6:10-11","['bible', 'religion ']"
religion,Allah is the Greatest. I'm just the greatest boxer,['religion ']
religion,When the government puts its imprimatur on a particular religion it conveys a message of exclusion to all those who do not adhere to the favored beliefs. A government cannot be premised on the belief that all persons are created equal when it asserts that God prefers some.,"['history', 'politics', 'religion', 'separation-of-church-and-state ']"
religion,"When the stakes are this high- when calling God by the right name can make the difference between eternal happiness and eternal suffering, it is impossible to respect the beliefs of others who don't believe as you do.","['agnosticism', 'atheism', 'belief', 'ethics', 'humanism', 'religion', 'spirituality ']"
religion,No matter what I said they insisted on thinking of God as something outside themselves. Something that yearns to take every indolent moron to His breast and comfort him. The notion that the effort has to be their own . . . and that the trouble they are in is all their own doing . . . is one that they can't or won't entertain.,"['psychology', 'religion ']"
religion,"When you can flatten entire cities at a whim, a tendency towards quiet reflection and seeing-things-from-the-other-fellow's-point- of-view is seldom necessary.",['religion ']
"philosophy,religion",Sitting still is a pain in the ass.,"['buddhism', 'meditation', 'philosophy', 'religion ']"
"truth,faith,religion",Faith is believing in something you know isn't true.,"['belief', 'believe', 'faith', 'religion', 'truth ']"
"faith,religion,science","knowledge, absolutely sure of its infallibility, is faith","['dystopia', 'faith', 'religion', 'science ']"
"death,religion","the first quality of an honest man is contempt for religion, which would have us afraid of the most natural thing in the world, which is death; and would have us hate the one beautiful thing destiny has given us, which is life.","['beauty', 'death', 'irreligion', 'life', 'religion ']"
"god,religion","You don't have to stop thinking and asking questions to believe in God, child. If He'd wanted a flock of eight billion sheep, He wouldn't have given us opposable thumbs, much less free will.","['god', 'religion ']"
religion,We make time for what we truly value. We build habits and routines around the things that really matter to us. This is an important principle to understand as we seek to build our lives around the gospel. Do you want a cross centered life? A cross centered life is made up of cross centered days.,"['christian-behavior', 'religion ']"
religion,"I think the attempt to defend belief can unsettle it, in fact, because there is always an inadequacy in argument about ultimate things.",['religion ']
"religion,education","Only a very few can be learned, but all can be Christian, all can be devout, and – I shall boldly add – all can be theologians.","['christianity', 'education', 'learning', 'religion', 'theology ']"
religion,I always tell my Western friends that it is best to keep your own tradition. Changing religion is not easy and sometimes causes confusion. You must value your tradition and honor your own religion.,"['christianity', 'religion ']"
"philosophy,religion","Isn't wine prohibited here?""the boy asked. ""It's not what enters men's mouths that's evil,""said the alchemist. ""It's what comes out of their mouths that is.","['evil', 'philosophy', 'religion ']"
"god,religion",If I convert it's because it's better that a believer dies than that an atheist does.,"['afterlife', 'atheism', 'atheist', 'christianity', 'death', 'god', 'gods', 'hitchens', 'humor', 'religion ']"
"faith,god,religion","For all works and things, which are either commanded or forbidden by God and thus have been instituted by the supreme Majesty, are 'musts.' Nevertheless, no one should be dragged to them or away from them by the hair, for I can drive no man to heaven or beat him into it with a club.","['christianity', 'faith', 'god', 'religion', 'service ']"
religion,"There was a time when people accepted magical experiences as natural. There were no priests then, and no one went chasing after the secrets of the occult.","['magic', 'religion', 'spirituality ']"
religion,"A man must be prepared not only to be a martyr, but to be a fool. It is absurd to say that a man is ready to toil and die for his convictions if he is not even ready to wear a wreathe around his head for them.","['apologetics', 'inspirational', 'religion ']"
religion,Isn't this enough? Just this world? Just THIS?,"['freethinking', 'music', 'religion', 'skepticism', 'song-lyrics', 'spirituality ']"
religion,"The average man, who does not know what to do with his life, wants another one which will last forever.",['religion ']
religion,"I’m sure I am wrong about many things, although I’m not sure exactly which things I’m wrong about. I’m even sure I’m wrong about what I think I’m right about in at least some cases.","['christianity', 'humility', 'religion ']"
religion,"We are not as Christ-centered and cross-cherishing as we should be, because we do not ponder the truth that everything good, and everything bad that God turns for the good, was purchased by the sufferings of Christ.","['christianity', 'religion ']"
"faith,religion",Living in a world such as this is like dancing on a live volcano.,"['belief', 'buddhism', 'faith', 'japan', 'life', 'religion', 'spirituality ']"
"god,religion","With or without God, good decisions can be made; But only with God will great decisions be made.","['decision', 'god', 'good', 'religion', 'smart ']"
"faith,religion","Guys like him, the ones who grip the Bible so tight they leave fingernail grooves, they're the ones who are the most scared of their dark side. Always going too far the other way, fighting for the Lord, often just because it gives them an excuse to fight.","['faith', 'religion ']"
religion,"I think it [religion] is an art, the greatest one; an extension of the communion all the other arts attempt.","['art', 'religion ']"
religion,قال بعض العارفين:من قرت عينه بالله قرت به كل عين ،ومن لم تقر عينه بالله تقطعت نفسه على الدنيا حسرات ،ويكفي في فضل هذه اللذة وشرفها انها تخرج من القلب ألم الحسرة على مايفوت من هذه الدنيا ، حتى انه ليتألم بأعظم مايلتذ به من أهلها ويفر منه فرارهم من المؤلم .,"['allah-روضة-المحبين', 'religion ']"
religion,A religion that takes no account of practical affairs and does not help to solve them is no religion.,"['peace', 'religion ']"
religion,وتجديد الإسلام ليس نقل الدين من مكانه إلى حيث يهوى الناس، بل نقل الناس من نطاق أهوائهم إلى حيث يرضى الله,['religion ']
religion,There seemed to be some correlation between devotion to God and a misguided zeal for marshmallows.,"['marshmallows', 'naked', 'religion ']"
religion,"The purpose of the gospel is to make bad men good and good men better, and to change human nature.","['gospel', 'human-nature', 'religion ']"
"philosophy,god,religion,mind",the body is wiser than its inhabitants. the body is the soul. the body is god’s messenger.,"['body', 'god', 'health', 'mind', 'philosophy', 'religion ']"
"faith,hope,religion","O Diabo, invejoso, fez o homem confundir fé com religião e amor com casamento.","['faith', 'hope', 'life', 'love', 'religion ']"
"god,religion","You will be at your best forever, Even now you have good moments. Occasional glimpses of your heavenly self. When you change your baby's diaper, forgive your boss's temper, tolerate your spouse's moodiness, you display traces of saintliness.","['christ', 'forgiveness', 'god', 'heaven', 'love', 'lucado', 'religion ']"
"faith,religion",[I]t is difficult to imagine a set of beliefs more suggestive of mental illness than those that lie at the heart of many of our religious traditions.,"['belief', 'delusion', 'faith', 'harris', 'religion', 'sam ']"
religion,"Du kennst doch bestimmt den Spruch, dass Gott die Menschen nach seinem Ebenbild erschaffen hat. Guck dich mal um! Wenn man davon ausgeht, dass Gott ein Arschloch ist, ergibt das plötzlich mächtig viel Sinn.","['arschlöcher', 'gott', 'religion ']"
religion,"Religion is never more tested than when our emotions are ablaze. At such a time, the timeless grandeur of the Law and its ethics stand at our mercy.","['islam', 'law', 'religion', 'spirituality ']"
religion,"What each of us believes in is up to us, but life is impossible without believing in something.","['belief', 'buddhism', 'japan', 'religion', 'spirituality ']"
religion,إن المؤمن ليدرك بحسن الخلق درجة الصائم والقائم,"['abou-daoud', 'aisha', 'ebn-habban', 'religion ']"
religion,"Religion must remain an outlet for people who say to themselves, 'I am not the kind of person I want to be.' It must never sink into an assemblage of the self-satisfied.",['religion ']
"wisdom,religion","When love and hate are both absent, everything becomes clear and undisguised. Make the slightest distinction, however, and heaven and earth are set infinitely apart. If you wish to see the truth, then hold no opinions for or against anything. To set up what you like against what you dislike is the disease of the mind.","['buddhism', 'christianity', 'hate', 'life', 'living', 'love', 'peace', 'prejudice', 'religion', 'spirituality', 'tao', 'taoism', 'wisdom ']"
"god,religion","Two or three angelsCame near to the earth.They saw a fat church.Little black streams of peopleCame and went in continually.And the angels were puzzledTo know why the people went thus,And why they stayed so long within.","['angel', 'angels', 'catholicism', 'chapel', 'christianity', 'church', 'god', 'religion', 'sabbath', 'sunday ']"
"faith,religion","The only thing that guarantees an open-ended collaboration among human beings, the only thing that guarantees that this project is truly open-ended, is a willingness to have our beliefs and behaviors modified by the power of conversation.","['agnosticism', 'atheism', 'belief', 'ethics', 'faith', 'humanism', 'religion', 'spirituality ']"
"god,religion,science",Science Fiction: Any scientific acclaim that omits God.,"['god', 'religion', 'science', 'science-fiction', 'scifi ']"
"religion,science","How can cosmic religious feeling be communicated from one person to another, if it can give rise to no definite notion of a God and no theology? In my view, it is the most important function of art and science to awaken this feeling and keep it alive in those who are receptive to it.","['art', 'religion', 'science ']"
religion,"Without the support from religion--remember, we talked about it--no father, using only his own resources, would be able to bring up a child.","['child', 'children', 'father', 'parenting', 'religion ']"
religion,It ain't that you get religion. Religion gets you and then milks you dry. Won't let you drink a little whiskey. Won't let you make no fat-assed girls grin and giggle. Won't let you do a damn thing except work for what you'll get in the hearafter. I live in the here and now.,['religion ']
religion,Be careful what you wish for. You never know who will be listening.,['religion ']
religion,"Tie me up, please...""Chantal said. They looked above at some vines and roots hanging down from the grassy area above the depression in the canal they were standing in. She was in his hands—he had to comply.A little bit of kink was one of the most delicious of erotic pleasures. Catholic school girls were often the horniest—Brett could hardly contain his elation.","['bdsm', 'catholic', 'catholic-sex', 'desire', 'desires', 'erotic', 'erotic-fiction', 'erotic-literature', 'fetish', 'kink', 'kinky', 'light-bdsm', 'lust', 'plaid-skirt', 'popular-culture', 'public', 'religion', 'religious', 'school', 'school-girl', 'schoolgirl-uniform', 'sexual', 'sexual-repression', 'sexuality', 'skirts', 'teenage', 'teenagers', 'uniform', 'uniforms ']"
religion,"Listen to the secret sound, the real sound, which is inside you. The one no one talks of speaks the secret sound to himself, and he is the one who has made it all.",['religion ']
"philosophy,religion","You can believe in whatsoever you like, but the truth remains the truth, no matter how sweet the lie may taste.","['bad-influence', 'belief', 'bible', 'christianity', 'exaggeration', 'fabrication', 'false-prophets', 'falsification', 'gospel', 'half-truth', 'liar', 'lie', 'mendacity', 'philosophy', 'religion', 'sugar-coated', 'sweet', 'taste', 'truth', 'untruth ']"
"hope,god,faith,religion,positive",لا تستهين بنفسك ، حتى لو كنت قطرة ، محاولاتك المستمرة .. بصبر تستطيع أن تفتت الصخر,"['faith', 'god', 'hope', 'life', 'positive-thinking', 'religion ']"
"god,religion","But I was always coming here. I though about one of my favorite Sufi poems, which says that God long ago drew a circle in the sand exactly around the spot where you are standing right now. I was never not coming here. This was never not going to happen.","['destiny', 'fate', 'god', 'religion ']"
"god,religion","Believe what you believe and it will be, believe what others believe and they will consume you!","['after-life', 'belief', 'god', 'life', 'peace', 'religion', 'spirituality', 'tranquility ']"
religion,"I have no argument with those who see in organized religion a template or an imperative to live life according to a prescribed set of beliefs. Just give others the room, within the laws of civil society, to believe or not believe whatever they like.","['belief', 'life', 'religion ']"
religion,"If I were asked for a one-sentence sound bite on religion, I would say I was against it.","['fanaticism', 'religion ']"
religion,"When we passed a Catholic church, I recalled, he said, ""You think your dad's a good chemist? They're turning soda crackers into meat in there. Can your dad do that?","['humor', 'religion ']"
"religion,science",The mentally disturbed do not employ the Principle of Scientific Parsimony: the most simple theory to explain a given set of facts. They shoot for the baroque.,"['conspiracy-theories', 'mentally-disturbed', 'religion', 'science ']"
religion,Still amazes me that people spend more time researching a new vehicle than they do the religion they entrust their souls to.,['religion ']
religion,"Once you've condoned faith in general, you've condoned any crazy shit done because of faith.","['atheism', 'religion ']"
religion,"Most of the time it's not the Europeans who belittle us. What happens when we look at them is that we belittle ourselves. When we undertake the pilgrimage, it's not just to escape the tyranny at home but also to reach to the depths of our souls. The day arrives when the guilty must return to save those who could not find the courage to leave.","['bildungsroman', 'identity', 'immigration', 'religion ']"
"religion,science","Maybe if I had to boil it down to one easy sentence, it would be this: I believe in evolution, and I believe in God. I just haven't worked out the details yet.","['religion', 'science ']"
"philosophy,religion","Do you believe in God, doctor?""No - but what does that really mean? I'm fumbling in the dark, struggling to make something out. But I've long ceased finding that original.","['philosophy', 'religion ']"
religion,"People need a moral code, to help them make decisions. All this bio-yogurt virtue and financial self-righteousness are just filling the gap in the market. But the problem is that it's all backwards. It's not that you do the right thing and hope it pays off; the morally right thing is by definition the thing that gives the biggest payoff.","['morals', 'religion ']"
religion,Some folks are happier not being saved.,['religion ']
"religion,science",Religions die when they are proved to be true. Science is the record of dead religions.,"['religion', 'science ']"
religion,We rely on faith only in the context of claims for which there is no sufficient sensory or logical evidence.,"['agnosticism', 'atheism', 'belief', 'ethics', 'humanism', 'religion', 'spirituality ']"
religion,النظرة مثل الحبة تلقى في الأرض فإذا لم يلتفت إليها يبست، وإن سقيت نبتت وكذلك النظرة إذا لحقت بمثلهاكم نظرة فعلت في قلب صاحبهاكمبلغ السهم بين القوس والوتر,['religion ']
religion,"Patriotism is a kind of religion; it is the egg from which wars are hatched.""[My Uncle Sosthenes]","['extremism', 'fanaticism', 'patriotism', 'religion', 'wars ']"
religion,"They are not mad. They're trained to believe, not to know. Belief can be manipulated. Only knowledge is dangerous.",['religion ']
religion,To regret religion is to regret Western civilization.,"['christianity', 'politics', 'religion ']"
religion,Liberty a word without which all other words are vain.,"['freedom', 'liberty', 'politics', 'religion', 'skepticism ']"
religion,"Everything in this life passes away — only God remains, only He is worth struggling towards. We have a choice: to follow the way of this world, of the society that surrounds us, and thereby find ourselves outside of God; or to choose the way of life, to choose God Who calls us and for Whom our heart is searching.","['choice', 'inspirational', 'life', 'orthodoxy', 'religion', 'religious ']"
"faith,quotes,religion","Always listen to the voice of your conscience. If your conscience conflicts with your faith, question everything.","['conscience', 'faith', 'quotes', 'religion', 'suzy-kassem', 'truth', 'voice ']"
religion,ugd بگذار هرکجا تنفراست بذرعشق بکارم هرکجا آزادگی هست ببخشایم وهر کجا غم هست شادی نثار کنم الهی توفیقم ده که بیش ازطلب همدلی همدلی کنم بیش از آنکه دوستم بدارند دوست بدارم زیرا در عطا کردن است که ستوده می شویم و در بخشیدن است که بخشیده می شویم,['religion ']
religion,Your daily life is your temple and your religion. When you enter into it take with you your all.,['religion ']
religion,it is interesting to find that people of faith now seek defensively to say that they are no worse than fascists or Nazis or Stalinists,['religion ']
"god,religion","Anything beyond the limits and grasp of the human mind is either illusion or futility; and because your god having to be one or the other of the two, in the first instance I should be mad to believe in him, and in the second a fool.","['atheism', 'god', 'religion ']"
"god,religion","Whoever possesses God in their being has Him in a divine manner, and He shines out to them in all things; for them all things taste of God and in all things it is God's image that they see.","['god', 'religion', 'sacramental-awareness ']"
religion,"I don't see,' I said, 'how people stand being old. Your insides all dry up. When you're young you're so self-reliant. You don't even need much religion.","['age', 'religion ']"
religion,Change is not what we expect from religious people. They tend to love the past more than the present or the future.,"['adaptability', 'change', 'conservatism', 'religion', 'status-quo ']"
religion,"Jehovah's Witness are welcomed into my home...You gotta respect anybody who gets all dressed up in Sunday clothes and goes door-to-door on days so hot their high heels sink a half-inch into the pavement.The trick is to do all the talking yourself. Pretty soon, they'll look at their watches and say, 'Speaking of end times, wouldja look at what time it is now!","['humor', 'religion ']"
religion,"To me, religion is about our dignity, not our depravity.",['religion ']
religion,He prays because he knows he doesn't control it. He's at the mercy of it.,['religion ']
religion,"God has judged me all my life. But that is God's privilege, my lady. Not yours.","['judgment', 'religion ']"
religion,The natural is so awesome that we need not go beyond it.,"['atheism', 'naturalism', 'religion ']"
