0,1,2
"philosophy,science",Problems in science are sometimes made easier by adding complications.,"['darwin', 'evolution', 'philosophy', 'science ']"
"philosophy,science",It’s ever been the way of the man of science or philosophy. Most folks stay in the dark and then complain they can’t see nothing.” – Snipes (185),"['darkness', 'enlightenment', 'ignorance', 'philosophy', 'science', 'sight ']"
science,"It is either coincidence piled on top of coincidence,""said Hollus, ""or it is deliberate design.","['anthropic-principle', 'chance', 'coincidenc-e', 'fine-tuning', 'id', 'intelligent-design', 'naturalism', 'religious-science-fiction', 'science', 'theism', 'theistic-science-fiction ']"
science,"Try and penetrate with our limited means the secrets of nature and you will find that, behind all the descernible laws and connections, there remains something subtle, intangible and inexplicable. Veneration for this force beyond anything that we can comprehend is my religion. To that extent I am, in fact, religious.","['science', 'spirituality ']"
science,Science is not a heartless pursuit of objective information; it is a creative human activity.,['science ']
science,There are many hypotheses in science which are wrong. That’s perfectly all right: it’s the aperture to finding out what’s right. Science is a self-correcting process.,"['error-and-truth', 'science ']"
science,"We have not the reverent feeling for the rainbow that the savage has, because we know how it is made. We have lost as much as we gained by prying into that matter.","['awe', 'science ']"
science,"Le savant doit ordonner ; on fait la science avec des faits comme une maison avec des pierres ; mais une accumulation de faits n'est pas plus une science qu'un tas de pierres n'est une maison.The Scientist must set in order. Science is built up with facts, as a house is with stones. But a collection of facts is no more a science than a heap of stones is a house.","['analogy', 'facts', 'inspirational', 'order', 'science', 'scientist ']"
science,"Arguments from authority carry little weight – authorities have made mistakes in the past. They will do so again in the future. Perhaps a better way to say it is that in science there are no authorities; at most, there are experts.","['authority', 'carl-sagan', 'science ']"
science,"Today the network of relationships linking the human race to itself and to the rest of the biosphere is so complex that all aspects affect all others to an extraordinary degree. Someone should be studying the whole system, however crudely that has to be done, because no gluing together of partial studies of a complex nonlinear system can give a good idea of the behavior of the whole.","['complexity', 'science', 'systems ']"
science,Nothing in biology makes sense except in the light of evolution.,"['biology', 'evidence', 'evolution', 'natural-selection', 'science', 'sense ']"
science,"There are no things man was not meant to know. There are, perhaps, things man is too dumb to figure out, but that's a different problem.","['forbidden-knowledge', 'humor', 'logic', 'science ']"
science,"You will never get to the irreducible definition of anything because you will never be able to explain why you want to explain, and so on. The system will gobble itself up.",['science ']
science,Take chances! Get messy! Make mistakes!,['science ']
science,"When you can measure what you are speaking about, and express it in numbers, you know something about it, when you cannot express it in numbers, your knowledge is of a meager and unsatisfactory kind; it may be the beginning of knowledge, but you have scarely, in your thoughts advanced to the stage of science.","['math', 'science ']"
science,"He saw that science had become as great a hoax as religion, that nationalism was a farce, patriotism a fraud, education a form of leprosy, and that morals were for cannibals","['ideals', 'morals', 'nationalism', 'religion', 'science ']"
"faith,science","The more you delve into science, the more it appears to rely on faith.","['faith', 'science ']"
science,"The well-being of a neuron depends on its ability to communicate with other neurons. Studies have shown that electrical and chemical stimulation from both a neuron's inputs and its targets support vital cellular processes. Neurons unable to connect effectively with other neurons atrophy. Useless, an abandoned neuron will die.","['metaphor', 'science ']"
science,"Human beings, viewed as behaving systems, are quite simple. The apparent complexity of our behavior over time is largely a reflection of the complexity of the environment in which we find ourselves.","['artificial-intelligence', 'emergence', 'psychology', 'science', 'simplicity ']"
science,...quantum mechanics—the physics of our world—requires that you hold such pedestrian complaints in abeyance.,"['humor', 'physics', 'quantum-mechanics', 'science ']"
science,"The study of mathematics is apt to commence in disappointment... We are told that by its aid the stars are weighed and the billions of molecules in a drop of water are counted. Yet, like the ghost of Hamlet's father, this great science eludes the efforts of our mental weapons to grasp it.","['disappointment', 'ghost', 'grasp', 'hamlet', 'math', 'mathematics', 'mental', 'molecules', 'science', 'shakespeare', 'stars', 'study', 'william-shakespeare ']"
science,"If your experiment needs a statistician, you need a better experiment.","['experiments', 'science', 'statistics ']"
science,"while the scientist sees everything that happens in one point of space, the poet feels everything that happens in one point of time.","['nabokov', 'poetry', 'science ']"
"philosophy,science","The aim of science is to seek the simplest explanations of complex facts. We are apt to fall into the error of thinking that the facts are simple because simplicity is the goal of our quest. The guiding motto in the life of every natural philosopher should be, 'Seek simplicity and distrust it.","['complex', 'explanations', 'facts', 'philosophy', 'science', 'simple', 'trust ']"
"wisdom,knowledge,inspiration,science","Knowledge is like an endless resource; a well of water that satisfies the innate thirst of the growing human soul. Therefore never stop learning... because the day you do, you will also stop maturing.","['inspirational', 'inspirational-quotes', 'knowledge', 'sci-fi', 'science', 'science-fiction', 'wisdom', 'wisdom-inspirational', 'wisdom-quote ']"
"inspiration,science",Be With Me In The Phases Of My Work Because My Brain Feels Like It Has Been Whipped And I Yearn To Make A Small Perfect Thing Which Will Live In Your Morning Like Curious Static Through A President's Elegy Or A Nude Hunchback Acquiring A Tan On The Crowded Oily Beach.,"['etc', 'humor', 'inspiration', 'science ']"
science,"Science and technology multiply around us. To an increasing extent they dictate the languages in which we speak and think. Either we use those languages, or we remain mute.","['ballard', 'language', 'science', 'technology ']"
science,You can get into a habit of thought in which you enjoy making fun of all those other people who don't see things as clearly as you do. We have to guard carefully against it.,"['science', 'skepticism ']"
science,"Many people find bald, unvarnished truths so disturbing, they prefer to ram their heads in the sand and start dreaming at the first sign of scientific reality.","['humour', 'science ']"
science,"A true conservationist is a man who knows that the world is not given by his fathers, but borrowed from his children.","['conservationist', 'land', 'nature', 'science ']"
science,Oh! to shoot for the stars if feels right. Aim for my heart if it feels right.,"['art', 'humor', 'inspirational', 'love', 'maroon-5', 'music', 'science ']"
science,To be able to see into a friends' dream is a dream in itself.-Doctor Kōsaku Tokita (Paprika),"['blaze', 'dreams', 'friend', 'lover', 'saotome', 'science', 'tsutsui', 'yasutaka ']"
science,Until we have the courage to recognize cruelty for what it is... we cannot expect things to be much better in this world... We cannot have peace among men whose hearts delight in killing any living creature. By every act that glorifies or even tolerates such moronic delight in killing we set back the progress of humanity.,"['courage', 'cruelty', 'expectations', 'humanity', 'killing', 'progress', 'science ']"
science,The prediction I can make with the highest confidence is that the most amazing discoveries will be the ones we are not today wise enough to foresee.,['science ']
science,I think the discomfort that some people feel in going to the monkey cages at the zoo is a warning sign.,"['evolution', 'monkey', 'science', 'truth', 'zoo ']"
science,To say that the first casualty of war is truth is to miss the rather more important point that a principal weapon of war is lies.,"['lie', 'science', 'technology', 'truth', 'war ']"
science,"I have been in my bed for five weeks, oppressed with weakness and other infirmities from which my age, seventy four years, permits me not to hope release. Added to this (proh dolor! [O misery!]) the sight of my right eye — that eye whose labors (dare I say it) have had such glorious results — is for ever lost. That of the left, which was and is imperfect, is rendered null by continual weeping.","['age', 'blind', 'misery', 'science ']"
science,…Our sunsets have been reduced to wavelengths and frequencies. The complexities of the universe have been shredded into mathematical equations. Even our self-worth as human beings has been destroyed.,"['meaning', 'science', 'science-and-religion ']"
"philosophy,science","A scientist may not be sure of the answer, but he's often sure he can find one. And that's a condition which is clearly not enjoyed by philosophy.","['answers', 'philosophy', 'science ']"
"philosophy,science","From the scientific view, the theory of karma may be a metaphysical assumption -- but it is no more so than the assumption that all of life is material and originated out of pure chance","['philosophy', 'science ']"
"truth,science","So those who wished for some central cosmic purpose for us, or at least our world, or at least our solar system, or at least our galaxy, have been disappointed, progressively disappointed. The universe is not responsive to our ambitious expectations.","['humans', 'science', 'truth ']"
science,The scientific method is nothing more than a system of rules to keep us from lying to each other.,"['christopher-moore', 'fluke', 'humor', 'science ']"
science,"Even if not a single fossil has ever been found, the evidence from surviving animals would still overwhelmingly force the conclusion that Darwin was right.","['evolution', 'science ']"
science,"Given her deafness, the auditory part of the brain, deprived of its usual input, had started to generate a spontaneous activity of its own, and this took the form of musical hallucinations, mostly musical memories from her earlier life. The brain needed to stay incessantly active, and if it was not getting its usual stimulation..., it would create its own stimulation in the form of hallucinations.","['cognitive-neuroscience', 'hallucinations', 'music', 'musical-hallucinations', 'neuroscience', 'psychology', 'science ']"
science,"No one, in the world's whole history, ever attempted to substantiate a truth by a miracle. Truth scorns the assistance of miracle. Nothing but falsehood ever attested itself by signs and wonders. No miracle ever was performed, and no sane man ever thought he had performed one, and until one is performed, there can be no evidence of the existence of any power superior to, and independent of nature.","['belief', 'miracles', 'religion', 'science', 'skepticism ']"
science,Human beings are ultimately nothing but carriers-passageways- for genes. They ride us into the ground like racehorses from generation to generation. Genes don't think about what constitutes good or evil. They don't care whether we are happy or unhappy. We're just means to an end for them. The only thing they think about is what is most efficient for them.,"['genetics', 'heredity', 'humanity', 'science ']"
science,The assumption of an absolute determinism is the essential foundation of every scientific enquiry.,"['absolute', 'determinism', 'enquiry', 'essential', 'foundation', 'science', 'scientific ']"
science,"Is there any conflict between science and religion? There is no conflict in the mind of God, but often there is conflict in the minds of men.","['inspirational', 'science ']"
science,"I don't believe that math and nature respond to democracy. Just because very clever people have rejected the role of the infinite, their collective opinions, however weighty, won't persuade mother nature to alter her ways. Nature is never wrong.","['math', 'nature', 'science ']"
science,"This is the team. We're trying to go to the moon. If you can't put someone up, please don't put them down.","['mathematics', 'rocket-science', 'science ']"
science,"To err is human, to persist in error is diabolical.","['error', 'ideology', 'science ']"
science,"Without art, we should have no notion of the sacred; without science, we should always worship false gods.","['art', 'sacred', 'science', 'worship ']"
science,"Newton was not the first of the age of reason. He was the last of the magicians, the last of the Babylonians and Sumerians, the last great mind that looked out on the visible and intellectual world with the same eyes as those who began to build our intellectual inheritance rather less than 10,000 years ago.","['isaac-newton', 'magic', 'science ']"
science,Oh juventud nunca dejes de pensar...,['science ']
science,"The tendency has always been strong to believe that whatever received a name must be an entity or being, having an independent existence of its own. And if no real entity answering to the name could be found, men did not for that reason suppose that none existed, but imagined that it was something peculiarly abstruse and mysterious.","['cybernetics', 'science', 'systems ']"
science,The alternative to thinking in evolutionary terms is not to think at all.,"['evolution', 'science', 'thinking ']"
science,"I am a member of a fragile species, still new to the earth, the youngest creatures of any scale, here only a few moments as evolutionary time is measured, a juvenile species, a child of a species. We are only tentatively set in place, error prone, at risk of fumbling, in real danger at the moment of leaving behind only a thin layer of of our fossils, radioactive at that.","['human-condition', 'nature', 'science ']"
science,"When man becomes greater than nature, nature, which gave us birth, will respond.",['science ']
"god,science","Your Excellency, I have no need of this hypothesis.","['astronomy', 'atheist', 'god', 'humor', 'mathematics', 'napoleon', 'science ']"
"religion,science","We should never wait for science to give us permission to do the uncommon; if we do, then we are turning science into another religion.","['permission', 'religion', 'science ']"
science,"Mencari, itulah titah ilmu pada pengabdinya.",['science ']
science,"The near side of a galaxy is tens of thousands of light-years closer to us than the far side; thus we see the front as it was tens of thousands of years before the back. But typical events in galactic dynamics occupy tens of millions of years, so the error in thinking of an image of a galaxy as frozen in one moment of time is small.","['astronomy', 'awe', 'galaxy', 'science ']"
science,"The human race is just a chemical scum on a moderate-sized planet, orbiting around a very average star in the outer suburb of one among a hundred billion galaxies. We are so insignificant that I can't believe the whole universe exists for our benefit. That would be like saying that you would disappear if I closed my eyes.",['science ']
science,The human mind delights in finding pattern—so much so that we often mistake coincidence or forced analogy for profound meaning. No other habit of thought lies so deeply within the soul of a small creature trying to make sense of a complex world not constructed for it.,['science ']
science,"Life off Earth is in two important respects not at all unworldly: you can choose to focus on the surprises and pleasures, or the frustrations. And you can choose to appreciate the smallest scraps of experience, the everyday moments, or to value only the grandest, most stirring ones.","['advice', 'appreciation', 'inspirational', 'life', 'science ']"
science,This fascination with computer models is something I understand very well. Richard Feynmann called it a disease. I fear he is right.,"['computer-models', 'richard-feynmann', 'science ']"
science,Order is heaven's first law.,"['physics', 'science ']"
science,"The physician must be able to tell the antecedents, know the present, and foretell the future — must mediate these things, and have two special objects in view with regard to disease, namely, to do good or to do no harm.","['antecedents', 'disease', 'future', 'harm', 'medicine', 'physician', 'science', 'time ']"
science,The humble Cumulus humilis - never hurt a soul.,"['clouds', 'funny', 'science ']"
science,"I am using the word theory as a scientist means it: a set of ideas so well established by observations and physical models that it is essentially indistinguishable from fact. That is different from the colloquial use that means ""guess.""To a scientist, you can bet your life on a theory. Remember, gravity is ""just a theory""too.","['science', 'theory ']"
science,NASA spent millions of dollars inventing the ball-point pen so they could write in space. The Russians took a pencil.,"['humor', 'science', 'space-exploration ']"
science,There are two kinds of truth; The truth that lights the way and the truth that warms the heart. The fist of these is science and the second is art.,"['art', 'science', 'truth ']"
science,"Just as primitive man believed himself to stand face to face with demons and believed that could he but know their names he would become their master, so is contemporary man faced by this incomprehensible, which disorders his calculations. ""If I can but grasp it, if I can but cognise it"", so he thinks, ""I can make it my servant.","['modern-age', 'science', 'superstition ']"
science,"En un mot, pour tirer la loi de l'expérience, if faut généraliser; c'est une nécessité qui s'impose à l'observateur le plus circonspect.In one word, to draw the rule from experience, one must generalize; this is a necessity that imposes itself on the most circumspect observer.","['experience', 'generalizations', 'necessity', 'rule', 'science ']"
science,"A kiss without a moustache, they said then, is like an egg without salt; I will add to it: and it is like Good without Evil.",['science ']
science,There is no reason to assume that the universe has the slightest interest in intelligence—or even in life. Both may be random accidental by-products of its operations like the beautiful patterns on a butterfly's wings. The insect would fly just as well without them.,['science ']
science,"If a conclusion is not poetically balanced, it cannot be scientifically true.",['science ']
science,"Every day, and in every way, I am becoming better and better.","['improvement', 'science ']"
science,"...evolution is not a religious tenet, to which one swears allegiance or belief as a matter of faith.. It is a factual reality of the empirical world. Just as one would not say 'I believe in gravity,""one should not proclaim 'I believe in evolution.","['evolution', 'god', 'intelligent-design', 'religion', 'science ']"
science,"Mathematics is the cheapest science. Unlike physics or chemistry, it does not require any expensive equipment. All one needs for mathematics is a pencil and paper.","['cheap', 'chemistry', 'equipment', 'expensive', 'math', 'mathematics', 'physics', 'science ']"
science,"Nothing in the universe can travel at the speed of light, they say, forgetful of the shadow`s speed.","['humor', 'science ']"
science,At the end of the universe you’ll find a door labeled “Do Not Enter.” No great mysteries are hidden there—it’s just a supplies closet.,"['closet', 'label', 'mystery', 'science', 'universe ']"
science,"It is our task, both in science and in society at large, to prove the conventional wisdom wrong and to make our unpredictable dreams come true","['science', 'unpredictability ']"
science,"The sheer quantity of brain power that hurled itself voluntarily and quixotically into the search for new baseball knowledge was either exhilarating or depressing, depending on how you felt about baseball. The same intellectual resources might have cured the common cold, or put a man on Pluto.","['baseball', 'humor', 'science ']"
science,"Every time you understand something, religion becomes less likely. Only with the discovery of the double helix and the ensuing genetic revolution have we had grounds for thinking that the powers held traditionally to be the exclusive property of the gods might one day be ours. . . .","['biology', 'discovery', 'dna', 'double-helix', 'genetics', 'gods', 'probability', 'science', 'understanding ']"
science,"It is a good principle in science not to believe any 'fact'---however well attested---until it fits into some accepted frame of reference. Occasionally, of course, an observation can shatter the frame and force the construction of a new one, but that is extremely rare. Galileos and Einsteins seldom appear more than once per century, which is just as well for the equanimity of mankind.",['science ']
science,"If the universe does consist of a battle between the devil and God, the final analysis should conclude that religion would have been the devil’s most brilliant move and science, God’s.","['battle', 'church', 'devil', 'god', 'religion', 'science', 'universe ']"
science,"In a nutshell, the universe is 4% visible, 23% undetectable and 73% unimaginable. Welcome to the cosmos, full of mass you can measure but not manhandle, driven by a force you can infer but not explain.",['science ']
science,"আধুনিক বিজ্ঞান মানুষকে দিয়েছে বেগ, কিন্তু কেড়ে নিয়েছে আবেগ। তাতে আছে গতির আনন্দ, নেই যতির আয়েস।","['philosophy', 'science ']"
science,"Perhaps eggs are like neurons, which also are not replenished in adulthood: they know too much. Eggs must plan the party. Sperm need only to show up- wearing top hat and tails, of course.","['biology', 'gender', 'science', 'sex ']"
science,"Consider the Lichen. Lichens are just about the hardiest visible organisms on Earth, but the least ambitious.",['science ']
science,"Sure, at some level scientists know nanobots will destroy mankind. They just can't resist seeing how it happens.","['apocalypse', 'humour', 'science ']"
"god,science",God is the name we give to the science we don't understand. Science is the name we give to the God we don't understand.,"['god', 'science', 'understanding ']"
"knowledge,science",There is no greater power than the one others do not believe you possess.,"['ak', 'asetian-bible', 'asetianists', 'asetians', 'asetka', 'book-of-orion', 'inspirational', 'kemet', 'knowledge', 'magic', 'magical', 'magick', 'occult', 'power', 'science', 'teachings', 'wisdom ']"
science,"The advantage of the emotions is that they lead us astray, and the advantage of science is that it is not emotional.","['emotions', 'science ']"
science,There are no foolish questions and no man becomes a fool until he has stopped asking questions.,"['advice', 'fool', 'foolish', 'questions', 'science ']"
science,"It took less than an hour to make the atoms, a few hundred million years to make the stars and planets, but five billion years to make man!","['atoms', 'cosmology', 'creation', 'humor', 'physics', 'science', 'stars ']"
science,"I don't know how many of you have ever met Dijkstra, but you probably know that arrogance in computer science is measured in nano-Dijkstras.","['arrogance', 'computer-science', 'edsger-dijkstra', 'edsger-w-dijkstra', 'edsger-wybe-dijkstra', 'humor', 'science ']"
science,"Although personally, I think cyberspace means the end of our species.","['mathematics', 'science ']"
science,"Sigmund Freud was a novelist with a scientific background. He just didn’t know he was a novelist. All those damn psychiatrists after him, they didn’t know he was a novelist either.""(Interview in Writers at Work: The Paris Review Interviews, Eighth Series, ed. George Plimpton, 1988)","['freud', 'novelists', 'psychiatrists', 'science', 'sigmund-freud ']"
science,Discover the force of the skies O Men: once recognised it can be put to use.,"['astronomy', 'inspirational', 'science', 'space', 'universe ']"
science,Science is essentially an anarchic enterprise: theoretical anarchism is more humanitarian and more likely to encourage progress than its law-and-order alternatives.,"['epistemological-anarchism', 'inspirational', 'philosophy-of-science', 'science ']"
science,Be humble for you are made of earth. Be noble for you are made of stars.,"['inspirational', 'science ']"
science,"Footnote: In 1998, a woman in Saline, Michigan received a patent for a Decorative Penile Wrap...The patent included three pages of drawings, including a penis wearing a ghost outfit, another in the robes of the Grim Reaper, and one dressed up to look like a snowman.","['science', 'sex ']"
"philosophy,science",Imagination is cheap as long as you don't have to worry about the details.,"['free-will', 'philosophy', 'science ']"
"god,religion,science","And fragile is thy tenure of this worldStill haunted by the monstrous ghost of God.(""To Science"")","['atheism', 'god', 'religion', 'science ']"
