0,1,2
science,"The chief deficiency I see in the skeptical movement is its polarization: Us vs. Them — the sense that we have a monopoly on the truth; that those other people who believe in all these stupid doctrines are morons; that if you're sensible, you'll listen to us; and if not, to hell with you. This is nonconstructive. It does not get our message across. It condemns us to permanent minority status.","['science', 'skepticism ']"
"god,science",I regard the afterlife to be a fairy story for people that are afraid of the dark,"['god', 'life', 'science', 'stephen-hawking ']"
"faith,religion,science","Man is manifestly not the measure of all things. This universe is shot through with mystery. The very fact of its being, and of our own, is a mystery absolute, and the only miracle worthy of the name.","['faith', 'reason', 'religion', 'science', 'skeptic ']"
science,What goes up must come down.,"['apple', 'newton', 'science ']"
science,"Scientists are a friendly, atheistic, hard-working, beer-drinking lot whose minds are preoccupied with sex, chess and baseball when they are not preoccupied with science.","['science', 'scientists ']"
"religion,science","We all have a thirst for wonder. It's a deeply human quality. Science and religion are both bound up with it. What I'm saying is, you don't have to make stories up, you don't have to exaggerate. There's wonder and awe enough in the real world. Nature's a lot better at inventing wonders than we are.","['ellie-arroway', 'freethinking', 'religion', 'science', 'spirituality ']"
science,"A new scientific truth does not triumph by convincing its opponents and making them see the light, but rather because its opponents eventually die, and a new generation grows up that is familiar with it.","['paradigm-shift', 'science', 'scientists ']"
science,"Science is like sex: sometimes something useful comes out, but that is not the reason we are doing it.","['science', 'sex ']"
"inspiration,science","We can only see a short distance ahead, but we can see plenty there that needs to be done.","['distance', 'future', 'inspirational', 'progress', 'science', 'vision', 'work ']"
science,Colour is a power which directly influences the soul.,"['abstraction', 'art', 'paintings', 'science ']"
science,"Science is what you know, philosophy is what you don't know",['science ']
"life,science",We are star stuff harvesting sunlight.,"['carl-sagan', 'humans', 'life', 'science', 'solar-power', 'star-stuff ']"
science,"Science cannot solve the ultimate mystery of nature. And that is because, in the last analysis, we ourselves are a part of the mystery that we are trying to solve.","['mystery', 'nature', 'science ']"
science,"When asked about which scientist he'd like to meet, Neil deGrasse Tyson said, ""Isaac Newton. No question about it. The smartest person ever to walk the face of this earth. The man was connected to the universe in spooky ways. He discovered the laws of motion, the laws of gravity, the laws of optics. Then he turned 26.","['newton', 'science ']"
science,Philosophy of science is about as useful to scientists as ornithology is to birds.,"['humor', 'inspirational', 'philosophy-of-science', 'science ']"
"wisdom,science","Whenever a theory appears to you as the only possible one, take this as a sign that you have neither understood the theory nor the problem which it was intended to solve.","['science', 'theory', 'wisdom ']"
science,Highly organized research is guaranteed to produce nothing new.,"['research', 'science ']"
science,"Above all, do not attempt to use science (I mean, the real sciences) as a defence against Christianity. They will positively encourage him to think about realities he can’t touch and see.",['science ']
science,"It turns out that an eerie type of chaos can lurk just behind a facade of order - and yet, deep inside the chaos lurks an even eerier type of order.","['chaos', 'order', 'science ']"
science,"And if humanity is the last war, then I am the battlefield.","['cool', 'humor', 'science ']"
science,I remember discussions with Bohr which went through many hours till very late at night and ended almost in despair; and when at the end of the discussion I went alone for a walk in the neighbouring park I repeated to myself again and again the question: Can nature possibly be so absurd as it seemed to us in these atomic experiments?,"['absurd', 'bohr', 'despair', 'experiments', 'nature', 'niels-bohr', 'physics', 'quantum-mechanics', 'science ']"
science,"As to diseases, make a habit of two things — to help, or at least, to do no harm.","['diseases', 'harm', 'medicine', 'science ']"
"inspiration,science",Everyone has a hidden agenda. Except me!,"['inspirational', 'science ']"
"faith,religion,science",We know enough at this moment to say that the God of Abraham is not only unworthy of the immensity of creation; he is unworthy even of man.,"['faith', 'reason', 'religion', 'science', 'skeptic ']"
"faith,science","Faith and science, I have learned, are two sides of the same coin, separated by an expanse so small, but wide enough that one side can't see the other. They don't know they are connected.","['coin', 'faith', 'science ']"
science,"Avoidable human misery is more often caused not so much by stupidity as by ignorance, particularly our ignorance about ourselves.","['human-nature', 'science', 'stupidity ']"
"knowledge,science","I believe in intuition and inspiration. Imagination is more important than knowledge. For knowledge is limited, whereas imagination embraces the entire world, stimulating progress, giving birth to evolution. It is, strictly speaking, a real factor in scientific research.","['evolution', 'imagination', 'knowledge', 'science ']"
"religion,science",Nothing exists except atoms and empty space; everything else is opinion.,"['mystery', 'religion', 'science ']"
science,"Every intelligent being, whether it breathes or not, coughs nervously at some time in its life.","['humor', 'science ']"
science,"The man of science has learned to believe in justification, not by faith, but by verification.","['belief', 'justification', 'learning', 'science', 'science-vs-religion', 'verification ']"
science,"The Universe is not only queerer than we suppose, but queerer than we can suppose.","['imagination', 'misattributed-arthur-c-clarke', 'physics', 'science', 'universe ']"
science,"If our brains were simple enough for us to understand them, we'd be so simple that we couldn't.","['complexity', 'science ']"
science,"Progress is born of doubt and inquiry. The Church never doubts, never inquires. To doubt is heresy, to inquire is to admit that you do not know—the Church does neither.","['doubt', 'heresy', 'inquiry', 'science', 'skepticism ']"
"funny,science","Log Entry: SOL 118My conversation with NASA about the Water Reclaimer was boring and riddled with technical details. So I'll paraphrase for you:Me: ""This is obviously a clog. How about I take it apart and check the internal tubing?""NASA: (After about 5 hours of deliberation) ""No. You'll fuck it up and die.""So I took it apart.","['funny', 'humor', 'science ']"
science,Those who are not shocked when they first come across quantum theory cannot possibly have understood it.,"['particles', 'physics', 'quantum', 'reality', 'science', 'strange ']"
science,"If time be judiciously employed, there is time for everything.","['science', 'time ']"
science,You know what's wrong with scientific power? It's a form of inherited wealth. And you know what assholes congenitally rich people are.,['science ']
"life,philosophy,science","Mankind flung its advance agents ever outward, ever outward. Eventually it flung them out into space, into the colorless, tasteless, weightless sea of outwardness without end. It flung them like stones.","['life', 'philosophy', 'science ']"
"god,science",Why do humans exist? A major part of the answer: because Pikaia Gracilens survived the Burgess decimation.,"['atheism', 'atheist', 'god', 'noremorse', 'science ']"
science,Science is all about proving theories and understanding the universe. Science folds everything into neat logical well-explained packages. The fey are magical capricious illogical and unexplainable. Science cannot prove the existence of faeries so naturally we do not exist. That type of nonbelief is fatal to faries.,"['faery', 'magic-bleeds', 'science ']"
science,"A blade of grass is a commonplace on Earth; it would be a miracle on Mars. Our descendants on Mars will know the value of a patch of green. And if a blade of grass is priceless, what is the value of a human being?","['cosmology', 'earth', 'science', 'space-exploration ']"
"philosophy,science","Thinking only begins at the point where we have come to know that Reason, glorified for centuries, is the most obstinate adversary of thinking.","['philosophy', 'reason', 'science ']"
"philosophy,science","Almost everything that distinguishes the modern world from earlier centuries is attibutable to science, which achieved its most spectacular triumphs in the seventeenth century.","['philosophy', 'science ']"
science,The significant problems we have cannot be solved at the same level of thinking with which we created them.,"['inspirational', 'problems', 'science ']"
science,"The most beautiful experience we can have is the mysterious. It is the fundamental emotion that stands at the cradle of true art and true science. Whoever does not know it and can no longer wonder, is as good as dead, and his eyes are dimmed (Albert Einstein)",['science ']
"philosophy,science","Science must not impose any philosophy, any more than the telephone must tell us what to say.","['impose', 'philosophy', 'science', 'telephone ']"
"knowledge,science","And a new philosophy emerged called quantum physics, which suggest that the individual’s function is to inform and be informed. You really exist only when you’re in a field sharing and exchanging information. You create the realities you inhabit.","['communication', 'information', 'knowledge', 'physics', 'science', 'sharing ']"
science,"Ours is a world of nuclear giants and ethical infants. We know more about war than we know about peace, more about killing than we know about living. We have grasped the mystery of the atom and rejected the Sermon on the Mount.","['ethics', 'humanism', 'humanity', 'imperialism', 'nuclear-weapons', 'peace', 'science', 'technology', 'war ']"
science,"In a very real sense we have two minds, one that thinks and one that feels","['biology', 'emotion', 'inspirational', 'love', 'neuropsychology', 'science', 'thoughts ']"
"wisdom,mind,science","Ignorance is hardly unusual, Miss Davar. The longer I live, the more I come to realize that it is the natural state of the human mind. There are many who will strive to defend its sanctity and then expect you to be impressed with their efforts.","['human-mind', 'ignorance', 'mind', 'religion-and-science', 'religion-vs-science', 'science', 'science-and-religion', 'science-vs-religion', 'wisdom ']"
science,Science is what we understand well enough to explain to a computer; art is everything else.,"['art', 'computer', 'science ']"
science,لا توجد أي دولة في العالم انطلقت في المجال التكنولوجي دون الاعتماد على اللغة الأم.,"['language', 'science ']"
science,"Down there between our legs, it's like an entertainment complex in the middle of a sewage system. Who designed that?","['humor', 'science', 'stupid-design ']"
science,Every great advance in science has issued from a new audacity of imagination.,"['imagination', 'science ']"
science,"There are no forbidden questions in science, no matters too sensitive or delicate to be probed, no sacred truths.",['science ']
science,"As a child, I was aware that, at night, infrared vision would reveal monsters hiding in the bedroom closet only if they were warm-blooded. But everybody knows that your average bedroom monster is reptilian and cold-blooded.","['childhood', 'monsters-in-the-dark', 'science ']"
science,"I think imagination is at the heart of everything we do. Scientific discoveries couldn't have happened without imagination. Art, music, and literature couldn't exist without imagination. And so anything that strengthens imagination, and reading certainly does that, can help us for the rest of our lives.","['art', 'imagination', 'literature', 'music', 'reading', 'science ']"
science,"Sadly, my socks are like snowflakes, no two are exactly alike.","['humor', 'science ']"
"inspiration,science",I have something that I call my Golden Rule. It goes something like this: 'Do unto others twenty-five percent better than you expect them to do unto you.' … The twenty-five percent is for error.,"['ethical-code', 'ethics', 'golden-rule', 'humor', 'inspirational', 'paraphrased', 'science ']"
"knowledge,science",The real purpose of the scientific method is to make sure nature hasn’t misled you into thinking you know something you actually don’t know.,"['error', 'knowledge', 'mistake', 'nature', 'science ']"
science,Nature composes some of her loveliest poems for the microscope and the telescope.,['science ']
"philosophy,science","We feel that even if all possible scientific questions be answered, the problems of life have still not been touched at all.","['life', 'philosophy', 'science ']"
"wisdom,religion,science",Jasnah had once defined a fool as a person who ignored information because it disagreed with desired results.,"['bias', 'bickering', 'disagreement', 'falacy', 'fool', 'information', 'intelligence', 'politics', 'religion', 'science', 'stupidity', 'wisdom ']"
science,أنت تجد في الشرق أحد اثنين .. تجد من يرفض العلم اكتفاء بالدين والقرآن .. و تجد من يرفض الدين اكتفاء و عبادة للعلم المادي و الوسائلالمادية .و كلا الاثنين سبب من أسباب النكبة الحضارية في المنطقة .. و كلاهمالم يفهم المعنى الحقيقي للدين و لا المعنى الحقيقي للعلم .,"['belief', 'islam', 'science ']"
science,It is very expensive to give bad medical care to poor people in a rich country.,"['medicine', 'poverty', 'rights', 'science ']"
science,"If we long for our planet to be important, there is something we can do about it. We make our world significant by the courage of our questions and by the depth of our answers.","['humanity', 'sagan', 'science ']"
science,Just because an apple falls one hundred times out of a hundred does not mean it will fall on the hundred and first.,"['anything-can-be', 'anything-is-possible', 'apple', 'everything-is-possible', 'gravity', 'inevitability', 'possibility', 'science', 'sir-isaac-newton', 'theories ']"
science,Never underestimate spite as a motivator for genius.,"['genius', 'science', 'spite ']"
"inspiration,science","The more clearly we can focus our attention on the wonders and realities of the universe about us the less taste we shall have for the destruction of our race. Wonder and humility are wholesome emotions, and they do not exist side by side with a lust for destruction.{Speech accepting the John Burroughs Medal}","['attention', 'burroughs', 'destruction', 'emotion', 'existence', 'humility', 'inspirational', 'john-burroughs', 'lust', 'reality', 'science', 'universe', 'wonder ']"
"faith,religion,science","Faith is a fine inventionWhen gentlemen can see,But microscopes are prudentIn an emergency.","['faith', 'religion', 'science ']"
science,We are survival machines – robot vehicles blindly programmed to preserve the selfish molecules known as genes. This is a truth which still fills me with astonishment.,"['evolution', 'genetics', 'science ']"
science,"One general law, leading to the advancement of all organic beings, namely, multiply, vary, let the strongest live and the weakest die.","['biology', 'evolution', 'natural-selection', 'science ']"
"faith,science","Science only goes so far, then comes God.- Noah Calhoun-","['faith', 'science ']"
science,Nothing is too wonderful to be true if it be consistent with the laws of nature.,"['inspirational', 'nature', 'science', 'wonderful ']"
science,"We live in a world where unfortunately the distinction between true and false appears to become increasingly blurred by manipulation of facts, by exploitation of uncritical minds, and by the pollution of the language.","['biochemist', 'biochemistry', 'blurred', 'critical-thinking', 'error', 'exploitation', 'facts', 'false', 'language', 'manipulation', 'manipulation-of-facts', 'nobel-laureate', 'pollution', 'science', 'superstition', 'truth', 'uncritical-minds', 'world ']"
science,Mother Nature doesn't care if you're having fun.,"['fun', 'nature', 'science ']"
science,"When a distinguished but elderly scientist states that something is possible, he is almost certainly right. When he states that something is impossible, he is very probably wrong.","['cynical', 'science ']"
science,"Any man could, if he were so inclined, be the sculptor of his own brain.","['brain', 'cognitive', 'desire', 'neuron', 'neuroplasticity', 'neuroscience', 'science ']"
science,"I believe in evidence. I believe in observation, measurement, and reasoning, confirmed by independent observers. I'll believe anything, no matter how wild and ridiculous, if there is evidence for it. The wilder and more ridiculous something is, however, the firmer and more solid the evidence will have to be.","['belief', 'evidence', 'observation', 'science ']"
"knowledge,science",We understand more than we know.,"['knowledge', 'science', 'understanding', 'wisdom ']"
"knowledge,education,science","Science replaces private prejudice with public, verifiable evidence.","['belief', 'education', 'enlighten', 'evidence', 'ignorance', 'knowledge', 'prejudice', 'proof', 'richard-dawkins', 'science ']"
"education,science","Even those who do not, or cannot, avail themselves of a scientific education, choose to benefit from the technology that is made possible by the scientific education of others.","['education', 'science ']"
science,"Measure what can be measured, and make measurable what cannot be measured.",['science ']
science,"Science is based on experiment, on a willingness to challenge old dogma, on an openness to see the universe as it really is. Accordingly, science sometimes requires courage - at the very least the courage to question the conventional wisdom.",['science ']
"inspiration,science","A real scientist solves problems, not wails that they are unsolvable.","['giving-up', 'humor', 'inspirational', 'science ']"
science,Science without conscience is the soul's perdition.,"['conscience', 'science ']"
science,"Aristotle maintained that women have fewer teeth than men; although he was twice married, it never occurred to him to verify this statement by examining his wives' mouths.","['aristotle', 'men', 'misconceptions', 'prejudice', 'science', 'women ']"
"knowledge,science",I am too much of a skeptic to deny the possibility of anything.,"['knowledge', 'possibility', 'science', 'skepticism', 'thinking ']"
science,"We shall never achieve harmony with the land, anymore than we shall achieve absolute justice or liberty for people. In these higher aspirations the important thing is not to achieve but to strive.","['inspirational', 'nature', 'science ']"
science,"The four stages of acceptance:1. This is worthless nonsense.2. This is an interesting, but perverse, point of view.3. This is true, but quite unimportant.4. I always said so.""(Review of The Truth About Death, in: Journal of Genetics 1963, Vol. 58, p.464)","['acceptance', 'dispute', 'haldane', 'opportunism', 'science', 'self-contradiction', 'theories ']"
science,"For someone who'e smarter than a supercomputer, sometimes you're a real idiot.","['humor', 'science ']"
"religion,science","Is it more probable that nature should go out of her course or that a man should tell a lie? We have never seen, in our time, nature go out of her course. But we have good reason to believe that millions of lies have been told in the same time. It is therefore at least millions to one that the reporter of a miracle tells a lie.","['miracles', 'religion', 'science', 'skepticism ']"
"mind,science","Nothing is so dangerous to the progress of the human mind than to assume that our views of science are ultimate, that there are no mysteries in nature, that our triumphs are complete and that there are no new worlds to conquer.","['exploration', 'mind', 'science ']"
science,It is not clear that intelligence has any long-term survival value.,['science ']
science,"My dear Kepler, what would you say of the learned here, who, replete with the pertinacity of the asp, have steadfastly refused to cast a glance through the telescope? What shall we make of this? Shall we laugh, or shall we cry?","['astronomy', 'johannes-kepler', 'kepler', 'science', 'telescope ']"
"inspiration,happiness,truth,success,science","It is not the possession of truth, but the success which attends the seeking after it, that enriches the seeker and brings happiness to him.","['happiness', 'inspirational', 'science', 'success', 'truth ']"
science,"It is not my intention to be fulsome, but I confess that I covet your skull.","['anatomy', 'morbid', 'moriarty', 'science', 'sherlock', 'skull', 'study ']"
"philosophy,science","If we wish to draw philosophical conclusions about our own existence, our significance, and the significance of the universe itself, our conclusions should be based on empirical knowledge. A truly open mind means forcing our imaginations to conform to the evidence of reality, and not vice versa, whether or not we like the implications.","['philosophy', 'science ']"
"philosophy,science","And although I have seen nothing but black crows in my life, it doesn't mean that there's no such thing as a white crow. Both for a philosopher and for a scientist it can be important not to reject the possibility of finding a white crow. You might almost say that hunting for 'the white crow' is science's principal task.","['epistemology', 'philosophy', 'science ']"
"hope,science","We must pass through the darkness, to reach the light.","['hope', 'inspirational', 'science', 'truth-of-life ']"
science,"[When asked why are numbers beautiful?]It’s like asking why is Ludwig van Beethoven’s Ninth Symphony beautiful. If you don't see why, someone can't tell you. I know numbers are beautiful. If they aren't beautiful, nothing is.","['beautiful', 'beauty', 'beethoven', 'ludwig-van-beethoven', 'math', 'mathematics', 'ninth-symphony', 'numbers', 'science', 'subjective ']"
science,"The question is whether any civilization can wage relentless war on life without destroying itself, and without losing the right to be called civilized.","['conservation', 'science', 'war ']"
science,We can't help it. Life looks for life.,['science ']
science,"The bright sun was extinguish'd, and the starsDid wander darkling in the eternal space.","['astronomy', 'cosmology', 'eschatology', 'physics', 'science', 'stars', 'sun ']"
"faith,god,religion,science",Science adjusts its views based on what's observedFaith is the denial of observation so that belief can be preserved.,"['faith', 'god', 'religion', 'science ']"
"religion,science","There are many sources of spirituality; religion may be the most common, but it is by no means the only. Anything that generates a sense of awe may be a source of spirituality. Science does this in spades.","['religion', 'science ']"
science,"Not a single one of the cells that compose you knows who you are, or cares.",['science ']
science,It's much easier on the emotions when one sees life as an experiment rather than a struggle for popularity.,"['arrogance', 'development', 'emotions', 'experiment', 'fame', 'growth', 'humility', 'improvement', 'learning', 'life', 'peace', 'popularity', 'pride', 'science', 'training ']"
science,Most institutions demand unqualified faith; but the institution of science makes skepticism a virtue.,"['science', 'skepticism ']"
science,Something deeply hidden had to be behind things.,"['cosmology', 'life', 'meaing', 'physics', 'science', 'universe ']"
"inspiration,science","My dream, is to dream, a dream.","['dream', 'inspirational', 'love', 'science ']"
"happiness,science","Flowers always make people better, happier, and more helpful; they are sunshine, food and medicine to the mind.","['flowers', 'happiness', 'helpfulness', 'medicine', 'science', 'sunshine ']"
"inspiration,science",And what greater might do we possess as human beings than our capacity to question and to learn?,"['ann-druyan', 'carl-sagan', 'inspirational', 'science', 'theology', 'thought-provoking ']"
science,"It's very, very dangerous to lose contact with living nature.","['being', 'contact', 'evolution', 'nature', 'science ']"
science,"There is a philosophy that says that if something is unobservable -- unobservable in principle -- it is not part of science. If there is no way to falsify or confirm a hypothesis, it belongs to the realm of metaphysical speculation, together with astrology and spiritualism. By that standard, most of the universe has no scientific reality -- it's just a figment of our imaginations.","['physics', 'science', 'universe ']"
"inspiration,science",The easiest way to do anything is properly.,"['inspirational', 'science ']"
"religion,science","The split in America, rather than simply economic, is between those who embrace reason, who function in the real world of cause and effect, and those who, numbed by isolation and despair, now seek meaning in a mythical world of intuition, a world that is no longer reality-based, a world of magic.","['atheists', 'christianity', 'dominionism', 'dominionists', 'evangelists', 'fascism', 'humanism', 'religion', 'sceptics', 'science ']"
